"Volume","Chapter","Paragraph","Line","LineId","Text"
"06","2","1","2","06020102","&nbsp;&nbsp;We nado kaki te&#44; irodori tamahu. Yorodu ni wokasiu susabi tirasi tamahi keri. Ware mo kaki sohe tamahu. Kami ito nagaki womna wo kaki tamahi te&#44; hana ni beni wo tuke te mi tamahu ni&#44; kata ni kaki te mo mimauki sama si tari. Waga mikage no kyaudai ni uture ru ga&#44; ito kiyora naru wo mi tamahi te&#44; tedukara kono akahaha wo kaki-tuke&#44; nihohasi te mi tamahu ni&#44; kaku yoki kaho dani&#44; sate mazire ra m ha migurusikaru bekari keri. Himegimi&#44; mi te&#44; imiziku warahi tamahu. "
"06","2","1","3","06020103","&nbsp;&nbsp;&#34;Maro ga&#44; kaku kataha ni nari na m toki&#44; ika nara m?&#34; to notamahe ba&#44; "
"06","2","1","4","06020104","&nbsp;&nbsp;&#34;Utate koso ara me.&#34;"
"06","2","1","5","06020105","&nbsp;&nbsp;tote&#44; samoya simi tuka m to&#44; ayahuku omohi tamahe ri. Sora-nogohi wo si te&#44;"
"06","2","1","6","06020106","&nbsp;&nbsp;&#34;Sarani koso&#44; siroma ne. Younaki susabi waza nari ya! Uti ni ikani notamaha m to su ram?&#34;"
"06","2","1","7","06020107","&nbsp;&nbsp;to&#44; ito mameyaka ni notamahu wo&#44; ito itohosi to obosi te&#44; yori te&#44; nogohi tamahe ba&#44; "
"06","2","1","8","06020108","&nbsp;&nbsp;&#34;Heityuu ga yau ni irodori sohe tamahu na. Akakara m ha ahe na m.&#34;"
"06","2","1","9","06020109","&nbsp;&nbsp;to&#44; tahabure tamahu sama&#44; ito wokasiki imose to miye tamahe ri."
"06","2","1","10","06020110","&nbsp;&nbsp;Hi no ito uraraka naru ni&#44; itusika to kasumi watare ru kozuwe-domo no&#44; kokoromotonaki naka ni mo&#44; mume ha kesikibami&#44; hohowemi watare ru&#44; toriwaki te miyu. Hasikakusi no moto no koubai&#44; ito toku saku hana nite&#44; iroduki ni keri."
"06","2","1","11","06020111","&nbsp;&nbsp;&nbsp;&nbsp;&#34;Kurenawi no hana zo ayanaku utoma ruru<BR>&nbsp;&nbsp;&nbsp;&nbsp;mume no tatiye ha natukasi kere do"
"06","2","1","12","06020112","&nbsp;&nbsp;Ide ya!&#34;"
"06","2","1","13","06020113","&nbsp;&nbsp;to&#44; ainaku uti-umeka re tamahu."
"06","2","1","14","06020114","&nbsp;&nbsp;Kakaru hitobito no suwezuwe&#44; ika nari kem?"
