"Volume","Chapter","Paragraph","Line","Annotation_Num","Annotation_State","Annotation_Title","Annotation_Body"
"52","4","2","3","332","1","宮も思し嘆きたる","以下「泣き騒ぐを」まで、薫の心中の思い。"
"52","4","2","3","333","1","事のありさまも","大島本は「ことの」とある。『集成』『完本』は諸本に従って「ここの」と校訂する。『新大系』は底本のまま「事の」とする。"
"52","4","2","3","334","1","かくおはしましたるにつけても","主語は薫。心中文に語り手の薫に対する敬語が紛れ込んだ表現。"
"52","4","2","4","335","1","御供に具して","以下「え信ずまじき」まで、薫の詞。『集成』は「逃げ隠れているなら、供の女房を連れているはず」と注す。"
"52","4","2","5","336","1","いとどしく","大島本は「いとゝしく」とある。『集成』『完本』は諸本に従って「いといとほしく」と校訂。『新大系』は底本のまま「いとどしく」とする。『集成』は「大層困ってしまって」。『完訳』は「右近は大将がおいたわしくて」と訳す。"
"52","4","2","5","337","1","さればよ","『完訳』は「薫の詰問は懸念どおり」と注す。"
"52","4","2","6","338","1","おのづから聞こし召しけむ","以下「はべるなるものを」まで、右近の詞。"
"52","4","2","6","339","1","時々も見たてまつらせたまふべきやうには","大島本は「やうにハ」とある。『集成』『完本』は諸本に従って「やうに」と「は」を削除する。『新大系』は底本のまま「やうに」とする。"
"52","4","2","6","340","1","かの筑波山も","浮舟の母。夫が常陸介なのでこう呼ぶ。また「筑波山」は常陸国の歌枕。風情ある言い方。"
"52","4","2","6","341","1","渡らせたまはむことを","浮舟が京の薫のもとに。"
"52","4","2","6","342","1","心得ぬ御消息はべりけるに","『完訳』は「納得できぬ文。薫からの「波こゆる--」と心変りを非難された。それが浮舟を一方的に追いつめた、の気持もこもる」と注す。"
"52","4","2","6","343","1","この宿直仕うまつる","大島本は「このとのゐ」とある。『集成』『完本』は諸本に従って「宿直など」と「など」を補訂する。『新大系』は底本のまま「宿直」とする。"
"52","4","2","6","344","1","荒々しきは田舎人どもの","大島本は「あら／＼しきハ」とある。『集成』『完本』は諸本に従って「荒々しき」と「は」を削除する。『新大系』は底本のまま「荒々しきは」とする。"
"52","4","2","6","345","1","あやしきさまにとりなしきこゆることども","『集成』は「おかしな具合に歪めて推測申し上げることもいろいろございましたが。宿直人が気をまわして山荘の警備を厳重にしたことをいう」と注す。"
"52","4","2","6","346","1","御消息などもはべらざりしに","薫からの手紙。接続助詞「に」原因理由の意をこめた順接条件。下文の浮舟の悲観・絶望の気持ちへと続く。"
"52","4","2","6","347","1","よろづに思ひ扱ひたまふ","大島本は「思ひあつかひ」とある。『集成』『完本』は諸本に従って「あつかひ」と「思ひ」を削除する。『新大系』は底本のまま「思ひあつかひ」とする。"
"52","4","2","6","348","1","人笑はれになりては","大島本は「なりてハ」とある。『集成』『完本』は諸本に従って「なりはてば」と「は」を補訂する。『新大系』は底本のまま「なりては」とする。"
"52","4","2","6","349","1","などおもむけてなむ","『完訳』は「悪いほうに考えて、の気持」と注す。"
"52","4","2","7","350","1","その筋よりほかに","『完訳』は「薫の不信をかった以外には」と注す。"
"52","4","2","7","351","1","いささか残る所もはべるなるものを","『完訳』は「証拠を残していくもの。入水以外には考えられぬという気持」と注す。「なる」伝聞推定の助動詞。"
"52","4","2","8","352","1","紛れつる御心も失せて","匂宮が隠しているのではないかと疑って紛らされていた悲しみの気持ち。わずかの希望も消え失せる。"
"52","4","3","1","353","1","我は心に身をもまかせず","以下「さらにな隠しそ」まで、薫の詞。"
"52","4","3","1","354","1","今近くて","近々京に浮舟を迎えて、の意。"
"52","4","3","1","355","1","おろかに見なしたまひつらむこそ","大島本は「給つらん」とある。『集成』『完本』は諸本に従って「たまひけむ」と校訂する。『新大系』は底本のまま「給つらん」とする。主語は浮舟。"
"52","4","3","1","356","1","分くる方ありける","『集成』は「悠長な自分より、熱心だと思う恋人がいたからだろうと、匂宮のことをほのめかす」と注す。"
"52","4","3","2","357","1","いとかたはに","『集成』は「全くけしからぬほど」。『完訳』は「まったく不都合にも」と訳す。"
"52","4","3","2","358","1","人の心を","女性の心を。"
"52","4","3","3","359","1","たしかにこそは聞きたまひてけれ","右近の心中。"
"52","4","3","3","360","1","いといとほしくて","『集成』は「とても困ってしまって」。『完訳』は「まことにお気の毒に思われるので」と訳す。"
"52","4","3","4","361","1","いと心憂きことを","以下「はべらぬものを」まで、右近の詞。浮舟身辺の出来事は委細に見届けている自分の話こそ真実だ、という含み。"
"52","4","3","6","362","1","おのづから聞こし召しけむ","以下「見たまへず」まで、右近の詞。"
"52","4","3","6","363","1","この宮の上の御方に","京の二条院の中君の所に。"
"52","4","3","6","364","1","入りおはしたりしかど","大島本は「いりおハしたりしかと」とある。『集成』『完本』は諸本に従って「入りおはしましたりしかど」と「まし」を補訂する。『新大系』は底本のまま「入りおはしたりしかど」とする。"
"52","4","3","6","365","1","いみじきことを聞こえさせはべりて","『集成』は「お側の女房たちの才覚で事無きを得た、と言う」と注す。"
"52","4","3","6","366","1","出でさせたまひにき","主語は匂宮。"
"52","4","3","6","367","1","それに懼ぢたまひて","主語は浮舟。"
"52","4","3","6","368","1","かのあやしくはべりし所に","三条の小家。隠れ家。"
"52","4","3","7","369","1","音にも聞こえじと","匂宮に噂としても知られまい、の意。"
"52","4","3","7","370","1","この如月ばかりより","『完訳』は「匂宮が浮舟の宇治の住いをかぎつけたのは一月上旬、同月下旬に宇治行を実行。事実を意識的にぼかして過小の言い方をした」と注す。"
"52","4","3","7","371","1","訪れきこえたまふべし","大島本は「をとつれきこえ給へし」とある。『集成』『完本』は諸本に従って「訪れきこえさせたまひし」と校訂する。『新大系』は底本のまま「をとづきこえ給べし」とする。"
"52","4","3","7","372","1","たびたびはべりしかど","大島本は「侍しかと」とある。『集成』『完本』は諸本に従って「はべめりしかど」と「めり」を補訂する。『新大系』は底本のまま「侍しかど」とする。"
"52","4","3","7","373","1","うたてあるやうに","大島本は「ミ（ミ＄う&lt;朱&gt;）たてあるやうに」とある。すなわち「み」をミセケチにして「う」と訂正する。『集成』『完本』は諸本に従って「なかなかうたてあるやうに」と「なかなか」を補訂する。『新大系』は底本のまま「うたてあるやうに」とする。"
"52","4","3","7","374","1","それより他のことは見たまへず","『集成』は「きっぱりと密通の事実を否定する」。『完訳』は「密通などなかったとする言いぶり。事実をまげて語り収める」と注す。"
"52","4","3","9","375","1","かうぞ言はむかし","『集成』は「以下、薫の心中に添って書く」。『完訳』は「こんな場合はこう答えるもの。主人を弁護し自分たち女房の過失を隠のが女房の常」と注す。"
"52","4","3","10","376","1","宮をめづらしく","以下「求め出でまし」まで、薫の心中の思い。"
"52","4","3","10","377","1","いと明らむるところなく","『集成』は「〔もともと〕はっきりした考えもなく」。『完訳』は「浮舟はまるで判断力に乏しく」と注す。"
"52","4","3","10","378","2","さし放ち据ゑざらましかば--深き谷をも求め出でまし","反実仮想の構文。浮舟を放置していたことに対する後悔。<BR>【深き谷をも求め】－『紫明抄』は「世の中の憂きたびごとに身を投げば深き谷こそ浅くなりけれ」（古今集俳諧、一〇六一、読人しらず）を指摘。"
"52","4","3","11","379","1","いみじう憂き水の契りかな","薫の感想。"
"52","4","3","11","380","1","あはれと思ひそめたりし方にて","大島本は「思そめたりし」とある。『集成』『完本』は諸本に従って「思ひそめてし」と校訂する。『新大系』は底本のまま「思そめたりし」とする。"
"52","4","3","11","381","1","この里の名をだに","宇治の地名。「宇治」は「憂し」に通じる。"
"52","4","4","1","382","1","宮の上の","中君が。"
"52","4","4","1","383","1","人形とつけそめたりしさへ","「人形」は祓いの後に水に流されもの。"
"52","4","4","1","384","1","ただわが過ちに失ひつる人なり","薫の後悔の念。"
"52","4","4","1","385","1","母のなほ","以下「しなしけるなめり」まで、薫の心中の思い。"
"52","4","4","1","386","1","後の後見も","死後の世話、葬送の儀式。"
"52","4","4","2","387","1","いかに思ふらむ","以下「思ふなるらむかし」まで、薫の心中の思い。浮舟の母の心中を忖度。"
"52","4","4","2","388","1","わがゆかりに","自分の縁者、薫の正室女二宮の方から何かあったのではないか、と。"
"52","4","4","3","389","1","穢らひといふことは","浮舟が死んだ場所の穢れ。"
"52","4","4","3","390","1","御供の人目もあれば","世間や供人には病死と言ってある。"
"52","4","4","3","391","1","昇りたまはで","穢れに触れないよう室内に上がらない。"
"52","4","4","3","392","1","今は","以下「心憂かるべし」まで、薫の思い。"
"52","4","4","4","393","2","我もまた憂き古里を荒れはてば--誰れ宿り木の蔭をしのばむ","薫の独詠歌。八宮、大君、中君に続いて自分薫までが、の意。"
"52","4","4","5","394","1","阿闍梨今は律師なりけり","律師は、僧正、僧都に次ぐ地位。"
"52","4","4","5","395","1","罪いと深かなるわざ","薫の思い。「自殺者殺生之随一也」（河海抄所引）。「なる」伝聞推定の助動詞。"
"52","4","4","5","396","1","あらましかば今宵帰らましやは","薫の思い。浮舟が生きていたら。反実仮想の構文。反語表現。"
"52","4","4","7","397","1","いともいとも","以下「臥してはべる」まで、弁尼の返事。"
"52","4","4","7","398","1","うつぶし臥して","『河海抄』は「世を厭ひ木のもとごとに立ちよりてうつぶし染めの麻の衣なり」（古今集雑体、一〇六八、読人しらず）を指摘。"
"52","4","4","9","399","1","骸をだに","以下「混じりけむ」まで、薫の心中の思い。"
"52","4","4","9","400","1","いづれの底のうつせに混じりけむ","大島本は「ましりけむ」とある。『集成』『完本』は諸本に従って「まじりにけむ」と「に」を補訂する。『新大系』は底本のまま「まじりけむ」とする。「うつせ」は「うつせ貝」、空になった貝。『弄花抄』は「今日今日とわが待つ君は石川の貝に交じりてありといはずやも」（万葉集巻二、依羅娘子）を指摘。"
"52","4","5","1","401","1","慎み騒げば","京の娘は出産を控えて死穢に触れることを避けている。"
"52","4","5","1","402","1","例の家にも","夫常陸介の家。"
"52","4","5","1","403","1","旅居のみして","『集成』は「三条の小家にでもいるのであろう」と注す。"
"52","4","5","1","404","1","残りの人びとの上も","浮舟以外の娘たちの身の上。"
"52","4","5","2","405","1","あさましきことは","以下「尋ねたまへ」まで、薫の手紙。浮舟の死をさす。"
"52","4","5","2","406","1","闇にか惑はれたまふらむと","『河海抄』は「人の親の心は闇にあらねども子を思ふ道に惑ひぬるかな」（後撰集雑一、一一〇二、藤原兼輔）を指摘。"
"52","4","5","2","407","1","過ぎにし名残とは","『集成』は「亡き人（浮舟）の形見とも思われて」と注す。"
"52","4","5","3","408","1","かの大蔵大輔","薫の家司、仲信。"
"52","4","5","4","409","1","心のどかに","以下「思ふべくなむ」まで、薫が仲信に伝えさせた口上。"
"52","4","5","4","410","1","年ごろにさへなりにけるほど","昨秋から今年の四月までの間。浮舟を宇治に置いておいた間。"
"52","4","6","1","411","1","いたくしも忌むまじき穢らひなれば","浮舟の死は邸宅内での死ではないので。"
"52","4","6","1","412","1","深うしも触れはべらず","大島本は「ふかうしも」とある。『集成』『完本』は諸本に従って「深うも」と「し」を削除する。『新大系』は底本のまま「深うしも」とする。浮舟母の詞。"
"52","4","6","1","413","1","御返り","浮舟母から薫への返書。"
"52","4","6","2","414","1","いみじきことに","以下「やすからずなむ」まで、浮舟母の返書。"
"52","4","6","3","415","1","かたじけなき御一言を","薫が浮舟を京の邸に迎えようと言ったこと。"
"52","4","6","3","416","1","頼みきこえはべりしに","大島本は「きこえ侍しに」とある。『集成』『完本』は諸本に従って「きこえさせ」と「させ」を補訂する。『新大系』は底本のまま「きこえ」とする。"
"52","4","6","3","417","1","里の契りも","宇治という地名。「憂し」に通じる。"
"52","4","6","4","418","1","さまざまにうれしき仰せ言に","自分のことや子供たちの将来のことに目をかけてくれるという言葉に。"
"52","4","6","4","419","1","目の前の涙にくれて","大島本は「なミたにくれて」とある。『集成』『完本』は諸本に従って「くれはべりて」と「はべり」を補訂する。『新大系』は底本のまま「くれて」とする。『全書』は「行く先を知らぬ涙の悲しきはただ目の前に落つるなりけり」（後撰集、離別羇旅、一三三三、源済）を指摘。"
"52","4","6","5","420","1","かの君に","浮舟に。"
"52","4","6","5","421","1","よき班犀の帯太刀のをかしきなど","斑犀の帯、太刀。『集成』は「浮舟にさし上げて、家臣の料などに与えてもらう積りだったのであろう。「斑犀の帯」は、斑文のある犀角を飾りにした石帯。四位五位の束帯に用いる」と注す。"
"52","4","6","6","422","1","これは昔の人の御心ざしなり","浮舟母の詞。<BR>【昔の人】－故人浮舟。"
"52","4","6","7","423","1","贈らせてけり","召使をして贈らせた。使者に帰り際に贈り物ををする作法。"
"52","4","6","9","424","1","いとすぞろなるわざかな","大島本は「すそろなる」とある。『集成』『完本』は諸本に従って「すずろなる」と校訂する。『新大系』は底本のまま「すぞろなる」とする。薫の詞。"
"52","4","6","10","425","1","言葉には","口上には、の意。"
"52","4","6","11","426","1","みづから会ひはべりたうびて","浮舟母自身が。"
"52","4","6","11","427","1","幼き者どもの","以下「さぶらはせむ」まで、浮舟母の詞を引用。"
"52","4","6","11","428","1","恥づかしう","大島本は「はつかしう」とある。『集成』『完本』は諸本に従って「はづかしうなむ」「恥づかしくなむ」と「なむ」を補訂する。『新大系』は底本のまま「はづかしう」とする。"
"52","4","6","11","429","1","人に何ゆゑなどは知らせはべらで","『完訳』は「浮舟が薫の妻妾にまでならなかったことからの配慮」と注す。"
"52","4","6","11","430","1","あやしきさまどもを","浮舟の異母弟たちを謙遜していう。"
"52","4","6","13","431","1","げにことなることなき","以下「見すべきこと」まで、薫の心中の思い。"
"52","4","6","13","432","1","ゆかり睦び","親戚付き合い。"
"52","4","6","13","433","1","さばかりの人の娘たてまつらずやはある","反語表現。受領の娘が後宮に入内した例はある。"
"52","4","6","13","434","1","時めかし思さむは","大島本は「おほさんハ」とある。『集成』『完本』は諸本に従って「思さむをば」と「を」を補訂する。『新大系』は底本のまま「おぼさんは」とする。"
"52","4","6","13","435","1","人の誹るべきことかは","反語表現。非難できない。"
"52","4","6","13","436","1","世に古りにたるなどを","いちど結婚したことのある女。"
"52","4","6","14","437","1","わがもてなしのそれに穢るべく","『集成』は「浮舟とは正式な結婚をしたわけではないから、女の身分を云々されても、自分の落度にはならない、の意」と注す。"
"52","4","7","1","438","1","かしこには","三条の小家。浮舟母のいる所。"
"52","4","7","1","439","1","立ちながら来て","『集成』は「ちょっとやって来て」と訳す。"
"52","4","7","1","440","1","折しもかくてゐたまへることなむ","常陸介の詞。娘の出産という重大な時期に、の意。"
"52","4","7","1","441","1","いづくになむおはするなど","主語は浮舟。"
"52","4","7","1","442","1","はかなきさまにておはすらむ","常陸介の心中。主語は浮舟。"
"52","4","7","1","443","1","京になど迎へたまひて後","大島本は「むかへ給てのち」とある。『集成』『完本』は諸本に従って「迎へたまひてむ後」と「む」を補訂する。『新大系』は底本のまま「迎へ給てのち」とする。以下「など知らせむ」まで、浮舟母の心中。"
"52","4","7","2","444","1","よき人かしこくして鄙びものめでする人にて","高貴な人を崇めて田舎人らしく何にでも感心する性格。"
"52","4","7","3","445","1","いとめでたき御幸ひを","以下「頼もしきことになむ」まで、常陸介の詞。"
"52","4","7","3","446","1","近く召し使ふこともなく","大島本は「めしつかふこともなく」とある。『集成』『完本』は諸本に従って「召し使ひたまふ」と「たまふ」を補訂する。『新大系』は底本のまま「召し使ふ」とする。"
"52","4","7","3","447","1","思はする殿なり","大島本は「おもはする」とある。『集成』『完本』は諸本に従って「おはする」と「も」を削除する。『新大系』は底本のまま「思はする」とする。"
"52","4","7","4","448","1","喜ぶを見るにも","主語は浮舟母。"
"52","4","7","5","449","2","さるはおはせし世には--あらずかし","『万水一露』は「薫の心を草子の地にいへる也」と注す。"
"52","4","7","5","450","1","わが過ちにて","以下「慰めむ」まで、薫の心中。"
"52","4","7","5","451","1","人の誹りねむごろに尋ねじ","薫の心中。"
"52","4","8","1","452","1","いかなりけむことにかはと","『集成』は「あるいは生きているかもしれない、とも思う」。『完訳』は「遺骸がないだけに不審が残る」と注す。"
"52","4","8","1","453","1","とてもかくても","生きているにせよ亡くなったにせよ、法事は罪障消滅になる。"
"52","4","8","1","454","1","かの律師の寺にて","大島本は「てらにて」とある。『集成』『完本』は諸本に従って「寺にてなむ」と「なむ」を補訂する。『新大系』は底本のまま「寺にて」とする。"
"52","4","8","2","455","1","宮よりは","匂宮から。"
"52","4","8","2","456","1","殿の人ども","薫の家人。"
"52","4","8","3","457","1","あやしく","以下「誰れならむ」まで、殿人の心中。"
"52","4","8","4","458","1","常陸守来て主人がり居る","『完訳』は「浮舟の養父というだけでなく、薫からの後援があるという頼もしさも加わって、得意然とする」と注す。"
"52","4","8","4","459","1","少将の子産ませて","左近少将、常陸介の婿。産養いを盛大に行おうとする。"
"52","4","8","4","460","1","この御法事の、忍びたるやうに思したれど","『集成』は「この（浮舟の）ご法要が。以下わが家の産養と比べる常陸の介の心中」と注す。「思し」の主語は薫で、薫に対する敬語であろう。"
"52","4","8","4","461","1","生きたらましかば","以下「宿世なりけり」まで、常陸介の心中。"
"52","4","8","5","462","1","宮の上も","中君。"
"52","4","8","5","463","1","七僧の前のこと","大島本は「まへの事」とある。『集成』『完本』は諸本に従って「前のことも」と「も」を補訂する。『新大系』は底本のまま「前の事」とする。法会を行う役僧。講師、読師、呪願、三礼、唄、散花、堂達。"
"52","4","8","5","464","1","帝までも聞こし召して","大島本は「みかとまても」とある。『集成』『完本』は諸本に従って「帝まで」と「も」を削除する。『新大系』は底本のまま「みかどまでも」とする。"
"52","4","8","5","465","1","隠し置きたまひたりける","大島本は「かくしをき給たりける」とある。『集成』『完本』は諸本に従って「隠しおきたまへりけるを」と校訂する。『新大系』は底本のまま「隠しをき給たりける」とする。"
"52","4","8","5","466","1","かかる人持たまへりけり","帝の感想。「持つ」の主語は薫。"
"52","4","8","5","467","1","おろかにもあらざりける人を","以下「いとほし」まで、帝の心中。「人」は浮舟をさす。"
"52","4","8","5","468","1","宮にかしこまりきこえて","女二宮、薫の正妻。"
"52","4","8","6","469","1","二人の人の御心のうち","薫と匂宮。"
"52","4","8","6","470","1","あやにくなりし御思ひの","匂宮についていう。"
"52","4","8","6","471","1","いといみじければ","大島本は「いみしけれは」とある。『集成』『完本』は諸本に従って「いみじけれど」と校訂する。『新大系』は底本のまま「いみじければ」とする。"
"52","4","8","6","472","1","あだなる御心は慰むやなどこころみたまふこともやうやうありけり","匂宮の好色な性格。"
"52","4","8","7","473","1","かの殿は","薫。"
"52","4","8","7","474","1","いふかひなきことを忘れがたく思す","薫の性格。匂宮との対照性を語る。"
"52","5","1","1","475","1","后の宮の御軽服のほどは","明石中宮の叔父の故蜻蛉式部卿宮の軽服、三か月間。"
"52","5","1","1","476","1","二の宮なむ式部卿になりたまひにける","匂宮（三宮）の兄、式部卿となる。"
"52","5","1","1","477","1","重々しうて常にしも参りたまはず","主語は匂宮の兄、式部卿宮。母明石中宮のもとに。"
"52","5","1","1","478","1","この宮は","匂宮。"
"52","5","1","1","479","1","一品の宮","匂宮の同母の姉、女一宮。"
"52","5","1","1","480","1","よき人の容貌をも","女一宮のもとに伺候している美貌の女房の顔を。"
"52","5","1","2","481","1","いと忍びて語らはせたまふ","大島本は「かたらハせ給」とある。『集成』『完本』は諸本に従って「語らひたまふ」と校訂する。『新大系』は底本のまま「語らはせ給」とする。"
"52","5","1","2","482","1","小宰相の君といふ人の","女一宮のもとに伺候している女房、小宰相君。『完訳』は「「--の」は、「同じ琴を--」に続く。その間は挿入句」と注す。"
"52","5","1","3","483","1","この宮も","匂宮も小宰相君に執心。"
"52","5","1","3","484","1","言ひ破りたまへど","匂宮が薫と小宰相君の仲に水をさすような悪口を言う。"
"52","5","1","3","485","1","などかさしもめづらしげなくはあらむ","小宰相君の心中。世間一般の女と違って自分は簡単に匂宮に靡くまい。"
