"Volume","Chapter","Paragraph","Line","Annotation_Num","Annotation_State","Annotation_Title","Annotation_Body"
"26","2","6","12","282","1","もて出でてこそあらね","挿入句。『集成』は「（ご姉妹のことゆえ）おおっぴらにではないが」。『完訳』は「そう露骨に示しはしないが」と訳す。"
"26","2","6","12","283","1","御返り乞へば","主語は使者の樋洗童。"
"26","2","6","13","284","1","をかしきことの","以下「いとほしからむ」まで、中納言の君の詞。"
"26","2","6","13","285","1","聞こえさせにくくこそ","係助詞「こそ」の下に「侍れ」などの語句が省略。"
"26","2","6","15","286","1","近きしるしなき","以下、和歌の終わり「筥崎の松」まで、中納言の君が書いた返事。"
"26","2","6","16","287","2","常陸なる駿河の海の須磨の浦に--波立ち出でよ筥崎の松","「常陸の浦」「田子の浦波」の語句を受けて、「常陸なる駿河の海」と返し、また「須磨の浦」「筥崎の松」という歌枕を詠んで返す。「松」は「待つ」の掛詞。「波」と「立つ」は縁語。歌意は「立ち出でよ」「待つ」にある。"
"26","2","6","18","288","1","あなうたて","以下「もこそ言ひなせ」まで、弘徽殿女御の詞。連語「もこそ」は、懸念の意を表す。"
"26","2","6","20","289","1","それは聞かむ人わきまへはべりなむ","中納言の君の詞。"
"26","2","6","21","290","1","おし包みて出だしつ","『完訳』は「正式な書状の形式の立文にした。女同士の文通には用いない」と注す。"
"26","2","6","22","291","1","御方見て","近江の君をさす。「御方」という敬語表現が皮肉。"
"26","2","6","23","292","1","をかしの御口つきや待つとのたまへるを","近江の君の詞。間投助詞「を」詠嘆。"
"26","2","6","24","293","1","御対面のほどさし過ぐしたることもあらむかし","『集成』は「草子地」。『完訳』は「語り手の言辞。この夜の出仕のさまを読者の想像にまかせる」と注す。"
