"Volume","Chapter","Paragraph","Line","Annotation_Num","Annotation_State","Annotation_Title","Annotation_Body"
"51","1","1","1","1","1","宮なほかのほのかなりし夕べを","匂宮。二条院で浮舟をちらった見たことをさす。"
"51","1","1","1","2","1","ことことしきほどには","以下「ありしかな」まで、匂宮の心中の思い。浮舟に対する感想。"
"51","1","1","1","3","1","女君をも","中君に対しても。"
"51","1","1","2","4","1","かうはかなきことゆゑ","以下「思はずに心憂し」まで、匂宮の心中。『完訳』は「自分が女房ふぜいの女とかかわるぐらい何でもないことなのに、中の君がむやみに嫉妬するとは意外だ、の気持。嫉妬して浮舟の素姓や所在を明かさぬのだと恨んだ」と注す。"
"51","1","1","3","5","1","いと苦しうて","主語は中君。"
"51","1","1","3","6","1","ありのままにや聞こえてまし","中君の心中。"
"51","1","1","4","7","1","やむごとなきさまには","以下「もてそこなはじ」まで、中君の心中の思い。"
"51","1","1","4","8","1","もてなしたまはざなれど","主語は薫。薫が浮舟を。"
"51","1","1","4","9","1","人の隠し置きたまへる人を","薫が浮舟を。"
"51","1","1","4","10","1","聞き過ぐしたまふべき御心ざまにもあらざめり","匂宮の性分。"
"51","1","1","5","11","1","あるまじき里まで尋ねさせたまふ","親王という身分柄あってはならない、女房ふぜいの実家まで尋ねていく匂宮の性分。"
"51","1","1","5","12","1","さばかり月日を経て思ししむめるあたりは","『完訳』は「匂宮が浮舟に迫ったのは八月。三、四か月後の今も忘れられない」と注す。「あたり」は浮舟をさす。"
"51","1","1","5","13","1","ましてかならず","『完訳』は「女房に手出しする以上に」と注す。"
"51","1","1","5","14","1","見苦しきこと取り出でたまひてむ","『集成』は「薫との間に悶着が起るだろう、の意」と注す。"
"51","1","1","5","15","1","他より伝へ聞きたまはむは","主語は匂宮。浮舟に関する情報を。"
"51","1","1","6","16","1","いづ方ざまにも","薫と浮舟。"
"51","1","1","6","17","1","防ぐべき人の御心ありさまならねば","匂宮の性分。"
"51","1","1","6","18","1","よその人よりは","匂宮の浮気の相手が他人でなく自分の妹であること。"
"51","1","1","7","19","1","異ざまにつきづきしく","『集成』は「ありもしない嘘をついて、もっともらしく言い繕ったりはおできにならないので」と注す。"
"51","1","2","1","20","1","かの人は","薫。"
"51","1","2","1","21","1","待ち遠なりと思ふらむ","薫の心中。宇治にいる浮舟が。"
"51","1","2","1","22","1","かやしく通ひたまふべき","明融臨模本には「かやし（し＝スイ）く」とある。すなわち「し」の傍らに異本「す」と傍記する。『集成』『完本』は傍記と諸本に従って「かやすく」と校訂する。『新大系』は底本（明融臨模本）のまま「かやしく」とする。"
"51","1","2","1","23","1","神のいさむるよりもわりなし","『源氏釈』は「恋しくは来てもみよかしちはやぶる神のいさむる道ならなくに」（伊勢物語）を指摘。"
"51","1","2","2","24","1","今いとよくもてなさむとす","以下「いと本意なし」まで、薫の心中の思い。浮舟の処遇について。『集成』は「以下、地の文から自然に薫の心中の叙述に移る」と注す。"
"51","1","2","2","25","1","日数も経ぬべきことども作り出でて","『完訳』は「日数のかかりそうな法会などにかこつけて浮舟を訪う心づもり」と注す。"
"51","1","2","2","26","1","かの心を","浮舟の心。"
"51","1","2","3","27","1","初めの心に違ふべし","亡き大君の身代わりとして求めた心。"
"51","1","2","3","28","1","宮の御方の聞き思さむことも","『完訳』は「中の君。彼女から、大君追慕の心を喪ったかと思われたくない」と注す。"
"51","1","2","3","29","1","もとの所を","大君ゆかりの宇治の地を。"
"51","1","2","4","30","1","例ののどけさ過ぎたる心からなるべし","『細流抄』は「草子地也」と指摘。『全集』は「薫は、常に人目を顧慮している。「例の、のどけさ過ぎたる心から--」に語り手の揶揄の口調がうかがえるゆえん。薫のこの性格は後の破綻を招く原因ともなる」と注す。"
"51","1","2","4","31","1","渡すべきところ思しまうけて","浮舟を京に迎えて。"
"51","1","3","1","32","1","世の中をやうやう思し知り","『完訳』は「中の君は。以下、心中叙述」と注す。"
"51","1","3","2","33","1","ねびまさりたまふままに","主語は薫。"
"51","1","3","3","34","1","思はずなりける宿世かな","以下「かかりそめけむよ」まで、中君の心中の思い。"
"51","1","3","3","35","1","故姫君の思しおきてしままにもあらで","「故姫君」は、大君。大君は中君と薫の結婚を望んでいた。"
"51","1","3","3","36","1","かくもの思はしかるべき方に","悩み事の多い結婚生活をさす。"
"51","1","3","4","37","1","思す折々多くなむ","下に「ありける」などの語句が省略。"
"51","1","3","4","38","1","対面したまふことは難し","中君が薫に会うことをさす。"
"51","1","3","5","39","1","うちうちの御心を深う知らぬ人は","『集成』は「宇治以来の事情を知らぬ新参の女房が増えているのである」と注す。"
"51","1","3","5","40","1","なほなほしきただ人こそ","『集成』は「以下、女房の心中」と注す。"
"51","1","3","5","41","1","なかなかかう","『集成』は「女房の心中からいつか中の君の心中叙述になる」と注す。"
"51","1","3","5","42","1","思し憚りたまひつつ","主語は中君。地の文にもどる。"
"51","1","3","5","43","1","おのづから疎きさまになりゆくを","中君と薫の関係が。"
"51","1","3","5","44","1","同じ心の変はりたまはぬなりけり","薫の心をいう。"
"51","1","3","6","45","1","他にはかかる人も出で来まじきにや","匂宮の思い。"
"51","1","3","6","46","1","人にまさりて","正室の六君以上に。"
"51","1","4","1","47","1","渡りたまひて","主語は匂宮。『集成』は「上旬は、朝廷、大臣家等での儀式、宴会が多い上、正室の六の君のもとで過さねばならなかったのであろう」と注す。"
"51","1","4","1","48","1","若君の年まさりたまへるを","若君、二歳になる。"
"51","1","4","1","49","1","緑の薄様なる包み文の","浮舟から中君への手紙。「包み文」は、結び文をさらに薄様で包んだもの。後朝の文などに用いる。"
"51","1","4","1","50","1","すくすくしき立文","正式の手紙の形式。右近から大輔に宛てた手紙。"
"51","1","4","1","51","1","女君に","中君に。"
"51","1","4","2","52","1","それはいづくよりぞ","匂宮の詞。"
"51","1","4","4","53","1","宇治より大輔のおとどに","以下「取りはべりぬる」まで、女童の返事。"
"51","1","4","4","54","1","もてわづらひはべりつるを","主語は使者。大輔のおとどがいなくてまごついていた。"
"51","1","4","4","55","1","例の","「御覧ぜむ」にかかる。女童の不用意な失言。"
"51","1","4","6","56","1","この籠は","以下「枝ぞとよ」まで、女童の詞。"
"51","1","4","8","57","1","いで我ももてはやしてむ","匂宮の詞。"
"51","1","4","10","58","1","文は大輔がりやれ","中君の詞。"
"51","1","4","11","59","1","大将のさりげなく","以下「つきづきし」まで、匂宮の心中。手紙を薫からかと疑う。"
"51","1","4","12","60","1","それならむ時に","匂宮の心中。もし薫からの手紙だったら。"
"51","1","4","13","61","1","開けて見むよ怨じやしたまはむとする","匂宮の詞。"
"51","1","4","15","62","1","見苦しう","以下「御覧ぜむ」まで、中君の詞。匂宮をたしなめる。"
"51","1","4","16","63","1","騒がぬけしきなれば","主語は中君。"
"51","1","4","17","64","1","さは見むよ女の文書きはいかがある","匂宮の詞。"
"51","1","4","18","65","1","いと若やかなる手にて","『集成』は「ひどく若々しい筆跡で。書き馴れぬ体。浮舟の手紙である」と注す。"
"51","1","4","19","66","1","おぼつかなくて","以下「絶え間なくて」まで、浮舟の手紙。"
"51","1","4","19","67","1","山里のいぶせさこそ峰の霞も絶え間なくて","『新釈』『大系』は「山隠す春の霞ぞうらめしきいづれの都の境なるらむ」（古今集羇旅、四一三、おと）「都人いかにと問はば山高みはれぬ雲居にわぶと答へよ」（古今集雑下、九三七、小野貞樹）を指摘。"
"51","1","4","21","68","1","これも若宮の御前にあやしうはべるめれど","浮舟の手紙。「これ」は卯槌をさす。"
"51","1","5","1","69","1","おぼえなき","明融臨模本は「おほえなき」とある。『完本』は諸本に従って「おぼえなきを」と「を」を補訂する。『集成』『新大系』は底本のまま「おぼえなき」とする。"
"51","1","5","1","70","1","この立文を","右近から大輔の君への手紙。"
"51","1","5","2","71","1","年改まりて","以下「御覧ぜさせたまへ」まで、右近の手紙。"
"51","1","5","2","72","1","御私にも","「私」は、主人筋に対して私的なこと。"
"51","1","5","3","73","1","なほふさはしからず","浮舟にとって。"
"51","1","5","3","74","1","眺めさせたまふよりは","主語は浮舟。"
"51","1","5","3","75","1","時々は渡り参らせたまひて","浮舟を中君のもとに参上あそばして。「せたまひて」は二重敬語。"
"51","1","5","3","76","1","思しとりて","主語は浮舟。"
"51","1","5","4","77","1","大き御前の","匂宮をさしていう。"
"51","1","5","5","78","1","言忌もえしあへず","『集成』は「（正月だというのに）縁起でもない言葉を慎むことも忘れて。「ふさはしからず」「つつましく恐ろしきものに」「もの憂きことに嘆かせたまふ」など」と注す。"
"51","1","5","6","79","1","今はのたまへかし誰がぞ","匂宮の詞。"
"51","1","5","8","80","1","昔かの山里に","以下「なむ聞きはべりし」まで、中君の詞。"
"51","1","5","9","81","1","かのわづらはしきことあるに","二条院で匂宮が浮舟に迫った事件。"
"51","1","5","11","82","2","まだ古りぬ物にはあれど君がため--深き心に待つと知らなむ","浮舟の詠歌。「まだ古り」に「またぶり」を響かせ、「松」「待つ」「先づ」は懸詞。「君」は若君をさす。若君の長寿と弥栄を予祝する歌。"
"51","1","5","12","83","1","かの思ひわたる人のにや","匂宮の心中。"
"51","1","5","13","84","1","返り事したまへ","以下「まかりなむよ」まで、匂宮の詞。"
"51","1","5","13","85","1","まかりなむよ","主語は自分匂宮。"
"51","1","5","14","86","1","少将などして","「などして」は、などに向かっての意。「少将」は中君付きの女房。「宿木」「東屋」巻に登場。"
"51","1","5","15","87","1","いとほしくもありつるかな","以下「見ざりつるぞ」まで、中君の詞。浮舟の手紙を匂宮に見られてしまったことを後悔する。"
"51","1","5","15","88","1","人は","他の女房。"
"51","1","5","17","89","1","見たまへましかば","以下「をかしけれ」まで、少将君の詞。「ましかば--参らせまし」反実仮想の構文。"
"51","1","5","17","90","1","人は","女子一般をさす。"
"51","1","5","19","91","1","あなかま幼き人な腹立てそ","中君の詞。"
"51","1","5","20","92","1","去年の冬","以下「したまふなりけり」まで、語り手の補足説明的叙述。三光院「注にかけり」と指摘。"
"51","1","6","2","93","1","あやしうもあるかな","以下「隠しおきたまへるなるべし」まで、匂宮の心中の思い。"
"51","1","6","2","94","1","忍びて夜泊りたまふ時もあり","匂宮の耳に入る風聞。"
"51","1","6","2","95","1","人の形見","大君の思いでの土地。"
"51","1","6","3","96","1","御書のこと","「書」は学問の意。"
"51","1","6","3","97","1","かの殿に","薫の邸。"
"51","1","6","4","98","1","韻塞すべきに","以下「積むべきこと」まで、匂宮の命じた詞の内容。間接的話法。"
"51","1","6","6","99","1","右大将の宇治へ","以下「いかでか見るべき」まで、匂宮の詞。"
"51","1","6","8","100","1","寺いとかしこく","以下「申すと聞きたまへし」まで、大内記の詞。"
"51","1","6","8","101","1","となむ--申すと聞きたまへし","『集成』は「大内記は、「下の人々」の噂を更に聞き伝えた体」と注す。"
"51","1","7","1","102","1","いとうれしくも聞きつるかな","匂宮の心中の思い。"
"51","1","7","2","103","1","たしかにその人とは","以下「と聞きし」まで、匂宮の詞。"
"51","1","7","3","104","1","尼は、廊になむ","以下「けはひにてゐてはべる」まで、大内記の詞。"
"51","1","7","3","105","1","この人は","噂の人。浮舟をさす。"
"51","1","7","5","106","1","をかしきことかな","以下「隈ある構へよ」まで、匂宮の詞。"
"51","1","7","6","107","1","この人の","以下「軽々し」まで、夕霧の詞を引用。"
"51","1","7","7","108","1","いづら","相手に呼びかける語。"
"51","1","7","8","109","1","隠したまふことも","主語は薫。"
"51","1","7","8","110","1","聞くなるべし","語り手の推量。"
"51","1","7","9","111","1","いかにしてこの人を","以下「いとねたう」あたりまで、匂宮の心中の思い。末尾は地の文に流れる。"
"51","1","7","9","112","1","かの君の","薫。"
"51","1","7","9","113","1","このわたりには","中君をさす。"
"51","1","7","9","114","1","心を交はして","中君と薫が。"
"51","2","1","1","115","1","賭弓内宴など過ぐして","賭弓は正月十八日、内宴は正月二十一、二、三頃の行事。"
"51","2","1","1","116","1","司召など","正月の中旬から下旬に行われる。"
"51","2","1","1","117","1","何とも思さねば","主語は匂宮。"
"51","2","1","2","118","1","いと難きことなりともわが言はむことはたばかりてむや","匂宮の詞。"
"51","2","1","3","119","1","かしこまりてさぶらふ","主語は大内記。"
"51","2","1","4","120","1","いと便なきことなれど","以下「いかがすべき」まで、匂宮の詞。"
"51","2","1","4","121","1","と聞きあはすることこそあれ","『完訳』は「大内記の話で思いあたったとして、下心を見抜かれぬよう装う」と注す。"
"51","2","1","4","122","1","ものより覗きなどして","主語は自分匂宮が。"
"51","2","1","5","123","1","あなわづらはし","大内記の心中。"
"51","2","1","6","124","1","おはしまさむことは","以下「知りはべらむ」まで、大内記の詞。"
"51","2","1","6","125","1","人の知りはべらむことはただ御供にさぶらひはべらむこそは","匂宮の微行を供人以外誰も知らない、意。"
"51","2","1","8","126","1","さかし昔も","以下「つつましきなり」まで、匂宮の詞。"
"51","2","2","1","127","1","今日明日よにおはせじ","明融臨模本は「けふあす（す＋ハ）よに（に＄モ）おはせし」とある。すなわち「は」を補入し「に」をミセケチにして「も」と訂正する。『集成』は底本の本行本文に従う。『完本』『新大系』は訂正本文に従って「今日明日はよも」とする。"
"51","2","2","1","128","1","いにしへを思し出づ","宇治の中君に通った往時。"
"51","2","2","2","129","1","あやしきまで","以下「わざにもあるかな」まで、匂宮の心中の思い。『完訳』は「心を合せては自分を伴ってくれた人、薫に対して。以下、浮舟に近づいて薫を裏切る、自責の念」と注す。"
"51","2","2","2","130","1","さはいへど","いかに好色の人とはいえ。"
"51","2","2","2","131","1","いつしか","以下「あるべけれ」まで、匂宮の心中の思い。"
"51","2","2","3","132","1","法性寺のほどまでは","「東屋」巻に既出。九条河原付近の寺。"
"51","2","2","3","133","1","かの殿の人に","薫邸の人に。"
"51","2","2","4","134","1","我も","大内記自身も、の意。"
"51","2","2","4","135","1","参りて","大内記が偵察から匂宮のもとに帰ってきて、の意。"
"51","2","2","5","136","1","まだ人は起きて","以下「おはしまさむ」まで、大内記の報告。"
"51","2","3","2","137","1","かの火影に見たまひしそれなり","二条院で浮舟と一緒にいたのを見た童女。「東屋」巻には「火影」云々の描写はなかった。"
"51","2","3","2","138","1","右近と名のりし若き人もあり","『新大系』は「あの時、右近と名のったのは、中君づきの侍女。ここは浮舟づき。同名の別人か、匂宮の思い違い」と注す。"
"51","2","3","2","139","1","君は","浮舟。"
"51","2","3","2","140","1","対の御方に","中君。"
"51","2","3","3","141","1","物折るとて","『完訳』は「裁縫で反物に折り目をつける」と注す。"
"51","2","3","4","142","1","かくて渡らせたまひなば","以下「聞こえさせたまへりけむ」まで、右近の詞。主語は浮舟。物詣での話。"
"51","2","3","4","143","1","殿は","薫。"
"51","2","3","4","144","1","朔日ころには","二月の初めころ。"
"51","2","3","4","145","1","御文には","薫への返書。"
"51","2","3","6","146","1","折しも","以下「見苦しさ」まで、右近の詞。薫が来訪した折に、の意。"
"51","2","3","7","147","1","向ひたる人","後文によれば侍従。"
"51","2","3","8","148","1","それはかくなむ渡りぬると","以下「旅心地すべしや」まで、侍従の詞。"
"51","2","3","8","149","1","御消息","薫への手紙。"
"51","2","3","8","150","1","いかでかは","「はひ隠れさせたまはむ」に係る。反語表現。"
"51","2","3","8","151","1","御物詣で","後文によれば石山詣で。"
"51","2","3","8","152","1","やがて渡りおはしましねかし","この宇治の山荘に。京の母の邸にではなく、の意。"
"51","2","3","8","153","1","なかなか旅心地すべしや","京の母の邸はかえって他人の家の心地。"
"51","2","3","10","154","1","なほしばしかくて","以下「幸ひ見果てたまふなれ」まで、女房の詞。"
"51","2","3","10","155","1","待ちきこえさせたまはむぞ","浮舟が薫を。"
"51","2","3","10","156","1","迎へたてまつらせたまへらむ","薫が浮舟を。"
"51","2","3","10","157","1","このおとどの","乳母をさす。"
"51","2","3","10","158","1","にはかにかう聞こえなしたまふ","参詣を母君に勧めたこと。"
"51","2","3","12","159","1","などてこの乳母を","以下「あるにこそ」まで、右近の詞。『集成』は「「まま」は、乳母を親しみ呼ぶ語」と注す。"
"51","2","3","12","160","1","とどめたてまつらずなりにけむ","上京を。後悔する気持ち。"
"51","2","3","13","161","1","乳母やうの人をそしるなめり","「なめり」は匂宮の推測。"
"51","2","3","13","162","1","「げに、憎き者ありかし」と思し出づるも","「げに」は匂宮の納得の気持ち。二条院で浮舟を見つけた折のことを想起。"
"51","2","3","14","163","1","宮の上こそ","以下「こそはあめれ」まで、右近の詞。"
"51","2","3","14","164","1","右の大殿","夕霧。"
"51","2","3","14","165","1","かかるさかしら人どもの","乳母をさす。"
"51","2","3","16","166","1","殿だにまめやかに","以下「たまふべきことかは」まで、女房の詞。「殿」は薫。"
"51","2","3","16","167","1","劣りきこえ","浮舟が中君に。"
"51","2","3","17","168","1","君すこし起き上がりて","浮舟。"
"51","2","3","18","169","1","いと聞きにくきこと","以下「かたはらいたからむ」まで、浮舟の詞。"
"51","2","3","18","170","1","かの御こと","中君の事。"
"51","2","4","1","171","1","何ばかりの","以下「けはひかな」まで、匂宮の心中の思い。"
"51","2","4","1","172","1","心恥づかしげにて","以下「いとをかしき」まで、匂宮の心中の思い。末尾は地の文に流れる。"
"51","2","4","1","173","2","かれは--これは","「かれ」は中君、「これ」は浮舟をさす。"
"51","2","4","1","174","1","さばかりゆかしと思ししめたる人を","浮舟をさす。"
"51","2","4","1","175","1","これを","浮舟。"
"51","2","4","2","176","1","いとねぶたし","以下「日たけてぞあらむ」まで、右近の詞。"
"51","2","4","2","177","1","急がせたまふとも","主語は薫。"
"51","2","4","3","178","1","君も","浮舟。"
"51","2","4","4","179","1","見たまひて","主語は匂宮。"
"51","2","4","4","180","1","この格子をたたきたまふ","主語は匂宮。"
"51","2","4","6","181","1","声づくりたまへば","匂宮が薫の声色を使った。"
"51","2","4","6","182","1","殿の","薫。"
"51","2","4","7","183","1","まづこれ開けよ","匂宮の詞。"
"51","2","4","9","184","1","あやしう","以下「はべりぬらむものを」まで、右近の返事。"
"51","2","4","11","185","1","ものへ渡りたまふべかなりと","以下「まづ開けよ」まで、匂宮の詞。"
"51","2","4","11","186","1","仲信","薫の家司。匂宮は薫を装う。"
"51","2","4","12","187","1","かい放つ","右近は格子を。"
"51","2","4","13","188","1","道にて","以下「火暗うなせ」まで、匂宮の詞。『完訳』は「途中で盗賊にでも出会ったような物言い。見苦しい姿を見せたくないから灯を暗くせよとは、顔を見られたくないための作り事」と注す。"
"51","2","4","15","189","1","あないみじ","右近の詞。"
"51","2","4","17","190","1","我人に","以下「人驚かすな」まで、匂宮の詞。"
"51","2","4","18","191","1","いとらうらうじき御心にて","『完訳』は「実に知恵のまわるお方。嘘つきを皮肉る、語り手の評言」と注す。"
"51","2","4","18","192","1","ゆゆしきことのさま","以下「御姿ならむ」まで、右近の心中の思い。"
"51","2","4","19","193","1","いと細やかに","匂宮の姿態。"
"51","2","4","20","194","1","例の御座にこそ","右近の詞。"
"51","2","4","21","195","1","ものものたまはず","主語は匂宮。"
"51","2","4","21","196","1","御衾参りて","主語は右近。"
"51","2","4","21","197","1","知らぬならひにて","『集成』は「薫の家来は、いつも、浮舟方では接待せぬことになっているので。弁の尼のいる廊の方で世話をする習慣なのであろう」と注す。"
"51","2","4","22","198","1","あはれなる夜の","以下「御覧じ知らぬよ」まで、女房の詞。"
"51","2","4","25","199","1","あなかま","以下「かしがましき」まで、右近の詞。"
"51","2","4","27","200","1","女君は","浮舟。"
"51","2","4","27","201","1","あらぬ人なりけり","浮舟の心中。薫ではない人だ。"
"51","2","4","27","202","1","いとつつましかりし所にてだに","二条院。中君の手前。"
"51","2","4","27","203","1","ひたぶるにあさまし","『完訳』は「何の気がねもない放埒ぶりだ。語り手の評言」と注す。"
"51","2","4","27","204","1","いかが","『完訳』は「「いかが」の語法やや不審」と注す。"
"51","2","4","27","205","1","夢の心地するに","浮舟の心地。また下文の匂宮の心地の意としても機能。"
"51","2","4","27","206","1","その折のつらかりし","匂宮の気持ち。匂宮が周囲の女房から妨げられたこと。"
"51","2","4","27","207","1","年月ごろ","匂宮が浮舟に迫ったのは昨年の秋八月、現在その翌年の一月下旬。年を越しているので「年ごろ」また「年月ごろ」。"
"51","2","4","28","208","1","かの上の御ことなど","中君。"
"51","2","5","1","209","1","出でたまはむ心地もなく","主語は匂宮。"
"51","2","5","1","210","1","京には求め騒がるとも","以下「ためこそあれ」あたりまで、匂宮の心中の思い。末尾は地の文に流れる。"
"51","2","5","1","211","1","生ける限りのためこそあれ","『源氏釈』は「恋死なむ後は何せむ生ける日のためこそ人は見まくほしけれ」（拾遺集恋一、六八五、大伴百世）を指摘。"
