"Volume","Chapter","Paragraph","Line","Annotation_Num","Annotation_State","Annotation_Title","Annotation_Body"
"52","6","2","1","657","1","侍従をぞ","浮舟づきの女房、侍従。"
"52","6","2","2","658","1","皆人どもは","宇治の女房たち。"
"52","6","2","2","659","1","乳母とこの人二人","乳母とこの女房二人、すなわち右近と侍従の計三人。"
"52","6","2","2","660","1","取り分きて思したりしも","主語は浮舟。特別に目をかけて下さった、の意。"
"52","6","2","2","661","1","侍従はよそ人なれど","侍従は右近と違って乳母子でなく、後に仕えた普通の女房。"
"52","6","2","2","662","1","世づかぬ川の音もうれしき瀬もやあると頼みしほどこそ","『弄花抄』は「祈りつつ頼みぞ渡る初瀬川うれしき瀬にも流れあふやと」（古今六帖三、川）を指摘。『源氏物語引歌』は「心みに猶おりたたむ涙川うれしき瀬にも流れあふやと」（後撰集恋二、六一二、藤原敏仲）を指摘。"
"52","6","2","2","663","1","京になむ","係助詞「なむ」は「このころゐたりける」に係る。"
"52","6","2","2","664","1","尋ねたまひて","大島本は「たつね給ひて」とある。『集成』『完本』は諸本に従って「尋ね出でたまひて」と「出で」を補訂する。『新大系』は底本のまま「尋ね給ひて」とする。主語は匂宮。"
"52","6","2","3","665","1","かくてさぶらへ","匂宮の詞。"
"52","6","2","4","666","1","とのたまへば","大島本は「の給へハ」とある。『集成』『完本』は諸本に従って「のたまへど」と校訂する。『新大系』は底本のまま「の給へば」とする。"
"52","6","2","4","667","1","御心はさるものにて","以下「聞きにくきこともあらむ」まで、侍従の心中の思い。"
"52","6","2","4","668","1","さる筋のこと混じりぬるあたりは","『完訳』は「浮舟が中の君の異母妹でありながら中の君の夫匂宮の情愛を受けたという、複雑な関係に遠慮」と注す。"
"52","6","2","4","669","1","后の宮に参らむ","侍従の意向。"
"52","6","2","5","670","1","いとよかなり","以下「思しつかはむ」まで、匂宮の詞。"
"52","6","2","6","671","1","心細くよるべなきも慰むや","侍従の心中の思い。"
"52","6","2","6","672","1","知るたより求め参りぬ","大島本は「もとめまいりぬ」とある。『集成』『完本』は諸本に従って「求めて参りぬ」と「て」を補訂する。『新大系』は底本のまま「求めまいりぬ」とする。"
"52","6","2","6","673","1","きたなげなくてよろしき下臈なり","明石中宮方の女房の侍従を見た評価。"
"52","6","2","6","674","1","ものの姫君のみ参り集ひたる宮","大島本は「まいりつとひたる」とある。『集成』『完本』は諸本に従って「多く参り集ひたる」と「多く」を補訂する。『新大系』は底本のまま「まいりつどひたる」とする。明石中宮のもとには高貴な大家の姫君ばかりが女房として出仕している。"
"52","6","2","6","675","1","見たてまつりし人に似たるはなかりけり","大島本は「見たてまつりし人に」とある。『集成』『完本』は諸本に従って「なほ見たてまつりし人に」と「なほ」を補訂する。『新大系』は底本のまま「見たてまつりし人に」とする。侍従の感想。上流の貴族の娘ばかりだが、浮舟ほど美しい女房はいなかった、の意。"
"52","6","3","1","676","1","式部卿宮","蜻蛉式部卿宮、桐壺帝の皇子、源氏の弟。"
"52","6","3","1","677","1","継母の北の方","『完訳』は「式部卿宮の後妻。話題の「御むすめ」は先妻腹であろう」と注す。庶妻とも考えられよう。"
"52","6","3","1","678","1","兄の馬頭","継母の北の方の兄弟。右馬頭、従五位上相当官。"
"52","6","3","1","679","1","心懸けたるを","継母の北の方の兄弟の右馬頭が式部卿宮の御娘に懸想している。"
"52","6","3","1","680","1","いとほしうなども思ひたらで","主語は継母の北の方。"
"52","6","3","1","681","1","さるべきさまになむ契る","継母の北の方が縁づけた。"
"52","6","3","1","682","1","聞こし召すたよりありて","主語は明石中宮。"
"52","6","3","1","683","1","いとほしう","以下「もてなさむこと」まで、明石中宮の詞。明石中宮と式部卿宮の御娘は従姉妹の間柄。"
"52","6","3","3","684","1","いと心細くのみ思ひ嘆きたまふありさま","式部卿宮の御娘の様子。"
"52","6","3","4","685","1","なつかしうかく尋ねのたまはするを","式部卿宮の御娘の兄弟の侍従の詞。明石中宮の詞を聞いてこう言う。"
"52","6","3","5","686","1","迎へ取らせたまひてけり","『完訳』は「中宮方で女房として引き取る」と注す。"
"52","6","3","5","687","1","姫宮の御具にて","女一宮のお相手。"
"52","6","3","5","688","1","限りあれば宮の君などうち言ひて裳ばかりひきかけたまふぞいとあはれなりける","『集成』は「（とはいえ）決りがあることなので（女房として出仕したものだから）、宮の君など名付けて。召名（女房としての呼び名）が付く」「裳くらいは。唐衣は略している体。主人の前では女房は裳、唐衣着用の正装が決りである」と注す。語り手の同情が移入された叙述。"
"52","6","3","6","689","1","兵部卿宮","匂宮。"
"52","6","3","6","690","1","この君ばかりや","以下「兄弟ぞかし」まで、匂宮の心中の思い。「この君」は式部卿の娘、宮の君をさす。"
"52","6","3","6","691","1","恋しき人","浮舟をさす。"
"52","6","3","6","692","1","父親王は兄弟ぞかし","宮の方の父故蜻蛉式部卿宮と浮舟の父宇治八宮の兄弟である、の意。"
"52","6","3","6","693","1","人ゆかしき御癖やまで","『集成』は「女あさりの」。『完訳』は「女人にはまるで目がないというお癖がやまず」と注す。"
"52","6","3","7","694","1","大将","薫。"
"52","6","3","7","695","1","もどかしきまでも","以下「わざにこそ」まで、薫の心中の思い。"
"52","6","3","7","696","1","けしきばませたまひきかし","主語は蜻蛉式部卿宮。「東屋」巻に語られている。"
"52","6","3","7","697","1","水の底に身を沈めても","浮舟の入水をさす。"
"52","6","3","7","698","1","人よりは心寄せきこえたまへり","宮の方に対して。憐愍と同情から。"
"52","6","3","8","699","1","この院におはしますをば","明石中宮が軽服のため六条院に里下りしている。"
"52","6","3","8","700","1","常にしもさぶらはぬどもも","大島本は「さふらハぬともゝ」とある。『集成』『完本』は諸本に従って「さぶらはぬ人どもも」と「人」を補訂する。『新大系』は底本のまま「さぶらはぬどもも」とする。"
"52","6","3","9","701","1","左大臣殿","横山本や池田本は「右大殿」とある。『集成』は「右の大殿」と校訂。『完訳』は「左大臣殿」のまま、「「右大臣」とあるべきか。夕霧。六条院の現在の主である」と注す。"
"52","6","3","9","702","1","営み仕うまつりたまふ","明石中宮の里下りをはじめとして万事に世話する。"
"52","6","3","9","703","1","いかめしうなりたる","大島本は「なりたる」とある。『集成』『完本』は諸本に従って「なりにたる」と「に」を補訂する。『新大系』は底本のまま「なりたる」とする。"
"52","6","3","10","704","1","この宮","匂宮。"
"52","6","3","10","705","1","例の御心ならば","『完訳』は「普通なら匂宮は、その好色な本性から宮の君などを相手に、浮気沙汰を引き起していたはず」と注す。現在、浮舟を失って悲嘆中。"
"52","6","3","10","706","1","し出でたまはまし","「まし」反実仮想の助動詞。現在は悲嘆にくれて意気消沈。"
"52","6","3","10","707","1","人目にすこし生ひ直りたまふかなと見ゆるを","大島本は「人めにすこしおいな越り給かな」とある。『集成』『完本』は諸本に従って「人目には」「したまふかな」と「は」と「し」を補訂する。『新大系』は底本のまま「人目に」「給かな」とする。語り手の判断。"
"52","6","3","10","708","1","このころぞまた","浮舟失踪後三か月が経過。"
"52","6","4","1","709","1","涼しくなりぬとて","季節は初秋七月に推移。"
"52","6","4","1","710","1","宮内裏に参らせたまひなむと","明石中宮、蜻蛉式部卿の軽服三か月の喪が明けて、内裏に帰参。"
"52","6","4","2","711","1","秋の盛り紅葉のころを見ざらむこそ","女房の詞。係助詞「こそ」の下に「口惜しけれ」などの語句が省略。"
"52","6","4","3","712","1","この宮ぞ","匂宮。"
"52","6","4","3","713","1","かかる筋は","管弦の遊び。"
"52","6","4","3","714","1","朝夕目馴れても、なほ今見む初花のさましたまへるに","匂宮の美しさ。『完訳』は「目のさめるような匂宮の美しさにいまさらながら感嘆させられる趣。女房の感想。次の薫のあり方と対比」と注す。"
"52","6","4","4","715","1","例の二所参りたまひて","匂宮と薫、いつものように明石中宮のもとに参上。"
"52","6","4","4","716","1","かの侍従は","かつては浮舟づきの女房、現在は明石中宮のもとで下臈の女房として出仕。"
"52","6","4","5","717","1","いづ方にもいづ方にもよりて","以下「心憂かりける御心かな」まで、侍従の感想。浮舟の悲運を思う。「いづ方にも」は薫と匂宮。"
"52","6","4","5","718","2","めでたき御宿世--おはせましかし","反実仮想の構文。浮舟が生きていたら。"
"52","6","4","5","719","1","あさましくはかなく心憂かりける御心かな","「御心」は浮舟の思慮。『集成』は「浮舟の入水を悔む、侍従のひそかな思い」。『完訳』は「自分だって下臈女房にならずにすんだろうに、との無念の気持」と注す。"
"52","6","4","6","720","1","そのわたりのこと","宇治での出来事。"
"52","6","4","6","721","1","宮は","匂宮。"
"52","6","4","6","722","1","聞こえさせたまへば","匂宮が明石中宮に。"
"52","6","4","6","723","1","いま一所は","薫をさす。"
"52","6","4","6","724","1","見つけられたてまつらじ","以下「と見えたてまつらじ」まで、侍従の心中の思い。"
"52","6","4","6","725","1","御果てをも過ぐさず心浅し","一周忌明けを待たず出仕したことをさす。"
"52","6","5","1","726","1","物語などする所におはして","大島本は「ものかたりなとする所に」とある。『集成』『完本』は諸本に従って「物語など忍びやかにする所」と「忍びやかに」を補訂する。『新大系』は底本のまま「もの語りなどする所」とする。主語は薫。"
"52","6","5","2","727","1","なにがしをぞ","以下「いとなむうれしき」まで、薫の詞。「なにがし」は薫自身をさす。"
"52","6","5","2","728","1","女房は睦ましと思すべき女だにかく心やすくはよもあらじかし","大島本は「女はうハむつましとおほすへき女たにかく心やすくハよもあらしかし」とある。『集成』『完本』は諸本に従って「睦ましく思すべきや」「あらじかし」と「や」を補訂し「よも」を削除して校訂する。『新大系』は底本のまま「むつましとおぼすべき」「よもあらじかし」」とする。"
"52","6","5","2","729","1","さるべからむこと","女房たちの知らないこと。"
"52","6","5","3","730","1","弁の御許","古参の女房。"
"52","6","5","4","731","1","そも睦ましく","以下「かたはらいたくてなむ」まで、弁御許の詞。"
"52","6","5","4","732","1","恥ぢきこえはべらぬにや","大島本は「侍らぬにや」とある。『集成』『完本』は諸本に従って「はべらぬや」と「に」を削除する。『新大系』は底本のまま「侍らぬにや」とする。"
"52","6","5","4","733","1","面無くつくりそめてける身に負はさざらむも","『完訳』は「厚かましさが身についている私が応対の役を引き受けないのも、いたたまれぬ気がして」と注す。<BR>【身に負はざらむも】－大島本は「おはささらんも」とある。『集成』『完本』は諸本に従って「負はざらむも」と「さ」を削除する。『新大系』は底本のまま「負はさざらんも」とする。"
"52","6","5","6","734","1","恥づべきゆゑ","以下「口惜しけれ」まで、薫の詞。"
"52","6","5","7","735","1","見れば唐衣は","以下、薫の視点を通しての叙述。"
"52","6","5","7","736","1","手習しけるなるべし","薫の推測。"
"52","6","5","7","737","1","花の末手折りて","大島本は「はなのすゑ」とある。『集成』『完本』は諸本に従って「花の末々」と「々」を補訂する。『新大系』は底本のまま「花の末」とする。"
"52","6","5","7","738","1","かたへは","『集成』は「（女房の）半ばは」と注す。"
"52","6","5","8","739","2","女郎花乱るる野辺に混じるとも--露のあだ名を我にかけめや","薫の贈歌。「かけめや」反語表現。『河海抄』は「女郎花多かる野辺に宿りせばあやなくあだ名をや立ちなむ」（古今集秋上、二二九、小野美材）を指摘。"
"52","6","5","9","740","1","心やすくは思さで","歌に続けて書いた文言。"
"52","6","5","10","741","1","うしろしたる人","後向きにしている人。『完訳』は「中将のおもと」と注す。"
"52","6","5","11","742","2","花といへば名こそあだなれ女郎花--なべての露に乱れやはする","中将の御許の返歌。『古今集』歌「女郎花多かる野辺に」歌を踏まえる。"
"52","6","5","12","743","1","今参う上りける道に塞げられてとどこほりゐたるなるべし","薫の推測。薫が中宮のもとに参上しようとした途中で戸口にいる薫に道を塞がれて留まっていた女房かと想像する。"
"52","6","5","13","744","1","いとけざやかなる翁言憎くはべり","弁御許の詞。『完訳』は「薫の歌を、女に囲まれても浮気心を持たぬ老人言葉と戯れた」と注す。"
"52","6","5","14","745","2","旅寝してなほこころみよ女郎花--盛りの色に移り移らず","弁御許の贈歌。薫を挑発する歌。"
"52","6","5","15","746","1","さて後定めきこえさせむ","歌に続けた詞。"
"52","6","5","17","747","2","宿貸さば一夜は寝なむおほかたの--花に移らぬ心なりとも","薫の弁御許の挑発に応えた歌。"
"52","6","5","19","748","1","何か","以下「聞こえさすれ」まで、弁御許の詞。ちょっと冗談を言っただけ、宿は貸しません、の意。"
"52","6","5","20","749","2","はかなきことを--聞かまほしくのみ思ひきこえたり","女性からみた薫の魅力のあることを印象づけた叙述。"
"52","6","5","21","750","1","心なし","以下「折にぞあめる」まで、薫の詞。"
"52","6","5","21","751","1","分きてもかの御もの恥ぢのゆゑ","誰か他に男性がいて物陰に隠れていりのだろうという。暗に匂宮の存在をいう。"
"52","6","5","22","752","1","おしなべてかく","以下「心憂けれ」まで、ある女房の思い。自分たちまでが弁御許のようにあけすけに物を言う女房だと薫から思われてしまうのはいやだ、の意。"
"52","6","6","1","753","1","東の高欄に","寝殿の東の簀子にある高欄。"
"52","6","6","1","754","1","中に就いて腸断ゆるは秋の天","「大抵四時は心惣べて苦なり中に就いて腸の断ゆるは是れ秋の天」（白氏文集、暮立）。『和漢朗詠集』秋にも所収の詩句。"
"52","6","6","1","755","1","ありつる衣の音なひしるきけはひして","薫に道を塞がれ和歌を詠み交わした中将君が中宮のもとに参上。"
"52","6","6","1","756","1","あなたに入るなり","「なり」伝聞推定の助動詞。薫が衣擦れの音で推測している叙述。"
"52","6","6","2","757","1","これよりあなたに参りつるは誰そ","匂宮の詞。"
"52","6","6","4","758","1","かの御方の中将の君","女房の答え。中宮づきの女房、中将君だと言う。"
"52","6","6","5","759","1","聞こゆなり","「なり」伝聞推定の助動詞。薫が女房の返事を耳にする。"
"52","6","6","6","760","1","なほあやしのわざや","以下「聞こゆる名ざしよ」まで、薫の感想。『完訳』は「浮気な男に問われるままに、安易に名を告げる女房の軽率さを非難」と注す。"
"52","6","6","6","761","1","いとほしく","中将君に対する同情。"
"52","6","6","6","762","1","この宮には","『集成』は「薫の心中に即した書き方」と注す。『完訳』は地の文扱い。"
"52","6","6","7","763","1","おりたちてあながちなる御もてなしに","以下「人の心は」まで、薫の心中。匂宮の浮舟に対する振る舞い。"
"52","6","6","7","764","1","女はさもこそ","女性一般。眼前の女房たちから浮舟まで含めた女性。"
"52","6","6","7","765","1","この御ゆかり","匂宮とその同母の女一宮をさす。"
"52","6","6","7","766","1","例の心入れて騷ぎたまはむを語らひ取りて","匂宮が熱中している女を横取りして、の意。"
"52","6","6","7","767","1","わが思ひしやうに","自分がかつて味わったような苦い思いを匂宮にさせてやりたい。"
"52","6","6","7","768","1","まことに心ばせあらむ人はわが方にぞ寄るべきや","薫の自負。終助詞「や」詠嘆の気持ち。"
"52","6","6","8","769","1","対の御方の","以下、薫の心中に即した叙述。"
"52","6","6","8","770","1","かの御ありさまをば","匂宮の好色な振る舞い。"
"52","6","6","8","771","1","いと便なき睦びになりゆくが","大島本は「なりゆくか」とある。『集成』『完本』は諸本に従って「なりゆく」と「か」を削除する。『新大系』は底本のまま「なりゆくが」とする。自分薫との仲が不都合になって行く。"
"52","6","6","8","772","1","さし放ちがたきものに思し知りたるぞ","主語は中君。"
"52","6","6","9","773","1","さやうなる心ばせある人","以下「すこしは好きもならはばや」まで、薫の心中の思い。"
"52","6","6","9","774","1","ここらの中に","ここ明石中宮方に仕えている大勢の女房の中に。"
"52","6","6","9","775","1","入りたちて深く見ねば知らぬぞかし","主語は薫。この中宮かたの様子を。"
"52","6","6","10","776","1","今はなほつきなし","語り手の批評を含んだ叙述。"
"52","6","7","1","777","1","例の、西の渡殿を","かつて女一宮を垣間見た場所。"
"52","6","7","1","778","1","あやし","『評釈』は「そのような薫の行動を、「あやし」と評したのである」と注す。"
"52","6","7","1","779","1","姫宮夜はあなたに渡らせたまひければ","女一宮は夜は中宮方でお寝みになる。"
"52","6","7","1","780","1","人びと月見るとて","女一宮づきの女房たち。"
"52","6","7","1","781","1","寄りおはして","主語は薫。"
"52","6","7","2","782","1","などかくねたまし顔にかき鳴らしたまふ","薫の詞。『源氏釈』は「故故将繊手　時時小絃　耳聞猶気絶　眼見若為怜」（遊仙窟）を指摘。女房の弾く箏琴のさまを遊仙窟の十娘が琴を弾くさまに比して言う。"
"52","6","7","3","783","1","皆おどろかるべけれど","大島本は「へけれと」とある。『集成』『完本』は諸本に従って「べかるめれど」と「めれ」を補訂する。『新大系』は底本のまま「べけれど」とする。自分薫との仲が不都合になって行く。"
"52","6","7","4","784","1","似るべき兄やは、はべるべき","中将御許の詞。『遊仙窟』の「気調如兄　崔季珪之小妹」を踏まえた表現。"
"52","6","7","6","785","1","まろこそ、御母方の叔父なれ","薫の詞。『遊仙窟』の「容貌似舅　潘安仁之外甥」を踏まえた表現。暗に自分は女一宮の叔父だ、話題を女一宮に転移。"
"52","6","7","8","786","1","例のあなたに","以下「せさせたまふ」まで、薫の詞。女一宮が中宮方にいらっしゃる。"
"52","6","7","8","787","1","御里住みの","六条院での生活。"
"52","6","7","9","788","1","あぢきなく問ひたまふ","『集成』は「聞かでものことをお聞きになる」。『完訳』は「気もなさそうにお尋ねになる」と訳す。"
"52","6","7","10","789","1","いづくにても","以下「過ぐさせたまふめれ」まで、中将御許の詞。"
"52","6","7","11","790","1","をかしの御身のほどや","以下「思ひ寄る人もこそ」まで、薫の心中の思い。『集成』は「優雅にお暮しのお身の上だな」。『完訳』は「なんと結構な御身の上よ」「自分に憂愁を抱かせる当人はもっぱら優雅な日々を暮しているとして、自らの苦悶が際だつ気持」と注す。"
"52","6","7","11","791","1","あやしと思ひ寄る人もこそ","女一宮に寄せる思慕の情を女房たちに気どられてはならない。"
"52","6","7","11","792","1","聞く声なれば","大島本は「きく」とある。『集成』『完本』は諸本に従って「聞こゆる」と校訂する。『新大系』は底本のまま「聞く」とする。自分薫との仲が不都合になって行く。"
"52","6","7","11","793","1","なかなかなり","女房たちの思い。かえって気がもめる、最後まで聞きたい。"
"52","6","7","12","794","1","わが母宮も","以下「心にくかりける所かな」まで、薫の心中の思い。薫の母女三宮も中宮腹の女一宮に劣らない。"
"52","6","7","12","795","1","隔てこそあれ","薫の母女三宮は女御腹。「こそあれ」の係結びは、逆接用法。"
"52","6","7","12","796","1","帝々の思しかしづき","女三宮の父帝朱雀と女一宮の父今上帝の寵愛。"
"52","6","7","12","797","1","明石の浦は心にくかりける所かな","明石一族の数奇な幸運を思う。"
"52","6","7","12","798","1","わが宿世は","以下「持ちたてまつらば」まで、薫の心中の思い。今上帝の皇女女二宮を正室に迎えている。その上に女一宮までも頂戴したら、と夢想する。"
"52","6","7","12","799","1","と思ふぞいと難きや","『全集』は「夢想としても、あまりしたたかな現世繁栄の欲望であろう。語り手が「いと難きや」と評するゆえんである」と注す。"
"52","6","8","1","800","1","宮の君は","蜻蛉式部卿宮の女王。女一宮のもとに出仕。"
"52","6","8","1","801","1","御方したりける","お部屋をもっていた、の意。"
"52","6","8","2","802","1","いであはれこれもまた同じ人ぞかし","薫の心中の思い。宮の御方も皇族の女王で、父親王にかわいがられていた方だ、の意。"
"52","6","8","3","803","1","親王の昔心寄せたまひしものを","薫の心中の思い。生前に式部卿宮が薫に好意を寄せていた、薫を婿にと申し込まれたことを思う。"
"52","6","8","3","804","1","見つけて入るさまども","大島本は「とも」とある。『集成』『完本』は諸本に従って「どもも」と「も」を補訂する。『新大系』は底本のまま「ども」とする。童女たちが薫を見て室内に隠れ入る様子。"
"52","6","8","3","805","1","これぞ世の常と思ふ","薫の思い。童女の振舞いを常識的な振舞いだと思う。男性から姿を見られまいとする態度。"
"52","6","8","4","806","1","南面の隅の間に寄りて","西の対の南廂の隅の間。"
"52","6","8","5","807","1","人知れぬ心寄せなど","以下「求められはべる」まで、薫の詞。"
"52","6","8","5","808","1","言より外を","『異本紫明抄』は「思ふてふことよりほかにまたもがな君一人をばわきて忍ばむ」（古今六帖五、わきて思ふ）を指摘。"
"52","6","8","5","809","1","求められはべる","「られ」自発の助動詞。"
"52","6","8","6","810","1","君にも言ひ伝へず","宮の君をさす。「君」は主人の、のニュアンスを含む。"
"52","6","8","7","811","1","いと思ほしかけざりし","以下「よろこびきこえたまふめる」まで、女房の詞。思いもかけなかった宮仕え。"
