"Volume","Chapter","Paragraph","Line","Annotation_Num","Annotation_State","Annotation_Title","Annotation_Body"
"31","1","1","1","1","1","内裏に聞こし召さむこと","以下「漏らさじ」まで、源氏の鬚黒大将に注意する詞である。しかし、源氏の心ともとれるような表現。「漏らさ」「じ」（打消推量の助動詞）は、自分自身に向かって戒めているような表現である。『完訳』は「源氏自身の無念さもこもるか」と指摘する。十月に尚侍として出仕することが予定されていた（「藤袴」第一章七段）。その前に鬚黒大将が玉鬘に通じてしまったことをさす。"
"31","1","1","1","2","1","諌めきこえたまへど","源氏が鬚黒大将にお諌め申し上げなさるが。"
"31","1","1","1","3","1","さしもえつつみあへたまはず","鬚黒大将は源氏が忠告するようにお隠し通しになれない。"
"31","1","1","1","4","1","ほど経れど","鬚黒大将が玉鬘のもとに通うようになって暫くしたが。"
"31","1","1","1","5","1","いささかうちとけたる御けしきもなく","玉鬘の鬚黒大将に対する態度には少しも気を許した御様子もなく。"
"31","1","1","1","6","1","思はずに憂き宿世なりけり","玉鬘の感慨。鬚黒大将との結婚を「憂き宿世」と感想する。"
"31","1","1","1","7","1","いみじうつらしと思へど","鬚黒大将はひどく辛いと思うが。"
"31","1","1","2","8","1","見るままにめでたく","以下、鬚黒の目を通して語られる。「よそものに見果ててやみなましよ」は鬚黒大将の心中。「見るままにめでたく」というように、文末が過去の助動詞「けり」で結ばれる。以下「あらはれける」までの段、語り手が鬚黒の気持ちに添って、またその周辺から語った内容である。"
"31","1","1","2","9","1","よそのものに見果ててやみなましよ","他人の妻としてしまうところであったよ。「まし」は反実仮想の助動詞。"
"31","1","1","2","10","1","石山の仏","滋賀県大津市にある石山寺。本尊は如意輪観音像。当時霊験あらたかな観音として女性の信仰を多くあつめた。ここは男性の鬚黒大将が熱心に祈願した。"
"31","1","1","2","11","1","弁の御許","玉鬘付きの女房で、「藤袴」巻に登場。鬚黒と玉鬘の結婚に一役果たしたらしい。"
"31","1","1","2","12","1","女君","玉鬘。"
"31","1","1","2","13","1","え交じらはで籠もりゐにけり","弁は他の女房に混じって出仕することもできず、里に謹慎しているのであった。"
"31","1","1","3","14","1","げにそこら心苦しげなることどもをとりどりに見しかど心浅き人のためにぞ寺の験も現はれける","『一葉抄』が「双紙の言葉也」と指摘。『評釈』では「女房の感想これは、そのとき傍観している女房のことばと考える」。『全集』は「語り手のことば」。『集成』は「草子地」。『完訳』は「玉鬘の意外な結婚への、語り手の評言」と指摘する。「げに」「とりどりに見しかど」（過去の助動詞「しか」は直接体験を意味する）という語句は、登場人物らの傍らで見ていた者の感想を表現したものである。物語の伝承者とその筆記編集者が一体化している。"
"31","1","1","4","15","1","誰れも誰れもかく許しそめたまへることなれば","尊敬語「たまへ」があるので、内大臣や源氏自身をさす。源氏の心内文中に語り手の源氏に対する敬意が紛れ込んだ語法。"
"31","1","1","5","16","1","いつしかと","鬚黒の心に添って語る。"
"31","1","1","5","17","1","軽々しく","以下、視点が源氏の心に移る。"
"31","1","1","5","18","1","よくも思ふまじき人","鬚黒の北の方。"
"31","1","1","5","19","1","ものしたまふなるが","「なる」（伝聞推定の助動詞）。いらっしゃというふうに聞いているのが。"
"31","1","1","5","20","1","ことづけたまひて","源氏はかこつけなさって。"
"31","1","1","6","21","1","なほ心のどかに","以下「もてなしたまへ」まで、源氏の玉鬘への忠告の詞。"
"31","1","2","1","22","1","父大臣","玉鬘の父大臣、すなわち内大臣。以下の段、「思ひきこえたまひける」まで、文末が過去の助動詞「けり」で結ばれる。語り手が物語の時間を結婚の三日夜の過去に遡らせ、その折の内大臣に関する態度について補足説明を挿入したような内容である。"
"31","1","2","2","23","1","なかなか","以下「いかがもてなさまし」まで、内大臣の詞。なまじ宮仕えするよりは結婚したほうが無難なようである。「めり」（推量の助動詞、視界内推量）は内大臣が自らの経験の中で判断したニュアンス。"
"31","1","2","2","24","1","うしろめたかりし","「し」（過去の助動詞）は内大臣自身不安に思っていた、というニュアンス。"
"31","1","2","2","25","1","女御かくてものしたまふを","弘徽殿女御をさす。「澪標」巻に入内。内大臣と右大臣の娘四の君との間の姫君。"
"31","1","2","2","26","1","いかがもてなさまし","反語表現。どのようにお世話できようか、しようがない。"
"31","1","2","3","27","1","げに、帝と聞こゆとも、人に思し落とし、はかなきほどに見えたてまつりたまひて、ものものしくももてなしたまはずは、あはつけきやうにもあべかりけり","『休聞抄』は「双ノ地也又玉鬘の心也」と指摘。『全書』は「草子地」と指摘。『評釈』は「内大臣の考えを、作者は、「げに」と、賛成する」といい、『全集』『集成』は「草子地」という言い方で、『完訳』は「語り手」という言い方で指摘する。「なるほど」は内大臣の詞を受け、語り手がそれに賛成の意を表した口ぶり、また「あべかりけり」も語り手の推察である。"
"31","1","2","4","28","1","聞こえ交はしたまひける","親代わりの源氏と婿の鬚黒大将との間でやりとりなさった。"
"31","1","2","4","29","1","伝へ聞きたまひて","実の父親の内大臣が伝え聞きなさって。"
"31","1","2","4","30","1","この大臣の君","源氏。"
"31","1","2","4","31","1","あはれにかたじけなくありがたし","内大臣の源氏に対する感謝の気持ち。"
"31","1","2","5","32","1","かう忍びたまふ御仲らひのことなれど","「かう」は以上の経緯を語った内容をさす。さらに角度を変えて、世間の人々の様子、さらに帝へと及んでいく。文末は過去の助動詞「けり」で結ばれている。『湖月抄』は「草子地也」と指摘する。"
"31","1","2","6","33","1","口惜しう","以下「思ひ絶えたまはめ」まで帝の独り言。"
"31","1","2","6","34","1","さ思しし本意","尚侍の君としての宮仕えをさす。"
"31","1","2","6","35","1","こそは思ひ絶えたまはめ","「こそ--め」の係結び。文末であるが、文意は逆接的または反語的表現である。断念なさるのもよいだろうが、入内するのではないから、何構うまい、という意である。下に「内侍所にも」（第三段）とあるように、帝のこのことばによって、玉鬘の尚侍としての出仕が決定したことを暗示している。"
"31","1","2","7","36","1","などのたまはせけり","以上、過去の助動詞「けり」で語られてきた段が終了し、以下は物語の現在時間に添って語られる。"
"31","1","3","1","37","1","霜月になりぬ","新年立では源氏三十七年十一月。"
"31","1","3","1","38","1","参りつつ","女官や内侍司の人々が六条院に尚侍の玉鬘の決裁を仰ぎに参上する。接尾語「つつ」は同じ行動が繰り返しなされる意。"
"31","1","3","2","39","1","宮などは","蛍兵部卿宮。"
"31","1","3","2","40","1","兵衛督","左兵衛督。紫の上の異母兄弟。式部卿宮の息子。その姉妹が鬚黒の北の方になっている。「藤袴」巻に初出の玉鬘求婚者の一人。"
"31","1","3","2","41","1","妹の北の方の御ことをさへ","「さへ」には、玉鬘への求婚争いに敗れ、その上、姉妹の北の方が夫の鬚黒から顧みられなくなったことまで。"
"31","1","3","3","42","1","大将は名に立てるまめ人の","鬚黒大将の堅物なる人物像。"
"31","1","3","4","43","1","女はわららかににぎははしくもてなしたまふ本性も","玉鬘の山吹の花のように明るく朗らかで何の屈託もなくはなやかな性格。"
"31","1","4","1","44","1","殿も","「心きよくあらはしたまひて」に繋る。"
"31","1","4","1","45","1","いとほしう","以下「疑ひける筋を」まで挿入句。源氏は玉鬘を愛人にしようとしたのではないかという疑い。"
"31","1","4","1","46","1","わが心ながらうちつけにねぢけたることは好まずかし","源氏の心。"
"31","1","4","3","47","1","今さらに人の心癖もこそ","源氏の心を語り手が語る。"
"31","1","4","3","48","1","さてもや","源氏の心を語り手が語る。「さ」は玉鬘を自分の愛人にすることをさす。"
"31","1","4","3","49","1","思し寄りたまひしことなれば","語り手は源氏の側近くから観察して語る。"
"31","1","4","4","50","1","大将のおはせぬ昼つ方","源氏、玉鬘の夫の鬚黒のいない間に訪れ思いを訴える。"
"31","1","4","5","51","1","世の常の人にならひては","普通の人、鬚黒との結婚生活に馴れて。源氏は「世の常の人」ではなかった、という反対の意のニュアンスが込められる。"
"31","1","4","5","52","1","御けはひありさま","源氏の御様子や態度。"
"31","1","4","5","53","1","見知りたまふにも","玉鬘が源氏の素晴らしさをお分かりになるにつけても。"
"31","1","4","5","54","1","思ひのほかなる身","玉鬘は鬚黒との結婚を思いの外のことだったと感じ取っている。"
"31","1","4","6","55","1","らうたいことの添ひたまへる","結婚生活後の玉鬘に表れた変化。"
"31","1","4","6","56","1","よそに見放つもあまりなる心のすさびぞかし","源氏の心。"
"31","1","4","6","57","1","口惜し","語り手が源氏の心中を忖度した表現。"
"31","1","4","7","58","2","おりたちて汲みは見ねども渡り川--人の瀬とはた契らざりしを","源氏から玉鬘への贈歌。「汲み」「瀬」は「川」の縁語。「せ」は「瀬」と「背」との掛詞。女は初めて逢った男に背負われて三途の川を渡る、という俗信をふまえる。"
"31","1","4","8","59","1","思ひのほかなりや","玉鬘が鬚黒のものとなってしまい、永遠に自分のもとから離れて行ってしまったという感慨。"
"31","1","4","9","60","1","なつかしうあはれなり","語り手の感想をこめた評言。"
"31","1","4","11","61","2","みつせ川渡らぬさきにいかでなほ--涙の澪の泡と消えなむ","玉鬘から源氏への返歌。「渡り川」を「みつせ川」と言い換えて返す。人は死んだら、三途の川を渡らねばならないものであるのに、その前に死んでしまいたいとは理屈にあわない歌であるが、その理不尽な気持ちを詠んでこたえた。"
"31","1","4","12","62","1","心幼なの御消えどころや","以下「きこえてむや」まで、源氏の詞。"
"31","1","4","13","63","1","まめやかには","以下「頼もしき」まで、源氏の詞。"
"31","1","4","13","64","1","世になき痴れ痴れしさ","機会がありながらも自分の妻妾の一人にしなかった迂闊さをさして、自嘲ぎみにいう。"
"31","1","4","13","65","1","さりともとなむ、頼もしき","執拗な物言い。源氏の執拗な未練が言葉に出る。"
"31","1","4","15","66","1","内裏にのたまはすることなむ","帝の「口惜しう宿世異なりける人なれど思しし本意もあるを。宮仕へなど、かけかけしき筋ならばこそは、思ひ絶えたまはめ」（第一章二段）という言葉をさす。以下「心やすくなむ」まで、源氏の詞。"
"31","1","4","15","67","1","おのがもの","公人である尚侍を私物化してしまう。"
"31","1","4","15","68","1","さやうの御交じらひ","尚侍として出仕して他の内侍司の官人たちと付き合うこと。"
"31","1","4","15","69","1","思ひそめきこえし心は違ふさまなめれど","源氏は最初、玉鬘を尚侍として出仕させることを考えていた。しかし、鬚黒と結婚してしまったために、尚侍定員二名のうち、実務官としての尚侍になってしまったことをいう。"
"31","1","4","15","70","1","二条の大臣","内大臣をさす。会話の中では、このように呼ぶ。二条に邸があった。"
"31","1","4","16","71","1","あるべきやう","尚侍としての心得をいう。"
"31","1","4","16","72","1","かしこに渡りたまはむこと","鬚黒大将邸にお移りになること。"
"31","1","4","16","73","1","とみにも許しきこえたまふまじき御けしきなり","「まじき」（打消推量の助動詞、推量）、「なり」（断定の助動詞）は、語り手の推量と断定である。以上、源氏と玉鬘との対座の場面が終了する。"
"31","2","1","1","74","1","内裏へ参りたまはむことをやすからぬことに大将思せど","以下の段、場面変わって、視点を鬚黒の立場において語る。"
"31","2","1","1","75","1","そのついでにや","大島本は「そのついてにや（△△＆にや）まかて」とある。すなわち「そのついて」の次の元の文字の上に重ねて「にや」と書く。『新大系』はその訂正に従う。『集成』『古典セレクション』は諸本に従って「そのついでにやがて」と校訂する。玉鬘が出仕した機会をさす。"
"31","2","1","1","76","1","まかでさせたてまつらむ","宮中から鬚黒の自邸に退出おさせ申そう、の意。"
"31","2","1","1","77","1","許しきこえたまふ","「許し」は名詞、許可の意。鬚黒は源氏にお許しを願い申し上げなさる、意。"
"31","2","1","1","78","1","忍び隠ろへたまふ御ふるまひ","夫婦でありながら鬚黒が人目を忍んで玉鬘のもとにお通いになることをいう。"
"31","2","1","1","79","1","ならひたまはぬ心地","経験のないこと。鬚黒の堅物らしい性格を示す。"
"31","2","1","1","80","1","儀式を改め","格式を立派に改めて、の意。"
"31","2","1","2","81","1","なよびかに","以下「思ふところもありけれ」まで、挿入句。"
"31","2","1","3","82","1","女君人に劣りたまふべきことなし","鬚黒の北の方は、父は式部卿宮、藤壷中宮の姪、源氏の紫の上とは異母姉妹。『紹巴抄』は「女君」以下「ことわりになむ」までを「双地」と指摘する。以下、文体がやや変化する。"
"31","2","1","3","83","1","また並ぶ人なく思ひきこえたまへるを","鬚黒がれっきとした北の方としてお思い申し上げていらしたが。"
"31","2","1","3","84","1","人にすぐれたまへる御ありさまよりも","『万水一露』は「草地に批判したる詞成へし」と指摘する。"
"31","2","1","3","85","1","推し量りしことさへ","過去の助動詞「し」は直接体験した出来事をいう。鬚黒の心に即して語り手が語っている。"
"31","2","1","3","86","1","ありがたうあはれと","『孟津抄』は「草子地也」と指摘する。"
"31","2","1","3","87","1","ことわりになむ","『岷江入楚』は「草子の地なるへし」と指摘する。もっともなことである、という批評判断は語り手の感想である。以上、客観的物語の地の文から次第に語り手中心の文体に変化してきた。"
"31","2","1","5","88","1","今はしか","以下「ものしたまひなむ」まで、式部卿宮の詞。"
"31","2","1","5","89","1","従ひなびかでも","鬚黒の言いなりにならなくても。"
"31","2","1","6","90","1","親の御あたりといひながら","以下「見えたてまつらむこと」まで、北の方の心。"
"31","2","1","6","91","1","今は限りの身","『集成』は「夫に捨てられた身の上」と解し、『完訳』は「ひとたび人の妻となった身の上」と解す。"
"31","2","1","7","92","1","本性は","以下「うち混じりたまひける」まで、語り手の説明的文章が挿入される。"
"31","2","1","7","93","1","時々心あやまりして","物の怪の発作によって気がおかしくなること。"
"31","2","2","1","94","1","玉を磨ける目移しに","玉を磨いたように素晴らしい玉鬘の邸を見て来た目には、の意。「磨く」には、「玉を磨く」（素晴らしい）意と「目を磨く」（鑑識眼を高める）の両意が掛けられた表現であろう。"
"31","2","2","2","95","1","昨日今日の","以下「たまふべきにやあらむ」まで、鬚黒の北の方への慰めの詞。"
"31","2","2","2","96","1","よろしき際になれば皆思ひのどむる方ありてこそ見果つなれ","ある程度の身分ある貴族の夫婦となると、みなお互いに我慢し合って最後まで添い遂げるもののようだ。「なれ」（伝聞推定の助動詞）。鬚黒の忠告は当時の貴族の夫婦生活をいうものか。"
"31","2","2","3","97","1","世の人にも似ぬ御ありさま","世間の人と違った御病気の様子。"
"31","2","2","4","98","1","幼き人びともはべれば","後文によれば、姫君一人、男君二人と見える。"
"31","2","2","6","99","1","うち笑ひてのたまへる","冗談めかした笑い。"
"31","2","2","6","100","1","いとねたげに心やまし","『集成』は「北の方の心を書いたもの」とある。語り手が北の方の立場になって気持ちを語ったところ。"
"31","2","3","1","101","1","御召人だちて","妻に準じる待遇の鬚黒の女房。"
"31","2","3","1","102","1","木工の君中将の御許","女房名。"
"31","2","3","1","103","1","人びとだに","女房たちでさえ～であるのだから、まして北の方は。"
"31","2","3","2","104","1","みづからを","以下「思ひはべらず」まで、北の方の詞。"
"31","2","3","2","105","1","宮の御ことを","父兵部卿宮の悪口。"
"31","2","3","2","106","1","漏り聞きたまはむは","兵部卿宮が悪口を漏れ聞きなさったら。推量の助動詞「む」は仮定の意。"
"31","2","3","2","107","1","軽々しき","皇族の身にとって軽々しい、すなわち、傷がつくようだの意。"
"31","2","3","2","108","1","耳馴れ","自分への悪口は聞き馴れている。"
"31","2","3","3","109","1","らうたげなり","語り手の、北の方をいじらしいという評言。以下、北の方の若かったころの美貌が語られる。"
"31","2","3","4","110","1","いとあはれなり","語り手の、北の方をとてもかわいそうだどいう評言。"
"31","2","3","5","111","1","いづこのはなやかなるけはひかはあらむ","反語表現。どこにも派手やかなところはない、という語り手の感想。以上、北の方への解説が終わり、再び物語の現時点に戻る。"
"31","2","3","6","112","1","宮の御ことを","以下「なのたまひなしそ」まで、鬚黒の北の方への慰めの詞。下に「こしらへて」とある。"
"31","2","3","6","113","1","軽くは","軽んじる、ないがしろにするの意。"
"31","2","3","7","114","1","かの通ひはべる所の","以下「かたみに後見むと思せ」まで、引き続き、鬚黒の北の方への慰めの詞。同じく下に「こしらへ聞こえたまへば」とある。六条院をいう。"
"31","2","3","7","115","1","玉の台","六条院をいう。歌語的表現をした。"
"31","2","3","7","116","1","人目たつらむ","眩しいほどの六条院に不格好なさまをして通っていたのでは人目にたって見苦しいとする、鬚黒自身認めており、またその解消策として玉鬘の迎えとりを持ち出す。"
"31","2","3","7","117","1","心やすく移ろはしてむ","気安く玉鬘を自分の邸に迎えてしまおうと。"
"31","2","3","8","118","1","太政大臣","源氏を「太政大臣」と呼ぶ。以下、その権勢をかさに着たものものしい言い方をする。"
"31","2","3","8","119","1","憎げなること","北の方と玉鬘との不和の噂。"
"31","2","3","8","120","1","いとなむいとほしうかたじけなかるべき","『集成』では「まことに不都合千万で、申しわけないことでしょう」と解し、『完訳』では「あなたにはまったく気の毒なことだし、大臣にも畏れ多いことになりましょう」と解す。"
"31","2","3","9","121","1","世の聞こえ人笑へ","『完訳』は「家の体面をつぶし、北の方も身を滅ぼす危惧」と解す。"
"31","2","3","9","122","1","まろがためにも","係助詞「も」同類の意。あなたはもちろんのこと、わたにとっても。"
"31","2","3","11","123","1","人の御つらさは","以下「見るばかり」まで、北の方の詞。"
"31","2","3","11","124","1","世の人にも似ぬ身の憂き","世間の人と違った身の不運、病い持ち。"
"31","2","3","11","125","1","乱りたまふなれば","「なれ」（伝聞推定の助動詞）。お心を砕いていらっしゃるというので。"
"31","2","3","12","126","1","大殿の北の方","六条院の北の方、すなわち紫の上をさしてこう呼ぶ。"
"31","2","3","12","127","1","異人にやはものしたまふ","反語表現。鬚黒の北の方と紫の上は異腹の姉妹である。"
"31","2","3","12","128","1","かれは","紫の上をさす。以下「つらさをなむ」まで、北の方が父宮の詞を間接的にいったもの。"
"31","2","3","12","129","1","親だち","紫の上が玉鬘の親代わりとなって結婚の世話をすることをいう。"
"31","2","3","12","130","1","思ほしのたまふなれど","「なれ」（伝聞推定の助動詞）。父宮はおっしゃるようだが。"
"31","2","3","12","131","1","ここには","わたしには。"
"31","2","3","12","132","1","もてないたまはむさま","『集成』は「どうしようと紫の上の勝手で、私は構わない」と解し、『完訳』は「あなたのなさることを」と解す。"
"31","2","3","14","133","1","いとようのたまふを","以下「苦しかるべきこと」まで、鬚黒の詞。"
"31","2","3","14","134","1","大殿の北の方の知りたまふことにもはべらず","「知る」は単に知っているという意でなく、関知し指図する意。紫の上が関知し指図したことではありません。"
"31","2","3","14","135","1","かく思ひ落とされたる人","玉鬘をさす。自分の結婚相手を卑下した言い方。"
"31","2","3","14","136","1","知りたまひなむや","係助詞「や」は反語。関知していらっしゃろうか、そんなことはない。"
"31","2","3","14","137","1","ものしたまふべかめれ","「べか」（推量の助動詞、推量）「めれ」（推量の助動詞、視界内推量）、鬚黒の体験から判断して「～でいらっしゃるようだ」。"
"31","2","3","14","138","1","かかることの聞こえ","紫の上が玉鬘の結婚を指図しているという非難。"
"31","2","3","15","139","1","入りゐて","北の方の部屋に入って座り続けて。"
"31","2","4","1","140","1","雪かきたれて降る","前に「霜月になりぬ」とあった。季節は冬である。雪が空をまっくらにして降る様子が描写される。"
"31","2","4","1","141","1","かかる空にふり出でむも","「ふり」は「雪」の縁語。「雪が降る」と「振り出す」の両意をこめた掛け詞的表現。以下、鬚黒の心情に添った語りとなる。言葉遊び的表現が見られる。"
"31","2","4","1","142","1","人目いとほしう","ひどい雪の中をわざわざ出掛けて行ったとあっては、人目に立って北の方にも気の毒である。"
"31","2","4","1","143","1","ふすべ","下文の「火」の縁語。"
"31","2","4","1","144","1","迎ひ火","大島本は「むかひ火」とある。『新大系』は底本のままとする。『集成』『古典セレクション』は諸本に従って「むかへ火」と校訂する。『日本書紀』巻第七に倭建命が相模野で迎え火をつけて難を逃れた故事がある。こちらから対抗して。"
"31","2","4","2","145","1","けしきを見て","物思いにふけっている鬚黒の様子を見て。"
"31","2","4","3","146","1","あやにくなめる","以下「更けぬめりや」まで、北の方の詞。"
