"Volume","Chapter","Paragraph","Line","Annotation_Num","Annotation_State","Annotation_Title","Annotation_Body"
"26","1","7","8","135","1","あるやうあらむとおぼゆかし","『完訳』は「きっとこれからさき相当なところに落ち着く人なのだろうと、気にもならずにはいられない」と訳す。源氏の一人娘として、きっと入内するであろう、という予測。"
"26","1","7","9","136","1","今姫君は","玉鬘をさす。"
"26","1","7","9","137","1","いとけしきあるところつきたまへる人にて","源氏をさしていう。"
"26","1","7","11","138","1","さていかが定めらるなる","以下「御あはひともならむかし」まで、内大臣の詞。「らる」受身の助動詞、「なる」伝聞推定の助動詞。"
"26","1","7","12","139","1","姫君の御こと","雲居雁をさす。"
"26","1","7","12","140","1","かやうに心にくくもてなして","以下「いぶかしがらせましものを」まで、内大臣の心中。「かやうに」とは源氏が玉鬘を大事にするように、の意。"
"26","1","7","12","141","1","いかにしなさむ","世間の人の噂を想定。"
"26","1","7","12","142","1","いぶかしがらせましものを","「まし」反実仮想の助動詞。"
"26","1","7","12","143","1","位さばかりと","夕霧の官位をさす。"
"26","1","7","13","144","1","大臣なども","以下「負くるやうにてもなびかめ」まで、内大臣の心中に即した叙述。「大臣」は源氏をさす。"
"26","1","7","13","145","1","男方は","夕霧をさす。"
"26","1","7","13","146","1","心やましくなむ","『集成』は「内大臣の気持をそのまま記したもの」と注す。"
"26","1","8","1","147","1","とかく思しめぐらすままに","主語は内大臣。"
"26","1","8","1","148","1","ゆくりもなく軽らかにはひ渡りたまへり","雲居雁の部屋を訪れる。"
"26","1","8","2","149","1","姫君は昼寝したまへるほどなり","雲居雁は昼寝の最中。"
"26","1","8","2","150","1","羅の単衣を着たまひて臥したまへるさま","羅の単衣。上半身は透けて見える。国宝源氏物語絵巻「夕霧」の雲居雁の装束がそれである。"
"26","1","8","3","151","1","人びとものの後に寄り臥しつつ","女房たちは屏風や几帳の物陰にいる。"
"26","1","8","3","152","1","ふともおどろいたまはず","主語は雲居雁。女房たちが起こさないから。"
"26","1","8","3","153","1","扇を鳴らしたまへるに","主語は内大臣。"
"26","1","8","4","154","1","うたた寝はいさめきこゆるものを","以下「いとゆかしけれ」まで、内大臣の詞。「たらちねの親のいさめしうたた寝は物思ふ時のわざにぞありける」（拾遺集恋四、八九七、読人しらず）を踏まえる。"
"26","1","8","7","155","1","太政大臣の后がねの姫君","源氏の明石姫君。将来は皇后にという教育。"
"26","1","8","7","156","1","よろづのことに通はしなだらめてかどかどしきゆゑもつけじ","広く一通りの教養を身につけ、かたよった特技というのは身につけない方針。"
"26","1","8","8","157","1","この君の人となり","明石姫君をさす。「この」は今話題にしているという近称の指示代名詞。内大臣の姫君をさすのではない。"
"26","1","8","8","158","1","宮仕へに出だし立てたまはむ世の","主語は源氏。"
"26","1","8","10","159","1","思ふやうに見たてまつらむと","以下「思ふさまはべり」まで、内大臣の詞。内大臣が雲居雁を東宮に入内させようと思っていたことをさす（少女巻）。"
"26","1","8","10","160","1","人の上のさまざまなるを","世間一般の女性の身の上をさす。"
"26","1","8","11","161","1","ねぎごとに","「ねぎごとをさのみ聞きけむ社こそ果てはなげきの森となるらめ」（古今集誹諧歌、一〇五五、讃岐）。夕霧の訴えをさす。"
"26","1","8","13","162","1","昔は何ごとも","以下「見えたてまつりけるよ」まで、雲居雁の心中。「昔」は三条宮邸にいたころをさす。"
"26","1","8","13","163","1","なかなか","「おもなくて」に係る。"
"26","1","8","13","164","1","いとほしかりしことの騒ぎにも","『集成』は「目も当てられなかった事件の時にも」。『完訳』は「夕霧に不憫なことをした、かつての騷ぎ」と注す。"
"26","1","8","14","165","1","かくのたまふるがつつましくて","大島本は「の給ふるか」とある。「のたまふ」は四段活用の動詞。連体形「のたまふる」は誤用法だが、今底本のままとする。父内大臣のおっしゃることに雲居雁は遠慮されて、の文意。"
"26","1","8","14","166","1","え渡り見たてまつりたまはず","雲居雁が三条宮邸に行き大宮にお目にかかることができない。"
"26","2","1","1","167","1","大臣この北の対の今姫君を","大島本は「いま姫君」とある。『新大系』は底本のままとする。『集成』『古典セレクション』は諸本に従って「今君」と「姫」を削除する。内大臣、近江の君の処遇に苦慮する。近江の君が「北の対」にいることが注意される。"
"26","2","1","2","168","1","いかにせむ","以下「さ言ふばかりにやはある」まで、内大臣の心中。"
"26","2","1","2","169","1","さかしらに","『集成』は「独り合点で」。『完訳』は「あらずもがなのことをして」と訳す。"
"26","2","1","2","170","1","籠めおきたれば","邸の奥に置いているので。已然形＋「ば」順接条件。"
"26","2","1","2","171","1","女御の御方などに","内大臣の娘弘徽殿女御。"
"26","2","1","2","172","1","さるをこのものにしないてむ","『完訳』は「内大臣は、自分の不見識を難じられぬよう、近江の君を道化者にすべく迎えたと装う」と注す。"
"26","2","1","2","173","1","人の","女房をさす。"
"26","2","1","2","174","1","言ひおとすなる","「なり」伝聞推定の助動詞。"
"26","2","1","2","175","1","やはある","反語表現。そう大してひどくもない、の意。"
"26","2","1","4","176","1","かの人参らせむ","以下「あはつけきやうなり」まで、内大臣の詞。"
"26","2","1","4","177","1","な笑はせさせたまひそ","大島本は「なわらはせさせ給ふそ」とある。『新大系』は底本のままとする。『集成』『古典セレクション』は諸本に従って「な笑はせさせたまひそ」と校訂する。"
"26","2","1","4","178","1","つつまず言ひ教へさせたまひて御覧ぜよ","『集成』は「びしびし叱って教育させなさってお使い下さい」。『完訳』は「遠慮なくお言い聞かせになって面倒を見ていただきたい」と訳す。"
"26","2","1","6","179","1","などか、いとさことのほかにははべらむ","以下「かかやかしきにや」まで、弘徽殿女御の詞。「などか--はべらむ」反語表現。"
"26","2","1","6","180","1","中将などの","柏木をさす。"
"26","2","1","6","181","1","かね言に足らず","大島本は「かねことにたらすと」とある。『集成』『新大系』は底本のままとする。『古典セレクション』は諸本に従って「かね言にたへず」と校訂する。"
"26","2","1","6","182","1","かくのたまひ騒ぐをはしたなう思はるるにも","「のたまひ騒ぐ」の主語は内大臣。「はしたなう思はるる」の主語は近江の君。「るる」は軽い尊敬の助動詞。"
"26","2","1","6","183","1","かたへはかかやかしきにや","『集成』は「一つには面映ゆいのではないでしょうか。それで気後れしてつい失敗が多いのではないか、と取りなす」と注す。"
"26","2","1","7","184","1","いと恥づかしげにて聞こえさせたまふ","『完訳』は「父を圧倒するほどの正論で」と訳す。"
"26","2","1","7","185","1","をかしげさはなくて","接続助詞「て」弱い逆接の意。"
"26","2","1","7","186","1","あてに澄みたるものの","接続助詞「ものの」弱い逆接の意。"
"26","2","1","7","187","1","おもしろき梅の花の開けさしたる朝ぼらけ","弘徽殿女御の美貌の譬喩。「匂はねどほほゑむ梅の花をこそ我もをかしと折りてながむれ」（曽丹集、二六）。"
"26","2","1","7","188","1","ほほ笑みたまへるぞ人に異なりけると見たてまつりたまふ","地の文がいつしか内大臣の心中文となって、引用句「と見たてまつりたまふ」と表現される。"
"26","2","1","8","189","1","中将のいとさ言へど心若きたどり少なさに","内大臣の詞。『集成』は「一人前だとはいっても、まだ世間知らずでよく考えもせずに」。『完訳』は「賢いとはいえ、思慮が足りず、調査が周到でなかったので。内大臣は柏木に責任を転嫁」と注す。"
"26","2","1","9","190","1","いとほしげなる人の御おぼえかな","『集成』は「草子地」。『完訳』は「語り手の、近江の君への同情」と注す。"
"26","2","2","1","191","1","やがてこの御方のたよりに","弘徽殿女御は里下がりして、現在、寝殿にいる。そこから、内大臣は北の対の近江の君のもとを訪れようとする。"
"26","2","2","1","192","1","簾高くおし張りて","『集成』は「簾を外に大きく張り出して。身体ごと簾を押し出すのであろう。つつしみのない端居のさま」と注す。"
"26","2","2","2","193","1","せうさいせうさい","近江の君の詞。『古典セレクション』は「小賽、小賽」と表記する。"
"26","2","2","3","194","1","いと舌疾きやあなうたて","「いと舌疾きや」は語り手の感想。「あなうたて」は内大臣の心中。また、全体が内大臣の心中とも考えらえる文章表現。"
"26","2","2","4","195","1","この従姉妹も","五節の君をさす。"
"26","2","2","5","196","1","御返しや御返しや","五節の君の詞。"
"26","2","2","6","197","1","とみに打ち出でず","大島本は「とみに」とある。『新大系』は底本のままとする。『集成』『古典セレクション』は諸本に従って「とみにも」と「も」を補訂する。"
"26","2","2","6","198","1","中に思ひはありやすらむ","語り手の推測、挿入句。「さざれ石の中に思ひはありながらうち出づることのかたくもあるかな」（紫明抄所引、出典未詳）を踏まえる。"
"26","2","2","7","199","1","そこなはれたるなめり","連語「なめり」断定の助動詞＋推量の助動詞、語り手の主観的推量のニュアンス。"
"26","2","2","7","200","1","異人とあらがふべくもあらず","『完訳』は「自分（内大臣）と近江の君とが、他人であるとは思われない意」と注す。"
"26","2","2","7","201","1","鏡に思ひあはせられたまふに","主語は内大臣。"
"26","2","2","7","202","1","いと宿世心づきなし","『集成』は「内大臣の思いをそのまま地の文にした書き方」と注す。"
"26","2","2","8","203","1","かくてものしたまふは","以下「訪らひまうでずや」まで、内大臣の詞。"
"26","2","2","8","204","1","訪らひまうでずや","内大臣が近江の君を。「や」間投助詞、詠嘆。"
"26","2","2","10","205","1","かくてさぶらふは","以下「心地しはべれ」まで、近江の君の詞。"
"26","2","2","10","206","1","何のもの思ひかはべらむ","反語表現。"
"26","2","2","10","207","1","手打たぬ心地しはべれ","『集成』は「まるでよい手を打たぬ時のような（焦れったい）気がいたします。「手打つ」は、双六で、巧みな手を打つこと」と注す。"
"26","2","2","12","208","1","げに、身に近く使ふ人も","以下「まして」まで、内大臣の詞。「身に近くさぶらふ人」とは、内大臣の身辺をさしていう。"
"26","2","2","12","209","1","さやうにても見ならしたてまつらむと","『集成』は「内大臣づきの女房役にするつもりだった、と言う」と注す。"
"26","2","2","12","210","1","えさしもあるまじきわざなりけり","実の娘ゆえにそのようにもできかねる、という意。"
"26","2","2","12","211","1","それだに","「それ」は「なべての仕うまつり人」をさす。『集成』は「その場合でも、誰それの娘、何がしの子と、名の通った家の生れとなると、親兄弟の面目を潰すような者が多いようだ。娘が至らぬ場合、名家の出身ほで家門の恥になる。家風を云々されるからである」と注す。"
"26","2","2","12","212","1","まして","下に、内大臣家の娘とあっては、の意が省略。"
"26","2","2","13","213","1","恥づかしきも知らず","大島本は「はつかしきもしらす」とある。『新大系』は底本のままとする。『集成』『古典セレクション』は諸本に従って「見知らず」と「見」を補訂する。"
"26","2","2","14","214","1","何かそは","以下「仕うまつりなむ」まで、近江の君の詞。"
"26","2","2","14","215","1","ことことしく思ひたまひて","大島本は「おもひ給ひて」とある。『古典セレクション』は底本のままとする。『集成』『新大系』は諸本に従って「思ひたまへて」と校訂する。本来「思ひたまへて」と謙譲表現であるべきところ。底本のままとする"
"26","2","2","16","216","1","似つかはしからぬ役ななり","以下「延びなむかし」まで、内大臣の詞。連語「ななり」断定の助動詞＋伝聞推定の助動詞。"
"26","2","2","17","217","1","ほほ笑みてのたまふ","大島本は「ほゝゑミてのまふ」とある。大島本は「のたまふ」の「た」脱字とみて「た」を補訂する。"
"26","2","3","1","218","1","舌の本性にこそははべらめ","以下「いかでこの舌疾さやめはべらむ」まで、近江の君の詞。"
"26","2","3","1","219","1","妙法寺の別当大徳","妙法寺（近江国神崎郡高屋郷にあった寺）の別当大徳。"
"26","2","3","1","220","1","あえものとなむ","別当大徳のあやかり者という意。その大徳は早口であったらしい。"
"26","2","3","2","221","1","いと孝養の心深く","『集成』は「内大臣の言葉の真意を解せず、素直に応じる近江の君をややからかった言い方」と注す。"
"26","2","3","3","222","1","その気近く","以下「数へたるかし」まで、内大臣の詞。"
"26","2","3","3","223","1","報いななり","連語「ななり」断定の助動詞＋伝聞推定の助動詞。"
"26","2","3","3","224","1","唖言吃とぞ大乗誹りたる罪","「若し人と為ることを得れば、聾盲おんあにして、貧窮諸衰、以自ら荘厳し、（中略）斯の経を謗るが故に、罪を獲ること是くの如し」（法華経、譬喩品）。"
"26","2","3","4","225","1","子ながら恥づかしくおはする御さまに","以下「迎へ寄せけむ」まで、内大臣の心中。弘徽殿女御をさしていう。近江の君を引き取ったことを後悔する。"
"26","2","3","4","226","1","見えたてまつらむこそ","近江の君を弘徽殿女御にお目にかける、の意。"
"26","2","3","4","227","1","人びともあまた見つぎ言ひ散らさむこと","内大臣の心中。"
"26","2","3","4","228","1","思ひ返したまふものから","近江の君を弘徽殿女御に仕えさせることを、考え直させる、の意。"
"26","2","3","5","229","1","女御里にものしたまふ時々","以下「見たてまつりたまひなむや」まで、内大臣の詞。"
"26","2","3","5","230","1","さる心して","直前の「ことなることなき人もおのづから人に交じらひ、さる方になればさてもありぬかし」をさす。"
"26","2","3","5","231","1","見えたてまつりたまひなむや","「なむや」、完了の助動詞「な」確述。推量の助動詞「む」勧誘。係助詞「や」疑問の意。～なさいませんか。"
"26","2","3","7","232","1","いとうれしきことにこそはべるなれ","以下「仕うまつりなむ」まで、近江の君の詞。「なれ」断定の助動詞。"
"26","2","3","7","233","1","御方々に数まへ","弘徽殿女御や雲居雁をさす。姉妹の一人としての意。"
"26","2","3","7","234","1","水を汲みいただきても仕うまつりなむ","「法華経をわが得しことは薪こり菜摘み水を汲み仕へてぞ得し」（拾遺集哀傷、一三四六、大僧正行基）を踏まえる。"
"26","2","3","9","235","1","いとしかおりたちて","以下「法の師だに遠くは」まで、内大臣の詞。"
"26","2","3","9","236","1","薪拾ひたまはずとも","前の大僧正行基の和歌を踏まえる。"
"26","2","3","9","237","1","参りたまひなむ","「なむ」は完了の助動詞「な」確述。推量の助動詞「む」適当。"
"26","2","3","10","238","1","をこごとにのたまひなすをも知らず","「見えにくき御けしきをも見知らず」と並列の構文。"
"26","2","3","10","239","1","おぼろけの人見えにくき御けしき","普通の人であったら気後れするほど立派な内大臣に対しての意。"
"26","2","3","11","240","1","さていつか女御殿には参りはべらむずる","近江の君の詞。枕草子では「むず」を下品な言葉遣いとする。"
"26","2","3","13","241","1","よろしき日などや","以下「今日にても」まで、内大臣の詞。"
"26","2","4","1","242","1","うち身じろきたまふにも","内大臣がちょっとどこかへお出ましになるにも、の意。"
"26","2","4","2","243","1","いであなめでたのわが親や","以下「生ひ出でたること」まで、近江の君の詞。"
"26","2","4","4","244","1","あまりことことしく","以下「尋ね出でられたまはまし」まで、五節君の詞。"
"26","2","4","4","245","1","尋ね出でられたまはまし","「られ」受身の助動詞。「まし」推量の助動詞、反実仮想の意。『完訳』は「ほどほどの身分の親で、大切に愛育してくれそうな方に引き取ってもらえばよかったのに。素直な感想だが、内大臣の娘としては不相応、の意にも解せる」と注す。"
"26","2","4","5","246","1","わりなし","『集成』は「草子地」と注す。語り手の批評の言葉。"
"26","2","4","6","247","1","例の君の人の言ふこと","以下「こそあめれ」まで、近江の君の詞。「君」は、あなた五節の君をさしていう。「人の」は、わたしの、の意。『完訳』は「五節の言葉を、自分への言いがかりと解した」と注す。"
"26","2","4","6","248","1","今はひとつ口に言葉な交ぜられそ","『集成』は「友だちみたいに、口出ししないで下さい」。『完訳』は「私が内大臣の娘と分った今は、気やすく口をきかないでくれ」と訳す。「られ」軽い尊敬の助動詞。"
"26","2","4","6","249","1","あるやうあるべき身にこそあめれ","『集成』は「きっと何か仔細のある身の上なのでしょう。内大臣に見出されたからには、特別の運勢に恵まれているのだろう、の意」と注す。"
"26","2","4","8","250","1","ことなるゆゑなき言葉をも","『完訳』は「「耳もとまるかし」まで、近江の君評の前提となる一般論」と注す。"
"26","2","4","8","251","1","打ち聞き","大島本は「うちきく（く＝き&lt;朱&gt;）」とある。すなわち「く」の右傍らに朱筆で「き」と傍記する。『集成』『新大系』は底本の朱筆傍記に従う。『古典セレクション』は訂正以前本文に従う。"
"26","2","4","8","252","1","本末惜しみたるさまにてうち誦じたるは","『集成』は「歌の上の句、下の句いずれにしろ、皆まで言わないように、ひそかに吟じたのは」と訳す。"
"26","2","4","9","253","1","いと心深くよしあることを言ひゐたりとも","『完訳』は「以下、近江の君の場合。たとえ深い内容で趣向のあることを」と注す。"
"26","2","4","9","254","1","言葉たみて","「東にて養はれたる人の子は舌たみてこそものは言ひけれ」（拾遺集物名、四一三、読人しらず）。"
"26","2","4","10","255","1","いといふかひなくはあらず","『完訳』は「以下、語り手の揶揄」と注す。"
"26","2","5","1","256","1","さて女御殿に","以下「殿のうちには立てりなむや」まで、近江の君の詞。"
"26","2","5","1","257","1","ものしくもこそ思せ","主語は内大臣。"
"26","2","5","1","258","1","天下に思すとも","強調表現、大袈裟な言い方。"
"26","2","5","2","259","1","御おぼえのほど、いと軽らかなりや","『集成』は「からかいの草子地」。『完訳』は「語り手のからかい気味の同情」と注す。"
"26","2","5","4","260","1","葦垣のま近きほどに","以下「あなかしこやあなかしこや」まで、近江の君の手紙文。「人知れぬ思ひやなぞと葦垣のま近けれども逢ふよしのなき」（古今集恋一、五〇六、読人しらず）。"
"26","2","5","4","261","1","影踏むばかりのしるしもはべらぬは","「立ち寄らば影ふむばかり近けれど誰か勿来の関を据ゑけむ」（後撰集恋二、六八二、小八条御息所）。「勿来の関」は陸奥の枕詞。"
"26","2","5","4","262","1","知らねども武蔵野といへば","「知らねども武蔵野といへばかこたれぬよしやさこそは紫のゆゑ」（古今六帖五、むらさき、三五〇七）。"
"26","2","5","5","263","1","点がちにて","字画の点が目立つ書き方かといわれる。"
"26","2","5","6","264","1","まことや暮にも","以下「水無瀬川にを」まで、近江の君の手紙の裏書き。"
"26","2","5","6","265","1","厭ふにはゆるにや","「あやしくもいとふにはゆる心かないかにしてかは思ひやむべき」（後撰集恋二、六〇八、読人しらず）。"
"26","2","5","6","266","1","あやしきは水無川","「悪しき手をなほよきさまにみなせ川底の水屑の数ならずとも」（源氏釈所引、出典未詳）。"
"26","2","5","8","267","2","草若み常陸の浦のいかが崎--いかであひ見む田子の浦波","近江の君の弘徽殿女御への贈歌。『集成』は「「いかが崎」は、「いかで」を言い出す序。河内の国の枕詞（あるいは近江とも）。「田子の浦」は駿河の国の枕詞。第一句「草若み」は、自分を卑下したつもりか。三箇所の関係のない名所を詠み込み、「本末あはぬ歌」の実例」と注す。"
"26","2","5","9","268","1","大川水の","歌に添えた言葉。「み吉野の大川野辺の藤波の並に思はば我が恋ひめやは」（古今集恋四、六九九、読人しらず）。"
"26","2","5","10","269","1","下長に","文字の下半分が長い書き方。"
"26","2","6","1","270","1","樋洗童しも","大島本は「ひすましわらハゝ（ゝ＃&lt;朱&gt;）しも」とある。すなわち底本は踊り字「ゝ」を朱筆で抹消する。『新大系』は底本の朱筆訂正に従う。『集成』『古典セレクション』は諸本及び底本の訂正以前本文に従って「樋洗童はしも」と校訂する。"
"26","2","6","1","271","1","女御の御方の台盤所に寄りて","弘徽殿女御方の女房の詰所。"
"26","2","6","2","272","1","これ参らせたまへ","使者の詞。"
"26","2","6","3","273","1","下仕へ見知りて","女御方の下仕え。"
"26","2","6","4","274","1","北の対にさぶらふ童なりけり","女御方の下仕えの詞。"
"26","2","6","5","275","1","大輔の君","女御方の女房。"
"26","2","6","5","276","1","持て参りて","大島本は「もてままいりて」とある。「ま」は衍字であろう。"
"26","2","6","6","277","1","中納言の君","女御方の女房。女房名からして上臈の女房。"
"26","2","6","6","278","1","近くゐて","大島本は「ちかくいて」とある。『新大系』は底本のままとする。『集成』『古典セレクション』は諸本に従って「近くさぶらひて」と校訂する。"
"26","2","6","7","279","1","いと今めかしき","以下「はべめるかな」まで、中納言の君の詞。"
"26","2","6","9","280","1","草の文字は","以下「見ゆるかな」まで、弘徽殿女御の詞。『集成』は「草仮名の読みにくさにかこつけて、やんわりと批評したもの」と注す。"
"26","2","6","11","281","1","返りこと","以下「書きたまへ」まで、弘徽殿女御の詞。"
