"Volume","Chapter","Paragraph","Line","Annotation_Num","Annotation_State","Annotation_Title","Annotation_Body"
"31","3","5","3","297","1","対面したまふべくもあらず","北の方にお会いなされるはずもない。「べくもあらず」は語り手の感情がこめられた表現。『完訳』は「北の方の固い覚悟による」と解す。"
"31","3","5","4","298","1","何かただ時に移る心の","以下「見え果てたまはめ」まで、式部卿宮の娘北の方への諌めの詞。「何か」の下には「会はむ」などの語句が省略されている。「か」（係助詞、反語）。どうしてお会うことがあろうか、会う必要はないの意。式部卿宮は鬚黒を、源氏におもねって玉鬘と結婚したと解釈する。"
"31","3","5","4","299","1","折とか待たむ","「か」（係助詞、反語）。心の改まる時と待とうか、そのような時はないの意。"
"31","3","5","5","300","1","諌め申したまふことわりなり","式部卿宮が諌めるのも当然であるとする語り手の評言。『明星抄』は「いさめ申給」以下に「草子地也」と指摘。『評釈』は「ことはりなり」に「もっともな判断と、語り手も、作者も、同意する」と指摘する。"
"31","3","5","6","301","1","いと若々しき心地も","以下「もてないたまはめ」まで、鬚黒の詞。北の方に申し上げている内容である。"
"31","3","5","6","302","1","罪さりどころなう","わたしの罪は免れ難い、弁解の余地がないの意。"
"31","3","5","6","303","1","かやうに","実家に戻ることをさす。"
"31","3","5","7","304","1","姫君をだに見たてまつらむ","鬚黒の詞。せめて姫君にだけでもお会い申したい。"
"31","3","5","7","305","1","出だしたてまつるべくもあらず","北の方が姫君を鬚黒の前にお出しするはずもない。「べくもあらず」という言い回しは、語り手の判断をも言い込めた表現。"
"31","3","5","10","306","1","あこをこそは","以下「見るべかめれ」まで、鬚黒の詞。二郎君を目の前にして、これからおまえをかわいがって行くことになるのだろうというニュアンス。"
"31","3","5","11","307","1","宮にも御けしき賜はらせたまへど","鬚黒は式部卿宮にも面会の御意向をお伺いになるが、の意。"
"31","3","5","12","308","1","風邪おこりて","以下「ほどにて」まで、式部卿宮の謝絶の詞。"
"31","3","6","1","309","1","六条殿にはえ率ておはせねば","玉鬘のいる六条院には子供たちを連れて行くことができないので。鬚黒の生活の中心は今や六条院の玉鬘の所に移っている。"
"31","3","6","2","310","1","なほここにあれ","以下「心やすかるべく」まで、鬚黒の詞。「ここ」は鬚黒の自邸をさす。"
"31","3","6","2","311","1","来て見むにも","大島本は「きてみ（み＋んイ&lt;朱&gt;）にも」とある。『集成』『新大系』『古典セレクション』は諸本及び底本の朱筆補入に従って「来て見むにも」と「む」を補訂する。"
"31","3","6","3","312","1","うち眺めて","子供たち二人が物思いに沈んで。"
"31","3","6","3","313","1","見送り","鬚黒を見送る。鬚黒は子供たちを残して六条院へ出掛ける。"
"31","3","6","3","314","1","女君","玉鬘。"
"31","3","6","3","315","1","ひがひがしき御さま","北の方の気違いじみた御様子。"
"31","3","6","5","316","1","春の上","紫の上をいう。この呼称は「胡蝶」「常夏」の巻に見えた。"
"31","3","6","6","317","1","ここにさへ","以下「苦しきこと」まで、紫の上の詞。"
"31","3","6","7","318","1","大臣の君","源氏をいう。"
"31","3","6","8","319","1","難きことなり","以下「となむ思ひはべる」まで、源氏の紫の上への詞。"
"31","3","6","8","320","1","人のゆかり","玉鬘との関係をさす。"
"31","3","6","8","321","1","思したなり","「た」（完了の助動詞、存続の意。連体形「たる」の「る」が撥音便化し、無表記された形）「なり」（伝聞推定の助動詞）。下文の「恨み解けたまひにたなり」も同じ。お思いになっているようだ。"
"31","3","6","8","322","1","聞きあきらめ","式部卿宮は鬚黒と玉鬘との結婚が源氏のしわざではないと知る。"
"31","3","6","8","323","1","人の仲らひ","男女関係をさしていう。"
"31","3","6","8","324","1","しか思ふべき罪もなし","そんなに苦にする責任はない。男女関係は自然と明らかになってくるものであるからという考えによる。"
"31","4","1","2","325","1","この参りたまはむと","以下「なくやはある」まで、鬚黒の心。「この」は尚侍としての出仕をさす。"
"31","4","1","2","326","1","妨げきこえつるを","鬚黒が玉鬘の尚侍としての宮中出仕をお妨げ申し上げてしまったことを、の意。"
"31","4","1","2","327","1","人びとも思すところあらむ","「人びと」は「思す」という敬語が使われているので、源氏や内大臣などをさす。「思すところ」とは不快にお思いになることをいう。"
"31","4","1","3","328","1","男踏歌ありければ","正月十四日に行われる行事。「末摘花」「初音」巻にも見えた。ここでは、玉鬘参内が「けれ」（過去の助動詞）「ば」とあり、過去の出来事という視点に立って語られる。"
"31","4","1","3","329","1","儀式","玉鬘の尚侍出仕の儀式。"
"31","4","1","4","330","1","かたがたの大臣たち","源氏と内大臣をいう。"
"31","4","1","4","331","1","宰相中将","夕霧をさす。"
"31","4","1","4","332","1","兄弟の君達","柏木や弁少将など。"
"31","4","1","5","333","1","承香殿の東面に御局したり","承香殿は東西に長い建物。玉鬘はその東面の間をお部屋とした。以下、語り手の説明的文章が続く。"
"31","4","1","5","334","1","西に宮の女御はおはしければ","承香殿の西面の間を式部卿宮の女御がお部屋としていた。"
"31","4","1","5","335","1","馬道ばかりの隔てなるに、御心のうちは、遥かに隔たりけむかし","「けむ」（過去推量の助動詞）「かし」（終助詞、念を押す）は語り手の宮の女御と玉鬘との心を推測した表現。『一葉抄』は「双紙地也」と指摘。『細流抄』は「草子地をしはかりていへり」と指摘。『集成』も「草子地」と指摘する。"
"31","4","1","5","336","1","御方々いづれとなく","冷泉帝の後宮の様子を語る。"
"31","4","1","6","337","1","左の大殿の女御","大島本は「左大殿のの女御」とある。衍字である。「左大殿」は「行幸」巻（第一章一段）に出てきた大臣。"
"31","4","1","6","338","1","中納言宰相の御女二人ばかり","中納言、宰相は系図不明の人々。更衣である。以上、冷泉帝の後宮は、秋好中宮（源氏方養女）、弘徽殿女御（内大臣娘）、王女御（式部卿娘）、左大臣女御（左大臣娘）、中納言更衣、宰相更衣などがいる。"
"31","4","2","1","339","1","春宮の女御","朱雀院の女御で鬚黒の妹。今、春宮の母女御として梨壺に住む。「澪標」巻参照。"
"31","4","2","1","340","1","宮はまだ若くおはしませど","春宮はまだお若くいらっしゃるが。十二歳。元服適齢期である。"
"31","4","2","2","341","1","御前中宮の御方朱雀院とに参りて","踏歌の一行が巡る順路である。帝の御前、すなわち清涼殿東庭から梅壺の中宮の御前、内裏を出て、上皇御所の朱雀院へと向かう。そして最後に内裏の梨壺の春宮の御前へと帰って来る。"
"31","4","2","2","342","1","六条の院には、このたびは 所狭しとはぶきたまふ","源氏の太政大臣邸の六条院は今回は仰々しいとという理由から省略なさる。「六条の院に」の格助詞「に」は尊敬の意、主格を表す。六条院におかれては。"
"31","4","2","3","343","1","竹河","催馬楽、呂。「竹河の橋の詰めなるや橋の詰めなるや花園にはれ花園に我をば放てや少女たぐへて」。「初音」巻の踏歌の折にも謡われた。"
"31","4","2","3","344","1","いとめでたし","その場の情景を見ている語り手の感想を交えた表現。"
"31","4","2","4","345","1","大将殿の太郎君","鬚黒の長男、十歳。"
"31","4","2","4","346","1","尚侍の君もよそ人と見たまはねば","尚侍の君すなわち玉鬘にとって、内大臣の子は異母兄弟。鬚黒大将の子は先妻の子、いわゆる継子関係になる。"
"31","4","2","4","347","1","この御局の袖口","承香殿の東面の玉鬘の局の女房たちの袖口。"
"31","4","2","6","348","1","皆同じごとかづけわたす綿のさま","踏歌の人々に褒美として被ける綿の様子。"
"31","4","2","6","349","1","こなたは","玉鬘の局。"
"31","4","2","6","350","1","水駅なりけれど","水駅であったが、というように「皆同じごと」以下の一文を過去の助動詞「けり」でもって過去の出来事として語る。"
"31","4","2","6","351","1","人びと心懸想しそして","踏歌の一行たちが緊張して。"
"31","4","2","6","352","1","大将殿せさせたまへりける","「ける」という過去の助動詞でもって、この一段を語り収める。"
"31","4","3","1","353","1","宿直所にゐたまひて","鬚黒が宿直所（陰明門内南廊、右大将直廬）に。"
"31","4","3","1","354","1","日一日聞こえ暮らしたまふことは","踏歌の翌日。一日中、鬚黒は玉鬘に何かと話し掛けなさる内容は。"
"31","4","3","2","355","1","夜さり、まかでさせたてまつりてむ","以下「やすからぬ」まで、鬚黒の詞。"
"31","4","3","2","356","1","かかるついでにと","このように宮中に上がった機会にそのままいようと。"
"31","4","3","4","357","1","大臣の心あわたたしきほどならで","以下「すがすがしうや」まで、女房の詞。「大臣」は源氏をさしていう。「心あわたたしき」以下「まかでさせたまへ」まで、源氏の詞を引用。"
"31","4","3","4","358","1","御心ゆかせたまふばかり","帝のお心に御満足あそばされるほど。"
"31","4","3","5","359","1","いとつらしと思ひて","鬚黒はとてもひどいと思って。"
"31","4","3","6","360","1","さばかり","以下「世かな」まで、鬚黒の心。"
"31","4","3","8","361","1","大将は司の御曹司にぞおはしける","挿入句。蛍兵部卿宮から手紙が来た時、鬚黒はちょうど近衛府の右大将直廬にいらっしゃったのであったという説明を挿入した。"
"31","4","3","8","362","1","これよりとて","大島本は「これより」とある。『新大系』は底本のままとする。『集成』『古典セレクション』は諸本に従って「それより」と校訂する。女房が鬚黒のもとからといって。"
"31","4","3","8","363","1","しぶしぶに見たまふ","玉鬘が渋々と御覧になる。"
"31","4","3","9","364","2","深山木に羽うち交はしゐる鳥の--またなくねたき春にもあるかな","蛍兵部卿宮からの贈歌。鬚黒を「深山木」に見立て、玉鬘を「鳥」に見立てる。「深山木」は無風流な木の譬えである。「またなくねたき」には「またなく妬き」に「また鳴く音」「また泣く声」を響かせる。「羽うち交はし」は「長恨歌」の比翼連理を踏まえた夫婦仲の睦まじいことをいう。楽しいはずの春が自分には悔しい思いでいる。"
"31","4","3","10","365","1","さへづる声も耳とどめられてなむ","蛍兵部卿宮の歌に添えた詞。『源氏釈』は「百千鳥囀る春はものごとに改まれども我ぞふりゆく」（古今集春上、二八、読人しらず）を指摘。現行の注釈書でも指摘する。"
"31","4","3","11","366","1","主上渡らせたまふ","主上が承香殿の東面の玉鬘の局にお渡りあそばす。"
"31","4","4","1","367","1","ただかの大臣の御けはひに違ふところなくおはします","月の光に照らされた主上のご容貌は源氏の大臣にそっくりでいらっしゃる。"
"31","4","4","1","368","1","かかる人はまたもおはしけり","玉鬘の感想。源氏のように美しい方がもう一人いらっしゃったのだ。"
"31","4","4","1","369","1","見たてまつりたまふ","玉鬘は主上を拝見なさる。"
"31","4","4","1","370","1","かの御心ばへは","以下「おぼえさせたまはむ」あたりまで玉鬘の心。源氏と主上を比較する。"
"31","4","4","1","371","1","などかはさしもおぼえさせたまはむ","反語表現。どうして主上がお思いあそばそうか、それはない。"
"31","4","4","1","372","1","いとなつかしげに","玉鬘の気持ちに添った語り口。「のたまはするに」に係る。"
"31","4","4","1","373","1","思ひしことの違ひにたる怨み","主上が独身の身での尚侍としての出仕を期待していたことに相違してしまった恨み言。主上が「思って」いたことだが、ここでは敬語表現がない。"
"31","4","4","1","374","1","面おかむかたなくぞおぼえたまふや","「や」（詠嘆の終助詞）、語り手の玉鬘に同情した表現。"
"31","4","4","1","375","1","御応へもえ聞こえたまはねば","大島本は「えきこえ」とある。『集成』『新大系』は底本のままとする。『古典セレクション』は諸本に従って「聞こえ」と「え」を削除する。主上の恨み言に玉鬘は何とも返事を申し上げられないので。"
"31","4","4","2","376","1","あやしうおぼつかなきわざかな","以下「御癖なりけり」まで、主上の玉鬘への詞。"
"31","4","4","2","377","1","よろこび","叙位の喜び。"
"31","4","4","4","378","2","などてかく灰あひがたき紫を--心に深く思ひそめけむ","帝の贈歌。「紫」は三位の服色。玉鬘を三位に叙したことをいう。また紫は椿の灰を混ぜて染料を作る。「灰合ひ」に「逢ひ」を掛け、「深く」「染め」は「紫」の縁語。"
"31","4","4","5","379","1","濃くなり果つまじきにや","これ以上深い関係にはなれないのでしょうかの意。「濃く」は「紫」の縁語。会話文の中にも縁語を使う。ここまで、主上の歌に添えた詞。"
"31","4","4","6","380","1","違ひたまへるところやある","玉鬘の心。源氏と主上を比較し、少しも違わないと思う。"
"31","4","4","6","381","1","宮仕への労もなくて今年加階したまへる心にや","語り手が玉鬘が次のような返歌をした気持ちを先回りして語った挿入文。『細流抄』は「此哥の注を草子地かく也」と指摘。『集成』も「あらかしめ次の歌に説明を加えた草子地」と指摘する。"
"31","4","4","7","382","2","いかならむ色とも知らぬ紫を--心してこそ人は染めけれ","玉鬘の返歌。帝への感謝の気持ちを詠む。「色」「染め」は「紫」の縁語。"
"31","4","4","8","383","1","今よりなむ思ひたまへ知るべき","ここまで、玉鬘の返歌に添えた詞。"
"31","4","4","10","384","1","その今より染めたまはむこそ","以下「聞かまほしくなむ」まで主上の詞。「そめ」は「初め」と「染め」とを掛け、「染め」は「紫」の縁語。"
"31","4","4","10","385","1","愁ふべき人あらば","私の愁えを聞いてくださる人がいたら。"
"31","4","4","11","386","1","いとうたてもあるかな","玉鬘の心。"
"31","4","4","11","387","1","をかしきさまをも","以下「世の癖なりけり」まで玉鬘の心。"
"31","4","4","11","388","1","世の癖","男女の仲、特に男性の悪い性分の意。"
"31","4","4","11","389","1","やうやうこそは目馴れめ","主上の心。玉鬘もだんだんと宮仕え生活に慣れてこよう。"
"31","4","4","11","390","1","思しけり","帝はお思いあそばすのであった。「けり」（過去の助動詞）でもって、この段を語り収める。"
"31","4","5","1","391","1","大将は","以下、鬚黒に視点を移して語る。"
"31","4","5","1","392","1","みづからも","「も」（係助詞、並列）があることによって、鬚黒はもちろんのこと、玉鬘自身でものニュアンス。"
"31","4","5","1","393","1","似げなきことも出で来ぬべき身なりけり","「似げなきこと」とは帝の寵愛を得ることをさす。既に夫があり、それはまた異母姉妹の弘徽殿女御や秋好中宮らと寵愛を競うことになると懸念した。"
"31","4","5","1","394","1","父大臣","玉鬘の父、内大臣。"
"31","4","5","2","395","1","さらば","以下「心地なむする」まで、帝の詞。それならしかたがないの意。"
"31","4","5","2","396","1","物懲りして","玉鬘を出仕させたことに懲りての意。"
"31","4","5","2","397","1","もぞある","～があっては困る、の意。"
"31","4","5","2","398","1","人に後れてけしき取り従ふよ","「人」は鬚黒をさす。鬚黒に先を越されて、今やその人の御機嫌を伺うことになったとはの意。"
"31","4","5","2","399","1","昔のなにがしが例も","「大納言国経の朝臣の家にはべりける女に、平定文いとしのびて語らひはべりて、行末まで契りはべりけるころ、この女にはかに贈太政大臣にむかへられてわたりはべりにければ、文だにも通はすかたなくなりにければ、かの女の子の五ばかりなるが、本院の西の対に遊びありきけるを呼び寄せて、母に見せたてまつれとて腕にかきつけはべりける、平定文　昔せしわがかねごとの悲しきはいかに契りし名残なるらむ。　返し、読人しらず　うつつにて誰契りけむ定めなき夢路にまどふ我は我かは」（後撰集恋三、七一一、平定文・七一二、読人しらず）の話が指摘されている。"
"31","4","5","4","400","1","聞こし召ししにもこよなき近まさりを","帝は玉鬘の美しさをお聞きあそばしていた以上に、実際間近で御覧になると格段に美しいのを、の意。"
"31","4","5","4","401","1","さる御心","妃の一人にしようとするお考え。"
"31","4","5","5","402","1","われはわれと思ふものを","玉鬘は、心に前出の「後撰集」の女の返歌、「うつつにて誰契りけむ定めなき夢路にまどふ我は我かは」の語句を引用して、わが身を省みる。夫をもったわが身は昔のわたしではない。しかし、いまだ「夢路に惑う」という心の底に帝を思い続けている気持ちがあるのか、否、もう「我は我かは」という確固とした鬚黒の妻としての自覚なのか。二者択一というより両方の気持ちが揺れ動いているというのが玉鬘の真実に近いのではなかろうか。『完訳』は女の返歌による叙述としながら、「あるいはこれと無関係に、自分自身としてはみかどに仕えたいのに、と解すべきか」と注す。"
"31","4","5","6","403","1","御輦車寄せて","御輦車は、女性では女御、妃などのうち、特に帝の勅許を得て許された者が乗用する。したがって、帝の玉鬘に対する特別な措置といえる。"
"31","4","5","6","404","1","こなたかなたの御かしづき人ども","源氏方内大臣方のお世話役連中。"
"31","4","5","6","405","1","えおはしまし離れず","帝は玉鬘のお側をお離れにならない。"
"31","4","5","7","406","1","かういと厳しき近き守りこそむつかしけれ","帝の詞。鬚黒が右大将なので、それにひっかけて揶揄する。"
"31","4","5","9","407","2","九重に霞隔てば梅の花--ただ香ばかりも匂ひ来じとや","帝の玉鬘への贈歌。別れの挨拶といった内容。「九重」は宮中の意と九重、すなわち幾重にもの意を掛ける。また「かはかり」にも「香はかり」と副詞の「かばかり」とを掛ける。「霞」に暗に鬚黒のことをいう。「梅の花」は玉鬘を譬喩する。"
"31","4","5","10","408","1","殊なることなきことなれども","以下「をかしくもやありけむ」まで語り手の判断の交じえた表現。『休聞抄』は「双也」と指摘。『孟津抄』は「紫式部が批判也」。『評釈』は「語り手の批評この歌はたいしたものでない、と、語り手はことわる。しかし、その時は、主上を拝していたのだから、結構なお歌と思ったことでしょうか。そう思ったひとを非難することはできない、と言うのである」と注す。『集成』は「草子地」と指摘。『完訳』は「語り手が、玉鬘の動揺を推測」と注す。"
"31","4","5","11","409","1","野をなつかしみ","以下「聞こゆべき」まで帝の詞。「春の野に菫摘みにと来しわれぞ野をなつかしみ一夜寝にける」（古今六帖六、菫、三九一六・万葉集巻八、一四二四、山部赤人）の和歌の句を引用する。"
"31","4","5","11","410","1","惜しむべかめる人","鬚黒をさす。"
"31","4","5","11","411","1","身をつみて","前出の和歌の語句「菫摘みに」に引っ掛けた表現。"
"31","4","5","12","412","1","と思し悩むも","と帝は玉鬘に仰せになってお悩みあそばすのもの意。「と」の下には「仰せて」などの語句が省略されている。"
"31","4","5","12","413","1","いとかたじけなしと見たてまつる","玉鬘は帝をまことに恐れ多いと拝する。"
"31","4","5","13","414","2","香ばかりは風にもつてよ花の枝に--立ち並ぶべき匂ひなくとも","玉鬘の返歌。帝の贈歌から、「香ばかり」の語句を引用して応える。「花の枝」は後宮の妃方を隠喩。また帝をさすと考えることもできよう。わが身を「匂ひなくとも」と謙遜する。"
"31","4","5","14","415","1","さすがにかけ離れぬけはひを","帝の目から見た玉鬘の冷淡にあしらわない態度。"
"31","4","5","14","416","1","あはれと思しつつ","帝の気持ち。"
"31","4","5","14","417","1","渡らせたまひぬ","帝はお戻りあそばした。以上、承香殿東間の玉鬘と帝の別れの場面終わる。帝の玉鬘に寄せる愛執はその後も語られる。"
"31","4","6","1","418","1","やがて今宵かの殿にと思しまうけたるを","場面は変わって、鬚黒を中心に語る。"
"31","4","6","1","419","1","かねては許されあるまじきにより漏らしきこえたまはで","誰が許さないのか不分明。『集成』は内大臣とし、『完訳』は源氏とする。『新大系』は「源氏や内大臣」とする。"
"31","4","6","2","420","1","にはかにいと","以下「おぼつかなくはべらむを」まで、鬚黒の詞。"
"31","4","6","3","421","1","申しないたまひて","「申しない」は「申しなし」のイ音便形。ここも誰に申し上げなさってなのか不分明。"
"31","4","6","3","422","1","やがて渡したてまつりたまふ","鬚黒は玉鬘をそのまま自邸にお移し申し上げなさる。"
"31","4","6","4","423","1","儀式なきやうにや","退出の作法が疎略ではないか。当時は格式を重んじた。"
"31","4","6","5","424","1","ともかくももとより進退ならぬ人の御ことなれば","内大臣の詞。内大臣にとって玉鬘はもともと自分の思うままにならなかった人であるという意。"
"31","4","6","6","425","1","とぞ聞こえたまひける","内大臣は鬚黒に申し上げるのであったという意。玉鬘のいわゆる親権者は内大臣に移っているのか。あるいは、よく儀式の格式を重んじる内大臣側に焦点を当てて玉鬘の退出を語ったものか。"
"31","4","6","7","426","1","六条殿ぞ","場面は変わって、六条院の源氏の立場を語る一文を挿入し、鬚黒の自邸に戻った鬚黒と玉鬘を語る。"
"31","4","6","7","427","1","などかはあらむ","語り手の批評を挿入。『集成』は「何の不都合なことがあろう。鬚黒としては、もう源氏の意向など意に介する必要はない、という意味の草子地」と注す。"
"31","4","6","7","428","1","塩やく煙のなびきけるかたを","『源氏釈』は「須磨の海人の塩焼く煙風をいたみ思はぬ方にたなびきにけり」（古今集恋四、七〇八、読人しらず）を指摘。現行の諸注釈書でも指摘する。"
