"Volume","Chapter","Paragraph","Line","Annotation_Num","Annotation_State","Annotation_Title","Annotation_Body"
"51","3","5","6","384","2","絶え間のみ世には危ふき宇治橋を--朽ちせぬものとなほ頼めとや","浮舟の返歌。「宇治橋」「朽ち」の語句を受けて「なほ頼めとや」と切り返す。『全集』は「忘らるる身を宇治橋の中絶えて人も通はぬ年ぞへにける」（古今集恋五、八二五、読人しらず）を指摘。"
"51","3","5","7","385","1","今さらなり心やすきさまにてこそ","薫の心中。『完訳』は「いまさら長居すべきでもない、京に引き取ってから気楽な所でゆっくり逢おう。匂宮とは対照的」と注す。"
"51","3","5","7","386","1","いとようもおとなびたりつるかな","薫の感想。浮舟の成長を思う。"
"51","3","5","7","387","1","ありしにまさりけり","明融臨模本、朱合点あり。『紫明抄』は「出でていなばいなば誰か別れの難からむありしにまさる今日は悲しも」（伊勢物語）を指摘。"
"51","4","1","1","388","1","何ごとも","以下、『一葉抄』は「草子詞也」と指摘。『評釈』は「何もかもすぐれている宮、と、改めて作者はほめる。それでいて女のことで乱れるのが困りもの、と。--このところ余りひどすぎる宮さまのおんふるまいと、読者が思うであろう。それを、さきまわりして弁解しておくのである」と注す。"
"51","4","1","1","389","1","すずろなること思し焦らるるのみなむ罪深かりける","『完訳』は「語り手の評」と注す。"
"51","4","1","3","390","1","闇はあやなしと","明融臨模本、朱合点、付箋「春のよのやみはあやなし梅のはな色こそみえね香やはかくるる」（古今集春上、四一、凡河内躬恒）を指摘。"
"51","4","1","4","391","2","衣片敷き今宵もやと","『源氏釈』、明融臨模本、朱合点、付箋「さむしろに衣かたしき今夜もやわれを待らんうちの橋姫」（古今集恋四、六八九、読人しらず）を指摘。"
"51","4","1","5","392","1","はかなきことを","『集成』は「漢詩に対して、和歌を「はかなきこと」という」と注す。"
"51","4","1","6","393","1","言しもこそあれ","『全集』は「語り手の短評」と注す。"
"51","4","1","7","394","1","おろかには思はぬなめりかし","以下「いかでつくべきぞ」まで、匂宮の心中の思い。「おろかには思はぬ」の主語は薫。"
"51","4","1","7","395","1","片敷く袖を","「古今集」歌の歌語。独り寝の寂しい気持ち。"
"51","4","1","7","396","1","かばかりなる本つ人をおきて","薫をさす。"
"51","4","1","9","397","1","文たてまつりたまはむとて","昨夜賜った詩題について作った漢詩。帝の御前に献上する。"
"51","4","1","9","398","1","かの君も同じほどにて今二つ三つまさるけぢめ","『集成』は「実は、薫は匂宮より年下のはず。匂宮誕生は、源氏四十七歳以前。薫は、源氏四十八歳の時の子である。老成した薫の人物像を強調しようとしてわざとこうしたのであろう」。『完訳』は「薫の老成のイメージを強調するために不用意に誤ったか」と注す。"
"51","4","1","9","399","1","才などもおほやけおほやけしき方も後れずぞおはすべき","『集成』は「女の語り手らしい語尾」と注す。"
"51","4","1","10","400","1","何とも聞き入れたまはず","詩文のことは念頭になく、浮舟のことばかりを思っている。"
"51","4","1","10","401","1","いかなる心地にてかかることをもし出づらむ","匂宮の心中。"
"51","4","2","1","402","1","かの人の御けしきにも","薫。"
"51","4","2","1","403","1","京には友待つばかり消え残りたる雪","『全集』は「白雪の色わきがたき梅が枝に友待つ雪ぞ消え残りたる」（家持集）。『集成』は「梅の花咲くとも知らずみ吉野の山に友待つ雪の見ゆるらむ」（貫之集）を指摘。"
"51","4","2","2","404","1","いづ方もいづ方も","本官の大内記も兼官の式部少輔も。"
"51","4","2","2","405","1","いとつきづきしく引き上げなどしたる姿もをかしかりけり","『完訳』は「不似合いな恋の案内訳を、逆説的に似合いと評して皮肉った。学者のかいがいしく仕える滑稽さ」と注す。"
"51","4","2","3","406","1","君も思へり","浮舟。係助詞「も」は、右近はもとより浮舟も、というニュアンス。"
"51","4","2","3","407","1","今宵はつつましさも忘れぬべし","『湖月抄』は「地」と指摘。『完訳』は「語り手の推測による」と注す。"
"51","4","2","3","408","1","同じやうに睦ましくおぼいたる若き人","浮舟が右近同様に親しく思っている若い女房。敬語「思す」とあるので、主語は浮舟。"
"51","4","2","4","409","1","いみじく","以下「もて隠したまへ」まで、右近の詞。"
"51","4","2","5","410","1","かの人の御けはひに","薫。"
"51","4","3","2","411","1","いとよく用意してさぶらふ","時方の詞。"
"51","4","3","3","412","1","と申さす","時方が右近をして匂宮に。"
"51","4","3","3","413","1","こはいかにしたまふことにか","右近の心中。"
"51","4","3","5","414","1","右近はこの後見にとまりて","明融臨模本は「このうしろみにとまりて」とある。『完本』は諸本に従って「ここの後見にとどまりて」と校訂する。『集成』『新大系』は底本のまま「この後見にとまりて」とする。"
"51","4","3","6","415","1","いとらうたしと思す","匂宮の感想。"
"51","4","3","7","416","1","有明の月澄み昇り","『集成』は「陰暦二十日以後の月で、夜半に出る。これによれば、匂宮の宇治来訪は、宮中詩宴（二月十日頃）の十日ほど後となる」と注す。"
"51","4","3","8","417","1","これなむ橘の小島","船頭の詞。『河海抄』は「今もかも咲き匂ふらむ橘の小島の崎の山吹の花」（古今集春下、一二一、読人しらず）を指摘。"
"51","4","3","9","418","1","されたる常磐木の蔭茂れり","『岷江入楚』は「橘は実さへ花さへその葉さへ枝に霜置けまして常磐木」（出典未詳、万葉集に類歌あり）を指摘。"
"51","4","3","10","419","1","かれ見たまへ","以下「緑の深さを」まで、匂宮の詞。"
"51","4","3","12","420","2","年経とも変はらむものか橘の--小島の崎に契る心は","匂宮の浮舟への贈歌。"
"51","4","3","14","421","2","橘の小島の色は変はらじを--この浮舟ぞ行方知られぬ","浮舟の返歌。「橘の小島」「変はる」の語句を受けて返す。"
"51","4","3","15","422","1","人のさまに","『集成』は「女も美しいので」と注す。"
"51","4","3","16","423","1","かの岸に","対岸。"
"51","4","3","16","424","1","何人を、かくもて騷ぎたまふらむ","供人たちの感想。『集成』は「大したこともない山里の女なのに、という気持」と注す。"
"51","4","3","16","425","1","見たてまつる","主語は供人。"
"51","4","3","16","426","1","時方が叔父の因幡守なるが領ずる荘に、はかなう造りたる家なりけり","『岷江入楚』は「此家の注なり」と指摘。『集成』は「用意した家の説明」と注す。語り手の説明的叙述。"
"51","4","4","1","427","1","人の御容貌も","『集成』は「二人のお顔立ちのお美しさも」。『完訳』は「浮舟の目にする匂宮の容姿」と注す。"
"51","4","4","1","428","1","女も脱ぎすべさせたまひてしかば","「脱ぎさせ給ひて」の主語は匂宮。「させ」は使役の助動詞、「たまふ」は匂宮に対する敬意。"
"51","4","4","1","429","1","まばゆきまで","以下「さしむかひたるよ」まで、浮舟の心中。"
"51","4","4","2","430","1","なつかしきほどなる白き限りを","手触りも柔らかい白い衣だけを。"
"51","4","4","2","431","1","常に見たまふ人","主語は匂宮。中君や六君をさす。"
"51","4","4","3","432","1","これさへかかるを残りなう見るよ","浮舟の思い。匂宮だけでなく侍従までが、のニュアンス。"
"51","4","4","4","433","1","これはまた誰そわが名漏らすなよ","匂宮の詞。『源氏釈』は「犬上の鳥篭の山なるいさや川いさと答えよ我が名洩らすな」（古今集、墨滅歌、一一〇八、読人しらず）を指摘。"
"51","4","4","5","434","1","いとめでたしと思ひきこえたり","主語は侍従。"
"51","4","4","5","435","1","物語しをるを","『完訳』は「「--をり」はさげすむ気持を表す語法」と注す。"
"51","4","4","5","436","1","いらへもえせずをかしと思ひけり","主語は時方。『完訳』は「宮への遠慮から返事できない」と注す。"
"51","4","4","6","437","1","いと恐ろしく","以下「他の人寄すな」まで、時方の詞。"
"51","4","5","1","438","1","かの人の","以下「見えてむかし」まで、匂宮の心中。「かの人」は薫。"
"51","4","5","1","439","1","二の宮をいとやむごとなくて持ちたてまつりたまへるありさまなども語りたまふ","匂宮は薫が女二宮を北の方として大切にしているのを話す。『集成』は「浮舟との仲に水を差したい気持」と注す。"
"51","4","5","1","440","1","かの耳とどめたまひし一言は、のたまひ出でぬぞ憎きや","詩会の夜、薫を浮舟を思って、「衣かたしき今宵もや」と古歌を誦したことをさす。『細流抄』は「草子地也」と指摘。『完訳』は「語り手の匂宮評」と注す。"
"51","4","5","3","441","1","いみじくかしづかるめる","以下「さてな見えそや」まで、匂宮の詞。『集成』は「時方を冷やかしての言葉。「主」は軽い敬称」と注す。"
"51","4","5","5","442","1","かのわが住む方を","明融臨模本、朱合点有り。『河海抄』は「晴るる夜の星か河辺の螢かも我が住む方の海人のたく火か」（伊勢物語）を指摘。"
"51","4","5","6","443","2","峰の雪みぎはの氷踏み分けて--君にぞ惑ふ道は惑はず","匂宮の浮舟への贈歌。"
"51","4","5","7","444","1","木幡の里に馬はあれど","匂宮の歌に続けて書いた文句。明融臨模本、朱合点と付箋「山しろのこわたの里に馬はあれと君をおもへはかちよりそゆく」（拾遺集雑恋、一二四三、人麿）を指摘。『源氏釈』も同文指摘。「拾遺集」は、初句「山科の」、下句「徒歩よりぞ来る君を思へば」とある。"
"51","4","5","8","445","1","手習ひたまふ","『集成』は「お心に浮ぶままに、歌などをお書きになる」と注す。"
"51","4","5","9","446","2","降り乱れみぎはに凍る雪よりも--中空にてぞ我は消ぬべき","浮舟の返歌。「氷」「雪」の語句を受けて返す。"
"51","4","5","10","447","1","この中空をとがめたまふ","『集成』は「匂宮と薫の中に立って迷っているように聞えることを咎める」と注す。"
"51","4","5","10","448","1","げに憎くも書きてけるかな","浮舟の心中。匂宮の詞に納得する気持ち。"
"51","4","5","10","449","2","さらでだに--言はむ方なし","『湖月抄』は「草子地にいふ也」と指摘する。"
"51","4","5","10","450","1","御ありさまを","匂宮の風姿。"
"51","4","5","10","451","1","人の心に","浮舟の心に。"
"51","4","6","1","452","1","右近はよろづに例の言ひ紛らはして御衣など","留守居役の右近は周囲の女房に言い繕って、浮舟のもとに着替えを差し上げた。"
"51","4","6","1","453","1","その裳を取りたまひて君に着せたまひて","『集成』は「（匂宮は）その褶をお取りになって、浮舟に着せられて、宮のご洗面のお世話をおさせになる。身近に世話をさせて玩弄したい気持。女房扱いになる」と注す。"
"51","4","6","2","454","1","姫宮にこれを","以下「さましたるは難くや」まで、匂宮の心中の思い。。「姫宮」は女一宮、匂宮の姉宮をさす。『集成』は「浮舟に対する薫の気持との、基本的な相違を示すところ」。『完訳』は「女一の宮に浮舟を出仕させて、召人として情交を保とうと考える」と注す。"
"51","4","6","2","455","1","いみじきものにしたまひてむかし","主語は女一の宮。『集成』は「きっと秘蔵の女房になさるだろう」。『完訳』は「どんなにか大事に扱ってくださることだろう」と訳す。"
"51","4","6","3","456","1","かの人に","薫をさす。"
"51","4","6","3","457","1","いみじきことどもを","『集成』は「とても無理なことを」。『完訳』は「薫に逢ったら承知しない意」と注す。"
"51","4","6","3","458","1","さらに目の前にだに思ひ移らぬなめり","匂宮の心中の思い。『集成』は「いくら自分が目の前にいても、（薫から）心を移そうとしないようだ。匂宮の思い」と注す。"
"51","4","6","3","459","1","怨みても泣きても","『源氏釈』は「恨みても泣きても言はむ方ぞなき鏡に見ゆる影ならずして」（古今集恋五、八一四、藤原興風）を指摘。"
"51","4","6","3","460","1","夜深く率て帰りたまふ","宇治川対岸の隠れ家から浮舟の邸へ。"
"51","4","6","4","461","1","いみじく思すめる人は","以下「見知りたまひたりや」まで、匂宮の詞。「いみじく思す人」は、浮舟が愛する人、すなわち薫をさす。"
"51","4","7","1","462","1","かやうの帰さは","忍び歩きの後の帰り。"
"51","4","7","1","463","1","内裏にもいづくにも","『集成』は「帝后をはじめどちらにも。夕霧方でも、の意」と注す。"
"51","4","7","2","464","1","かしこにも","宇治の浮舟方。"
"51","4","7","2","465","1","かの殿のもてなし","薫。"
"51","4","7","2","466","1","ゆかしく待つことにて","主語は乳母。"
"51","4","7","2","467","1","母君も","浮舟の母。"
"51","4","7","2","468","1","忍びたるさまながらも近く渡してむことを","『完訳』は「表だった結婚の扱いではないとしても、薫の本邸三条宮近くに」と注す。"
"51","4","7","3","469","1","わが心にも","浮舟。"
"51","4","7","3","470","1","あながちなる人の","匂宮。"
"51","5","1","1","471","1","雨降り止まで","『集成』は「雨が降り止まず、日数も重なる頃。三月の長雨であろう。月も変った趣」と注す。"
"51","5","1","1","472","1","親のかふこは所狭きものにこそ","匂宮の心中。明融臨模本、朱合点。『源氏釈』は「たらちねの親のかふ蚕の繭ごもりいぶせくもあるか妹に逢はずて」（拾遺集恋四、八九五、柿本人麿）を指摘。"
"51","5","1","1","473","1","と思すもかたじけなし","『一葉抄』は「双紙詞なるへし云々」と指摘。"
"51","5","1","2","474","2","眺めやるそなたの雲も見えぬまで--空さへ暮るるころのわびしさ","匂宮から浮舟への贈歌。「眺め」「長雨」の懸詞。"
"51","5","1","3","475","1","いと重くなどはあらぬ若き心地に","浮舟の思慮。"
"51","5","1","4","476","1","いとかかる心を","以下「やうはありなむや」まで、浮舟の心中。"
"51","5","1","4","477","1","初めより契りたまひしさまも","『完訳』は「薫とはじめて契り交したこと。以下、浮舟の心に即し、「かかるうきこと」あたりから直接話法」と注す。"
"51","5","1","4","478","1","かかる憂きこと","匂宮との関係。"
"51","5","1","5","479","1","かく心焦られしたまふ人","匂宮。"
"51","5","1","5","480","1","いとあだなる御心本性","匂宮の好色な性癖。"
"51","5","1","5","481","1","かかるほどこそあらめ","「こそあらめ」係結び、逆接用法。『完訳』は「熱中している間はともかく、やがて冷めてしまうだろう」と注す。"
"51","5","1","5","482","1","かうながらも","秘密の関係のまま。"
"51","5","1","5","483","1","かの上の思さむこと","中君。"
"51","5","1","6","484","1","ともかくもあらむを","匂宮の隠妻の状態。"
"51","5","1","7","485","1","わが心も","以下「いみじかるべし」まで、浮舟の心中。"
"51","5","1","7","486","1","かの殿より","薫。"
"51","5","2","1","487","1","これかれと見るも","匂宮と薫との手紙。"
"51","5","2","1","488","1","言多かりつるを","匂宮の手紙。"
"51","5","2","4","489","1","ことわりぞかし","以下「見たてまつりてむ」まで、侍従の詞。"
"51","5","2","4","490","1","この御ありさまは","匂宮のご器量。"
"51","5","2","4","491","1","后の宮にも参りて","明石中宮のもとに女房として出仕してでも常に拝していたい。"
"51","5","2","6","492","1","うしろめたの御心のほどや","以下「いかがならせたまはむとすらむ」まで、右近の詞。"
"51","5","2","6","493","1","誰れかあらむ","反語表現。右近は薫を称揚。"
"51","5","2","6","494","1","容貌などは知らず御心ばへけはひなどよ","薫の心配りや感じを強調。"
"51","5","2","6","495","1","この御ことは","浮舟と匂宮との関係。"
"51","5","2","7","496","1","心一つに思ひしよりは","『完訳』は「右近一人より、嘘をつくにも好都合。右近が侍従をまきこむ」と注す。『湖月抄』は「草子地也」と指摘。『全集』は「諧謔的な語り口で、読者の緊張をときほぐす効果がある」と注す。"
"51","5","2","9","497","1","思ひながら","以下「おろかなるにやは」まで、薫の手紙。"
"51","5","2","11","498","2","水まさる遠方の里人いかならむ--晴れぬ長雨にかき暮らすころ","薫から浮舟への贈歌。「をち」（宇治にある地名）と「遠方」、「眺め」と「長雨」の懸詞。浮舟の寂しさを思いやる。"
"51","5","2","12","499","1","常よりも","以下「まさりてなむ」まで、歌に続けた手紙。"
"51","5","2","13","500","1","白き色紙にて立文なり","白色の料紙、立文の形式は、恋文には用いない。『集成』は「儀礼や普通の用件の時の形式」と注す。"
"51","5","2","14","501","1","まづかれを人見ぬほどに","侍従の詞。先に匂宮に返事を書くように勧める。"
"51","5","2","16","502","1","今日はえ聞こゆまじ","浮舟の詞。"
"51","5","2","17","503","1","手習に","『完訳』は「相手への返歌よりも、自らの思いを独詠的に書きつける趣」と注す。"
"51","5","2","18","504","2","里の名をわが身に知れば山城の--宇治のわたりぞいとど住み憂き","浮舟の独詠歌。『細流抄』は「わが庵は都の巽しかぞ住む世を宇治山と人はいふなり」（古今集雑下、九八二、喜撰法師）を指摘。"
"51","5","2","19","505","1","ながらへてあるまじきことぞ","浮舟の思い。匂宮との関係は長く続くはずのないのも、の意。"
"51","5","2","19","506","1","他に絶え籠もりてやみなむはいとあはれにおぼゆべし","「おぼゆ」の主語は浮舟。「べし」の推量の主体は語り手。『完訳』は「以下、匂宮への断ちがたい執心。「--べし」は語り手の推測」と注す。"
"51","5","2","20","507","2","かき暮らし晴れせぬ峰の雨雲に--浮きて世をふる身をもなさばや","浮舟の匂宮への返歌。"
"51","5","2","21","508","1","混じりなば","明融臨模本、朱合点。『源氏釈』は「行く舟の跡なき波にまじりなば誰かは水の泡とだに見む（新勅撰集恋四、九四一、読人しらず）。『異本紫明抄』は「白雲の晴れぬ雲居にまじりなばいづれかそれと君は尋ねむ」（出典未詳）を指摘。『玉の小櫛』は「ほととぎす峯の雲にやまじりにしありとは聞けど見るよしもなし」（古今集物名、四四七、平篤行）を指摘。"
"51","5","2","22","509","1","さりとも恋しと思ふらむかし","匂宮の思い。"
"51","5","2","23","510","1","まめ人は","薫。"
"51","5","2","23","511","1","あはれいかに眺むらむ","薫の思い。"
"51","5","2","24","512","2","つれづれと身を知る雨の小止まねば--袖さへいとどみかさまさりて","浮舟から薫への返歌。明融臨模本、朱合点。『異本紫明抄』は「数々に思ひ思はず問ひがたみ身をしる雨は降りぞまされる」（古今集恋四、七〇五、在原業平）。『湖月抄』は「つれづれと長雨にまさる涙川袖のみ濡れて逢ふよしもなし」（古今集恋三、六一七、藤原敏行）を指摘。"
"51","5","3","1","513","1","女宮に","薫の正室の女二宮。"
"51","5","3","2","514","1","なめしともや","以下「罪得ぬべき心地して」まで、薫の詞。"
"51","5","3","2","515","1","年経ぬる人","浮舟。長年付き合ってきた、の意。"
"51","5","3","2","516","1","昔より異やうなる心ばへはべりし身にて","薫自身の性癖についていう。『完訳』は「「異やうなる心ばへ」「例の人ならで」は、現世に否定的な世捨人の姿勢。薫独自の自己主張」と注す。"
"51","5","3","2","517","1","かく見たてまつるにつけて","女二宮との結婚生活をさす。"
"51","5","3","4","518","1","いかなることに心置くものとも知らぬを","女二宮の返事。『完訳』は「どんなことに気がねすべきものか分らぬ。嫉妬心はないとする。高貴な女性の常套的な応答」と注す。"
"51","5","3","6","519","1","内裏になど","以下「はべるまじ」まで、薫の詞。"
"51","5","3","6","520","1","それは","浮舟。"
"51","5","3","8","521","1","造りたる所に渡してむ","薫が京に新築中の邸。"
"51","5","3","8","522","1","かかる料なりけり","女を迎えるための邸であったのか、の意。"
"51","5","3","8","523","1","人しもこそあれ","『完訳』は「他にも人はあろうに。事の経緯に対する、語り手の評言」と注す。"
"51","5","3","8","524","1","この内記が知る人の親、大蔵大輔なるものに","大内記の妻の父親で大蔵大輔という者。大蔵大輔は薫の家司。しかし、婿の大内記は匂宮の腹心の家来。"
"51","5","3","8","525","1","聞きつぎて","主語は大内記。"
"51","5","3","9","526","1","絵師どもなども","以下「わざとなむせさせたまふ」まで、大内記の詞。"
"51","5","3","9","527","1","御随身どもの","右大将薫の随身は六人。"
"51","5","3","9","528","1","さすがに","隠れ家とはいっても、の意。"
"51","5","3","10","529","1","いとど思し騷ぎて","主語は匂宮。"
"51","5","3","10","530","1","遠き受領の妻にて下る家","遠国の受領の妻となって下る予定の家。"
"51","5","3","11","531","1","いと忍びたる人しばし隠いたらむ","匂宮の詞。"
"51","5","3","12","532","1","いかなる人にかは","受領の思い。"
"51","5","3","12","533","1","さらば","受領の詞。"
"51","5","3","12","534","1","この月の晦日方に","受領らは三月末方に下向の予定。"
"51","5","3","13","535","1","かくなむ思ふゆめゆめ","匂宮の詞。他言を禁じる。"
"51","5","4","1","536","1","誘ふ水あらばとは","明融臨模本、朱合点。『源氏釈』は「わびぬれば身を浮草の根を絶えて誘ふ水あらばいなむとぞ思ふ」（古今集雑下、九三八、小野小町）を指摘。"
"51","5","4","1","537","1","浮きたる心地のみすれば","浮舟の心理。"
"51","5","4","1","538","1","少将の妻、子産むべきほど近くなりぬ","左近少将の妻。浮舟の異父妹。昨年の八月頃に結婚。この五月頃に出産予定。"
"51","5","4","2","539","1","殿より人びとの","以下「はべらむかし」まで、乳母の詞。"
"51","5","4","3","540","1","見たまふにも","主語は浮舟。"
"51","5","4","4","541","1","けしからぬことども","以下「いかにせむ」まで、浮舟の心中。"
"51","5","4","4","542","1","あやにくにのたまふ人","匂宮。"
"51","5","4","4","543","1","八重立つ山に","明融臨模本、朱合点。『源氏釈』は「白雲の絶えずたなびく峯にだに住めば住みぬる世にこそありけれ」（古今集雑下、九四五、惟喬親王）。『異本紫明抄』は「白雲の八重立つ山にこもるとも思ひ立ちなば尋ねざらめやは」（出典未詳）を指摘。"
"51","5","4","4","544","1","我も人も","自分も匂宮も。"
"51","5","4","4","545","1","なほ心やすく隠れなむことを思へ","匂宮からの文面の主旨。匂宮の隠れ家に移すことをいう。"
