"Volume","Chapter","Paragraph","Line","Annotation_Num","Annotation_State","Annotation_Title","Annotation_Body"
"38","3","1","8","143","1","心やすかるべきほどにつけてだにおのづから思ひかかづらふほだしのみはべるを","家族に対する思いのため出家のし難さをいう。"
"38","3","1","8","144","1","などか","『集成』は読点で「どうしてそんな人真似をして負けじと競われるようなご出家のお志では」と訳し「御道心」にかけて読む。『完訳』は句点で「なぜ出家などお考えなのか」と訳す。"
"38","3","1","8","145","1","人もこそはべれ","「もこそ」--已然形。懸念の気持ちを表す。"
"38","3","1","8","146","1","御ことになむ","係助詞「なむ」の下に「はべる」などの語句が省略。"
"38","3","1","9","147","1","深うも汲みはかりたまはぬなめりかし","秋好中宮の心中。"
"38","3","2","1","148","1","御息所の","『集成』は「以下、中宮の気持を直接書く体であるが、「かの院には」あたり以下は、自然に地の文ふうの書き方になる」と注す。"
"38","3","2","1","149","1","御身の苦しうなりたまふらむありさま","推量の助動詞「らむ」視界外推量。地獄に堕ちて苦しんでいる母六条御息所を推量しているニュアンス。"
"38","3","2","1","150","1","いかなる煙の中に","『完訳』は「以下、「出で来けること」まで、中宮の心中に即した叙述」と注す。"
"38","3","2","1","151","1","亡き影にても人に疎まれたてまつりたまふ御名のりなどの","死霊となって、紫の上を仮死状態に陥れたり（「若菜下」巻）、女三の宮を出家させたりした（「柏木」巻）という話をさす。"
"38","3","2","1","152","1","かの院には","六条院をさす。冷泉院を基準にした言い方。"
"38","3","2","1","153","1","仮にてもかののたまひけむありさま","『集成』は「憑坐にのり移った物の怪の言葉にせよ」。『完訳』は「憑坐のかりそめの言いぐさでもよい」と訳す。"
"38","3","2","2","154","1","亡き人の御ありさまの罪","以下「思ひ知らるることもありける」まで、秋好中宮の詞。"
"38","3","2","2","155","1","推し量り伝へつべき","大島本は「つたへつへき」とある。『集成』『完本』は諸本に従って「つべき」と「つたへ」を削除する。『新大系』は底本のままとする。"
"38","3","2","2","156","1","もののあなた思うたまへやらざりけるがものはかなさを","『集成』は読点で「後世の苦しみにまで思いをめぐらしませんでしたとはほんとにいたらぬことでしたので」。『完訳』は句点で「後生のお苦しみまでは考えてあげようともいたしませんでした、それがなんとも至らぬことでございました」と訳す。"
"38","3","2","2","157","1","やうやう積もるになむ思ひ知らるることもありける","『集成』は「出家の志が、長年の間に自然に固まったものだという」と注す。"
"38","3","2","4","158","1","げにさも思しぬべきこと","源氏の心中。中宮の言葉に納得する気持ち。"
"38","3","2","5","159","1","その炎なむ","以下「心幼きことなれ」まで、源氏の詞。"
"38","3","2","5","160","1","朝の露","大島本は「あしたの露」とある。『集成』『完本』は諸本に従って「朝露」と校訂する。『新大系』は底本のままとする。"
"38","3","2","5","161","1","目蓮が仏に近き聖の身にてたちまちに救ひけむ例にも","「仏説盂蘭盆経」に見える目蓮が餓鬼道に堕ちた母親を救ったという話。"
"38","3","2","5","162","1","え継がせたまはざらむものから","主語は中宮。目蓮の真似はできない意。"
"38","3","2","5","163","1","玉の簪捨てさせたまはむも","『集成』「「玉の簪」は、玉で飾った中国風の髪飾り。中宮に対してふさわしい言葉遣い」。『完訳』は「出家して后の位を捨てても母を救えず現世に悔恨が残るとする」と注す。"
"38","3","2","6","164","1","かの御煙晴るべきこと","大島本は「はるへき」とある。『集成』『完本』は諸本に従って「はるくべき」と「く」を補訂する。『新大系』は底本のままとする。"
"38","3","2","6","165","1","しか思ひたまふる","主語は源氏、自分自身。"
"38","3","2","6","166","1","げにこそ心幼きことなれ","『集成』は「「心をさなし」は、無常の世に、いつまでも命があるかのように油断していることへの自嘲」。『完訳』は「中宮の言う「物のあなた--ものはかなさを」に納得し、出家に踏みきれぬ自分を苦々しく顧みる」と注す。"
"38","3","2","7","167","1","なほやつしにくき御身のありさまどもなり","『細流抄』は「草子地也」と指摘。『完訳』は「語り手の評」と注す。"
"38","3","3","1","168","1","上達部ども","大島本は「上達部とん」とある。「ん」は「も」に同じ。『集成』『完本』は諸本に従って「上達部なども」と「な」を補訂する。『新大系』は底本のままとする。"
"38","3","3","2","169","1","春宮の女御","明石姫君をさす。"
"38","3","3","2","170","1","御ありさま","大島本は「御有様」とある。『集成』『完本』は諸本に従って「御ありさまの」と「な」を補訂する。『新大系』は底本のままとする。"
"38","3","3","2","171","1","いづれとなくめやすしと思すに","源氏の心中。「に」接続助詞、逆接の意。『集成』は「どちらも結構なことと満足にお思いになるのだが」。『完訳』は「どちらがどうと優り劣りなくご満足であるが」と訳す。"
"38","3","3","2","172","1","院も","冷泉院。"
"38","3","3","2","173","1","御対面のまれに","冷泉院の在位中をさす。"
"38","3","3","2","174","1","かく心安きさまにと思しなりけるになむ","『集成』は「草子地」と注す。係助詞「なむ」の下に「ある」などの語句が省略された形。"
"38","3","3","3","175","1","ただ人の仲のやうに並びおはしますに","『集成』は「帝は在位中は後宮の后妃にあまねく心を配らねばならないが、譲位後は、お気に召した方と思いのままに暮すことができる」と注す。"
"38","3","3","3","176","1","ただかの御息所の御事を","中宮の母御息所をさす。"
"38","3","3","3","177","1","人の許しきこえたまふまじきことなれば","「人」について、『集成』『新大系』は「源氏」、『完訳』は「冷泉院」とする。両説ある。"
"38","3","3","3","178","1","世の中を思し取れるさまになりまさりたまふ","『集成』は「人の世の無常をお悟りになったご日常になってゆかれる」。『完訳』は「世の中の無常をお悟りになるお気持もいよいよ深くおなりになる」と訳す。"
