"Volume","Chapter","Paragraph","Line","Annotation_Num","Annotation_State","Annotation_Title","Annotation_Body"
"51","2","5","1","212","1","まことに死ぬべく思さるれば","『新釈』は「恋しとは誰が名づけけむ事ならむ死ぬとぞ唯にいふべかりけり」（古今集恋四、六九八、清原深養父）を指摘。"
"51","2","5","2","213","1","いと心地なしと","以下「いらへなどせよ」まで、匂宮の詞。"
"51","2","5","2","214","1","時方は","匂宮の乳母子。"
"51","2","5","2","215","1","山寺に忍びてなむ","虚偽の口実。"
"51","2","5","3","216","1","いとあさましくあきれて","主語は右近。初めて匂宮であったことを知る。"
"51","2","5","4","217","1","今はよろづに","以下「人のしたるわざかは」まで、右近の心中の思い。"
"51","2","5","4","218","1","かう逃れざりける御宿世にこそ","『完訳』は「人の力を超えた宿世と諦め、自らの責任を回避しようとする」と注す。"
"51","2","5","6","219","1","今日御迎へにとはべりしを","以下「のどかにも」まで、右近の詞。浮舟の母が京から迎えに来る予定であった。"
"51","2","5","7","220","1","およすけても言ふかな","匂宮の感想。"
"51","2","5","8","221","1","我は月ごろ思ひつるに","明融臨模本は「思つるに」とある。『完本』は諸本に従って「もの思ひつるに」と「もの」を補訂する。『集成』『新大系』は底本のまま「思ひつるに」とする。以下「異事はかひなし」まで、匂宮の詞。"
"51","2","5","8","222","1","異事はかひなし","『集成』は「ほかの事は一切無用だ」。『完訳』は「何があっても退かぬ、の気持」と注す。"
"51","2","5","9","223","1","この人の","浮舟。"
"51","2","5","9","224","1","忘れたまひぬべし","『孟津抄』は「地也」と指摘。いわゆる草子地、の意。"
"51","2","6","2","225","1","かくなむのたまはするを","以下「いかならまし」まで、右近の詞。"
"51","2","6","2","226","1","御供人どもの御心にこそあらめ","供人たちの考えしだいだ、の意。「御心」は相手供人を前にした敬語。"
"51","2","6","2","227","1","率てたてまつりたまふこそ","明融臨模本は「ゐてたてまつり給こそ」とある。『完本』は諸本に従って「たまひしぞ」と校訂する。『集成』『新大系』は底本のまま「たまふこそ」とする。"
"51","2","6","3","228","1","げにいとわづらはしくもあるかな","時方の心中。"
"51","2","6","4","229","1","時方と仰せらるるは誰れにかさなむ","右近の詞。「さなむ」の下に「仰せらる」などの語句が省略。匂宮の詞を伝える。"
"51","2","6","6","230","1","勘へたまふことどもの","以下「皆起きぬなり」まで、大内記時方の詞。「勘へ」の主語は右近。"
"51","2","6","6","231","1","身を捨ててなむ","係助詞「なむ」の下に「参りつる」などの語句が省略。"
"51","2","6","8","232","1","人びと起きぬるに","女房たち。"
"51","2","6","9","233","1","殿はさるやうありて","以下「仰せられつる」まで、右近の詞。「殿」は薫。"
"51","2","6","11","234","1","あなむくつけや","以下「あないみじや」まで、御達の詞。"
"51","2","6","13","235","1","あなかまあなかま","以下「いといみじからむ」まで、右近の詞。"
"51","2","6","14","236","1","殿の御使の","薫の使者。"
"51","2","6","15","237","1","初瀬の観音今日事なくて暮らしたまへ","『集成』は「今日一日を無事におすませ下さい」。『完訳』は「「暮らさせたまへ」の意か」「今日一日無事に過させてくださいまし」と注す。"
"51","2","6","16","238","1","大願をぞ立てける","『完訳』は「語り手の、揶揄する気持」と注す。"
"51","2","6","17","239","2","石山に今日--迎ふるなりけり","『細流抄』は「訓釈していへり」と指摘。語り手の説明的叙述。"
"51","2","6","18","240","1","さらば今日は","以下「いと口惜しき」まで、女房の詞。"
"51","2","7","1","241","1","母君もやみづからおはする","右近の心中。"
"51","2","7","1","242","1","夢見騒がしかりつ","右近の詞。周囲の人に言った。"
"51","2","7","1","243","1","まかなひめざましう思されて","主語は匂宮。右近一人の介添えを不満に思う。"
"51","2","7","2","244","1","そこに洗はせたまはば","匂宮の詞。「そこ」は浮舟をさす。『集成』は「あなたがお洗いになったら（そのあとで私が）」。『完訳』は「あなたが先に、と譲る。その心やさしさが、浮舟を感動させる」と注す。"
"51","2","7","3","245","1","女","『完訳』は「恋の場面を強調する呼称。以下、この呼称の多出する点に注意」と注す。"
"51","2","7","3","246","1","いとさまよう心にくき人を","薫をいう。『集成』は「一分の隙もなく奥ゆかしい人」。『完訳』は「好ましく奥ゆかしい人」と訳す。"
"51","2","7","3","247","1","見ざらむに","明融臨模本は「見さらむ（む＋は）に（に＄）」とある。すなわち「は」を補訂し、「に」をミセケチにする。『集成』『完本』は諸本と底本の訂正前本文に従って「見ざらむに」と校訂する。『新大系』は底本の訂正に従って「見ざらむは」とする。"
"51","2","7","3","248","1","思し焦がるる人","匂宮。"
"51","2","7","3","249","1","心ざし深しとはかかるを言ふにやあらむ","浮舟の心中の思い。"
"51","2","7","3","250","1","あやしかりける身かな","以下「いかに思さむ」まで、浮舟の心中の思い。"
"51","2","7","3","251","1","いかに思さむ","主語は中君、薫、母親たち。"
"51","2","7","3","252","1","まづかの上の御心を","『完訳』は「真っ先に中の君を思い起す点に注意。匂宮の妻であり、自分を世話してくれた義理もある」と注す。"
"51","2","7","4","253","1","知らぬを","以下「あはれなるべき」まで、匂宮の詞。浮舟の素姓を知らないので。なお、『集成』は「返す返す」から匂宮の詞とする。"
"51","2","7","5","254","1","わりなう問ひたまへどその御いらへは絶えてせず","『完訳』は「光源氏と夕顔との恋に類似」と注す。"
"51","2","7","6","255","1","迎への人","浮舟の母からの迎え。"
"51","2","7","7","256","1","あなたに隠れよ","迎えの人々に対して言った詞。"
"51","2","7","8","257","1","言はせなどす","『集成』は「女房が直接言うのでなく、下働きの者を通じて伝えさせるので、こう言う」と注す。"
"51","2","7","8","258","1","いかにせむ","以下「こそあれ」まで、右近の心中の思い。"
"51","2","7","8","259","1","殿なむおはする","「殿」は薫をさす。"
"51","2","7","8","260","1","おはしおはせず","いらっしゃる、いらっしゃらないは、の意。"
"51","2","7","9","261","1","昨夜より穢れさせたまひて","以下「見たてまつりはべる」まで、右近の手紙。「穢れ」は、生理の意。血を穢れとして忌んだ。"
"51","2","7","11","262","1","今日は物忌にて渡りたまはぬ","右近の詞。浮舟の母君への伝言。"
"51","2","8","1","263","1","思し焦らるる人","匂宮。"
"51","2","8","1","264","1","見れども見れども飽かず","『湖月抄』は「春霞たなびく山の桜花見れどもあかぬ君にもあるかな」（古今集恋四、六八四、紀友則）を引歌として指摘。"
"51","2","8","2","265","1","さるはかの対の御方には似劣りなり","明融臨模本は「にをとりなり」とある。『完本』は諸本と底本の訂正前本文に従って「劣りたり」と校訂する。『集成』『新大系』は底本のまま「似劣りなり」とする。『全集』は「語り手の言葉。恋に盲いた匂宮の心に即した叙述をひるがえし、その主観的偏向を読者に気づかせる筆づかい」。『完訳』は「前述から翻った語り手の評言」と注す。"
"51","2","8","2","266","1","大殿の君の盛りに匂ひたまへるあたり","夕霧の娘六の君。匂宮の正室。"
"51","2","8","2","267","1","こよなかるべきほどの人を","『集成』は「お話にもならない人なのに」。『完訳』は「比べられぬほど浮舟は劣るとする」と注す。"
"51","2","8","3","268","1","いときよげにまたかかる人あらむや","浮舟の薫に対する感想。"
"51","2","8","3","269","1","こまやかに","以下「おはしけり」まで、浮舟の匂宮に対する感想。「おはしけり」の「けり」は詠嘆の意。"
"51","2","8","4","270","1","手習などしたまふ","主語は匂宮。"
"51","2","8","4","271","1","若き心地には思ひも移りぬべし","『岷江入楚』は「草子の地なり」と指摘。『完訳』は「浮舟は二十二歳」と注す。十分な成人である。"
"51","2","8","5","272","1","心より外に","以下「見たまへよ」まで、匂宮の詞。"
"51","2","8","7","273","1","常にかくてあらばや","匂宮の詞。"
"51","2","8","8","274","1","涙落ちぬ","『集成』は「匂宮は」。『完訳』は「女は涙がこぼれた」と注す。"
"51","2","8","9","275","2","長き世を頼めてもなほ悲しきは--ただ明日知らぬ命なりけり","匂宮から浮舟への贈歌。"
"51","2","8","10","276","1","いとかう思ふこそ","以下「尋ね出でけむ」まで、歌に続けた匂宮の詞。"
"51","2","8","12","277","2","心をば嘆かざらまし命のみ--定めなき世と思はましかば","浮舟の返歌。「命」「世」の語句を受けて返す。『完訳』は「「--ましかば--まし」の反実仮想の構文で、倒置法。命の移ろいやすいだけの世だとしたら、として、宮の不訪の言い訳を恨む歌」と注す。"
"51","2","8","14","278","1","いかなる人の心変はりを見ならひて","匂宮の詞。暗に薫をさして言う。"
"51","2","8","16","279","1","え言はぬことをかうのたまふこそ","浮舟の詞。"
"51","2","8","17","280","1","言はせまほしきぞわりなきや","『休聞抄』は「双」と指摘。『集成』は「本人の口から言わせたいとは、困ったものです。匂宮の蕩児ぶりをからかい気味に言う草子地」。『完訳』は「語り手の評言。無理強いをする匂宮の好色ぶりを強調」と注す。"
"51","2","9","1","281","1","大夫参りて","大夫時方。前に「（六位）蔵人よりかうぶり得たる」と五位になった大内記時方である。"
"51","2","9","2","282","1","后の宮よりも","以下「ものしはべりつる」まで、時方の詞。"
"51","2","9","4","283","1","女こそ","以下「せさせたまふよ」まで、引き続き時方の詞。"
"51","2","9","4","284","1","ものはあれ","明融臨模本は「もの（の＋に）はあれ」とある。すなわち「に」を補訂する。『集成』『完本』は諸本と底本の訂正前本文に従って「ものは」と校訂する。『新大系』は底本の補入に従って「ものには」と校訂する。"
"51","2","9","6","285","1","聖の名をさへ","以下「御ありきにこそは」まで、右近の詞。『完訳』は「浮舟を「聖」とまで読んでくれたとは上出来、とからかう」と注す。"
"51","2","9","6","286","1","私の罪も","『集成』は「ご家来の嘘つきの罪。仏教では、殺生、偸盗、邪淫、妄語、飲酒を五悪とする。ここでは軽口」と注す。"
"51","2","9","6","287","1","それにて滅ぼしたまふらむ","『完訳』は「時方が嘘をついた罪障も、浮舟を聖扱いした功徳で消えよう」と注す。"
"51","2","9","6","288","1","あやしき御心の","匂宮の性分。"
"51","2","9","7","289","1","扱ひきこゆ","『集成』は「とやかく口出し申し上げる」。『完訳』は「お相手申している」と訳す。"
"51","2","9","8","290","1","参りてさなむとまねびきこゆれば","右近が匂宮のもとに参上して時方が言ったことをそのまま、の意。"
"51","2","9","8","291","1","げにいかならむ","匂宮の心中。都ではどんなに騒いでいるだろう、の意。"
"51","2","9","9","292","1","所狭き身こそ","以下「率て離れたてまつらむ」まで、匂宮の詞。"
"51","2","9","9","293","1","わびしけれ","明融臨模本は「わるしけれ」とある。『集成』『完本』『新大系』は諸本に従って「わびしけれ」と校訂する。「る」（留）は「ひ」（日）からの誤写であろう。"
"51","2","9","10","294","1","さるべきほどとは","『集成』は「親しいのは当然の叔父甥の間柄とはいえ」と注す。"
"51","2","9","11","295","1","世のたとひに言ふことも","『集成』は「以下の文意によれば、「自分のことは棚に上げて他人の行為を咎める」といったこと」と注す。"
"51","2","9","11","296","1","わがおこたりをも知らず怨みられたまはむを","「わがおこたり」は薫のそれ。「怨みられ」の「られ」は受身の助動詞、薫から浮舟が恨まれる。「給ふ」は浮舟に対する敬意。"
"51","2","9","12","297","1","今日さへかくて","『完訳』は「今日で三日目になる」と注す。"
"51","2","9","12","298","1","袖の中にぞ留めたまひつらむかし","『源氏釈』は「あかざりし袖の中にや入りにけむ我が魂のなき心地する」（古今集雑下、九九二、陸奥）を指摘。明融臨模本も付箋で同歌を指摘。三光院「草子地に推してかけり」と指摘。"
"51","2","9","14","299","2","世に知らず惑ふべきかな先に立つ--涙も道をかきくらしつつ","匂宮から浮舟への贈歌。「世」「夜」の懸詞。「夜」「惑ふ」「立つ」「道」は縁語。"
"51","2","9","16","300","2","涙をもほどなき袖にせきかねて--いかに別れをとどむべき身ぞ","浮舟の返歌。「涙」の語句を受けて返す。"
"51","2","9","17","301","1","霜深き暁におのが衣々も","『源氏釈』は「しののめのほがらほがらと明けゆけばおのが衣ぎぬなるぞ悲しき」（古今集恋三、六三七、読人しらず）を指摘。"
"51","2","9","17","302","1","戯れにくしと思ひて","『評釈』は「ありぬやと心見がてらあひ見ねばたはぶれにくきまでぞ恋しき」（古今集俳諧、一〇二五、読人しらず）を指摘。"
"51","2","9","18","303","1","この五位二人","大内記と時方。"
"51","2","9","18","304","1","昔もこの道に","中君のもとに通ったころ。"
"51","2","9","18","305","1","あやしかりける里の契りかな","匂宮の感想。"
"51","3","1","1","306","1","心やすき方に","自分の部屋。寝殿にある。"
"51","3","1","1","307","1","対に渡りたまひぬ","西の対。中君の部屋。"
"51","3","1","2","308","1","めづらしく","以下「たまへりかし」まで、匂宮の心中。浮舟と比較。"
"51","3","1","3","309","1","心地こそいと悪しけれ","以下「かなふなれば」まで、匂宮の詞。"
"51","3","1","3","310","1","いみじくあはれと見置いたてまつるとも","あなた中君を。"
"51","3","1","3","311","1","御ありさまはいととく変はりなむかし","『完訳』は「薫と結婚するかと、いやみに言う」と注す。"
"51","3","1","4","312","1","けしからぬことをも、まめやかにさへのたまふかな","中君の心中の思い。"
"51","3","1","5","313","1","かう聞きにくきことの","以下「いと苦しく」まで、中君の詞。"
"51","3","1","5","314","1","漏りて聞こえたらば","薫の耳に。"
"51","3","1","5","315","1","人も","薫。"
"51","3","1","7","316","1","まことにつらしと","以下「いと心うき」まで、匂宮の詞。"
"51","3","1","7","317","1","おろかなる人かは","反語表現。いい加減な男ではない、大事な夫だ。"
"51","3","1","7","318","1","人もありがたしなど","世間の人も私のことをめったにいないほどの人だという。"
"51","3","1","7","319","1","人にはこよなう","薫と比較して。"
"51","3","1","7","320","1","誰れもさべきにこそはと","明融臨模本は「た（た＝ソ）れも」とある。すなわち「た」に「そ」を傍記する。『完本』は諸本と底本の傍記に従って「それも」と校訂する。『集成』『新大系』は本行本文に従って「たれも」と校訂する。"
"51","3","1","8","321","1","宿世のおろかならで尋ね寄りたるぞかし","匂宮の心中の思い。浮舟との宿縁の深さを思う。"
"51","3","1","8","322","1","いかやうなることを聞きたまへるならむ","中君の心中の思い。"
"51","3","1","9","323","1","ものはかなきさまにて","以下「おぼえ劣る身にこそ」まで、中君の心中の思い。匂宮との結婚が正式な結婚でなかったことを思う。"
"51","3","1","9","324","1","思し続くるも","主語は中君。"
"51","3","1","10","325","1","かの人見つけたることは、しばし知らせたてまつらじ","匂宮の考え。「かの人」は浮舟、「知らせたてまつらじ」の対象は中君に。"
"51","3","1","10","326","1","異ざまに思はせて怨みたまふを","主語は匂宮。"
"51","3","1","10","327","1","ただこの大将の御ことを","以下、中君の心中に即した叙述。"
"51","3","2","1","328","1","内裏より大宮の御文あるに","匂宮の母、明石中宮からの手紙。"
"51","3","2","1","329","1","なほ心解けぬ御けしきにて","『集成』は「まだご機嫌の直らぬご様子で」と注す。"
"51","3","2","1","330","1","あなたに渡りたまひぬ","西の対から寝殿へ。"
"51","3","2","2","331","1","昨日のおぼつかなさを","以下「なりにけるを」まで、明石中宮からの手紙。"
"51","3","2","3","332","1","参りたまへど","二条院に。"
"51","3","2","5","333","1","こなたにを","匂宮の詞。"
"51","3","2","7","334","1","悩ましげに","以下「御悩みに」まで、薫の詞。"
"51","3","2","8","335","1","聖だつと言ひながら","以下「わびさすらむよ」まで、匂宮の心中。『完訳』は「薫の宇治の山里通いを皮肉って、山野に修行する山伏だとする」と注す。"
"51","3","2","8","336","1","あはれなる人を","浮舟。"
"51","3","2","9","337","1","例はさしもあらぬことのついでに","以下「いかにのたまはまし」まで、『細流抄』は「草子地也」と指摘。"
"51","3","2","9","338","1","我はまめ人と","薫が。"
"51","3","2","9","339","1","ねたがりたまひて","主語は匂宮。"
"51","3","2","9","340","1","いかにのたまはまし","反実仮想。『完訳』は「どんなに言い立てたことだろう。しかし、今はそれも憚る気持」と注す。"
"51","3","2","10","341","1","不便なるわざかな","以下「よくつくろはせたまへ」まで、薫の詞。"
"51","3","2","11","342","1","恥づかしげなる人なりかし","以下「いかに思ひ比べけむ」まで、匂宮の心中。薫の態度と自分を比較。"
"51","3","2","11","343","1","いかに思ひ比べけむ","主語は浮舟。"
"51","3","2","11","344","1","この人を","浮舟。"
"51","3","2","12","345","1","かしこには","宇治をさす。"
"51","3","2","13","346","1","右近が古く","以下「ねむごろがる」まで、右近の詞。"
"51","3","2","14","347","1","よろづ右近ぞ虚言しならひける","『集成』は「何もかも、右近は嘘ばかりつく破目になるのだった。からかい気味の草子地」。『完訳』は「諧謔味のある評言」と注す。"
"51","3","3","1","348","1","月もたちぬ","二月となる。"
"51","3","3","1","349","1","かう思し知らるれど","明融臨模本は「おほしゝらるれと（ゝらるれと＝イラルレト　イ）」とある。すなわち「しらるれと」の傍らに異本「いらるれと」を傍記する。『集成』『完本』は諸本と底本の傍記に従って「焦らるれど」と校訂する。『新大系』は本行本文に従って「知らるれど」と校訂する。"
"51","3","3","1","350","1","かうのみ","以下「身なめり」まで、匂宮の心中。"
"51","3","3","2","351","1","ここには","浮舟のもと。"
"51","3","3","2","352","1","これは","薫。匂宮のやつし姿に対していう。"
"51","3","3","3","353","1","女","浮舟。"
"51","3","3","3","354","1","いかで見えたてまつらむとすらむと","浮舟の懊悩の心中。匂宮に逢ったうしろめたさ。"
"51","3","3","3","355","1","あながちなりし人","匂宮。"
"51","3","3","4","356","1","われは年ごろ見る人をも","以下「いかに聞きて思さむ」まで、浮舟の心中。また「心地なむする」まで、『完訳』は「浮舟の心に刻印された匂宮の言葉」と注す。"
"51","3","3","4","357","1","げにそののち","浮舟の納得の気持ち。『完訳』は「匂宮は病気と騒がれたが、中の君にも六の君にも会わぬと噂が宇治に伝わる。それを根拠に宮の言葉に「げに」と納得」と注す。"
"51","3","3","4","358","1","いづくにもいづくにも","中君や六君。"
"51","3","3","4","359","1","いかに聞きて思さむ","主語は匂宮。浮舟が薫を逢うことを。"
"51","3","3","5","360","1","この人はた","薫。"
"51","3","3","5","361","1","言ふにはまさりて","明融臨模本、朱合点。『源氏釈』は「心には下行く水のわきかへり言はで思ふぞ言ふにまされる」（古今六帖五、言はで思ふ）を指摘。"
"51","3","3","5","362","1","人の思ひぬべきさまを","『集成』は「相手の女が思いそうな感じを」。『完訳』は「誰しもまったく感にたえるほかないような風格を」と注す。"
"51","3","3","5","363","2","艶なる方は--まさりたまへり","『湖月抄』は「草子地に薫のさまをいふ也」と注す。"
"51","3","3","6","364","1","思はずなるさまの心ばへなど","浮舟が匂宮に逢ったこと。それが薫にとっては心外な浮舟のこころ映るだろうこと。以下、浮舟の心情にそった叙述。"
"51","3","3","6","365","1","思し焦らるる人","匂宮。"
"51","3","3","6","366","1","月ごろに","以下「あらじかし」まで、薫の心中。浮舟の変化に対する感動。昨年の秋以来の再会。"
"51","3","4","1","367","1","造らする所","以下「渡してむ」まで、薫の詞。浮舟を迎えるために造っている京の邸。"
"51","3","4","1","368","1","三条の宮も","薫の本邸。"
"51","3","4","2","369","1","かの人の","以下「さ思すらむよ」まで、浮舟の心中。「かの人」は匂宮。"
"51","3","4","2","370","1","昨日ものたまへりしを","『集成』は「昨日も匂宮から手紙が来た趣」と注す。"
"51","3","4","2","371","1","そなたになびくべきにはあらずかし","浮舟の心中。「そなた」は匂宮。"
"51","3","4","2","372","1","と思ふからに","『集成』は「と思うその下から」。『完訳』は「と思うとすぐさまに」と訳す。"
"51","3","4","2","373","1","ありし御さまの面影に","先日逢った折の匂宮の姿。"
"51","3","4","2","374","1","我ながらもうたて心憂の身や","浮舟の心中。"
"51","3","4","3","375","1","御心ばへのかからで","以下「ありさまもあらぬを」まで、薫の詞。薫は浮舟が薫の不訪を恨んで嫉妬するものと思っていた。"
"51","3","4","4","376","1","朔日ごろ","二月初旬。"
"51","3","4","4","377","1","男は過ぎにし方のあはれをも思し出で","薫は故大君を追慕。"
"51","3","5","1","378","1","山の方は霞隔てて","以下の景色について、『異本紫明抄』は「蒼茫たる霧雨の霽の初めに寒汀に鷺立てり重畳せる煙嵐の断えたる処に晩寺に僧帰る」（和漢朗詠集、僧）を指摘。"
"51","3","5","1","379","1","そのかみのことの","大君在世当時。"
"51","3","5","1","380","1","いとかからぬ人を","『集成』は「ほんとに、大君ゆかりの人といった筋合ではない女と向い合ったにしても、ざらにはない逢瀬の風情が多かろうというものである。それほど趣深い背景」。『完訳』は「亡き大君にゆかりのない女を相手にする場合でさえ。「--だに」を受け、「まして」浮舟は、と続く」と注す。"
"51","3","5","2","381","1","恋しき人に","故大君に。主語「浮舟は」が省略されている。"
"51","3","5","3","382","2","宇治橋の長き契りは朽ちせじを--危ぶむ方に心騒ぐな","薫から浮舟への贈歌。"
"51","3","5","4","383","1","今見たまひてむ","歌に添えた詞。"
