"Volume","Chapter","Paragraph","Line","Annotation_Num","Annotation_State","Annotation_Title","Annotation_Body"
"17","4","1","3","131","1","かう好き好きしきやうなる後の聞こえやあらむ","『集成』は「（そんなものを）この機会に持ち出したりして、いかにも物好きなようなのは、後世から批判されるかもしれません」と訳す。"
"17","4","1","5","132","1","何の才も","以下「けしからぬわざなり」まで、帥宮の詞。"
"17","4","1","5","133","1","人に抜けぬる人","大島本は「ぬけぬる人の（の＃&lt;朱墨&gt;）」とある。すなわち「の」を朱筆と墨筆で抹消する。『集成』『新大系』は底本の抹消に従って「人」とする。『古典セレクション』は底本の訂正以前本文と諸本に従って「人の」と校訂する。"
"17","4","1","6","134","1","いづれかは","下文の「習はさせたまはざりけむ」に係る反語表現。『完訳』は「院の御前で、親王や内親王たちは、いずれも芸能のそれぞれをお習いにならなかった方はございませんでしょう」と訳す。"
"17","4","1","6","135","1","さまざま","大島本は「さま」とある。『集成』『新大系』『古典セレクション』は諸本に従って「さまざま」と「さま」を補訂する。"
"17","4","1","6","136","1","習はさせたまはざりけむ","「させ」使役の助動詞。主語は院。院が親王や内親王たちに。"
"17","4","1","6","137","1","伝へ受けとらせたまへるかひありて","大島本は「う（う＝つイ&lt;墨朱&gt;）たへ」とある。すなわち本行本文「う」の右傍らに朱筆と墨筆で「つイ」と異本との校合を記す。『集成』『新大系』『古典セレクション』は「つたへ」と校訂する。「せたまへ」二重敬語。主語は源氏。"
"17","4","1","6","138","1","文才をばさるものにて","以下「習ひたまへる」まで、院の詞を引用。"
"17","4","1","6","139","1","こそ思ひたまへしか","「こそ」係助詞、「しか」已然形の係結びは、逆接用法で、下文に続く。"
"17","4","1","7","140","1","うちしほれたまひぬ","大島本は「しほ△（△＃）れ給ぬ」とある。すなわち元の文字（不明）を抹消して「しほれ」とする。『新大系』は底本の抹消に従って「しほれ」と整定する。『集成』『古典セレクション』は諸本に従って「しほたれ」と校訂する。"
"17","4","2","1","141","1","おほかたの空をかしきほどなるに","三月二十日過ぎの天象模様。"
"17","4","2","2","142","1","明け果つるままに花の色も人の御容貌どもほのかに見えて鳥のさへづるほど心地ゆきめでたき朝ぼらけなり","大島本は「御かたちとも」とある。『集成』『新大系』は底本のままとする。『古典セレクション』は諸本に従って「御容貌も」と校訂する。冷泉朝の開幕を象徴する表現。"
"17","4","2","2","143","1","また重ねて賜はりたまふ","帝から頂戴することをいう。"
"17","4","3","1","144","1","そのころのことには","その当時の話題としては、の意。"
"17","4","3","2","145","1","かの浦々の巻は中宮にさぶらはせたまへ","源氏の詞。須磨、明石の絵日記は藤壺の宮に献上する。"
"17","4","3","3","146","1","残りの巻々ゆかしがらせたまへど","大島本は「のこりのまきまき」とある。『新大系』は底本のままとする。『集成』『古典セレクション』は諸本に従って「また残りの巻々」と「また」を補訂する。主語は藤壺。「せ」尊敬の助動詞、「たまへ」尊敬の補助動詞。最高敬語。"
"17","4","3","4","147","1","今次々に","源氏の詞。"
"17","4","3","5","148","1","主上にも御心ゆかせたまひて","主語は帝。「せ」尊敬の助動詞、「たまひ」尊敬の補助動詞、最高敬語。"
"17","4","3","5","149","1","うれしく見たてまつりたまふ","主語は源氏。"
"17","4","3","6","150","1","なほおぼえ圧さるべきにや","権中納言の心中。「おぼえ」は世の評判。"
"17","4","3","6","151","1","思さるべかめり","「べかめり」連語、推量の助動詞。この主観的推量は語り手。"
"17","4","3","6","152","1","なほこまやかに","『完訳』は「以下、権中納言の心中」と解す。"
"17","4","3","6","153","1","人知れず見たてまつり知りたまひてぞ","主語は権中納言。"
"17","4","3","6","154","1","さりとも","権中納言の心中。『集成』は「いくら源氏方の勢力が強くとも、まさかお見捨てになるまい」。『完訳』は「わが女御への帝寵は衰えまい」と注す。"
"17","4","3","6","155","1","思されける","「れ」自発の助動詞。自然とそのように思われるの意。"
"17","4","3","7","156","1","この御時よりと末の人の言ひ伝ふべき例を添へむ","源氏の心中。『集成』は「聖代と仰がれるような立派な前例を遺すのが補佐の役目である。以下、今上の治世を聖代と印象づける筆致」と注す。"
"17","4","4","1","157","1","今すこしおとなび","以下「世を背きなむ」まで、源氏の心中。"
"17","4","4","1","158","1","思ほすべかめる","「べかめる」連語、推量の助動詞。源氏の心中を推量。この主観的推量は語り手。"
"17","4","4","2","159","1","昔のためしを","以下「齢をも延べむ」まで、源氏の心中。"
"17","4","4","2","160","1","世に抜けぬる人の長くえ保たぬわざなりけり","「の」格助詞。『完訳』は「世にぬきんでてしまった人は、とても長寿を保つことができなかったのだった」と訳す。"
"17","4","4","2","161","1","今より後の栄えはなほ命うしろめたし","『集成』は「今後も栄華を貪っては、やはり命が心配だ」。『完訳』は「今よりのちの栄華は、やはり寿命がともなわず危ぶまれる」と訳す。"
"17","4","4","2","162","1","山里ののどかなるを占めて御堂を造らせ","次の「松風」巻によれば、嵯峨野の御堂。清涼寺がモデルとされる。"
"17","4","4","2","163","1","仏経のいとなみ添へてせさせたまふめるに","「させ」使役の助動詞。「める」推量の助動詞。この主観的推量は語り手。以下の文章にも語り手の言辞がうかがえる。"
"17","4","4","2","164","1","末の君たち思ふさまにかしづき出だして見む","源氏の心中を間接的に語る表現。夕霧十歳、明石姫君三歳。"
"17","4","4","2","165","1","いかに思しおきつるにかといと知りがたし","『集成』は「草子地」。『完訳』は「源氏の人生の奥行の深さを暗示させる、語り手の言辞」と注す。"
