"Volume","Chapter","Paragraph","Line","Annotation_Num","Annotation_State","Annotation_Title","Annotation_Body"
"31","2","4","4","147","1","今は限りとどむとも","北の方の心。「いかならむ」などの語句が省略されている。鬚黒の気持ちはもう元には戻るまいという諦めの気持ち。"
"31","2","4","5","148","1","かかるにはいかでか","鬚黒の詞。「え出でむ」などの語句が省略されている。このようにひどい雪ではどうして出掛けられようかの意。"
"31","2","4","7","149","1","なほこのころばかり","以下「思ひきこゆる」まで、引き続き鬚黒の詞。結婚したばかりのころ。文はここで、いったん切れる。この語を受ける述語はない。"
"31","2","4","7","150","1","大臣たち","源氏太政大臣や内大臣。"
"31","2","4","9","151","1","立ちとまりたまひても","以下「解けなむかし」まで、北の方の詞。"
"31","2","4","9","152","1","袖の氷も","『奥入』は「思ひつゝねなくに明くる冬の夜の袖の氷はとけずもあるかな」（後撰集冬。四八二、読人しらず）＜あの人を思いながら泣き明かした冬の夜は涙に濡れて凍った袖も解けないままであることよ＞を指摘し、現在の注釈書でも指摘する。"
"31","2","4","9","153","1","解けなむかし","きっと解けましょう。「な」（完了の助動詞、確述）「む」（推量の助動詞）。"
"31","2","5","1","154","1","焚きしめさせたてまつりたまふ","北の方が女房をして鬚黒の衣装に香をたきこめさせ申し上げなさる。"
"31","2","5","1","155","1","いと心苦し","語り手の北の方に対する同情の句。"
"31","2","5","1","156","1","すこしものしけれど","鬚黒と語り手の感情が重なったような表現。"
"31","2","5","1","157","1","いとあはれ","鬚黒の心。鬚黒が北の方をたいそういとおしいと思う。"
"31","2","5","2","158","1","いかで過ぐしつる年月ぞ","鬚黒の感想。『集成』は「どうして今まで長の年月、疎遠に過してきたのか」と訳し、『完訳』は「よくもこの長い年月いっしょに過してきたものよ」と訳す。前者は鬚黒の反省、後悔と解し、後者は鬚黒が北の方との仲を不思議に思っているところと解す。「いかで」は疑問であるとともに反語でもあろう。"
"31","2","5","2","159","1","名残なう移ろふ心のいと軽きぞや","引き続き、鬚黒の反省、後悔。"
"31","2","5","2","160","1","思ふ思ふなほ心懸想は進みて","「思ふ思ふ」「なほ」というように、その反面ではやはり玉鬘を思う気持ちははやって、という複雑な心理を捉えて語る。"
"31","2","5","2","161","1","そら嘆きをうちしつつ","嘘の嘆息を何度もして見せる。あなたを置いて出掛けるのは億劫だというポーズである。"
"31","2","5","2","162","1","しめゐたまへり","大島本は「しゐ給へり」とある。『新大系』『集成』『古典セレクション』は諸本に従って「しめゐたまへり」と「め」を補訂する。"
"31","2","5","3","163","1","なつかしきほどに","鬚黒の様子について語る。"
"31","2","5","3","164","1","容貌も","『万水一露』は「草子の批判の詞也」と指摘する。「心恥づかしげなり」は語り手の評言ともいえよう。"
"31","2","5","3","165","1","かの並びなき御光","源氏の美しさを譬喩していう。"
"31","2","5","4","166","1","侍","名詞。侍所のこと、供人の詰所。"
"31","2","5","5","167","1","雪すこし隙あり夜は更けぬらむかし","供人の声。「ぬ」（完了の助動詞、確述）「らむ」（推量の助動詞、視界外推量）「かし」（終助詞、強調）。夜が更けてしまいましょうの意。"
"31","2","5","6","168","1","さすがにまほにはあらで","供人たちの北の方への遠慮した態度動作。"
"31","2","5","7","169","1","中将木工など","召人の中将の御許や木工の君など。"
"31","2","5","7","170","1","あはれの世や","中将の御許や木工の君など感慨。北の方への同情。「世」は鬚黒と北の方の夫婦仲をいう。"
"31","2","5","7","171","1","正身は","以下「あきれてものしたまふ」まで北の方の一連の動作。その間の緩急の行動が「～と見るほどに、～て、～ほど、～のほどもなう、～に」という語りの口調の上に巧みに語られている。"
"31","2","5","7","172","1","ややみあふる","『集成』は「「ややみ」「あふる」と複合動詞と見るべきであろうが、語義不詳。「ややむ」は驚きあるいは呼び掛けの語「やや」を活用させたものか。「あふる」は煽るか。「やや見敢ふる」と見るのは無理であろう」と注す。『完訳』は「「見敢ふ」で見届ける意。人の目にもとまらぬ瞬時の出来事」と注す。"
"31","2","5","7","173","1","あきれてものしたまふ","鬚黒の態度。すでに灰を浴びせ掛けられて茫然自失しているさま。"
"31","2","5","8","174","1","さるこまかなる","以下、その様子を細かく具体的に語る。"
"31","2","5","9","175","1","うつし心にてかくしたまふぞと思はば","鬚黒の気持ちに添って語る。"
"31","2","5","10","176","1","例の御もののけの","以下「するわざ」まで、鬚黒の感想であるとともに、「御前なる人びとも」とあるように女房たちの感想へと移る。"
"31","2","5","12","177","1","きよらを尽くしたまふわたり","六条院の玉鬘の所を指していう。"
"31","2","5","13","178","1","心違ひとはいひながら","以下「さまなりや」まで、鬚黒の気持ち。"
"31","2","5","13","179","1","爪弾きせられ","「られ」（自発の助動詞）。自然と～とういう気持ちになって。"
"31","2","5","13","180","1","あはれと思ひつる心","『集成』は「いとしいと思っていた気持」と解し、『完訳』は「憐憫」と注し「いじらしいと思っていた気持」と訳すが、憐憫よりも愛情であろう。"
"31","2","5","13","181","1","このころ荒立ててはいみじきこと出で来なむ","鬚黒の心。この時期に事を荒立てては源氏方からも式部卿宮方からも厄介な事が出てこようという懸念。"
"31","2","5","13","182","1","呼ばひののしりたまふ声など","北の方に乗り移った物の怪の声。"
"31","2","6","1","183","1","夜一夜打たれ引かれ泣きまどひ","北の方が僧から打たれたり引き回されたり、また北の方自身泣き叫んだりしている様子。"
"31","2","6","1","184","1","かしこへ","鬚黒は玉鬘のもとへ。"
"31","2","6","2","185","1","昨夜にはかに消え入る人のはべしにより","以下「とりなしはべりけむ」まで、鬚黒の文。北の方が物の怪に苦しめられて、と言わずに、漠然と昨夜急に瀕死の状態に陥った人が生じてと、言い訳をしている。"
"31","2","6","2","186","1","ふり出でがたく","「ふり」は雪の縁語。また「降る」と「振る」の掛詞的表現。"
"31","2","6","2","187","1","身さへ","心はもちろん身体までがの意。"
"31","2","6","4","188","2","心さへ空に乱れし雪もよに--ひとり冴えつる片敷の袖","鬚黒から玉鬘への贈歌。空模様ばかりでなく心までが。"
"31","2","6","5","189","1","堪へがたくこそ","歌に添えた言葉。"
"31","2","6","6","190","1","白き薄様に","雪にあわせて白の薄様の紙を選んだ。"
"31","2","6","6","191","1","ことにをかしきところもなし","語り手の鬚黒の手紙に対する評言。以下「ものしたまひける」まで、鬚黒についての評言が続く。"
"31","2","6","7","192","1","尚侍の君","玉鬘。"
"31","2","6","7","193","1","かく心ときめきしたまへるを","鬚黒がはらはらしてお書きになった手紙を。「を」は下の「見も入れたまはねば」の目的格を表すとともに、内容的には逆接的に繋がっていくので、逆接の接続助詞とも見られる。両義性をもった用法である。"
"31","2","6","7","194","1","男","鬚黒を「男」と呼ぶことに注意。男と女の場面。"
"31","2","6","8","195","1","心のうちにも","鬚黒の心をいう。"
"31","2","6","8","196","1","このころばかりだに","以下「あらせたまへ」まで、鬚黒の心。仏への祈り。"
"31","2","6","8","197","1","まことの心ばへの","以下「け疎さかな」まで、鬚黒の心。"
"31","2","7","1","198","1","暮るれば例の","「例の」とあることによって、日が暮れると鬚黒は玉鬘のもとへ出掛けて行くことが習慣化していることが知られる。"
"31","2","7","1","199","1","世にあやしううちあはぬさまにのみむつかりたまふを","鬚黒の身につかない風流事を自分自身でも認め不快がっている。"
"31","2","7","4","200","2","ひとりゐて焦がるる胸の苦しきに--思ひあまれる炎とぞ見し","木工の君の贈歌。「ひとり」に「独り」と「火取り」を掛ける。「焦がるる」「炎」は「火」の縁語。「思ひ」の「ひ」に「火」を掛ける。"
"31","2","7","6","201","1","いかなる心にて","以下「言ひけむ」まで鬚黒の心。"
"31","2","7","6","202","1","情けなきことよ","『細流抄』は「草子地の評也」と注し、『評釈』は「木工の君がそう思い、この物語を読み上げる女房がそう思い、男心と秋の空、と、物語の読者たる女性は思う」と解説する。『全集』『集成』『完訳』等も「草子地」と注す。鬚黒の木工の君に対する態度を薄情なことだという語り手の評言。"
"31","2","7","7","203","2","憂きことを思ひ騒げばさまざまに--くゆる煙ぞいとど立ちそふ","鬚黒の返歌。「思ひ」の「ひ」に「火」を掛け、「くゆる」に「燻る」と「悔ゆる」を掛ける。「燻る煙」は「火」の縁語。"
"31","2","7","8","204","1","いとことの","以下「身なめり」まで鬚黒の詞が歌の後に続く。"
"31","2","7","8","205","1","中間になりぬべき","どっちつかずの状態。北の方は式部卿宮に引き取られ、玉鬘は源氏方から仲を裂かれるような状態。"
"31","2","7","10","206","1","いとど心を分くべくもあらずおぼえて","玉鬘のことを思うとますます他の女性に愛情を分けることはできないように思われて。"
"31","2","7","10","207","1","心憂ければ","北の方のことを思うと憂鬱なので。"
"31","2","7","10","208","1","久しう籠もりゐたまへり","鬚黒が六条院の玉鬘のもとに。"
"31","3","1","1","209","1","あるまじき疵もつき","以下「ありなむ」まで、鬚黒の心。"
"31","3","1","2","210","1","殿に渡りたまふ","鬚黒の自邸。"
"31","3","1","2","211","1","異方に離れゐたまひて","北の方の部屋から離れていらして。"
"31","3","1","2","212","1","呼び放ちて","子供たちを北の方のもとから引き離して鬚黒のもとに呼び寄せて。"
"31","3","1","2","213","1","女一所十二三ばかりにて","鬚黒と北の方の子供の紹介文。女子は一人、真木柱の姫君という。年齢十二、三歳は成人式を迎え結婚適齢期にさしかかった女性である。"
"31","3","1","2","214","1","次々男二人なむおはしける","弟君が二人が続いていらっしゃるのであった。"
"31","3","1","2","215","1","御仲も隔たりがちにて","鬚黒と北の方の夫婦仲が疎遠がちである。"
"31","3","1","2","216","1","今は限りと見たまふに","北の方が結婚生活もいよいよ最後だとお思いになると。"
"31","3","1","3","217","1","父宮聞きたまひて","北の方の父式部卿宮が鬚黒夫婦のことを。"
"31","3","1","4","218","1","今は","以下「くづほれたまはむ」まで、式部卿宮の詞。"
"31","3","1","4","219","1","しか","鬚黒が玉鬘に熱中して入りびたっている生活態度をさす。"
"31","3","1","7","220","1","しひて立ちとまりて","以下「こそあらめ」まで、北の方の心。"
"31","3","1","7","221","1","人の","夫鬚黒が。"
"31","3","1","9","222","1","兵衛督","「藤袴」巻（第三章二段）に初出。"
"31","3","1","9","223","1","上達部におはすれば","兵衛督は従四位下相当官であるが、従三位に叙されていたものか。"
"31","3","1","9","224","1","中将","従四位下相当官。"
"31","3","1","9","225","2","さこそはあべかめれ","女房たちの予測。「さ」は北の方が父式部卿宮に引き取られることをさす。"
"31","3","1","10","226","1","年ごろならひたまはぬ","以下「たまひなむに」まで女房たちの詞。「たまはぬ」は北の方に対する敬語。"
"31","3","1","10","227","1","旅住み","これから始まる式部卿宮家での慣れない生活をいう。"
"31","3","1","10","228","1","かたへは","女房の半分の人は。"
"31","3","1","10","229","1","しづまらせたまひなむに","「せ」（尊敬の助動詞）「給」（尊敬の補助動詞）「な」（完了の助動詞、確述）「む」（推量の助動詞）。女房の会話どうしでも二重敬語を使う。"
"31","3","1","11","230","1","はかなきものどもなど","女房のそれぞれの持物や荷物などをさす。"
"31","3","1","11","231","1","乱れ散るべし","語り手の推量。"
"31","3","2","2","232","1","みづからはかく","以下「いみじきこと」まで、北の方の子供たちへの詞。"
"31","3","2","2","233","1","生ひ先遠うて","子供たちのことをいう。"
"31","3","2","3","234","1","姫君は","北の方は女の子は自分と一緒に生活させようと考える。"
"31","3","2","3","235","1","男君たちは","北の方は男子はどうしても政治の世界で父親と一緒に暮らして行かねばならないと考えている。"
"31","3","2","3","236","1","人の","父親の鬚黒が。"
"31","3","2","4","237","1","宮のおはせむほど","祖父の式部卿宮。"
"31","3","2","4","238","1","かの大臣たちの御心にかかれる世にて","あの太政大臣の源氏や内大臣たちのお心のままの世の中だから。"
"31","3","2","4","239","1","心おくべきわたり","源氏方から見れば、気を許せない所の者だ。"
"31","3","2","4","240","1","山林に引き続きまじらむこと","自分が出家遁世し、息子たちも後を追って出家し山林に姿をくらますこと。"
"31","3","2","6","241","1","昔物語などを","以下「もてないたまはじ」まで、北の方の詞。『住吉物語』『落窪物語』などの父親が後妻と結婚生活を続けるうちにやがて先妻の子供は父親の愛情も薄れてゆき、さらには継母からも苛められていくような話を想定する。"
"31","3","2","6","242","1","人に従へば","具体的には後妻をさすが、一般論として読める。"
"31","3","2","7","243","1","御乳母どもさし集ひてのたまひ嘆く","子供たちの乳母も北の方と一緒になっておっしゃり嘆く。敬語があるので、北の方を中心にした表現。"
"31","3","3","1","244","1","日も暮れ雪降りぬべき空のけしきも","冬の雪の日の別れの場面。「薄雲」巻には大堰山荘を舞台にして明石の母子の別れの場面が語られていた。物語の季節と主題との類同的発想の一つである。"
"31","3","3","2","245","1","いたう荒れはべりなむ早う","迎えの君達の詞。「な」（完了の助動詞、確述）「む」（推量の助動詞）、～してしまいましょう、の意。"
"31","3","3","3","246","1","おし拭ひつつ眺めおはす","迎えの君達の動作。"
"31","3","3","3","247","1","姫君は殿いとかなしうしたてまつりたまふならひに","姫君は殿がふだんからとてもおかわいがり申し上げなさっていたのでの意。"
"31","3","3","4","248","1","見たてまつらでは","以下「こそあれ」まで、姫君の心。"
"31","3","3","6","249","1","かく思したるなむいと心憂き","北の方の姫君への詞。"
"31","3","3","7","250","1","ただ今も渡りたまはなむ","姫君の心。「なむ」は願望の意の終助詞。今すぐにでも父が帰ってきてほしいの意。"
"31","3","3","7","251","1","かく暮れなむに","「な」（完了の助動詞、確述）「む」（推量の助動詞）。このように今にも日が暮れようとしている時に、の意。以下、語り手の評言。『孟津抄』は「推量也」と指摘する。『集成』も「草子地」と指摘、『完訳』は「語り手の推測。父の恋狂いなど思わぬ娘の純真さを暗示」と指摘する。"
"31","3","3","7","252","1","まさに動きたまひなむや","反語表現。これから夜になっていこうとする時、鬚黒が玉鬘のもとから帰って来ようか、そんなことはまずあるまいという。"
"31","3","3","9","253","2","今はとて宿かれぬとも馴れ来つる--真木の柱はわれを忘るな","姫君の歌。「真木」は歌語。『大系』『評釈』『全集』『完訳』は「東風吹かば匂いおこせよ梅の花主なしとて春を忘るな」（拾遺集雑春、一〇〇六、菅原道真）を引歌として指摘する。この和歌が姫君の呼称となり、さらに巻名となる。"
"31","3","3","11","254","2","馴れきとは思ひ出づとも何により--立ちとまるべき真木の柱ぞ","北の方の返歌。"
"31","3","3","14","255","2","浅けれど石間の水は澄み果てて--宿もる君やかけ離るべき","中将の御許から木工の君への贈歌。「石間の水」に木工の君をたとえる。「宿守る君」は北の方をさす。「すみ」に「住み」と「澄み」を掛け、「かけ」に「かけ離る」と水に映る「影」とを響かせる。「や～べき」反語表現。～することがあっていいものでだろうか、おかしなことだ。"
"31","3","3","15","256","1","思ひかけざりしことなりかくて別れたてまつらむことよ","中将の御許の歌に続く詞。木工の君と別れることをいう。"
"31","3","3","17","257","2","ともかくも岩間の水の結ぼほれ--かけとむべくも思ほえぬ世を","木工の君の返歌。「言はま」に「岩間」を掛ける。「結ぼほれ」は、水の流れが滞る意と思いが鬱屈する意とこめる。「かけ」は「かけ留む」と「影留む」を響かす。"
"31","3","3","20","258","1","またはいかでかは見む","中将の御許の木工の君に二度と会えまいという思い。"
"31","3","3","20","259","1","はかなき心地す","中将の御許の気持ち。"
"31","3","3","20","260","1","梢をも目とどめて隠るるまでぞ返り見たまひける","『源氏釈』は「君が住む宿の梢を行くゆくと隠るるまでに返り見しはや」（拾遺集別、三五一 、菅原道真）を引歌として指摘。現行の注釈書でも指摘する。"
"31","3","3","20","261","1","君が住むゆゑにはあらで","前掲「拾遺集」歌の語句を引く。ここでは夫の鬚黒をさす。"
"31","3","3","20","262","1","いかでか偲びどころなくはあらむ","語り手の感情移入のこもった表現。"
"31","3","4","2","263","1","太政大臣を","以下「いかがつらからぬ」まで、大北の方の詞。"
"31","3","4","2","264","1","思ひきこえたまへれど","あなたはお思い申し上げていらっしゃいますが、の意。大北の方の夫式部卿宮への皮肉。"
"31","3","4","3","265","1","女御をもことに触れ","大北の方の姫君、王女御をさす。「澪標」巻に初出。入内して女御となるが、源氏方の養女として入内した前斎宮が「少女」巻で中宮に立ち、立后が叶わなかった。"
"31","3","4","3","266","1","御仲の恨み","源氏の須磨流謫前後に式部卿宮が源氏に対して冷淡な態度をとったことへの恨み。"
"31","3","4","4","267","1","人一人を思ひかしづきたまはむゆゑはほとりまでも","源氏が紫の上を大事にするからには、その親類縁者までも厚遇してよい、の意。"
"31","3","4","4","268","1","末にすずろなる継子かしづきをして","源氏が晩年の今頃になってから玉鬘の世話をして、の意。"
"31","3","4","4","269","1","おのれ古したまへるいとほしみに","「古し」「いとをしみ」は、自分が玉鬘を愛人として長い間付き合ってきたのに飽きて、そのことを気の毒に思っての意。大北の方は、源氏と玉鬘の関係をこのように理解している。"
"31","3","4","4","270","1","実法なる人","鬚黒をさす。"
"31","3","4","6","271","1","あな聞きにくや","以下「やみぬべきなめり」まで、式部卿宮の詞。"
"31","3","4","7","272","1","皆かの沈みたまひし世の報いは","源氏の須磨退去の不遇当時に疎遠にしたことをさす。"
"31","3","4","7","273","1","一年もさる世の響きに家よりあまることどももありしか","式部卿宮の五十賀を新築の六条院で祝ってくれたことをいう。「少女」巻（第七章三段）に見える。"
"31","3","4","8","274","1","この大北の方ぞさがな者なりける","語り手の大北の方に対する人物批評。『孟津抄』は「草子地」と指摘。『集成』も「草子地」と指摘。『完訳』は「語り手の評言。継子物語の性悪の継母像として語り収める」と指摘する。"
"31","3","4","9","275","1","大将の君","場面は六条院の玉鬘のもとに変わる。"
"31","3","4","9","276","1","かく渡りたまひにける","北の方が実家に移ってしまったこと。"
"31","3","4","10","277","1","いとあやしう","以下「おはする」まで鬚黒の心。"
"31","3","4","11","278","1","尚侍の君に","玉鬘。"
"31","3","4","12","279","1","かくあやしきことなむはべる","大島本は「侍る」とある。『新大系』は底本のままとする。『集成』『古典セレクション』はそれぞれ諸本に従って「はべるなる」「はべなる」と校訂する。以下「参り来なむ」まで、鬚黒の玉鬘への詞。"
"31","3","4","12","280","1","なかなか心やすくは思ひたまへなせど","北の方が実家に帰ってくれて、かえって気が楽になったとは思ってみるが。「たまへ」は鬚黒が自分自身「思う」謙譲表現である。"
"31","3","4","12","281","1","さて片隅に","そのまま北の方が鬚黒の邸にいて。"
"31","3","4","12","282","1","人の聞き見ることも","世間の人が鬚黒の態度を聞いたり見たりすることも。"
"31","3","4","14","283","1","いとものものし","女房の目と一体化した語り手の評言。"
"31","3","4","14","284","1","などかは似げなからむ","反語表現。鬚黒の堂々とした姿と玉鬘の美しさが似つかわしい。"
"31","3","4","14","285","1","かかることども","鬚黒の話。主として北の方や式部卿宮のことをさす。"
"31","3","5","1","286","1","宮に恨み聞こえむとて","以下、場面が変わって、鬚黒の自邸を舞台となる。"
"31","3","5","1","287","1","いとあはれなり","語り手の感情移入の表現。『評釈』は「大将の涙を見ると、木工も、許す気になったことであろう。「いとあはれなり」は、作者が読者に報告するだけのことばではない」と指摘。"
"31","3","5","2","288","1","さても世の人にも似ず","以下「たまはむとすらむ」まで鬚黒の詞。"
"31","3","5","2","289","1","見知りたまはずありけるかな","北の方はおわかりではなかったのだな。"
"31","3","5","2","290","1","いと思ひのままならむ人","鬚黒が自分自身のことをいうが、自分はそのようなわがままな人ではないの意。"
"31","3","5","2","291","1","立ちとまるべくやはある","「べく」（推量の助動詞、可能）「や」（係助詞、反語）。とどまっていられるものであろうか、そんなことはできないの意。"
"31","3","5","2","292","1","同じことなり","邸に残るも実家に帰るも同じことである意。"
"31","3","5","2","293","1","いかやうにもてなしたまはむとすらむ","北の方は幼い子供たちまでどのように巻き添えにしようとなさるのだろうか。"
"31","3","5","3","294","1","かの真木柱を","姫君が歌を詠み残して挟んでいった真木柱。"
"31","3","5","3","295","1","道すがら","場面は鬚黒邸から式部卿宮邸に向かう道中に変わる。"
"31","3","5","3","296","1","参うでたまへれば","鬚黒が式部卿宮邸に参上なさると。"
