"Volume","Chapter","Paragraph","Line","Annotation_Num","Annotation_State","Annotation_Title","Annotation_Body"
"52","1","1","1","1","1","かしこには人びとおはせぬを求め騒げど","浮舟失踪の翌朝。「おはせぬ」の主語は浮舟。「人びと」の述語は「求め騒げど」。"
"52","1","1","1","2","2","物語の姫君の--やうなれば","『伊勢物語』第六段、『大和物語』第百五十四段、同百五十五段など。"
"52","1","1","1","3","1","詳しくも言ひ続けず","三光院説「作者の分別となり」と指摘。"
"52","1","1","1","4","1","京よりありし使の","浮舟の母からの使者。"
"52","1","1","1","5","1","また人おこせたり","主語は浮舟母。"
"52","1","1","2","6","1","まだ、鶏の鳴くになむ、出だし立てさせたまへる","使者の詞。"
"52","1","1","3","7","1","かの心知れるどち","右近と侍従。"
"52","1","1","3","8","1","身を投げたまへるか","主語は浮舟。宇治川に身を投げたか、の意。『異本紫明抄』は「世の中の憂きたびごとに身を投げば深き谷こそ浅くなりなめ」（古今集俳諧、一〇六一、読人しらず）を指摘。"
"52","1","1","4","9","1","泣く泣くこの文を開けたれば","主語は乳母や右近など。"
"52","1","1","5","10","1","いとおぼつかなさに","以下「はべりぬべければ」まで、浮舟母の手紙。"
"52","1","1","5","11","1","なほいと恐ろしく","『集成』は「本妻方の呪詛など恐れるのであろう」と注す。"
"52","1","1","5","12","1","ものへ渡らせたまはむことは","薫の京の新築した邸へ移ること。四月十日の予定であった（浮舟巻）。"
"52","1","1","5","13","1","そのほど","薫の邸へ移る前に。"
"52","1","1","6","14","1","昨夜の御返りをも開けて見て","浮舟から母への返事。主語は右近ら。"
"52","1","1","7","15","1","さればよ","以下「つらきこと」まで、右近の心中の思い。"
"52","1","1","7","16","1","聞こえたまひけり","浮舟が母に。辞世の歌をさす。"
"52","1","1","7","17","1","幼かりしほどより","右近は浮舟の乳母子。"
"52","1","1","8","18","1","足摺りといふことを","『異本紫明抄』は「白玉か何ぞと人の問ひし時露と答へて消えなましものを」（伊勢物語）を指摘。"
"52","1","1","8","19","1","いみじく思したる御けしきは","以下「いかにしつることにか」まで、右近の心中の思い。浮舟の苦悩の様子を思う。『完訳』は「以下、右近の心情に即した行文」と注す。"
"52","1","1","9","20","1","言はれける","「れ」自発の助動詞。"
"52","1","2","1","21","1","例ならぬけしきありし御返り","浮舟から匂宮への返書。「からをだに」の歌（浮舟巻）。"
"52","1","2","1","22","1","いかに思ふならむ","以下「行き隠れむとにやあらむ」まで、匂宮の心中の思い。匂宮は入水したとは思いもよらない。"
"52","1","2","1","23","1","思し騷ぎ","大島本は「おほしさハき」とある。『集成』『完本』は諸本に従って「思し騒ぎて」と「て」を補訂する。『新大系』は底本のまま「おぼしさは（わ）ぎ」とする。"
"52","1","2","3","24","1","いかなるぞ","匂宮の使者の詞。"
"52","1","2","5","25","1","上の今宵","以下「惑ひたまふ」まで、下衆女の詞。"
"52","1","2","5","26","1","ものもおぼえたまはず","主語は女房たち。下衆女から見れば上位の身分。"
"52","1","2","5","27","1","頼もしき人も","『集成』は「母君のことなどであろう」と注す。"
"52","1","2","5","28","1","さぶらひたまふ人びとは","女房たち。"
"52","1","2","5","29","1","惑ひたまふ","主語は女房たち。会話文中なので、敬語がつく。"
"52","1","2","6","30","1","詳しう問はで","大島本は「くハしうとハて」とある。『集成』『完本』は諸本に従って「くはしくも」と「も」を補訂する。『新大系』は底本のまま「くはしう」とする。"
"52","1","2","7","31","1","かくなむと申させたるに","使者が取次の者に、これこれしかじかでしたと、匂宮に申し上げさせる。"
"52","1","2","7","32","1","夢とおぼえて","主語は匂宮。"
"52","1","2","8","33","1","いとあやし","以下「をかしげなりしものを」まで、匂宮の心中の思い。"
"52","1","2","10","34","1","時方行きて","以下「問ひ聞け」まで、匂宮の詞。"
"52","1","2","12","35","1","かの大将殿","以下「人しげくはべらむを」まで、時方の詞。"
"52","1","2","12","36","1","下人の","宇治山荘の下人。"
"52","1","2","12","37","1","思し合はすること","匂宮が浮舟に通じているということ。実は薫は既に知ってしまっている。"
"52","1","2","13","38","1","さりとては","以下「言ふなり」まで、匂宮の詞。"
"52","1","3","1","39","1","かやすき人は","時方をさす。"
"52","1","3","2","40","1","今宵やがてをさめたてまつるなり","浮舟方の人々の詞。"
"52","1","3","4","41","1","ただ今ものおぼえず","以下「え聞こえぬこと」まで、右近の詞。"
"52","1","3","4","42","1","今宵ばかりこそかくも立ち寄りたまはめ","大島本は「う（う＃&lt;朱&gt;こ&lt;墨&gt;）そ」とある。すなわち「う」を朱筆で抹消して傍らに墨筆で「こ」と訂正する。『集成』『完本』『新大系』は底本の訂正に従って「こそ」と訂正する。係結び「こそ--め」逆接用法。『完訳』は「浮舟が死ねば交渉もなくなるとする」と注す。"
"52","1","3","6","43","1","さりとて","以下「今一所だに」まで、時方の詞。もうお一方に、すなわち侍従に会いたい。"
"52","1","3","8","44","1","いとあさまし","大島本は「あさまし」とある。『集成』『完本』は諸本に従って「あさましく」と「く」を補訂する。『新大系』は底本のまま「あさまし」とする。以下「立ち寄りたまへ」まで、侍従の詞。"
"52","1","3","8","45","1","思しもあへぬ","主語は浮舟。突然の急死。"
"52","1","3","8","46","1","申させたまへ","時方から匂宮へ。"
"52","1","3","8","47","1","いと心苦しと思ひきこえさせたまへりし","浮舟が匂宮を。先夜、逢わずに帰したこと。"
"52","1","3","8","48","1","この穢らひなど","死の穢れ。近親者は三十日間家に籠もる。"
"52","1","4","1","49","1","内にも","邸宅の中。"
"52","1","4","1","50","1","乳母なるべし","時方の目を通しての叙述。"
"52","1","4","2","51","1","あが君や","以下「見たてまつらむ」まで、乳母の詞。"
"52","1","4","2","52","1","おぼえたまひ","「たまふ」は浮舟に対する敬意。乳母が思う。"
"52","1","4","2","53","1","頼みきこえつるにこそ、命も延びはべりつれ","【頼みきこえつるにこそ】－浮舟が京の薫に引き取られる日を楽しみにしていたこと。<BR>【きこえつるにこそ--延びはべりつれ】－係結び法則、逆接用法。"
"52","1","4","3","54","1","帝釈も返したまふなり","帝釈天のせん子蘇生仏説を踏まえる（仏説せん子経）。"
"52","1","4","5","55","1","なほのたまへ","以下「見たてまつる」まで、時方の詞。"
"52","1","4","5","56","1","聞こし召さむと","主語は匂宮。"
"52","1","4","5","57","1","御使なり","わたし時方は匂宮の使いである。"
"52","1","4","5","58","1","聞こし召し合はする","主語は匂宮。"
"52","1","4","5","59","1","罪なるべし","大島本は「つミなるへし」とある。『集成』『完本』は諸本に従って「罪に」と「に」を補訂する。『新大系』は底本のまま「罪」とする。"
"52","1","4","6","60","1","またさりともと頼ませたまひて","主語は匂宮。『集成』は「それに、いくら何でも（確実なことを話してくれるだろう）と頼みなさって」。『完訳』は「さすが右近や侍従は嘘をつくまいと宮は信頼し。一説に、浮舟は死んではいまいと。前者に従う」と注す。"
"52","1","4","6","61","1","君たちに","右近や侍従をさす。"
"52","1","4","6","62","1","人の朝廷にも、古き例どもありけれど","中国の漢武帝と李夫人や玄宗皇帝と楊貴妃の話が有名。"
"52","1","4","6","63","1","かかることこの世には","大島本は「かゝることこのよにハ」とある。『集成』『完本』は諸本に従って「かかることはこの世に」を校訂する。『新大系』は底本のまま「かゝることこの世には」とする。"
"52","1","4","7","64","1","げにいとあはれなる","以下「聞こえなむ」まで、侍従の心中の思い。"
"52","1","4","7","65","1","例ならぬことのさま","姫君浮舟の突然の失踪事件。"
"52","1","4","8","66","1","などかいささかにても","以下「言ひ続けらるるなめり」まで、侍従の詞。"
"52","1","4","8","67","1","かの殿の","薫をさす。"
"52","1","4","9","68","1","初めより知りそめたりし方に","薫をさす。"
"52","1","4","9","69","1","この御ことをば","匂宮との関係。"
"52","1","4","9","70","1","思ひきこえさせ","大島本は「思ひきえさせ」とある。『集成』『完本』『新大系』は諸本に従って「思ひきこえさせ」と「こ」を補訂する。"
"52","1","4","9","71","1","御心乱れけるなるべし","浮舟の心。"
"52","1","4","9","72","1","あさましう、心と身を亡くなしたまへるやうなれば","暗に自殺したことをほのめかす。"
"52","1","4","9","73","2","かく心の惑ひに--なめり","乳母の発言の背景を推測して説明する。"
"52","1","4","10","74","1","心得がたくおぼえて","大島本は「おほえて」とある。『集成』『完本』は諸本に従って「思ひて」と校訂する。『新大系』は底本のまま「おぼえて」とする。"
"52","1","4","11","75","1","さらばのどかに","以下「おはしましなむ」まで、時方の詞。「のどかに」に下に、なってからの意が含まれる。"
"52","1","4","11","76","1","御みづからも","匂宮ご自身。"
"52","1","4","13","77","1","あなかたじけな","以下「御心ざしにはべるべき」まで、侍従の詞。"
"52","1","4","13","78","1","今さら人の","大島本は「いまさら」とある。『集成』『完本』は諸本に従って「今さらに」と「に」を補訂する。『新大系』は底本のまま「いまさら」とする。"
"52","1","5","2","79","1","目の前に","以下「いかにしつることぞ」まで、浮舟母の詞。"
"52","1","5","4","80","1","鬼や食ひつらむ","以下「言ふなりし」まで、浮舟母の心中の思い。"
"52","1","5","6","81","1","さては","以下「人もやあらむ」まで、浮舟母の心中の思い。"
"52","1","5","6","82","1","かの恐ろしと思ひきこゆるあたりに","薫の正室女二宮をさす。"
"52","1","5","6","83","1","かう迎へたまふべしと","薫が浮舟を迎えることをいう。"
"52","1","5","6","84","1","たばかりたる人もやあらむ","浮舟を誘拐した人が。"
"52","1","5","8","85","1","今参りの心知らぬやある","浮舟母の詞。"
"52","1","5","9","86","1","と問へば","大島本は「とゝへハ」とある。『集成』『完本』は諸本に従って「問へど」を校訂する。『新大系』は底本のまま「問へば」とする。"
"52","1","5","10","87","1","いと世離れたりとて","以下「帰り出ではべりにし」まで、女房の詞。宇治はたいそう不便な田舎だと言って、の意。"
"52","1","5","10","88","1","今とく参らむ","新参の女房の詞を引用。"
"52","1","5","10","89","1","と言ひてなむ","大島本は「いひて」とある。『集成』『完本』は諸本に従って「言ひつつ」を校訂する。『新大系』は底本のまま「言ひて」とする。"
"52","1","5","10","90","1","帰り出ではべりにし","京に帰ってしまった。"
"52","1","6","1","91","1","身を失ひてばや","侍従、浮舟が日頃口にしていた詞を想起。"
"52","1","6","1","92","1","亡き影に","浮舟の「なげきわび身をば捨つとも亡き影に憂き名流さむことをこそ思へ」（浮舟）とあった歌の文句。"
"52","1","6","2","93","1","さて亡せたまひけむ人を","以下「いとほしきこと」まで、侍従の詞。"
"52","1","6","3","94","1","言ひ合はせて","右近と話し合って。"
"52","1","6","4","95","1","忍びたる事とても","以下「つくろはむ」まで、侍従の詞。"
"52","1","6","4","96","1","いとやさしきほどならぬを","『集成』は「別に恥ずかしいお相手ではないのですから」と訳す。"
"52","1","6","4","97","1","かくいみじくおぼつかなきことどもをさへ","『集成』は「このように全くどうなったやら分らないといった心配ごとまで」。『完訳』は「真相を明らかにしえない不安」と注す。"
"52","1","6","4","98","1","かたがた思ひ惑ひたまふさま","主語は浮舟母。"
"52","1","6","4","99","1","骸を置きてもて扱ふこそ","亡骸を安置して葬儀を執行すること。"
"52","1","6","4","100","1","聞こえて","浮舟母に浮舟の死を。"
"52","1","6","5","101","1","と語らひて","侍従が右近と相談しあって。"
"52","1","6","5","102","1","さはこの","以下「亡せたまひにけり」まで、浮舟母の心中。"
"52","1","6","6","103","1","おはしましにけむ方を","以下「はかばかしくをさめむ」まで浮舟母の詞。"
"52","1","6","8","104","1","さらに何のかひはべらじ","以下「いと聞きにくし」まで右近たちの詞。"
"52","1","6","9","105","1","とざまかくざまに","『完訳』は「浮舟の行方をあれこれ想像」と注す。"
"52","1","6","9","106","1","この人びと二人して","右近と侍従。"
"52","1","6","9","107","1","車寄せさせて","『集成』は「遺骸を運び入れる体を装う」と注す。"
"52","1","6","9","108","1","乳母子の大徳","浮舟の乳母の子である大徳。"
"52","1","6","9","109","1","それが叔父の阿闍梨","乳母子の大徳の叔父である阿闍梨。"
"52","1","6","9","110","1","御忌に籠もるべき限りして","近親者による三十日間の忌籠もり。"
"52","1","6","9","111","1","出だし立つるを","葬送の車を。"
"52","1","6","9","112","1","いといみじくゆゆしと","大島本は「いといみしくゆゝしと」とある。『集成』『完本』は諸本に従って「いとゆゆしくいみじと」を校訂する。『新大系』は底本のまま「いといみじくゆゝしと」とする。『完訳』は「まだ生きているかもしれないのに、の気持から、不吉だとする」と注す。"
"52","1","7","2","113","1","御葬送の事は","以下「仕うまつらめ」まで、大夫らの詞。"
"52","1","7","4","114","1","ことさら","大島本は「ことさら」とある。『集成』『完本』は諸本に従って「ことさらに」と「に」を補訂する。『新大系』は底本のまま「ことさら」とする。以下「あればなむ」まで、右近らの詞。"
"52","1","7","4","115","1","思ふやうあればなむ","『完訳』は「子細があるとするが、具体的に言わない。不審がられるゆえん」と注す。"
"52","1","7","5","116","1","田舎人どもはなかなかかかることを","田舎人とは大夫や内舎人をさす。『完訳』は「彼らは都人よりかえって、葬送などを丁重に扱い縁起などもかつぎやすい」と注す。"
"52","1","7","6","117","1","いとあやしう","以下「せられぬることかな」まで、大夫らの詞。"
"52","1","7","6","118","1","例の作法など","葬式の入棺や拾骨の儀式など。"
"52","1","7","6","119","1","あることども知らず","大島本は「あることゝもしらす」とある。『集成』『完本』は諸本に従って「ことどももしたまはず」と校訂する。『新大系』は底本のまま「ことども知らず」とする。"
"52","1","7","7","120","1","誹りければ","非難すると、またその一方で、というつながり方。"
"52","1","7","8","121","1","片へおはする人は","以下「京の人はしたまふ」まで、大夫らの詞。『完訳』は「兄弟のいらっしゃるお方。一説には、一方で妻妾をお持ちの薫、とする」と注す。"
"52","1","7","8","122","1","したまふ--などぞ","大島本は「し給なとそ」とある。『集成』『完本』は諸本に従って「したまふなるなど」と校訂する。『新大系』は底本のまま「し給などぞ」とする。"
"52","1","7","10","123","1","かかる人どもの","以下「疑はれたまはむ」まで、右近や侍従の心中の思い。"
"52","1","7","10","124","1","亡せたまひにけりと聞かせたまはば","大島本は「うせ給にけりときかせ給ハゝ」とある。『集成』『完本』は諸本に従って「亡せたまへりと聞こしめさば」と校訂する。『新大系』は底本のまま「亡せ給にけりと聞かせ給はば」とする。"
"52","1","7","10","125","1","同じ御仲らひにて","匂宮は薫と同族の親しい間柄。"
"52","1","7","11","126","1","いと気高くおはせし人の","浮舟をいう。"
"52","1","7","11","127","1","げに亡き影に","「げに」は浮舟の独詠歌「なげきわび」歌を受ける。「亡き影に」はその歌中の語句。"
"52","1","7","12","128","1","けしきも見聞きつるには口かため案内知らぬには聞かせじ","右近らの思い。"
"52","1","7","13","129","1","ながらへては","以下「なるべし」まで、右近らの思い。『集成』は「悲しみのあまり、とても生き永らえそうにもないが、という含み」と注す。"
"52","1","7","13","130","1","悲しさ覚めぬべきこと","『完訳』は「真相を知っては疑惑が先立つとする」と注す。"
"52","1","7","14","131","1","この人二人ぞ","右近と侍従。"
"52","2","1","1","132","1","入道の宮","薫の母女三宮。"
"52","2","1","1","133","1","かしこを","浮舟をさす。"
"52","2","1","1","134","1","さなむと","浮舟の入水。"
"52","2","1","1","135","1","御使のなきを","薫の使者。"
"52","2","1","1","136","1","人目も心憂しと思ふに","主語は浮舟の家人たち。"
"52","2","1","1","137","1","御荘の人なむ参りて","薫の荘園の人が石山寺に参籠中の薫のもとに。"
"52","2","1","1","138","1","御使そのまたの日まだつとめて","浮舟の失踪事件が判明した翌日の早朝。薫の使者が宇治に来る。浮舟の葬送は当日の夜に執行され、その後となる。"
"52","2","1","2","139","1","いみじきことは","以下「ここのためもからき」まで、使者の伝える薫の詞。"
"52","2","1","2","140","1","かく悩みたまふ御ことにより","母女三宮の病気平癒のための参籠。"
"52","2","1","2","141","1","昨夜のことは","葬送のこと。夜に荼毘にふす。"
"52","2","1","2","142","1","などか","「急ぎせられにける」に係る。"
"52","2","1","2","143","1","とぢめのことを","葬儀の事。"
"52","2","1","2","144","1","山賤の誹りをさへ","『完訳』は「大夫・内舎人らの批判も薫の耳に入ったらしい」と注す。"
"52","2","1","3","145","1","大蔵大輔","薫の腹心の家司で大蔵大輔仲信。"
"52","2","2","2","146","1","心憂かりける所かな","以下「犯したまふなりけむかし」まで、薫の心中の思い。『新釈』は「わが庵は都の巽しかぞ住む世を宇治山と人はいふなり」（古今集雑下、八九三、喜撰法師）を指摘。"
"52","2","2","2","147","1","人も言ひ犯したまふなりけむかし","「人」は匂宮をさす。"
"52","2","2","3","148","1","悩ませたまふあたりに","母女三宮が病気中。"
"52","2","2","3","149","1","京におはしぬ","薫は宇治に赴かず、京へ帰った。"
"52","2","2","4","150","1","宮の御方にも","薫の正室女二宮。"
"52","2","2","5","151","1","ことことしきほどにも","以下「いまいましうて」まで、薫の詞。浮舟について言う。『完訳』は「浮舟を、低い身分で表だった妻妾ではないとする」と注す。"
"52","2","2","5","152","1","ゆゆしきことを","浮舟の死を言う。"
"52","2","2","5","153","1","聞きつれば","大島本は「きゝつれハ」とある。『集成』『完本』は諸本に従って「聞きはべれば」と校訂する。『新大系』は底本のまま「聞きつれば」とする。"
"52","2","2","6","154","1","など聞こえたまひて","大島本は「なときこえ給て」とある。『集成』『完本』は諸本に従って「なむと聞こえたまひて」と校訂する。『新大系』は底本のまま「など聞こえ給て」とする。"
"52","2","2","6","155","1","ありしさま容貌","『完訳』は「以下、薫の回想と感慨」と注す。"
"52","2","2","7","156","1","うつつの世には","以下「こそはあなれ」まで、薫の心中の思い。"
"52","2","2","7","157","1","思ひ晴れず","大島本は「思はれす」とある。『集成』『完本』は諸本に従って「思ひ入れず」と校訂する。『新大系』は底本のまま「思はれず」とする。"
"52","2","2","7","158","1","かかることの筋につけて","女性関係のこと。"
"52","2","2","7","159","1","ものすべき","大島本は「ものすへき」とある。『集成』『完本』は諸本に従って「もの思ふべき」と校訂する。『新大系』は底本のまま「ものすべき」とする。"
"52","2","2","7","160","1","さま異に心ざしたりし身の思ひの外にかく例の人にて","『集成』は「世間の人とは違った願いを持っていた身なのに。この世の栄華を求めず仏道修行を志していたのに」。『完訳』は「世人に異なって道心を身上としたはずのわが人生なのに、現世に執着する結果となったと反省」と注す。"
"52","2","2","7","161","1","仏などの","大島本は「ほとけなとの」とある。『集成』『完本』は諸本に従って「仏なども」と校訂する。『新大系』は底本のまま「仏などの」とする。"
"52","2","3","1","162","1","かの宮はた","匂宮。"
"52","2","3","1","163","1","いかなる御もののけならむなど騒ぐに","主語は匂宮の女房たち。"
"52","2","3","1","164","1","思し静まるにしもぞ","『完訳』は「気持が落ち着くとかえって」と注す。"
"52","2","3","1","165","1","人には","周囲の人、さらには世間の人。"
"52","2","3","1","166","1","かくすぞろなる","大島本は「すそろなる」とある。『集成』『完本』は諸本に従って「すずろなる」と校訂する。『新大系』は底本のまま「すぞろなる」とする。"
"52","2","3","2","167","1","いかなることに","以下「沈みたまふらむ」まで、女房たちの詞。"
"52","2","3","3","168","1","かの殿にも","薫をさす。"
"52","2","3","3","169","1","この御けしきを","匂宮の状態。"
"52","2","3","3","170","1","さればよ","以下「出で来なまし」まで、薫の心中の思い。『完訳』は「文通のみならず、情交もあったとうと推測。「--けり」と、確信」と注す。"
"52","2","3","3","171","1","見たまひては","主語は匂宮。浮舟を見たら、の意。"
"52","2","3","3","172","1","さ思しぬべかりし人ぞかし","『完訳』は「宮が必ず執心するはずの女。男を魅了させる浮舟の美貌をいう」と注す。"
"52","2","3","3","173","2","ながらへましかば--出で来なまし","反実仮想の構文。主語は浮舟。"
"52","2","3","3","174","1","ただなるよりぞ","大島本は「たゝなるよりそ」とある。『集成』『完本』は諸本に従って「ただなるよりは」と校訂する。『新大系』は底本のまま「ただなるよりぞ」とする。<BR>『集成』は「匂宮と浮舟の関係は、やがて世間に知れ、そうなれば匂宮とは叔父甥の間柄だけに、自分も恥を晒すことになるのだった」と注す。"
"52","2","3","3","175","1","胸もすこし冷むる心地したまひける","『完訳』は「浮舟の死に胸をなでおろす気持さえまじる」と注す。"
"52","2","4","1","176","1","宮の御訪らひに","匂宮のお見舞い。"
"52","2","4","1","177","1","ことことしき際ならぬ思ひに籠もりゐて","以下「ひがみたるべし」まで、薫の心中の思い。「ことことしき際」は浮舟の身分。<BR>【思ひに籠もりゐて】－ 浮舟の喪に服す。"
"52","2","4","2","178","1","式部卿宮","蜻蛉式部卿宮、以前に娘を薫にと志したことがある宮（東屋）。"
"52","2","4","2","179","1","御叔父の服にて","薫の叔父。軽服三ケ月の喪。"
