"Volume","Chapter","Paragraph","Line","Annotation_Num","Annotation_State","Annotation_Title","Annotation_Body"
"52","2","4","2","180","1","思ひよそへられて","叔父の服喪に浮舟を悼む。"
"52","2","4","2","181","1","人びとまかり出でて","大島本は「まかりいてゝ」とある。『集成』『完本』は諸本に従って「まかでて」と校訂する。『新大系』は底本のまま「まかり出でて」とする。匂宮邸の様子。"
"52","2","4","3","182","1","臥し沈みてはなき","大島本は「ふししつミてハなき」とある。『集成』『完本』は諸本に従って「臥し沈みてのみはあらぬ」と校訂する。『新大系』は底本のまま「臥し沈みてはなき」とする。"
"52","2","4","3","183","1","御簾の内にも例入りたまふ人には","薫のような人。"
"52","2","4","3","184","1","見たまふにつけても","匂宮が薫を。"
"52","2","4","4","185","1","おどろおどろしき心地にも","以下「おもひはべる」まで、匂宮の詞。"
"52","2","4","4","186","1","皆人","大島本は「ミな人」とある。『集成』『完本』は諸本に従って「皆人は」と「は」を補訂する。『新大系』は底本のまま「みな人」とする。"
"52","2","4","4","187","1","慎むべき病のさまなりと","『集成』は「物の怪かもしれないと疑っている」と注す。"
"52","2","4","4","188","1","内裏にも宮にも","帝と明石中宮。匂宮の両親。"
"52","2","4","4","189","1","げに、世の中の常なきをも","『完訳』は「現世の無常が薫の口癖。それに「げに」と納得しながら、浮舟の死を悼む気持も言外に出る趣」と注す。"
"52","2","4","5","190","1","かならずしも","以下「見ゆらむ」まで、匂宮の心中の思い。薫は浮舟との関係を気づくまい、と思う。"
"52","2","4","5","191","1","さりやただこのことをのみ","以下「思しわたりつらむ」まで、薫の心中の思い。『集成』は「匂宮には「とおぼすも」と敬語、薫は「と思ふに」と書き分ける。以下、薫、匂宮の思惑の違いを相互に書く」。『完訳』「以下、秘事を確信する薫の心中」と注す。"
"52","2","4","7","192","1","こよなくも","以下「人しもつれなき」まで、匂宮の心中の思い。『完訳』は「薫はなんと薄情な人か。以下、冷静な薫を見ての匂宮の心中」と注す。"
"52","2","4","7","193","1","かからぬことにつけてだに","人の死去ということ。"
"52","2","4","7","194","1","空飛ぶ鳥の鳴き渡るにも","『完訳』は「景物に感情の増幅される趣」と注す。"
"52","2","4","7","195","1","すぞろに","大島本は「すそろに」とある。『集成』『完本』は諸本に従って「すずろに」と校訂する。『新大系』は底本のまま「すぞろに」とする。"
"52","2","4","7","196","1","もし心得たらむに","大島本は「心えたらむに」とある。『集成』『完本』は諸本に従って「心を得たらむに」と「を」を補訂する。『新大系』は底本のまま「心得たらむに」とする。"
"52","2","4","7","197","1","もののあはれも知らぬ人にもあらず","薫をさす。"
"52","2","4","7","198","1","世の中の常なきこと惜しみて思へる人しもつれなき","『集成』は「世間無常の道理を深く悟っている人は、かえって（身辺の不幸には）冷静でいられるのだな」。『完訳』は「薫の独自な道心ぶりを評す」と注す。"
"52","2","4","8","199","1","真木柱はあはれなり","『源氏釈』は「わぎもこが来ても寄り立つ真木柱そもむつましやゆかりと思へば」（出典未詳、源氏釈所引）を指摘。薫も浮舟ゆかりの人と思えば懐かしく思われる、の意。"
"52","2","4","8","200","1","これに向かひたらむさまも","浮舟が薫に向かい合っているさまを。"
"52","2","4","8","201","1","形見ぞかしとも","大島本は「かたみそかしとも」とある。『集成』『完本』は諸本に従って「形見ぞかしと」と「も」を削除する。『新大系』は底本のまま「形見ぞかしとも」とする。薫は浮舟の形見だ、の意。"
"52","2","5","1","202","1","いと籠めてしもはあらじと思して","主語は薫。薫と浮舟との関係を。"
"52","2","5","2","203","1","昔より心に籠めてしばしも","大島本は「心にこめてしハしも」とある。『集成』『完本』は諸本に従って「心にしばしも籠めて」を校訂する。『新大系』は底本のまま「心に籠めてしばしも」とする。以下「聞こし召すやうもはべるらむかし」まで、薫の詞。"
"52","2","5","2","204","1","なかなか上臈に","大島本は「中／＼」とある。『集成』『完本』は諸本に従って「なかなかの」と「の」を補訂する。『新大系』は底本のまま「なかなか」とする。"
"52","2","5","2","205","1","御暇なき御ありさまにて","匂宮をいう。"
"52","2","5","2","206","1","宿直などに、そのこととなくてはえさぶらはず","主語は薫。"
"52","2","5","2","207","1","そこはかとなくて過ぐしはべるをなむ","係助詞「なむ」の下に、今まで話さなかったことを申し訳なく思う、などの意が省略。以上、まえおき。"
"52","2","5","3","208","1","はかなくて亡せはべりにし人の同じゆかりなる人","故大君の妹の浮舟。"
"52","2","5","3","209","1","あいなく人の誹りもはべりぬべかりし折なりしかば","女二宮との結婚の時期であった。"
"52","2","5","3","210","1","このあやしき所に","宇治の山荘をさす。"
"52","2","5","3","211","1","かれもなにがし一人をあひ頼む心もことになくてやありけむとは見たまひつれど","『完訳』は「女（浮舟）の方も、私一人を頼りにする気も特になかったのではないか。匂宮との仲を暗に皮肉る」と注す。"
"52","2","5","3","212","1","やむごとなくものものしき筋に","正妻待遇をいう。"
"52","2","5","3","213","1","見るにはた","世話する。"
"52","2","5","3","214","1","悲しくなむ","係助詞「なむ」の下に「はべる」などの語句が省略。"
"52","2","5","3","215","1","聞こし召すやうも","浮舟のことをさす。『完訳』は「匂宮の秘事にさりげなく迫る」と注す。"
"52","2","5","5","216","1","これも","薫をさす。"
"52","2","5","5","217","1","いとかうは","以下「をこなり」まで、薫の心中の思い。『集成』は「匂宮に奪られた女のことを、宮の前で嘆くのは間抜けなこと、という気持」と注す。"
"52","2","5","5","218","1","けしきのいささか乱り顔なるを","薫のやや取り乱した態度。"
"52","2","5","5","219","1","あやしくいとほしと思せど","『集成』は「浮舟との秘事を知られたか、とようやくこのあたりで気づく体」と注す。"
"52","2","5","6","220","1","いとあはれなることにこそ","以下「聞きはべりしかばなむ」まで、匂宮の詞。"
"52","2","5","6","221","1","思ひはべりながら","大島本は「思侍なから」とある。『集成』『完本』は諸本に従って「思ひたまへながら」を校訂する。『新大系』は底本のまま「思侍ながら」とする。"
"52","2","5","7","222","1","いと堪へがたければ","主語は匂宮。"
"52","2","5","8","223","1","さる方にても","以下「参り通ふべきゆゑはべりしかば」まで、薫の詞。『完訳』は「あなたのしかるべき相手として。匂宮の愛人として紹介したかったとする。匂宮への痛烈な皮肉」と注す。"
"52","2","5","8","224","1","思ひたまへりし","大島本は「思給へりし」とある。『集成』『完本』は諸本に従って「思ひたまへし」と「り」を削除する。『新大系』は底本のまま「思給へりし」とする。"
"52","2","5","8","225","1","人になむ","係助詞「なむ」の下に「ありける」などの語句が省略。"
"52","2","5","8","226","1","宮にも参り通ふべきゆゑ","「ゆゑ」は理由。中君と浮舟は異母姉妹の関係。"
"52","2","5","10","227","1","御心地例ならぬほどは","以下「おはしませ」まで、薫の詞。"
"52","2","5","10","228","1","すぞろなる世のこと聞こし召し入れ","大島本は「すそろなる」とある。『集成』『完本』は諸本に従って「すずろなる」と校訂する。『新大系』は底本のまま「すぞろなる」とする。『集成』は「つまらぬ世間話をお耳にあそばし、お心を騒がせられますのもよろしくないことですございます。暗に、浮舟の死をそう嘆かれますな、と言い、それゆえの病と察していることを仄めかす」と注す。"
"52","2","5","10","229","1","あいなきこと","大島本は「あいなきこと」とある。『集成』『完本』は諸本に従って「あいなきわざ」と校訂する。『新大系』は底本のまま「あいなきこと」とする。"
"52","2","6","1","230","1","いみじくも思したりつるかな","以下「かからじ」まで、薫の心中の思い。"
"52","2","6","1","231","1","高き人の宿世なりけり","『完訳』は「高貴な匂宮に愛された点で浮舟をすぐれた宿運の人とみる。前の女房たちと同じ見方」と注す。"
"52","2","6","1","232","1","見たまふ人とても","『集成』は「妻となさる方とても、並一通りではなく。正夫人の六の君、側室の中の君、それぞれ一方ならずすばらしい女性である」と注す。"
"52","2","6","1","233","1","これに","浮舟に。"
"52","2","6","1","234","1","この人を思すゆかりの御心地のあやまりに","『完訳』は「実は、浮舟に執心するあまりの錯乱だった、と薫は合点」と注す。"
"52","2","6","2","235","1","この人のらうたくおぼゆる方は劣りやはしつる","『集成』は「この人（浮舟）がいとしく思われたことでは（匂宮に）劣っていただろうか。以下、高貴の身の自分からも、宮に劣らず思われる浮舟の宿世に感嘆する気持」と注す。"
"52","2","6","2","236","1","今はと","浮舟は今は亡き人と。"
"52","2","6","2","237","1","かからじ","『集成』は「もう嘆くまい」と訳す。"
"52","2","6","4","238","1","人木石に非ざれば皆情けあり","薫の詞。「人は木石に非ず、皆情有り、如かず、傾城の色に遇はざらんには」（白氏文集・李夫人）の一節。"
"52","2","6","6","239","1","後のしたためなども","浮舟の葬送の儀式。"
"52","2","6","6","240","1","宮にも","『完訳』は「匂宮。一説には中の君」と注す。"
"52","2","6","6","241","1","母のなほなほしく","以下「こと削ぐなりけむかし」まで、薫の想像。浮舟の母は八宮の女房中将の君、現在は受領の北の方という低い身分。"
"52","2","6","6","242","1","兄弟あるはなど","『完訳』は「兄弟のある人は葬儀を簡略にするとの風習」と注す。"
"52","2","6","7","243","1","長籠もりしたまはむも便なし","以下「心苦し」まで、薫の思い。宇治に行き三十日間の忌籠もりをするのは不都合と考える。"
"52","3","1","1","244","1","月たちて","四月となる。"
"52","3","1","1","245","1","今日ぞ渡らましと","薫の思い。四月十日が引っ越しの日であった。"
"52","3","1","1","246","1","思し出でたまふ","大島本は「おほしいて給」とある。『集成』『完本』は諸本に従って「思ひ出たまふ」を校訂する。『新大系』は底本のまま「おぼし出で給」とする。"
"52","3","1","1","247","1","御前近き橘の香のなつかしきに","『集成』は「五月待つ花橘の香をかげば昔の人の袖の香ぞする」（古今集夏、一三九、読人しらず）を指摘。"
"52","3","1","1","248","1","宿に通はば","薫の口ずさみ。『源氏釈』は「亡き人の宿に通はばほととぎすかけて音にのみ泣くと告げなむ」（古今集哀傷、八五五、読人しらず）を指摘。"
"52","3","1","1","249","1","北の宮に","二条院をいう。薫邸は三条宮。"
"52","3","1","1","250","1","渡りたまふ日なりければ","主語は薫。"
"52","3","1","2","251","2","忍び音や君も泣くらむかひもなき--死出の田長に心通はば","薫から匂宮への贈歌。『河海抄』は「いくばくの田を作ればかほととぎすしでの田長朝な朝な呼ぶ」（古今集雑体、一〇一三、藤原敏行）。『花鳥余情』は「死出の山越えて来つらむほととぎす恋しき人のうへ語らなむ」（拾遺集哀傷、一三〇七、伊勢）を指摘。"
"52","3","1","3","252","1","あはれと思して","大島本は「あはれとおほして」とある。『集成』『完本』は諸本に従って「いとあはれに」と校訂する。『新大系』は底本のまま「あはれと」とする。"
"52","3","1","3","253","1","二所","匂宮と中君。"
"52","3","1","3","254","1","けしきある文かなと見たまひて","『完訳』は「浮舟のことをほのめかしたと気づく」と注す。"
"52","3","1","4","255","2","橘の薫るあたりはほととぎす--心してこそ鳴くべかりけれ","匂宮の返歌。『全書』は「五月待つ花橘の香をかげば昔の人の袖の香ぞする」（古今集夏、一三九、読人しらず）を指摘。"
"52","3","1","7","256","1","このことのけしきは","夫の匂宮と浮舟との関係及び浮舟の死。"
"52","3","1","7","257","1","あはれにあさましき","以下「それもいつまで」まで、中君の心中の思い。"
"52","3","1","7","258","1","我一人もの思ひ知らねば","姉の大君や妹の浮舟と比較して。"
"52","3","1","7","259","1","隔てたまふも","大島本は「へたて給も」とある。『集成』『完本』は諸本に従って「隔てたまへるも」と校訂する。『新大系』は底本のまま「隔て給も」とする。"
"52","3","1","8","260","1","隠したまひしがつらかりし","匂宮の詞。『完訳』は「中君が浮舟の素姓や境遇を」と注す。"
"52","3","1","9","261","1","異人よりは睦ましくあはれなり","浮舟は中君と姉妹ゆえに。"
"52","3","1","9","262","1","ことことしくうるはしくて","六条院の様子。"
"52","3","1","9","263","1","例ならぬ御ことのさまも","婿の匂宮の病気。"
"52","3","1","9","264","1","おどろき惑ひたまふ所にては","主語は夕霧。"
"52","3","1","9","265","1","父大臣兄の君たち","六君の父大臣夕霧や兄弟の公達。"
"52","3","1","9","266","1","ここはいと心やすくて","匂宮の本邸二条院。正妻のいる六条院と比較。"
"52","3","2","1","267","1","いと夢のやうにのみ","『完訳』は「以下、匂宮の心中。いまだに浮舟の死が信じられない。「なほ」は「いぶせければ」にかかる」と注す。"
"52","3","2","1","268","1","右近を迎へに遣はす","時方や道定をして宇治に右近を迎えにやる。"
"52","3","2","1","269","1","母君も","浮舟母。その葬儀には立ち合った。"
"52","3","2","2","270","1","頼もしき者にて","主語は宇治の人々。"
"52","3","2","2","271","1","入り来たれば","主語は匂宮の使者たち。"
"52","3","2","2","272","1","あやにくに","以下「なりにしよ」まで、時方らの感想。『完訳』は「皮肉にも、今にして思えば最後の対面の機会だったのに、宮を邸内に導くことができなかった。以下、時方たちの回想である」と注す。"
"52","3","2","3","273","1","さるまじきことを思ほし焦がるること","時方らの感想。"
"52","3","2","3","274","1","おはしましし","主語は匂宮。"
"52","3","2","3","275","1","抱かれたてまつりたまひて","「れ」受身の助動詞。主語は浮舟。"
"52","3","2","4","276","1","かくのたまはせて御使になむ参りつる","大島本は「まいりつる」とある。『集成』『完本』は諸本に従って「参り来つる」と「き」を補訂する。『新大系』は底本のまま「まいりつる」とする。時方の詞。"
"52","3","2","6","277","1","今さらに","以下「語りきこえまほしき」まで、右近の詞。"
"52","3","2","6","278","1","聞こし召し明らむばかり","主語は匂宮。"
"52","3","2","6","279","1","あからさまにもなむ","大島本は「あからさまにもなん」とある。『集成』『完本』は諸本に従って「あからさまにものになん」と校訂する。『新大系』は底本のまま「あからさまにもなん」とする。『完訳』は「京に用事がと言いつくろっても、おかしくない時期を待って」と注す。"
"52","3","2","6","280","1","げにいと夢のやうなりしことども","匂宮の「いと夢のやうにのみ」を受ける。使者が伝えたのであろう。"
"52","3","2","6","281","1","語りきこえまほしき","大島本は「かたりきこえまほしき」とある。『集成』『完本』は諸本に従って「語りきこえさせはべらまほしき」と「させはべら」を補訂する。『新大系』は底本のまま「語りきこえまほしき」とする。"
"52","3","3","1","282","1","大夫も泣きて","左衛門大夫時方。"
"52","3","3","2","283","1","さらにこの御仲の","以下「まさりてなむ」まで、時方の詞。"
"52","3","3","2","284","1","物の心","大島本は「物の心」とある。『集成』『完本』は諸本に従って「ものの心も」と「も」を補訂する。『新大系』は底本のまま「物の心」とする。"
"52","3","3","2","285","1","君たちをも","右近や侍従。"
"52","3","3","2","286","1","言ふかひなく悲しき御こと","浮舟の死をさしていう。"
"52","3","3","2","287","1","私の御心ざしもなかなか深さまさりて","『集成』は「浮舟存生中は、主命による奉公だったが、もはやそれもないかと思うとかえって、の意」と注す。"
"52","3","3","4","288","1","わざと御車など","以下「参りたまへ」まで、時方の詞。"
"52","3","3","4","289","1","思しめぐらして","主語は匂宮。"
"52","3","3","4","290","1","今一所にても","侍従をさしていう。"
"52","3","3","6","291","1","さは参りたまへ","右近が侍従に言った詞。"
"52","3","3","8","292","1","まして何事をかは","大島本は「なに事をかハ」とある。『集成』『完本』は諸本に従って「何ごとをか」と「は」を削除する。『新大系』は底本のまま「何事をかは」とする。"
"52","3","3","10","293","1","悩ませたまふ御響きに","以下「参りたまへ」まで、時方の詞。"
"52","3","3","10","294","1","残りの日","忌明けまでの残りの日数。"
"52","3","3","11","295","1","ありし御さまも","匂宮の姿。橘小島に同行した折の印象。"
"52","3","3","11","296","1","いかならむ世にかは見たてまつらむ、かかる折に","侍従の心中の思い。匂宮にお目にかかれる機会を思う。"
"52","3","4","1","297","1","裳はただ今我より上なる人なきにうちたゆみて","『完訳』は「裳は、唐衣とともに、主人の前に出る際の礼装。今はお仕えする主人も亡くなったので、油断して鈍色のを染めておかなかった」と注す。"
"52","3","4","1","298","1","薄色なるを持たせて参る","『集成』は「薄紫色の裳を持たせて参上する。お供の女の童などに持たせるのであろう」と注す。"
"52","3","4","2","299","1","おはせましかば","以下「心寄せきこえしものを」まで、侍従の心中の思い。「ましかば--まし」反実仮想の構文。浮舟が生きていたら。"
"52","3","4","2","300","1","忍びて出でたまはまし","主語は浮舟。匂宮に密かに京へ連れ出されたろうに、と仮想。"
"52","3","4","2","301","1","人知れず心寄せきこえしものを","主語は侍従。匂宮に対して。"
"52","3","4","3","302","1","女君には","中君。"
"52","3","4","3","303","1","寝殿におはしまして渡殿に降ろしたまへり","大島本は「おろし給へり」とある。『集成』『完本』は諸本に従って「おろさせたまへり」と校訂する。『新大系』は底本のまま「おろし給へり」とする。『集成』は「ご自身は寝殿においでになって。中の君のいる西の対にいたのを、侍従到着と聞いて、自室（寝殿）に赴いたのである。侍従を渡殿に降ろさせなさった。寝殿の東の渡殿に車を着けさせたのであろう。西の対から遠く、人目にも付かぬよう計らう体」と注す。"
"52","3","4","4","304","1","あやしきまで","以下「なむはべりし」まで、侍従の詞。"
"52","3","4","4","305","1","かく心強きさまに","浮舟の入水という事件をさす。"
"52","3","4","5","306","1","さるべきにても","大島本は「さるへきにても」とある。『集成』『完本』は諸本に従って「さるべきにて」と「も」を削除する。『新大系』は底本のまま「さるべきにても」とする。以下「溺れけむ」まで、匂宮の心中の思い。『集成』は「詮方もない病気で」。『完訳』は「避けられぬ前世の因縁によって病死することなどよりも」と注す。"
"52","3","4","5","307","1","これを見つけて","浮舟の入水現場を見つけて。"
"52","3","4","6","308","1","御文を焼き","以下「はべらざりけむ」まで、侍従の詞。"
"52","3","4","7","309","1","かの巻数に書きつけたまへりし","浮舟の母へ返書として巻数に書きつけた。"
"52","3","5","1","310","1","御覧ぜざりし人も","侍従をさす。"
"52","3","5","2","311","1","わがもとに","以下「離るべくやは」まで、匂宮の詞。"
"52","3","5","2","312","1","あなたももて離るべくやは","「あなた」は中君をさす。浮舟の異母姉であることをいう。反語表現。"
"52","3","5","4","313","1","さてさぶらはむに","以下「過ぐして」まで、侍従の詞。"
"52","3","5","4","314","1","この御果てなど","一周忌。"
"52","3","5","5","315","1","またも参れ","匂宮の詞。"
"52","3","5","6","316","1","暁帰るに","大島本は「あか月」とある。『集成』『完本』は諸本に従って「暁に」と「に」を補訂する。『新大系』は底本のまま「あか月」とする。"
"52","3","5","6","317","1","かの御料に","浮舟をさす。"
"52","3","5","6","318","1","贈物にせさせたまふ","匂宮が侍従に持たせる。"
"52","3","5","6","319","1","さまざまにせさせたまふことは","『一葉抄』は「双紙詞也」と指摘。"
"52","3","5","7","320","1","なに心もなく","以下「わざかな」まで、侍従の感想。"
"52","3","5","10","321","1","かかる御服にこれをばいかでか隠さむ","大島本は「いかてか」とある。『集成』『完本』は諸本に従って「いかで」と「か」を削除する。『新大系』は底本のまま「いかでか」とする。侍従の感想。"
"52","4","1","1","322","1","大将殿もなほ","『完訳』は「「なほ」とあり、前に宇治行を決しかねていた気持が揺曳」と注す。"
"52","4","1","2","323","1","いかなる契りにて","以下「思ひ知らするなめり」まで、薫の心中の思い。『集成』は「世の無常を悟らせようとするのであろう」。『完訳』は「仏が懲らしめようとする」と訳す。"
"52","4","1","2","324","1","かかる思ひかけぬ","大島本は「かゝる」とある。『集成』『完本』は諸本に従って「かく」と校訂する。『新大系』は底本のまま「かゝる」とする。"
"52","4","1","4","325","1","ありけむさまも","以下「はかなくなりたまひにし」まで、薫の詞。浮舟の死にいたるまでの経緯。"
"52","4","1","5","326","1","尼君なども","以下「わづらはしう」あたりまで、右近の心中の思い。"
"52","4","1","5","327","1","あやしきことの筋にこそ","匂宮との関係。『集成』は「不埒なこと」。『完訳』は「匂宮との秘密の情事」と注す。"
"52","4","2","1","328","1","あさましう思しかけぬ筋なるに","入水事件をさす。"
"52","4","2","2","329","1","さらにあらじと","以下「いふにかあらむ」まで、薫の心中の思い。"
"52","4","2","2","330","1","いかなるさまに","『集成』は「入水ではなくて、匂宮がどこかへ隠しているのではないか、と疑う」と注す。"
"52","4","2","2","331","1","言ふにか","大島本は「いふにか」とある。『集成』『完本』は諸本に従って「言ふにかあらむ」と「あらむ」を補訂する。『新大系』は底本のまま「言ふにか」とする。"
