Volume,Chapter,Paragraph,Line,LineId,Text
35,1,1,1,35010101,"    Kojiju~'s answer was not unreasonable,"
35,1,1,2,35010102, and yet it seemed rather brusque. Was there to be nothing more? Might he not hope for some word from the princess herself?
35,1,1,3,35010103," He seemed in danger of doing grave disservice to Genji, whom he so liked and admired."
35,1,1,4,35010104,"    On the last day of the Third Month there was a large gathering at the Rokujo~ mansion. Kashiwagi did not want to attend, but presently decided that he might feel a little less gloomy under the blossoms where the Third Princess lived."
35,1,1,5,35010105," There was to have been an archery meet in the Second Month, but it had been canceled, and in the Third Month the court was in retreat. Everyone was always delighted to hear that something was happening at Rokujo~. The two generals, Higekuro and Yu~giri, were of course present, both of them being very close to the Rokujo~ house, and all their subordinates were to be present as well. It had been announced as a competition at kneeling archery, but events in standing archery were also included, so that several masters of the sport who were to be among the competitors might show their skills."
35,1,1,6,35010106," The bowmen were assigned by lot to the fore and after sides. Evening came, and the last of the spring mists seemed somehow to resent it. A pleasant breeze made the guests even more reluctant to leave the shade of the blossoms. It may have been that a few of them had had too much to drink."
35,1,1,7,35010107,"     ""Very fine prizes,""  said someone. ""They show so nicely the tastes of the ladies who chose them. And who really wants to see a soldier battering a willow branch with a hundred arrows in a row?* We much prefer a mannerly meet of the sort we are here being treated to."""
35,1,1,8,35010108,"    The two generals, Higekuro and Yu~giri, joined the other officers in the archery court. Kashiwagi seemed very thoughtful as he took up his bow. Yu~giri noticed and was worried."
35,1,1,9,35010109,
35,1,1,10,35010110," He could not, he feared, tell himself that the matter did not concern him. He and Kashiwagi were close friends, alive to each other's moods as friends seldom are. One of them knew immediately when the smallest shadow had crossed the other's spirits."
35,1,1,11,35010111,    Kashiwagi was afraid to look at Genji.
35,1,1,12,35010112, He knew that he was thinking forbidden thoughts. He was always concerned to behave with complete correctness and much worried about appearances. What then was he to make of so monstrous a thing as this?
35,1,1,13,35010113,
35,1,1,14,35010114," He thought of the princess's cat and suddenly longed to have it for himself. He could not share his unhappiness with it, perhaps, but he might be less lonely."
35,1,1,15,35010115, The thought became an obsession. Perhaps he could steal it--but that would not be easy.
35,1,2,1,35010201,"    He visited his sister at court, hoping that she would help him forget his woes. She was an extremely prudent lady who allowed him no glimpse of her. It did seem odd that his own sister should be so careful to keep up the barriers when the Third Princess had let him see her; but his feelings did not permit him to charge her with loose conduct."
35,1,2,2,35010202,"    He next called on the crown prince, the Third Princess's brother. There must, he was sure, be a family resemblance. No one could have called the crown prince devastatingly handsome, but such eminence does bestow a certain air and bearing."
35,1,2,3,35010203," The royal cat had had a large litter of kittens, which had been put out here and there. One of them, a very pretty little creature, was scampering about the crown prince's rooms. Kashiwagi was of course reminded of the Rokujo~ cat."
35,1,2,4,35010204,"     ""The Third Princess has a really fine cat. You would have to go a very long way to find its rival. I only had the briefest glimpse, but it made a deep impression on me."""
35,1,2,5,35010205,"    Very fond of cats, the crown prince asked for all the details. Kashiwagi perhaps made the Rokujo~ cat seem more desirable than it was."
35,1,2,6,35010206,"     ""It is a Chinese cat, and Chinese cats are different. All cats have very much the same disposition, I suppose, but it does seem a little more affectionate than most. A perfectly charming little thing."""
35,1,2,7,35010207,
35,1,2,8,35010208,"    The crown prince made overtures through the Akashi princess and presently the cat was delivered. Everyone was agreed that it was a very superior cat. Guessing that the crown prince meant to keep it, Kashiwagi waited a few days and paid a visit."
35,1,2,9,35010209," He had been a favorite of the Suzaku emperor's and now he was close to the crown prince, to whom he gave lessons on the koto and other instruments."
35,1,2,10,35010210,"     ""Such numbers of cats as you do seem to have. Where is my own special favorite?"""
35,1,2,11,35010211,    The Chinese cat was apprehended and brought in. He took it in his arms.
35,1,2,12,35010212,"     ""Yes, it is a handsome beast,""  said the crown prince, ""but it does not seem terribly friendly. Maybe it is not used to us. Do you really think it so superior to our own cats?"""
35,1,2,13,35010213,
35,1,2,14,35010214,"     ""Cats do not on the whole distinguish among people, though perhaps the more intelligent ones do have the beginnings of a rational faculty. But just look at them all, such swarms of cats and all of them such fine ones. Might I have the loan of it for a few days?"""
35,1,2,15,35010215,    He was afraid that he was being rather silly. But he had his cat.
35,1,2,16,35010216," He kept it with him at night, and in the morning would see to its toilet and pet it and feed it. Once the initial shyness had passed it proved to be a most affectionate animal. He loved its way of sporting with the hem of his robe or entwining itself around a leg. Sometimes when he was sitting at the veranda lost in thought it would come up and speak to him.
     ""What an insistent little beast you are.""  He smiled and stroked its back."
35,1,2,17,35010217," ""You are here to remind me of someone I long for, and what is it you long for yourself?"
35,1,2,18,35010218," We must have been together in an earlier life, you and I."""
35,1,2,19,35010219,"    He looked into its eyes and it returned the gaze and mewed more emphatically. Taking it in his arms, he resumed his sad thoughts."
35,1,2,20,35010220,"     ""Now why should a cat all of a sudden dominate his life?""  said one of the women. ""He never paid much attention to cats before."""
35,1,2,21,35010221,"    The crown prince asked to have the cat back, but in vain. It had become Kashiwagi's constant and principal companion."
35,1,3,1,35010301,"    Tamakazura still felt closer to Yu~giri than to her brothers and sisters. She was a sensitive and affectionate lady and when he came calling she received him without formality. He particularly enjoyed her company because his sister, the crown princess, rather put him off."
35,1,3,2,35010302," Higekuro was devoted to his new wife and no longer saw his old wife, Prince Hyo~bu's daughter. Since Tamakazura had no daughters, he would have liked to bring Makibashira into the house, but Prince Hyo~bu would not hear of it."
35,1,3,3,35010303, Makibashira at least must not become a laughingstock.
35,1,3,4,35010304,
35,1,3,5,35010305," Prince Hyo~bu was a highly respected man, one of the emperor's nearest advisers,* and no request of his was refused. A vigorous man with lively modern tastes, he stood so high in the general esteem that he was only less in demand than Genji and To~ no Chu~jo~."
35,1,3,6,35010306," It was commonly thought that Higekuro would be equally important one day. People were of course much interested in his daughter, who had many suitors. The choice among them would be Prince Hyo~bu's to make. He was interested in Kashiwagi and thought it a pity that Kashiwagi should be less interested in Makibashira than in his cat."
35,1,3,7,35010307," She was a bright, modern sort of girl. Because her mother was still very much at odds with the world, she turned more and more to Tamakazura, her stepmother."
35,1,4,1,35010401,    Prince Hotaru was still single. The ladies he had so energetically courted had gone elsewhere. He had lost interest in romantic affairs and did not want to invite further ridicule.  Yet bachelorhood was too much of a luxury. He let it be known that he was not uninterested in Makibashira.
35,1,4,2,35010402,"     ""I think he would do nicely,""  said Prince Hyo~bu. ""People generally say that the next-best thing after sending a daughter to court is finding a prince for her. I think it rather common and vulgar, the rush these days to marry daughters off to mediocrities who have chiefly their seriousness to recommend them."""
35,1,4,3,35010403,  He accepted Prince Hotaru's proposal without further ado.
35,1,4,4,35010404,"    Prince Hotaru was somewhat disappointed. He had expected more of a challenge. Makibashira was not a lady to be spurned, however, and it was much too late to withdraw his proposal. He visited her and was received with great ceremony by Prince Hyo~bu's household."
35,1,4,5,35010405,"     ""I have many daughters,""  said Prince Hyo~bu,"
35,1,4,6,35010406," ""and they have caused me nothing but trouble. You might think that by now I would have had enough. But Makibashira at least I must do something for. Her mother is very odd and only gets odder. Her father has not been allowed to manage her affairs and seems to want no part of them. It is all very sad for her."""
35,1,4,7,35010407,    He supervised the decorations and went to altogether more trouble than most princes would have thought necessary.
35,1,5,1,35010501,"    Prince Hotaru had not ceased to grieve for his dead wife. He had hoped for a new wife who looked exactly like her. Makibashira was not unattractive, but she did not resemble the other lady. Perhaps it was because of disappointment that he so seldom visited her."
35,1,5,2,35010502,"    Prince Hyo~bu was surprised and unhappy. In her lucid moments, the girl's mother could see what was happening, and sigh over their sad fate, hers and her daughter's."
35,1,5,3,35010503," Higekuro, who had been opposed to the match from the outset, was of course very displeased. It was as he had feared and half expected. Prince Hotaru had long been known for a certain looseness and inconstancy."
35,1,5,4,35010504," Now that she had evidence so near at hand, Tamakazura looked back to her maiden days with a mixture of sadness and amusement, and wondered what sort of troubles Genji and To~ no Chu~jo~ would now be facing if she had accepted Hotaru's suit. Not that she had had much intention of doing so."
35,1,5,5,35010505,"        She had seemed to encourage him only because of his very considerable ardor, and it much shamed her to think that she might have seemed even a little eager. And now her stepdaughter was his wife."
35,1,5,6,35010506," What sort of things would he be telling her? But she did what she could for the girl, whose brothers were in attendance on her as if nothing had gone wrong.
    Prince Hotaru for his part had no intention of abandoning her, and he did not at all like what her sharp-tongued grandmother was saying."
35,1,5,7,35010507,"     ""One marries a daughter to a prince in the expectation that he will give her his undivided attention. What else is there to make up for the fact that he does not amount to much?"""
35,1,5,8,35010508,"     ""This seems a bit extreme,""  said Prince Hotaru, missing his first wife more than ever. ""I loved her dearly, and yet I permitted myself an occasional flirtation on the side, and I do not remember that I ever had to listen to this sort of thing."""
35,1,5,9,35010509,"    He withdrew more and more to the seclusion of his own house, where he lived with memories.
    A year passed, and two years. Makibashira was reconciled to her new life. It was the marriage she had made for herself, and she did not complain."
35,2,1,1,35020101,"    And more years went by, on the whole uneventfully. The reign was now in its eighteenth year.*"
35,2,1,2,35020102,"    The emperor had no sons. He had long wanted to abdicate and had not kept the wish a secret. ""A man never knows how many years he has ahead of him. I would like to live my own life, see the people I want to see and do what I want to do."""
35,2,1,3,35020103,"    After some days of a rather painful indisposition he suddenly abdicated. It was a great Pity, everyone said, that he should have taken the step while he was still in the prime of life; but the crown prince was now a grown man and affairs of state passed smoothly into his hands."
35,2,1,4,35020104,    To~ no Chu~jo~ submitted his resignation as chancellor and withdrew to the privacy of his own house.
35,2,1,5,35020105," ""Nothing in this world lasts forever,""  he said, ""and when so wise an emperor retires no one need have any regrets at seeing an old graybeard turn in his badge and keys."""
35,2,1,6,35020106,"    Higekuro became Minister of the Right, in effective charge of the government. His sister would now be the empress-mother if she had lived long enough. She had not been named empress and she had been overshadowed by certain of her rivals."
35,2,1,7,35020107," The eldest son of the Akashi princess* was named crown prince. The designation was cause for great rejoicing, though no one was much surprised. Yu~giri was named a councillor of the first order. He and the new minister were the closest of colleagues and the best of friends."
35,2,1,8,35020108,"    Genji lamented in secret that the abdicated emperor, who now moved into the Reizei Palace, had no sons. Genji's worries had passed and his great sin had gone undetected, and he stood in the same relationship to the crown prince as he would have stood to a Reizei son. Yet he would have been happier if the succession had gone through the Reizei emperor. These regrets were of course private. He shared them with no one."
35,2,1,9,35020109,"    The Akashi princess had several children and was without rivals for the emperor's affection. There was a certain dissatisfaction abroad that yet another Genji+ lady seemed likely to be named empress.
    Akikonomu was more grateful to Genji as the years went by, for she knew that without him she would have been nothing."
35,2,1,10,35020110," It was now much easier for the Reizei emperor to see Genji, and he was far happier than when he had occupied the throne."
35,2,2,1,35020201,"    The new emperor was most solicitous of the Third Princess, his sister. Genji paid her due honor, but his love was reserved for Murasaki, in whom he could see no flaw. It was an ideally happy marriage, closer and fonder as the years went by."
35,2,2,2,35020202,"    Yet Murasaki had been asking most earnestly that he let her become a nun. ""My life is a succession of trivialities. I long to be done with them and turn to things that really matter. I am old enough to know what life should be about. Do please let me have my way."""
35,2,2,3,35020203,
35,2,2,4,35020204,"     ""I would not have thought you heartless enough to suggest such a thing. For years now I have longed to do just that, but I have held back because I have hated to think what the change would mean to you. Do try to imagine how things would be for you if I were to have my way."""
35,2,2,5,35020205,
35,2,2,6,35020206,"    The Akashi princess was fonder of Murasaki than of her real mother, but the latter did not complain. She was an undemanding woman and she knew that her future would be peaceful and secure in quiet service to her daughter."
35,2,2,7,35020207," The old Akashi nun needed no encouragement to weep new tears of joy. Red from pleasant weeping, her eyes proclaimed that a long life could be a happy one."
35,2,3,1,35020301,"    The time had come, thought Genji, to thank the god of Sumiyoshi. The Akashi princess too had been contemplating a pilgrimage. Genji opened the box that had come those years before from Akashi. It was stuffed with very grand vows indeed."
35,2,3,2,35020302," Towards the prosperity of the old monk's line the god was to be entertained every spring and autumn with music and dancing. Only someone with Genji's resources could have seen to fulfilling them all. They were written in a flowing hand which told of great talent and earnest study, and the style was so strong and bold that the gods native and foreign must certainly have taken notice."
35,2,3,3,35020303," But how could a rustic hermit have been so imaginative? Genji was filled with admiration, even while thinking that the old man had somewhat over- reached himself. Perhaps a saint from a higher world had been fated to descend for a time to this one. He could not find it in him to laugh at the old man."
35,2,3,4,35020304,"    The vows were not made public. The pilgrimage was announced as Genji's own. He had already fulfilled his vows from those unsettled days on the seacoast, but the glory of the years since had not caused him to forget divine blessings. This time he would take Murasaki with him. He was determined that the arrangements be as simple as possible and that no one be inconvenienced. There were limits, however, to the simplicity permitted one of his rank, and in the end it proved to be a very grand progress."
35,2,4,1,35020401, All the high-ranking courtiers save only the ministers were in attendance. Guards officers of fine appearance and generally uniform height were selected for the dance troupe. Among those who did not qualify were some who thought themselves very badly used.
35,2,4,2,35020402," The most skilled of the musicians for the special Kamo and Iwashimizu festivals were invited to join the orchestra. There were two famed performers from among the guards musicians as well, and there was a large troupe of Kagura dancers."
35,2,4,3,35020403," The emperor, the crown prince, and the Reizei emperor all sent aides to be in special attendance on Genji. The horses of the grandees were caparisoned in infinite variety and all the grooms and footmen and pages and miscellaneous functionaries were in livery more splendid than anyone could remember."
35,2,4,4,35020404,"    The Akashi princess and Murasaki rode in the same carriage. The next carriage was assigned to the Akashi lady, and her mother was quietly shown to the place beside her. With them was the nurse of the Akashi days. The retinues were very grand, five carriages each for Murasaki and the Akashi princess and three for the Akashi lady."
35,2,4,5,35020405,"     ""If your mother is to come with us,""  said Genji, ""then it must be with full honors. We shall see to smoothing her wrinkles."""
35,2,4,6,35020406,
35,2,4,7,35020407,"     ""Are you quite sure you should be showing yourself on such a public occasion?""  the lady asked her mother. ""Perhaps when the very last of our prayers has been answered."" *"
35,2,4,8,35020408,"    But they could not be sure how long she would live, and she did so want to see everything. One might have said that she was the happiest of them all, the one most favored by fortune. For her the joy was complete."
35,2,5,1,35020501,"    It was late in the Tenth Month. The vines* on the shrine fence were red and there were red leaves beneath the pine trees as well, so that the services of the wind were not needed to tell of the advent of autumn.+ The familiar eastern music# seemed friendlier than the more subtle Chinese and Korean music. Against the sea winds and waves, flutes joined the breeze through the high pines of the famous grove with a grandeur that could only belong to Sumiyoshi. The quiet clapping that went with the koto was more moving than the solemn beat of the drums."
35,2,5,2,35020502," The bamboo of the flutes had been stained to a deeper green, to blend with the green of the pines.** The ingeniously fabricated flowers in all the caps seemed to make a single carpet with the flowers of the autumn fields."
35,2,5,3,35020503,"     ""The One I Seek""## came to an end and the young courtiers of the higher ranks all pulled their robes down over their shoulders as they descended into the courtyard, and suddenly a dark field seemed to burst into a bloom of pink and lavender. The crimson sleeves beneath, moistened very slightly by a passing shower, made it seem for a moment that the pine groves had become a grove of maples and that autumn leaves were showering down."
35,2,5,4,35020504," Great reeds that had bleached to a pure white swayed over the dancing figures, and the waves of white seemed to linger on when the brief dance was over and they had returned to their places."
35,2,6,1,35020601,"    For Genji, the memory of his time of troubles was so vivid that it might have been yesterday. He wished that To~ no Chu~jo~ had come with him. There was no one else with whom he could exchange memories."
35,2,6,2,35020602," Going inside, he took out a bit of paper and quietly got off a note to the old nun in the second carriage."
35,2,6,3,35020603,"              ""You and I remember--and who else?<br>             Only we can address these godly pines."""
35,2,6,4,35020604,"    Remembering that day, the old lady was in tears. That day: Genji had said goodbye to the lady who was carrying his daughter, and they had thought that they would not see him again. And the old lady had lived for this day of splendor! She wished that her husband could be here to share it, but would not have wanted to suggest that anything was lacking."
35,2,6,5,35020605,"              ""The aged fisherwife knows as not before<br>             That Sumiyoshi is a place of joy."""
35,2,6,6,35020606,"    It was a quick and spontaneous answer, for it would not do on such an occasion to seem sluggish. And this was the poem that formed in her heart:"
35,2,6,7,35020607,"               ""It is a day I never shall forget.<br>               This god of Sumiyoshi brings me joy."""
35,2,6,8,35020608,
35,2,7,1,35020701,"    The music went on through the night. A third-quarter moon shone clear above and the sea lay calm below; and in a heavy frost the pine groves too were white. It was a weirdly, coldly beautiful scene."
35,2,7,2,35020702," Though Murasaki was of course familiar enough with the music and dance of the several seasons, she rarely left the house and she had never before been so far from the city. Everything was new and exciting."
35,2,7,3,35020703,"          ""So white these pines with frost in the dead of night.<br>         Bedecked with sacred strands by the god himself?"""
35,2,7,4,35020704,"    She thought of Takamura musing upon the possibility that the great white expanse of Mount Hira had been hung out with sacred mulberry strands.* Was the frost a sign that the god had acknowledged their presence and accepted their offerings?
    This was the princess's poem:"
35,2,7,5,35020705,"        ""Deep in the night the frost has added strands<br>        To the sacred branches with which we make obeisance."""
35,2,7,6,35020706,    And Nakatsukasa's:+
35,2,7,7,35020707,"          ""So white the frost, one takes it for sacred strands<br>            And sees in it a sign of the holy blessing."""
35,2,7,8,35020708,"    There were countless others, but what purpose would be served by setting them all down? Each courtier thinks on such occasions that he has outdone all his rivals--but is it so? One poem celebrating the thousand years of the pine is very much like another."
35,2,8,1,35020801,"    There were traces of dawn and the frost was heavier. The Kagura musicians had had such a good time that response was coming before challenge. They were perhaps even funnier than they thought they were. The fires in the shrine courtyard were burning low. ""A thousand years""  came the Kagura refrain, and ""Ten thousand years,""  and the sacred branches waved to summon limitless prosperity for Genji's house."
35,2,8,2,35020802, And so a night which they longed to stretch into ten thousand nights came to an end. It seemed a pity to all the young men that the waves must now fall back towards home.
35,2,8,3,35020803, All along the line of carriages curtains fluttered in the breeze and the sleeves beneath were like a flowered tapestry spread against the evergreen pines. There were numberless colors for the stations and tastes of all the ladies. The footmen who set out refreshments on all the elegant stands were fascinated and dazzled.
35,2,8,4,35020804, For the old nun there was ascetic fare on a tray of light aloeswood spread with olive drab. People were heard to whisper that she had been born under happy stars indeed.
35,2,8,5,35020805,"    The progress to Sumiyoshi had been laden with offerings, but the return trip could be leisurely and meandering. It would be very tiresome to recount all the details."
35,2,8,6,35020806," Only the fact that the old Akashi monk was far away detracted from the pleasure. He had braved great difficulties and everyone admired him, but it is probable that he would have felt sadly out of place. His name had become synonymous with high ambitions, and his wife's with good fortune. It was she whom the Omi lady called upon for good luck in her gaming. ""Akashi nun!""  she would squeal as she shook her dice.  ""Akashi nun!"""
35,3,1,1,35030101,"    The Suzaku emperor had given himself up most admirably to the religious vocation. He had dismissed public affairs and gossip from his life, and it was only when the emperor, his son, came visiting in the spring and autumn that memories of the old days returned. Yet he did still think of his third daughter. Genji had taken charge of her affairs, but the Suzaku emperor had asked his son to help with the more intimate details. The emperor had named her a Princess of the Second Rank and increased her emoluments accordingly, and so life was for her ever more cheerful."
