Volume,Chapter,Paragraph,Line,LineId,Text
9,2,4,15,09020415,"      ""Bind the hem of my robe, to keep it within,<br>    The grieving soul that has wandered through the skies."" *"
9,2,4,16,09020416,"    It was not Aoi's voice, nor was the manner hers. Extraordinary--and then he knew that it was the voice of the Rokujo~ lady. He was aghast. He' had dismissed the talk as vulgar and ignorant fabrication, and here before his eyes he had proof that such things did actually happen. He was hor- rified and repelled."
9,2,4,17,09020417,"    ""You may say so. But I don't know who you are. Identify yourself."""
9,2,4,18,09020418,"    It was indeed she. ""Aghast"" --is there no stronger word? He waved the women back."
9,2,5,1,09020501,"    Thinking that these calmer tones meant a respite from pain, her mother came with medicine; and even as she drank it down she gave birth to a baby boy. Everyone was delighted, save the spirits that had been transferred to mediums. Chagrined at their failure, they were raising a great stir, and all in all it was a noisy and untidy scene. There was still the afterbirth to worry about."
9,2,5,2,09020502," Then, perhaps because of all the prayers, it too was delivered. The grand abbot of Hiei and all the other eminent clerics departed, looking rather pleased with themselves as they mopped their foreheads."
9,2,5,3,09020503," Sure that the worst was past after all the anxious days, the women allowed themselves a rest.
    The prayers went on as noisily as ever, but the house was now caught up in the happy business of ministering to a pretty baby."
9,2,5,4,09020504, It hummed with excitement on each of the festive nights. * Fine and unusual gifts came from the old emperor and from all the princes and high courtiers. Ceremonies honoring a boy baby are always interesting.
9,2,5,5,09020505,"    The Rokujo~ lady received the news with mixed feelings. She had heard that her rival was critically ill, and now the crisis had passed."
9,2,5,6,09020506," She was not herself. The strangest thing was that her robes were permeated with the scent of the poppy seeds burned at exorcisms. She changed clothes repeatedly and even washed her hair, but the odor persisted. She was overcome with self-loathing. And what would others be thinking? It was a matter she could discuss with no one. She could only suffer in distraught silence."
9,2,5,7,09020507,"    Somewhat calmer, Genji was still horrified at the unsolicited remarks he had had from the possessive spirit. He really must get off a note to the Rokujo~ lady. Or should he have a talk with her? He would find it hard to be civil, and he did not wish to hurt her. In the end he made do with a note."
9,2,5,8,09020508,"    Aoi's illness had been critical, and the strictest vigil must be continued. Genji had been persuaded to stop his nocturnal wanderings. He still had not really talked to his wife, for she was still far from normal. The child was so beautiful as to arouse forebodings, and preparations were already under way for a most careful and elaborate education. The minister was pleased with everything save the fact that his daughter had still not recovered. But he told himself that he need not worry. A slow convales- cence was to be expected after so serious an illness."
9,2,5,9,09020509,"    Especially around the eyes, the baby bore a strong resemblance to the crown prince, whom Genji suddenly felt an intense longing to see. He could not sit still. He had to be off to court."
9,2,5,10,09020510,"    ""I have been neglecting my duties,""  he said to the women, ""and am feeling rather guilty. I think today I will venture out. It would be good if I might see her before I go. I am not a stranger, you know."""
9,2,5,11,09020511,
9,2,5,12,09020512,"    ""Quite true, sir. You of all people should be allowed near. She is badly emaciated, I fear, but that is scarcely a reason for her to hide herself from you."""
9,2,5,13,09020513,    And so a place was set out for him at her bedside.
9,2,5,14,09020514," She answered from time to time, but in a very weak voice. Even so little, from a lady who had been given up for dead, was like a dream. He told her of those terrible days. Then he remembered how, as if pulling back from a brink, she had begun talking to him so volubly and so eagerly. A shudder of revulsion passed over him."
9,2,5,15,09020515,"    ""There are many things I would like to say to you, but you still seem very tired."""
9,2,5,16,09020516,    He even prepared medicine for her. The women were filled with admiration. When had he learned to be so useful?
9,2,5,17,09020517,"    She was sadly worn and lay as if on the border of death, pathetic and still lovely. There was not a tangle in her lustrous hair. The thick tresses that poured over her pillows seemed to him quite beyond compare. He gazed down at her, thinking it odd that he should have felt so dissatisfied with her over the years."
9,2,5,18,09020518,"    ""I must see my father, but I am sure I will not be needed long. How nice if we could always be like this. But your mother is with you so much, I have not wanted to seem insistent. You must get back your strength and move back to your own rooms. Your mother pampers you too much. That may be one reason why you are so slow getting well."""
9,2,5,19,09020519,    As he withdrew in grand court dress she lay looking after him as she had not been in the habit of doing.
9,2,6,1,09020601,"    There was to be a conference on promotions and appointments. The minister too set off for court, in procession with all his sons, each of them with a case to plead and determined not to leave his side."
9,2,6,2,09020602,"    The Sanjo~ mansion was almost deserted. Aoi was again seized with a strangling shortness of breath; and very soon after a messenger had been sent to court she was dead. Genji and the others left court, scarcely aware of where their feet were taking them. Appointments and promotions no longer concerned them."
9,2,6,3,09020603," Since the crisis had come at about midnight there was no possibility of summoning the grand abbot and his suffragans. Everyone had thought that the worst was over, and now of course everyone was stunned, dazed, wandering aimlessly from room to room, hardly knowing a door from a wall. Messengers crowded in with condolences, but the house was in such confusion that there was no one to receive them. The intensity of the grief was almost frightening."
9,2,6,4,09020604," Since malign spirits had more than once attacked the lady, her father ordered the body left as it was for two or three days in hopes that she might revive. The signs of death were more and more pronounced, however, and, in great anguish, the family at length accepted the truth."
9,2,6,5,09020605," Genji, who had private distress to add to the general grief, thought he knew as well as anyone ever would what unhappiness love can bring. Condolences even from the people most important to him brought no comfort. The old emperor, himself much grieved, sent a personal message; and so for the minister there was new honor, happiness to temper the sorrow. Yet there was no relief from tears."
9,2,6,6,09020606,"    Every reasonable suggestion was accepted toward reviving the lady, but, the ravages of death being ever more apparent, there was finally no recourse but to see her to Toribe Moor. There were many heartrending scenes along the way."
9,2,7,1,09020701," The crowds of mourners and priests invoking the holy name quite overflowed the wide moor. Messages continued to pour in, from the old emperor, of course, and from the empress and crown prince he great houses as well.
    The minister was desolate."
9,2,7,2,09020702," ""Now in my last years to be left behind could see him without sharing his sorrow."
9,2,7,3,09020703,
9,2,7,4,09020704,"    Grandly the services went on through the night, and as dawn came over the sky the mourners turned back to the city, taking with them only a handful of ashes."
9,2,7,5,09020705," Funerals are common enough, but Genji, who had not been present at many, was shaken as never before. Since it was late in the Eighth Month a quarter moon still hung in a sky that would have brought melancholy thoughts in any case; and the figure of his father-in-law, as if groping in pitch darkness, seemed proper to the occasion and at the same time indescribably sad.
    A poem came to his lips as he gazed up into the morning sky:"
9,2,7,6,09020706,"    ""Might these clouds be the smoke that mounts from her pyre?<br>     They fill my heart with feelings too deep for words."""
9,2,7,7,09020707,"    Back at Sanjo~, he was unable to sleep. He thought over their years together."
9,2,7,8,09020708," Why had he so carelessly told himself that she would one day understand? Why had he allowed himself silly flirtations, the smallest of them sure to anger her? He had let her carry her hostility to the grave. The regrets were strong, but useless."
9,2,7,9,09020709,"    It was as if in a trance that he put on the dull gray mourning robes. Had she outlived him, it occurred to him, hers would have been darker gray.*"
9,2,7,10,09020710,"        ""Weeds obey rules. Mine are the shallower hue.<br>        But tears plunge my sleeves into the deepest wells."""
9,2,7,11,09020711,"    He closed his eyes in prayer, a handsomer man in sorrow than in happiness. He intoned softly:"
9,2,7,12,09020712," ""Hail, Samantabhadra, in whose serene thoughts all is contained."" * The invocation seemed more powerful than from the mouth of the most reverend priest.
    There were tears in his eyes as he took the little boy up in his arms.
 ""What would we have to remember her by?"" + he whispered to himself. The sorrow would be worse if he did not have this child."
9,2,7,13,09020713,    Princess Omiya took to her bed in such a sad state that services were now commenced for her.
9,2,7,14,09020714," The preparations for memorial rites were the sadder for the fact that there had been so little warning. Parents grieve at the loss of the most ill-favored child, and the intensity of the grief in this case was not to be wondered at. The family had no other daughters. It was as if--it was worse than if the jewels upon the silken sleeve had been shattered to bits.#"
9,2,7,15,09020715,"    Genji did not venture forth even to Nijo~. He passed his days in tears and in earnest prayer. He did, it is true, send off a few notes."
9,2,7,16,09020716," The high priestess of Ise had moved to a temporary shrine in the guards' quarters of the palace. Making the girl's ritual purity her excuse, the Rokujo~ lady refused to answer. The world had not been kind to him, and now, gloomier than ever, he thought that if he had not had this new bond with the world he would have liked to follow what had for so long been his deepest inclinations and leave it entirely behind. But then he would think of the girl Murasaki at Nijo~."
9,2,7,17,09020717," He slept alone. Women were on duty nearby, but still he was lonely. Unable to sleep, he would say to himself: ""In autumn, of all the seasons."" * Summoning priests of good voice, he would have them chant the holy name; and the dawn sky would be almost more than he could bear."
9,2,7,18,09020718,"    In one of those late-autumn dawns when the very sound of the wind seems to sink to one's bones, he arose from a lonely, sleepless bed to see the garden enshrouded in mist. A letter was brought in, on dark blue-gray paper attached to a half-opened bud of chrysanthemum. In the best of taste, he thought. The hand was that of the Rokujo~ lady."
9,2,7,19,09020719,"    ""Do you know why I have been so negligent?"
9,2,7,20,09020720,"    ""I too am in tears, at the thought of her sad, short life.<br>        Moist the sleeves of you whom she left behind."
9,2,7,21,09020721,"    ""These autumn skies make it impossible for me to be silent."""
9,2,7,22,09020722,"    The hand was more beautiful than ever. He wanted to fling the note away from him, but could not. It seemed to him altogether too disingenu- ous. Yet he could not bring himself to sever relations. Poor woman, she seemed marked for notoriety."
9,2,7,23,09020723," No doubt Aoi had been fated to die. But anger rose again. Why had he seen and heard it all so clearly, why had it been paraded before him? Try though he might, he could not put his feelings toward the woman in order. He debated at great length, remem- bering too that perhaps he should hold his tongue out of respect for the high priestess."
9,2,7,24,09020724,"    But he finally decided that the last thing he wanted was to seem cold and insensitive. His answer was on soft, quiet purple."
9,2,7,25,09020725," ""You for your part will understand, I am sure, the reasons for this inexcusably long silence. You have been much on my mind, but I have thought it best to keep my distance."
9,2,7,26,09020726,"          ""We go, we stay, alike of this world of dew.<br>        We should not let it have such a hold upon us."
9,2,7,27,09020727,"    ""You too should try to shake loose. I shall be brief, for perhaps you will not welcome a letter from a house of mourning."""
9,2,7,28,09020728,
9,2,7,29,09020729,"    Now back at Rokujo~, she waited until she was alone to read the letter. Her conscience told her his meaning all too clearly. So he knew. It was too awful."
9,2,7,30,09020730," Surely no one had been more cruelly treated by fate than herself. What would the old emperor be thinking? He and her late husband, the crown prince, were brothers by the same mother, and they had been very close. The prince had asked his protection for their daughter, and he had replied that he would look upon the girl as taking the place of her father. He had repeatedly invited the lady and her daughter to go on living in the palace, but she held to a demanding view of the proprieties. And so she had found herself in this childish entanglement, and had succeeded in making a very bad name for herself."
9,2,7,31,09020731, She was still not feeling well.
9,2,7,32,09020732,"    In fact, the name she had made for herself was rather different. She had long been famous for her subtlety and refinement, and when her daughter moved to another temporary shrine, this one to the west of the city, all the details were tasteful and in the latest fashion. Genji was not surprised to hear that the more cultivated of the courtiers were making it their main business to part the dew-drenched grasses before the shrine. She was a lady of almost too good taste. If, wanting no more of love, she were to go with her daughter to Ise, he would, after all, miss her."
9,2,8,1,09020801,"    The memorial services were over, but Genji remained in seclusion for seven weeks. Pitying him in the unaccustomed tedium, To~ no Chu~jo~ would come and divert him with the latest talk, serious and trivial; and it seems likely that old Naishi was cause for a good laugh now and then."
9,2,8,2,09020802,"    ""You mustn't make fun of dear old Granny,"""
9,2,8,3,09020803,  said Genji; but he found stories of the old lady unfailingly amusing.
9,2,8,4,09020804,"    They would go over the list of their little adventures, on the night of a misty autumn moon, just past full, and others; and their talk would come around to the evanescence of things and they would shed a few tears."
9,2,8,5,09020805,"    On an evening of chilly autumn rains, To~ no Chu~jo~ again came calling. He had changed to lighter mourning and presented a fine, manly figure indeed, enough to put most men to shame."
9,2,8,6,09020806," Genji was at the railing of the west veranda, looking out over the frostbitten garden. The wind was high and it was as if his tears sought to compete with the driven rain."
9,2,8,7,09020807,"    ""Is she the rain, is she the clouds? Alas, I cannot say."" *"
9,2,8,8,09020808,"    He sat chin in hand. Were he himself the dead lady, thought To~ no Chu~jo~, his soul would certainly remain bound to this world. He came up to his friend. Genji, who had not expected callers, quietly smoothed his robes,"
9,2,8,9,09020809," a finely glossed red singlet under a robe of a deeper gray than To~ no Chu~jo~'s. It was the modest, conservative sort of dress that never seems merely dull.
    To~ no Chu~jo~ too looked up at the sky."
9,2,8,10,09020810,"    ""Is she the rain? Where in these stormy skies,"
9,2,8,11,09020811,"        To which of these brooding clouds may I look to find her?
"
9,2,8,12,09020812," Neither can I say,"""
9,2,8,13,09020813,"  he added, as if to himself."
9,2,8,14,09020814,"          ""It is a time of storms when even the clouds<br>         To which my lady has risen are blotted away."""
9,2,8,15,09020815,    Genji's grief was clearly unfeigned.
9,2,8,16,09020816," Very odd, thought To~ no Chu~jo~. Genji had so often been reproved by his father for not being a better husband, and the attentions of his father-in-law had made him very un- comfortable. There were circumstances, having largely to do with his nearness to Princess Omiya, which kept him from leaving Aoi completely; and so he had continued to wait upon her, making little attempt to hide his dissatisfaction. To~ no Chu~jo~ had more than once been moved to pity him in this unhappy predicament. And now it seemed that she had after all had a place in his affections, that he had loved and honored her."
9,2,8,17,09020817," To~ no Chu~jo~,s own sorrow was more intense for the knowledge. It was as if a light had gone out."
9,2,8,18,09020818,"    Gentians and wild carnations peeped from the frosty tangles. After To~ no Chu~jo~ had left, Genji sent a small bouquet by the little boy's nurse, Saisho~, to Princess Omiya, with this message:"
9,2,8,19,09020819,"          ""Carnations at the wintry hedge remind me<br>          Of an autumn which we leave too far behind."
9,2,8,20,09020820," Do you not think them a lovely color?"""
9,2,8,21,09020821,"    Yes, the smiling little ""wild carnation""  he now had with him was a treasure.
    The princess, less resistant to tears than the autumn leaves to the winds, had to have someone read Genji's note to her."
9,2,8,22,09020822,"    She sent this answer:
          ""I see them, and my sleeves are drenched afresh,
         The wild carnations at the wasted hedge."""
9,2,8,23,09020823,"    It was a dull time. He was sure that his cousin Princess Asagao, despite her past coolness, would understand his feelings on such an evening. He had not written in a long time, but their letters had always been irregularly spaced. His note was on azure Chinese paper."
9,2,8,24,09020824,"            ""Many a desolate autumn have I known,<br>          But never have my tears flowed as tonight."
9,2,8,25,09020825," Each year brings rains of autumn."" *"
9,2,8,26,09020826,"    His writing was more beautiful all the time, said her women, and see what pains he had taken. She must not leave the note unanswered.
    She agreed."
9,2,8,27,09020827," ""I knew how things must be on Mount Ouchi,+ but what was I to say?"
9,2,8,28,09020828,"         ""I knew that the autumn mists had faded away,<br>         And looked for you in the stormy autumn skies."""
9,2,8,29,09020829,"    That was all. It was in a faint hand which seemed to him--his imagination, perhaps--to suggest deep, mysterious things."
9,2,8,30,09020830," We do not often find in this world that the actuality is better than the anticipation, but it was Genji's nature to be drawn to retiring women."
9,2,8,31,09020831," A woman might be icy cold, he thought, but her affections, once awakened, were likely to be strengthened by the memory of the occasions that had called for reluctant sympa- thy. The affected, overrefined sort of woman might draw attention to herself, but it had a way of revealing flaws she was herself unaware of. He did not wish to rear his Murasaki after such a model. He had not forgotten to ask himself whether she would be bored and lonely without him, but he thought of her as an orphan he had taken in and did not worry himself greatly about what she might be thinking or doing, or whether she might be resentful of his outside activities."
9,2,8,32,09020832,"    Ordering a lamp, he summoned several of the worthier women to keep him company."
9,2,8,33,09020833," He had for some time had his eye on one Chu~nagon, but for the period of mourning had put away amorous thoughts. It seemed most civilized of him.
    He addressed them affectionately, though with careful politeness."
9,2,8,34,09020834," ""I have felt closer to you through these sad days. If I had not had you with me I would have been lonelier than I can think. We need not brood over what is finished, but I fear that difficult problems lie ahead of us."""
9,2,8,35,09020835,    They were in tears.
9,2,8,36,09020836," ""It has left us in the blackest darkness, "" said one of them, ""and the thought of how things will be when you are gone is almost too much to bear."""
9,2,8,37,09020837,"  She could say no more.
    Deeply touched, Genji looked from one to another."
9,2,8,38,09020838," ""When I am gone --how can that be? You must think me heartless. Be patient, and you will see that you are wrong. Though of course life is very uncertain."""
9,2,8,39,09020839,"  Tears came to his eyes as he looked into the lamplight. They made him if anything handsomer, thought the women."
9,2,8,40,09020840,"    Among them was a little girl, an orphan, of whom Aoi had been especially fond. He quite understood why the child should now be sadder than any of the others."
9,2,8,41,09020841," ""You must let me take care of you, Ateki."""
9,2,8,42,09020842,"  She broke into a violent sobbing. In her tiny singlet, a very dark gray, and her black cloak and straw-colored trousers, she was a very pretty little thing indeed."
9,2,8,43,09020843,"    Over and over again he asked the women to be patient. ""Those of you who have not forgotten--you must bear the loneliness and do what you can for the boy. I would find it difficult to come visiting if you were all to run off."""
9,2,8,44,09020844,"    They had their doubts. His visits, they feared, would be few and far  between. Life would indeed be lonely."
9,2,8,45,09020845,"    Avoiding ostentation, the minister distributed certain of Aoi's belongings to her women, after their several ranks: little baubles and trinkets, and more considerable mementos as well."
9,2,9,1,09020901,"    Genji could not remain forever in seclusion. He went first to his father's palace. His carriage was brought up, and as his retinue gathered an autumn shower swept past, as if it knew its time, and the wind that summons the leaves blew a great confusion of them to the ground; and for the sorrowing women the sleeves that had barely had time to dry were damp all over again."
9,2,9,2,09020902," Genji would go that night from his father's palace to Nijo~. Thinking to await him there, his aides and equerries went off one by one. Though this would not of course be his last visit, the gloom was intense."
9,2,9,3,09020903,"    For the minister and Princess Omiya, all the old sorrow came back. Genji left a note for the princess:"
9,2,9,4,09020904," ""My father has asked to see me, and I shall call upon him today. When I so much as set foot outside this house, I feel new pangs of grief, and I ask myself how I have survived so long. I should come in person to take my leave, I know, but I fear that I would quite lose control of myself. I must be satisfied with this note."""
9,2,9,5,09020905,"    Blinded with tears, the princess did not answer."
9,2,9,6,09020906,"    The minister came immediately. He dabbed at his eyes, and the women were weeping too."
9,2,9,7,09020907," There seemed nothing in the least false about Genji's own tears, which gave an added elegance and fineness of feature.
    At length controlling himself, the minister said:"
9,2,9,8,09020908," ""An old man's tears have a way of gushing forth at the smallest provocation, and I am unable to stanch the flow. Sure that I must seem hopelessly senile and incontinent, I have been reluctant to visit your royal father. If the subject arises, perhaps you can explain to him how matters are. It is painful, at the end of your life, to be left behind by a child."""
9,2,9,9,09020909,"  He spoke with great difficulty.
    Genji was weeping only less openly."
9,2,9,10,09020910," ""We all of course know the way of the world, that we cannot be sure who will go first and who will remain behind, but the shock of the specific instance is all the same hard to bear. I am sure that my father will understand."""
9,2,9,11,09020911,"    ""Well, then, perhaps you should go before it is too dark. There seems to be no letting up of the rain."""
9,2,9,12,09020912,"    Genji looked around at the rooms he was about to leave. Behind curtains, through open doors, he could see some thirty women in various shades of gray, all weeping piteously."
9,2,9,13,09020913,"    ""I have consoled myself,""  said the minister, ""with the thought that you are leaving someone behind in this house whom you cannot abandon, and that you will therefore find occasion to visit in spite of what has happened; but these not very imaginative women are morbid in their insistence that you are leaving your old home for good. It is natural that they should grieve for the passing of the years when they have seen you on such intimate and congenial terms, indeed that they should grieve more than for the loss of their lady. You were never really happy with her, but I was sure that things would one day improve, and asked them to hope for the not perhaps very hopeful. This is a sad evening."""
9,2,9,14,09020914,
9,2,9,15,09020915,"    ""You have chosen inadequate grounds for lamenting, sir. I may once have neglected you and your good lady, in the days when I too thought that a not very happy situation would improve. What could persuade me to neglect you now? You will see presently that I am telling you the truth."""
