Volume,Chapter,Paragraph,Line,LineId,Text
4,4,6,36,04040636,"    Koremitsu was in a panic. He should not have permitted this expedi- tion, however strong Genji's wishes. Dipping his hands in the river, he turned and made supplication to Kiyomizu."
4,4,6,37,04040637," Genji somehow pulled himself together. Silently invoking the holy name, he was seen back to Nijo~."
4,4,6,38,04040638,"    The women were much upset by these untimely wanderings. ""Very bad, very bad. He has been so restless lately. And why should he have gone out again when he was not feeling well?"""
4,4,6,39,04040639,"    Now genuinely ill, he took to his bed. Two or three days passed and he was visibly thinner. The emperor heard of the illness and was much alarmed. Continuous prayers were ordered in this shrine and that temple. The varied rites, Shinto and Confucian and Buddhist, were beyond count- ing. Genji's good looks had been such as to arouse forebodings. All through the court it was feared that he would not live much longer."
4,4,6,40,04040640," Despite his illness, he summoned Ukon to Nijo~ and assigned her rooms near his own. Koremitsu composed himself sufficiently to be of service to her, for he could see that she had no one else to turn to."
4,4,6,41,04040641," Choosing times when he was feeling better, Genji would summon her for a talk, and she soon was accustomed to life at Nijo~. Dressed in deep mourning, she was a somewhat stern and forbidding young woman, but not without her good points."
4,4,6,42,04040642,"    ""It lasted such a very little while. I fear that I will be taken too. It must be dreadful for you, losing your only support. I had thought that as long as I lived I would see to all your needs, and it seems sad and ironical that I should be on the point of following her."""
4,4,6,43,04040643,"  He spoke softly and there were tears in his eyes. For Ukon the old grief had been hard enough to bear, and now she feared that a new grief might be added to it."
4,4,6,44,04040644,"    All through the Nijo~ mansion there was a sense of helplessness. Emissaries from court were thicker than raindrops. Not wanting to worry his father, Genji fought to control himself. His father-in-law was extremely solicitous and came to Nijo~ every day. perhaps because of all the prayers and rites the crisis passed--it had lasted some twenty days--and left no ill effects."
4,4,6,45,04040645," Genji's full recovery coincided with the final cleansing of the defilement. With the unhappiness he had caused his father much on his mind, he set off for his apartments at court. For a time he felt out of things, as if he had come back to a strange new world."
4,4,7,1,04040701,"    By the end of the Ninth Month he was his old self once more. He had lost weight, but emaciation only made him handsomer. He spent a great deal of time gazing into space, and sometimes he would weep aloud. He must be in the clutches of some malign spirit, thought the women. It was all most peculiar."
4,4,7,2,04040702,    He would summon Ukon on quiet evenings.
4,4,7,3,04040703," ""I don't understand it at all. Why did she so insist on keeping her name from me? Even if she was a fisherman's daughter it was cruel of her to be so uncommunicative. It was as if she did not know how much I loved her."""
4,4,7,4,04040704,"    ""There was no reason for keeping it secret. But why should she tell you about her insignificant self? Your attitude seemed so strange from the beginning. She used to say that she hardly knew whether she was waking or dreaming. Your refusal to identify yourself, you know, helped her guess who you were. It hurt her that you should belittle her by keeping your name from her."""
4,4,7,5,04040705,"    ""An unfortunate contest of wills. I did not want anything to stand between us; but I must always be worrying about what people will say. I must refrain from things my father and all the rest of them might take me to task for. I am not permitted the smallest indiscretion. Everything is exaggerated so. The little incident of the 'evening faces' affected me strangely and I went to very great trouble to see her. There must have been a bond between us."
4,4,7,6,04040706," A love doomed from the start to be fleeting--why should it have taken such complete possession of me and made me find her so precious? You must tell me everything. What point is there in keeping secrets now? I mean to make offerings every week, and I want to know in whose name I am making them."""
4,4,7,7,04040707,"    ""Yes, of course--why have secrets now? It is only that I do not want to slight what she made so much of."
4,4,7,8,04040708," Her parents are dead. Her father was a guards captain. She was his special pet, but his career did not go well and his life came to an early and disappointing end. She somehow got to know Lord To~ no Chu~jo~--it was when he was still a lieutenant. He was very attentive for three years or so,"
4,4,7,9,04040709," and then about last autumn there was a rather awful threat from his father-in-law's house. She was ridiculously timid and it frightened her beyond all reason. She ran off and hid herself at her nurse's in the western part of the city. It was a wretched little hovel of a place. She wanted to go off into the hills, but the direction she had in mind has been taboo since New Year's. So she moved to the odd place where she was so upset to have you find her."
4,4,7,10,04040710," She was more reserved and withdrawn than most people, and I fear that her unwillingness to show her emotions may have seemed cold."""
4,4,7,11,04040711,    So it was true. Affection and pity welled up yet more strongly.
4,4,7,12,04040712,"    ""He once told me of a lost child. Was there such a one?"""
4,4,7,13,04040713,"    ""Yes, a very pretty little girl, born two years ago last spring."""
4,4,7,14,04040714,"    ""Where is she? Bring her to me without letting anyone know. It would be such a comfort. I should tell my friend To~ no Chu~jo~, I suppose, but why invite criticism? I doubt that anyone could reprove me for taking in the child. You must think up a way to get around the nurse."""
4,4,7,15,04040715,"    ""It would make me very happy if you were to take the child. I would hate to have her left where she is. She is there because we had no compe- tent nurses in the house where you found us."""
4,4,7,16,04040716,"    The evening sky was serenely beautiful. The flowers below the veranda were withered, the songs of the insects were dying too, and autumn tints were coming over the maples. Looking out upon the scene, which might have been a painting, Ukon thought what a lovely asylum she had found herself. She wanted to avert her eyes at the thought of the house of the ""evening faces.""  A pigeon called, somewhat discordantly, from a bamboo thicket. Remembering how the same call had frightened the girl in that deserted villa, Genji could see the little figure as if an apparition were there before him."
4,4,7,17,04040717,"    ""How old was she? She seemed so delicate, because she was not long for this world, I suppose."""
4,4,7,18,04040718,"    ""Nineteen, perhaps? My mother, who was her nurse, died and left me behind. Her father took a fancy to me, and so we grew up together, and I never once left her side. I wonder how I can go on without her."
4,4,7,19,04040719," I am almost sorry that we were so close.* She seemed so weak, but I can see now that she was a source of strength."""
4,4,7,20,04040720,"    ""The weak ones do have a power over us. The clear, forceful ones I can do without. I am weak and indecisive by nature myself, and a woman who is quiet and withdrawn and follows the wishes of a man even to the point of letting herself be used has much the greater appeal. A man can shape and mold her as he wishes, and becomes fonder of her all the while."""
4,4,7,21,04040721,"    ""She was exactly what you would have wished, sir.""  Ukon was in tears. ""That thought makes the loss seem greater."""
4,4,7,22,04040722,"    The sky had clouded over and a chilly wind had come up. Gazing off into the distance, Genji said softly:"
4,4,7,23,04040723,"      ""One sees the clouds as smoke that rose from the pyre,<br>        And suddenly the evening sky seems nearer."""
4,4,7,24,04040724,"    Ukon was unable to answer. If only her lady were here! For Genji even the memory of those fulling blocks was sweet.<br>    ""In the Eighth Month, the Ninth Month, the nights are long,"" * he whispered, and lay down."
4,5,1,1,04050101,"    The young page, brother of the lady of the locust shell, came to Nijo~ from time to time, but Genji no longer sent messages for his sister. She was sorry that he seemed angry with her and sorry to hear of his illness. The prospect of accompanying her husband to his distant province was a dreary one. She sent off a note to see whether Genji had forgotten her."
4,5,1,2,04050102,"    ""They tell me you have not been well."
4,5,1,3,04050103,"           ""Time goes by, you ask not why I ask not.<br>           Think if you will how lonely a life is mine."
4,5,1,4,04050104,"    ""I might make reference to Masuda Pond."" +"
4,5,1,5,04050105,    This was a surprise; and indeed he had not forgotten her. The uncertain hand in which he set down his reply had its own beauty.
4,5,1,6,04050106,"    ""Who, I wonder, lives the more aimless life."
4,5,1,7,04050107,"            ""Hollow though it was, the shell of the locust<br>           Gave me strength to face a gloomy world."
4,5,1,8,04050108,"    ""But only precariously."""
4,5,1,9,04050109,"    So he still remembered ""the shell of the locust.""  She was sad and at the same time amused."
4,5,1,10,04050110," It was good that they could correspond without rancor. She wished no further intimacy, and she did not want him to despise her."
4,5,1,11,04050111,"    As for the other, her stepdaughter, Genji heard that she had married a guards lieutenant. He thought it a strange marriage and he felt a certain pity for the lieutenant. Curious to know something of her feelings, he sent a note by his young messenger."
4,5,1,12,04050112,"    ""Did you know that thoughts of you had brought me to the point of expiring?<br>       ""I bound them loosely, the reeds beneath the eaves,#<br>         And reprove them now for having come undone."""
4,5,1,13,04050113,"    He attached it to a long reed.<br>    The boy was to deliver it in secret, he said. But he thought that the lieutenant would be forgiving if he were to see it, for he would guess who the sender was. One may detect here a note of self-satisfaction."
4,5,1,14,04050114,"    Her husband was away. She was confused, but delighted that he should have remembered her. She sent off in reply a poem the only excuse for which was the alacrity with which it was composed:"
4,5,1,15,04050115,"        ""The wind brings words, all softly, to the reed,<br>      And the under leaves are nipped again by the frost."""
4,5,1,16,04050116,"    It might have been cleverer and in better taste not to have disguised the clumsy handwriting. He thought of the face he had seen by lamplight. He could forget neither of them, the governor's wife, seated so primly before him, or the younger woman, chattering on so contentedly, without the smallest suggestion of reserve. The stirrings of a susceptible heart suggested that he still had important lessons to learn."
4,6,1,1,04060101,"    Quietly, forty-ninth-day services were held for the dead lady in the Lotus Hall on Mount Hiei. There was careful attention to all the details, the priestly robes and the scrolls and the altar decorations. Koremitsu's older brother was a priest of considerable renown, and his conduct of the services was beyond reproach."
4,6,1,2,04060102," Genji summoned a doctor of letters with whom he was friendly and who was his tutor in Chinese poetry and asked him to prepare a final version of the memorial petition. Genji had prepared a draft. In moving language he committed the one he had loved and lost, though he did not mention her name, to the mercy of Amita~bha."
4,6,1,3,04060103,"    ""It is perfect, just as it is. Not a word needs to be changed."""
4,6,1,4,04060104,"  Noting the tears that refused to be held back,"
4,6,1,5,04060105," the doctor wondered who might be the subject of these prayers. That Genji should not reveal the name, and that he should be in such open grief--someone, no doubt, who had brought a very large bounty of grace from earlier lives."
4,6,1,6,04060106,    Genji attached a poem to a pair of lady's trousers which were among his secret offerings:
4,6,1,7,04060107,"            ""I weep and weep as today I tie this cord.<br>           It will be untied in an unknown world to come."""
4,6,1,8,04060108,"    He invoked the holy name with great feeling. Her spirit had wandered uncertainly these last weeks. Today it would set off down one of the ways of the future.<br>    His heart raced each time he saw To~ no Chu~jo~. He longed to tell his friend that ""the wild carnation""  was alive and well; but there was no point in calling forth reproaches."
4,6,1,9,04060109,"    In the house of the ""evening faces,""  the women were at a loss to know what had happened to their lady. They had no way of inquiring. And Ukon too had disappeared. They whispered among themselves that they had been right about that gentleman, and they hinted at their suspicions to Koremitsu. He feigned complete ignorance, however, and continued to pursue his little affairs. For the poor women it was all like a nightmare. perhaps the wanton son of some governor, fearing To~ no Chu~jo~, had spirited her off to the country?"
4,6,1,10,04060110," The owner of the house was her nurse's daughter. She was one of three children and related to Ukon. She could only long for her lady and lament that Ukon had not chosen to enlighten them. Ukon for her part was loath to raise a stir, and Genji did not want gossip at this late date. Ukon could not even inquire after the child. And so the days went by bringing no light on the terrible mystery."
4,6,1,11,04060111,"    Genji longed for a glimpse of the dead girl, if only in a dream. On the day after the services he did have a fleeting dream of the woman who had appeared that fatal night. He concluded, and the thought filled him with horror, that he had attracted the attention of an evil spirit haunting the neglected villa."
4,7,1,1,04070101,"    Early in the Tenth Month the governor of iyo left for his post, taking the lady of the locust shell with him. Genji chose his farewell presents with great care. For the lady there were numerous fans,* and combs of beautiful workmanship, and pieces of cloth (she could see that he had had them dyed specially) for the wayside gods. He also returned her robe, ""the shell of the locust."""
4,7,1,2,04070102,"          ""A keepsake till we meet again, I had hoped,<br>         And see, my tears have rotted the sleeves away."""
4,7,1,3,04070103,"    There were other things too, but it would be tedious to describe them."
4,7,1,4,04070104, His messenger returned empty-handed. It was through her brother that she answered his poem.
4,7,1,5,04070105,"          ""Autumn comes, the wings of the locust are shed.<br>         A summer robe returns, and I weep aloud."""
4,7,1,6,04070106,"    She had remarkable singleness of purpose, whatever else she might have. It was the first day of winter. There were chilly showers, as if to mark the occasion and the skies were dark. He spent the day lost in thought."
4,7,1,7,04070107,"         ""The one has gone, to the other I say farewell.<br>         They go their unknown ways. The end of autumn."""
4,7,1,8,04070108,"    He knew how painful a secret love can be.<br>    I had hoped, out of deference to him, to conceal these difficult matters; but I have been accused of romancing, of pretending that because he was the son of an emperor he had no faults. Now, perhaps, I shall be accused of having revealed too much."