Volume,Chapter,Paragraph,Line,LineId,Text
19,4,2,5,19040205," The matter is one which can project its unhappy influence into the future. Silence is damaging for everyone concerned. I have reference to the late emperor, to your late mother, and to the Genji minister.
    ""I am old and of no account, and shall have no regrets if I am punished for the revelation.
    ""I humbly reveal to you what was first revealed to me through the Blessed One himself."
19,4,2,6,19040206," There were matters that deeply upset your mothere was carrying you within her. The details were rather beyond the grasp of a simple priest like myself. There was that unexpected crisis when the Genji minister was charged with a crime he had not committed. Your royal mother was even more deeply troubled, and I undertook yet more varied and elaborate services. The minister heard of them and on his own initiative commissioned the rites which I undertook upon Your Majesty's accession."""
19,4,2,7,19040207,  And he described them in detail.
19,4,2,8,19040208,    It was a most astounding revelation. The terror and the sorrow were beyond describing.
19,4,2,9,19040209," The emperor was silent for a time. Fearing that he had given offense, the old man started from the room."
19,4,2,10,19040210,"    ""No, Your Reverence. My only complaint is that you should have concealed the matter for so long. Had I gone to my grave ignorant of it, I would have had it with me in my next life. And is there anyone else who is aware of these facts?"""
19,4,2,11,19040211,
19,4,2,12,19040212,"    ""There are, I most solemnly assure you, two people and two people only who have ever known of them, Omyo~bu and myself. The fear and the awe have been all the worse for that fact. Now you will understand, perhaps, the continuing portents which have had everyone in such a state of disquiet. The powers above held themselves in abeyance while Your Majesty was still a boy, but now that you have so perfectly reached the age of discretion they are making their displeasure known. It all goes back to your parents. I had been in awful fear of keeping the secret. ""The old man was weeping. ""I have forced myself to speak of what I would much prefer to have forgotten."""
19,4,2,13,19040213,    It was full daylight when the bishop left.
19,4,2,14,19040214,    The emperor's mind was in turmoil. It was all like a terrible dream.
19,4,2,15,19040215," His reputed father, the old emperor, had been badly served, and the emperor was serving his real father badly by letting him toil as a common minister."
19,4,2,16,19040216, He lay in bed with his solitary anguish until the sun was high. A worried Genji came making inquiries. His arrival only added to the confusion in the emperor's mind. He was in tears.
19,4,2,17,19040217," More tears for his mother, surmised Genji, it being a time when there was no respite from tears."
19,4,2,18,19040218,
19,4,3,1,19040301," He must regretfully inform the emperor that Prince Shikibu* had just died. Another bit of the pattern, thought the emperor. Genji stayed with him all that day."
19,4,3,2,19040302,"    ""I have the feeling,""  said the emperor, in the course of quiet, intimate talk,"
19,4,3,3,19040303," ""that I am not destined to live a long life. I have a feeling too which I cannot really define that things are wrong, out of joint. There is a spirit of unrest abroad. I had not wished to upset my mother by subjecting her and all of you to radical change, but I really do think I would prefer a quieter sort of life."""
19,4,3,4,19040304,
19,4,3,5,19040305,"    ""It is out of the question. There is no necessary relationship between public order and the personal character of a ruler. In ages past we have seen the most deplorable occurrences in the most exemplary reigns. In China there have been violent upheavals during the reigns of sage emperors. Similar things have happened here. People whose time has come have died, and that is all. You are worrying yourself about nothing."""
19,4,3,6,19040306,    He described many precedents which it would not be proper for me to describe in my turn.
19,4,3,7,19040307,"    In austere weeds of mourning, so much more subdued than ordinary court dress, the emperor looked extraordinarily like Genji. He had long been aware of the resemblance, but his attention was called to it more forcibly by the story he had just heard. He wanted somehow to hint of it to Genji. He was still very young, however, and rather awed by Genji and fearful of embarrassing or displeasing him. Though it turned on matters far less important, their conversation was unusually warm and affectionate."
19,4,3,8,19040308,"    Genji was too astute not to notice and be puzzled by the change. He did not suspect, however, that the emperor knew the whole truth."
19,4,4,1,19040401,    The emperor would have liked to question Omyo~bu;
19,4,4,2,19040402," but somehow to bring her into this newest secret seemed a disservice to his mother and the secret she had guarded so long and so well. He thought of asking Genji, as if by way of nothing at all, whether his broad knowledge of history included similar examples,"
19,4,4,3,19040403," but somehow the occasion did not present itself. He pursued his own studies more diligently, going through voluminous Chinese and Japanese chronicles."
19,4,4,4,19040404," He found great numbers of such irregularities in Chinese history, some of which had come to the public notice and some of which had not. He could find none at all in Japanese history--but then perhaps they had been secrets as well guarded as this one. He found numerous examples of royal princes who had been reduced to common status and given the name of Genji and who, having become councillors and ministers, had been returned to royal status and indeed named as successors to the throne. Might not Genji's universally recognized abilities be sufficient reason for relinquishing the throne to him?"
19,4,4,5,19040405," The emperor turned the matter over and over in his mind, endlessly."
19,4,5,1,19040501,"    He had reached one decision, consulting no one: that Genji's appointment as chancellor would be on the autumn lists. He told Genji of his secret thoughts about the succession.
    So astonished that he could scarcely raise his eyes, Genji offered the most emphatic opposition."
19,4,5,2,19040502," ""Father, whatever may have been his reasons, favored me above all his other sons, but never did he consider relinquishing the throne to me. What possible reason would I now have for going against his noble intentions and taking for myself a position I have never coveted? I would much prefer to follow his clear wishes and be a loyal minister, and when you are a little older, perhaps, retire to the quiet pursuits I really wish for."""
19,4,5,3,19040503,"    To the emperor's very great disappointment, he was adamant in his refusal."
19,4,5,4,19040504,"    Then came the emperor's wish to appoint him chancellor. Genji had reasons for wishing to remain for a time a minister, however, and the emperor had to be content with raising him one rank and granting him the special honor of bringing his carriage in through the Great South Gate. The emperor would have liked to go a little further and restore him to royal status, but Genji's inclinations were against that honor as well."
19,4,5,5,19040505," As a prince he would not have the freedom he now had in advising the emperor, and who besides him was to perform that service? To~ no Chu~jo~ was a general and councillor. When he had advanced a step or two Genji might safely turn everything over him to him and, for better or worse, withdraw from public life."
19,4,5,6,19040506,    But there was something very odd about the emperor's behavior. Suspicions crossed Genji's mind.
19,4,5,7,19040507," If they were valid, then they had sad implications for the memory of Fujitsubo, and they suggested secret anguish on the part of the emperor."
19,4,5,8,19040508, Genji was overwhelmed by feelings of awed guilt. Who could have let the secret out?
19,4,5,9,19040509,"    Having become mistress of the wardrobe, Omyo~bu was now living in the palace. He went to see her."
19,4,5,10,19040510,"    Had Fujitsubo, on any occasion, allowed so much as a fragment of the secret to slip out in the emperor's presence?"
19,4,5,11,19040511,
19,4,5,12,19040512,"    ""Never, my lord, never. She lived in constant tenor that he might hear of it from someone else, and in terror of the secret itself, which might bring upon him the disfavor of the powers above."""
19,4,5,13,19040513,    Genji's longing for the dead lady came back anew.
19,5,1,1,19050101,"    Meanwhile Akikonomu's performance at court was above reproach. She served the emperor well and he was fond of her. She could be given perfect marks for her sensitivity and diligence, which to Genji were beyond pricing."
19,5,1,2,19050102, In the autumn she came to Nijo~ for a time. Genji had had the main hall polished and refitted until it quite glittered. He now stood unapologetically in the place of her father.
19,5,1,3,19050103,"    A gentle autumn rain was falling. The flower beds near the veranda were a riot of color, softened by the rain. Genji was in a reminiscent mood and his eyes were moist. He went to her apartments, a figure of wonderful courtliness and dignity in his dark mourning robes. The recent unsettling events had sent him into retreat. Though making no great show of it, he had a rosary in his hand."
19,5,2,1,19050201, He addressed her through only a curtain.
19,5,2,2,19050202,"    ""And so here are the autumn flowers again with their ribbons all undone. It has been a rather dreadful year, and it is somehow a comfort that they should come back, not one of them forgetting its proper time."""
19,5,2,3,19050203,"    Leaning against a pillar, he was very handsome in the evening light. ""When I think of her"" *--was the princess too thinking of her mother? He told her of the memories that had been so much with him these last days, and especially of how reluctant he had been to leave the temporary shrine that morning shortly before their departure for Ise."
19,5,2,4,19050204," He heard, and scarcely heard at all, a soft movement behind the curtains, and guessed that she was weeping. There was a touching delicacy in it. Once more he regretted that he was not permitted to look at her. (It is not entirely admirable, this sort of regret.)"
19,5,2,5,19050205,"    ""All my life I have made trouble for myself which I could have avoided, and gone on worrying about ladies I have been fond of. Among all the affairs in which, I fear, my impulsiveness has brought pain to others, two have continued to trouble me and refused to go away."
19,5,2,6,19050206,"    ""One was the case of your late mother. To the end she seems to have thought my behavior outrageous, and I have always known that to the end I shall be sorry. I had hoped that my being of service to you and enjoying your confidence as I hope I do might have comforted her. But it would seem that in spite of everything the smoke refused to clear, and I must continue to live with it."""
19,5,2,7,19050207,"    Two affairs, he had said; but he did not elaborate upon the second."
19,5,2,8,19050208,"    ""There were those years when I was lost to the world. Most of the unfinished business which I took with me has since been put in order, after a fashion. There is the lady in the east lodge, for instance: she has been rescued from her poverty and is living in peace and security. Her amiable ways are well known to everyone, most certainly to me, and I should say that in that quarter mutual understanding prevails."
19,5,2,9,19050209," That I am back in the city and able to be of some service to His Majesty is not, for me, a matter that calls for very loud congratulation. I am still unable to fight back the unfortunate tendencies of my earlier years as I would have wished. Are you aware, I wonder, that my services to you, such as they have been, have required no little self-control? I should be very disappointed indeed if you were to leave me with the impression that you have not guessed."""
19,5,2,10,19050210,    A heavy silence succeeded these remarks.
19,5,2,11,19050211,"    ""You must forgive me."""
19,5,2,12,19050212,  And he changed the subject.
19,5,2,13,19050213," ""How I wish that, for the remaining years that have been granted me, I might shut myself up in some retreat and lose myself in quiet preparations for the next world. My great regret would be that I would leave so little behind me. There is, as you may know, a girl, of such mean birth that the world cannot be expected to notice her. I wait with great impatience for her to grow up. I fear that it will seem inappropriate of me to say so, but it would give me much comfort to hope that you might number the prosperity of this house among your august concerns, and her, after I am gone, among the people who matter to you."""
19,5,2,14,19050214,
19,5,2,15,19050215,"    Her answer was but a word, so soft and hesitant that he barely caught it. He would have liked to take her in his arms. He stayed on, talking affectionately until it was quite dark."
19,5,3,1,19050301,"    ""But aside from house and family, it is nature that gives me the most pleasure, the changes through the seasons, the blossoms and leaves of autumn and spring, the shifting patterns of the skies. People have always debated the relative merits of the groves of spring and the fields of autumn, and had trouble coming to a conclusion."
19,5,3,2,19050302," I have been told that in China nothing is held to surpass the brocades of spring, but in the poetry of our own country the preference would seem to be for the wistful notes of autumn. I watch them come and go and must allow each its points, and in the end am unable to decide between song of bird and hue of flower."
19,5,3,3,19050303," I go further: within the limits allowed by my narrow gardens, I have sought to bring in what I can of the seasons, the flowering trees of spring and the flowering grasses of autumn, and the humming of insects that would go unnoticed in the wilds. This is what I offer for your pleasure. Which of the two, autumn or spring, is your own favorite?"""
19,5,3,4,19050304,"    He had chosen another subject which produced hesitation, but one on which silence would seem merely rude."
19,5,3,5,19050305,"    ""If Your Lordship finds it difficult to hand down a decision, how much more do I. It is as you say: some are of the one opinion and some of the other. Yet for me the autumn wind which poets have found so strange and compelling--in the dews I sense a fleeting link with my mother."" *"
19,5,3,6,19050306,    He found the very muteness and want of logic deeply touching.
19,5,3,7,19050307,"         ""Then we two feel alike. You know my secret:<br>          For me it is the autumn winds that pierce."
19,5,3,8,19050308,"    ""There are times when I find them almost more than I can bear."""
19,5,3,9,19050309,    How was she to answer? She made it seem that she had not understood. Somehow he was in a complaining mood this evening.
19,5,3,10,19050310," He caught himself just short of further indiscretion. She had every right to be unhappy with him, for he was behaving like a silly stripling. He sighed a heavy sigh, and even that rather put her off with its intrusive elegance."
19,5,3,11,19050311, She seemed to be inching away from him.
19,5,3,12,19050312,"    ""I have displeased you, and am sorry--though I doubt that most people of feeling would have been quite as displeased. Well, do not let the displeasure last. It could be very trying."""
19,5,3,13,19050313,    He went out.
19,5,3,14,19050314, Even the perfume that lingered on upset her.
19,5,3,15,19050315,"    ""What a scent he did leave on these cushions--just have a whiff. I can't find words to describe it.""  Her women were lowering the shutters."
19,5,3,16,19050316," ""He brings everything all together in himself, like a willow that is all of a sudden blooming like a cherry."
19,5,3,17,19050317," It sets a person to shivering."""
19,5,3,18,19050318,
19,5,4,1,19050401,"    He went to Murasaki's wing of the house. He did not go inside immediately, but, choosing a place on the veranda as far as possible from the lamps, lay for a time in thought. He exchanged desultory talk with several of her women."
19,5,4,2,19050402, He was thinking of love. Had those wild impulses still not left him?
19,5,4,3,19050403," He was too old for them, and angry with himself for the answer which the question demanded."
19,5,4,4,19050404," He had misbehaved grievously, but he had been young and unthinking, and was sure that he would by now have been forgiven. So he sought to comfort himself; and there was genuine comfort in the thought that he was at least more aware of the dangers than he once had been."
19,5,4,5,19050405,
19,5,4,6,19050406,"    Akikonomu was sorry that she had said as much as she had. Her remarks about the autumn must have sounded very poetic, and she should have held her tongue. She was so unhappy with herself that she was feeling rather tired. Genji's robustness had not seemed to allow for fatigue. He was behaving more all the time as if he were her father."
19,5,4,7,19050407,    He told Murasaki of this newly discovered preference for the autumn.
19,5,4,8,19050408," ""Certainly I can appreciate it. With you it is the early spring morning, and that too I understand. We must put together a really proper entertainment sometime to go with the blossoms and the autumn leaves. But I have been so busy. Well, it will not always be so. I will have what I want most, the life of the recluse. And will you be lonely, my dear? The possibility that you might is what really holds me back."""
19,5,4,9,19050409,
19,5,5,1,19050501,"    He still thought a great deal about the Akashi lady, but his life was so constricted that he could not easily visit her."
19,5,5,2,19050502," She seemed to have concluded that the bond between them meant nothing. By what right? Her refusal to leave the hills for a more conventional abode seemed to him a touch haughty. Yet he pitied her, and took every opportunity to attend services in his new chapel."
19,5,5,3,19050503," Oi only seemed sadder as she came to know it better, the sort of place that must have a melancholy effect on even the chance visitor. Genji's visits brought contradictory feelings: the bond between them was a powerful one, obviously, and it had meant unhappiness. She might have been better off without it. These are the sad thoughts which most resist consolation."
19,5,5,4,19050504,    The torches of the cormorant fishermen through the dark groves were like fireflies on a garden stream.
19,5,5,5,19050505,"    ""For someone not used to living beside the water,""  said Genji, ""I think it must be wonderfully strange and different."""
19,5,5,6,19050506,
19,5,5,7,19050507,"           ""The torches bobbing with the fisher boats<br>           Upon those waves have followed me to Oi."
19,5,5,8,19050508,"    ""The torches and my thoughts are now as they were then."""
19,5,5,9,19050509,    And he answered:
19,5,5,10,19050510,"           ""Only one who does not know deep waters<br>           Can still be bobbing, dancing on those waves."
19,5,5,11,19050511,"    ""Who, I ask you, has made whom unhappy?"""
19,5,5,12,19050512,  So he turned her gentle complaint against her.
19,5,5,13,19050513,"    It was a rime of relative leisure when Genji could turn his thoughts to his devotions. Because his visits were longer, the Akashi lady (or so one hears) was feeling somewhat happier with her lot."