Volume,Chapter,Paragraph,Line,LineId,Text
9,1,1,1,09010101," With the new reign Genji's career languished, and since he must be the more discreet about his romantic adventures as he rose in rank, he had less to amuse him. Everywhere there were complaints about his aloofness."
9,1,1,2,09010102,"    As if to punish him, there was one lady who continued to cause him pain with her own aloofness. Fujitsubo saw more of the old emperor, now abdicated, than ever. She was always at his side, almost as if she were a common housewife. Annoyed at this state of affairs, Kokiden did not follow the old emperor when he left the main palace. Fujitsubo was happy and secure. The concerts in the old emperor's palace attracted the attention of the whole court, and altogether life was happier for the two of them than while he had reigned. Only one thing was lacking: he greatly missed the crown prince, Fujitsubo's son, and worried that he had no strong backers. Genji, he said, must be the boy's adviser and guardian. Genji was both pleased and embarrassed."
9,1,1,3,09010103,"    And there was the matter of the lady at Rokujo~. With the change of reigns, her daughter, who was also the daughter of the late crown prince, had been appointed high priestess of the Ise Shrine. No longer trusting Genji's affections, the Rokujo~ lady had been thinking that, making the girl's youth her excuse, she too would go to Ise."
9,1,1,4,09010104,    The old emperor heard of her plans.
9,1,1,5,09010105," ""The crown prince was so very fond of her,""  he said to Genji, in open displeasure. ""It is sad that you should have made light of her, as if she were any ordinary woman. I think of the high priestess as one of my own children, and you should be good to her mother, for my sake and for the sake of the dead prince. It does you no good to abandon yourself to these affairs quite as the impulse takes you."
9,1,1,6,09010106,"    It was perfectly true, thought Genji. He waited in silence."
9,1,1,7,09010107,"    ""You should treat any woman with tact and courtesy, and be sure that you cause her no embarrassment. You should never have a woman angry with you."""
9,1,1,8,09010108,    What would his father think if he were to learn of Genji's worst indiscretion? The thought made Genji shudder. He bowed and withdrew.
9,1,1,9,09010109,"    The matter his father had thus reproved him for did no good for either of them, the woman or Genji himself. It was a scandal, and very sad for her. She continued to be very much on his mind, and yet he had no thought of making her his wife."
9,1,1,10,09010110," She had grown cool toward him, worried about the difference in their ages. He made it seem that it was because of her wishes that he stayed away. Now that the old emperor knew of the affair the whole court knew of it. In spite of everything, the lady went on grieving that he had not loved her better."
9,1,1,11,09010111,"    There was another lady, his cousin Princess Asagao.* Determined that she would not share the plight of the Rokujo~ lady, she refused even the briefest answer to his notes. Still, and he thought her most civil for it, she was careful to avoid giving open offense."
9,1,1,12,09010112,"    At Sanjo~, his wife and her family were even unhappier about his infidelities, but, perhaps because he did not lie to them, they for the most part kept their displeasure to themselves. His wife was with child and in considerable distress mentally and physically. For Genji it was a strange and moving time. Everyone was delighted and at the same time filled with apprehension, and all manner of retreats and abstinences were prescribed for the lady. Genji had little time to himself. While he had no particular wish to avoid the Rokujo~ lady and the others, he rarely visited them."
9,1,2,1,09010201,"    At about this time the high priestess of Kamo resigned. She was replaced by the old emperor's third daughter, whose mother was Kokiden. The new priestess was a favorite of both her brother, the new emperor, and her mother, and it seemed a great pity that she should be shut off from court life; but no other princess was qualified for the position. The installation ceremonies, in the austere Shinto tradition, were of great dignity and solemnity. Many novel details were added to the Kamo festival in the Fourth Month, so that it was certain to be the finest of the season."
9,1,2,2,09010202," Though the number of high courtiers attending the princess at the lustration+ was limited by precedent, great care was taken to choose handsome men of good repute. Similar care was given to their uniforms and to the uniform trappings of their horses. Genji was among the attendants, by special command of the new emperor."
9,1,2,3,09010203," Courtiers and ladies had readied their carriages far in advance, and Ichijo~ was a frightening crush, without space for another vehicle. The stands along the way had been appointed most elaborately. The sleeves that showed beneath the curtains fulfilled in their brightness and variety all the festive promise."
9,1,2,4,09010204,    Genji's wife seldom went forth on sightseeing expeditions and her pregnancy was another reason for staying at home.
9,1,2,5,09010205,"    But her young women protested. ""Really, my lady, it won't be much fun sneaking off by ourselves. Why, even complete strangers--why, all the country folk have come in to see our lord! They've brought their wives and families from the farthest provinces. It will be too much if you make us stay away."""
9,1,2,6,09010206,"    Her mother, Princess Omiya, agreed."
9,1,2,7,09010207," ""You seem to be feeling well enough, my dear, and they will be very disappointed if you don't take them."""
9,1,2,8,09010208,"    And so carriages were hastily and unostentatiously decked out, and the sun was already high when they set forth."
9,1,2,9,09010209," The waysides were by now too crowded to admit the elegant Sanjo~ procession. Coming upon several fine carriages not attended by grooms and footmen, the Sanjo~ men com- menced clearing a space. Two palm-frond carriages remained, not new ones, obviously belonging to someone who did not wish to attract attention. The curtains and the sleeves and aprons to be glimpsed beneath them, some in the gay colors little girls wear, were in very good taste."
9,1,2,10,09010210,"    The men in attendance sought to defend their places against the Sanjo~ invaders. ""We aren't the sort of people you push around."""
9,1,2,11,09010211,"    There had been too much drink in both parties, and the drunken ones were not responsive to the efforts of their more mature and collected seniors to restrain them."
9,1,2,12,09010212,"    The palm-frond carriages were from the Rokujo~ house of the high priestess of Ise. The Rokujo~ lady had come quietly to see the procession, hoping that it might make her briefly forget her unhappiness. The men from Sanjo~ had recognized her, but preferred to make it seem otherwise."
9,1,2,13,09010213,"    ""They can't tell us who to push and not to push,""  said the more intemperate ones to their fellows."
9,1,2,14,09010214," ""They have General Genji to make them feel important."""
9,1,2,15,09010215,"    Among the newcomers were some of Genji's men. They recognized and felt a little sorry for the Rokujo~ lady, but, not wishing to become involved, they looked the other way. presently all the Sanjo~ carriages were in place."
9,1,2,16,09010216," The Rokujo~ lady, behind the lesser ones, could see almost noth- ing. Quite aside from her natural distress at the insult, she was filled with the bitterest chagrin that, having refrained from display, she had been recognized. The stools for her carriage shafts had been broken and the shafts propped on the hubs of perfectly strange carriages, a most undig- nified sight. It was no good asking herself why she had come. She thought of going home without seeing the procession, but there was no room for her to pass;"
9,1,2,17,09010217," and then came word that the procession was approaching,"
9,1,2,18,09010218," and she must, after all, see the man who had caused her such unhappiness.
 How weak is the heart of a woman! perhaps because this was not ""the bamboo by the river Hinokuma,"" * he passed without stopping his horse or looking her way; and the unhappiness was greater than if she had stayed at home."
9,1,2,19,09010219,"    Genji seemed indifferent to all the grandly decorated carriages and all the gay sleeves, such a flood of them that it was as if ladies were stacked in layers behind the carriage curtains. Now and again, however, he would have a smile and a glance for a carriage he recognized. His face was solemn and respectful as he passed his wife's carriage. His men bowed deeply, and the Rokujo~ lady was in misery. She had been utterly defeated."
9,1,2,20,09010220,"    She whispered to herself:
         ""A distant glimpse of the River of Lustration.<br>          His coldness is the measure of my sorrow."""
9,1,2,21,09010221,    She was ashamed of her tears. Yet she thought how sorry she would have been if she had not seen that handsome figure set off to such advan- tage by the crowds.
9,1,2,22,09010222,"    The high courtiers were, after their several ranks, impeccably dressed and caparisoned and many of them were very handsome; but Genji's radiance dimmed the strongest lights. Among his special attendants was a guards officer of the Sixth Rank, though attendants of such standing were usually reserved for the most splendid royal processions. His retinue made such a fine procession itself that every tree and blade of grass along the way seemed to bend forward in admiration."
9,1,2,23,09010223,"    It is not on the whole considered good form for veiled ladies of no mean rank and even nuns who have withdrawn from the world to be jostling and shoving one another in the struggle to see, but today no one thought it out of place. Hollow-mouthed women of the lower classes, their hair tucked under their robes, their hands brought respectfully to their foreheads, were hopping about in hopes of catching a glimpse. plebeian faces were wreathed in smiles which their owners might not have enjoyed seeing in mirrors, and daughters of petty provincial officers of whose existence Genji would scarcely have been aware had set forth in carriages decked out with the most exhaustive care and taken up posts which seemed to offer a chance of seeing him. There were almost as many things by the wayside as in the procession to attract one's attention."
9,1,2,24,09010224,    And there were many ladies whom he had seen in secret and who now sighed more than ever that their station was so out of keeping with his.
9,1,2,25,09010225, Prince Shikibu viewed the procession from a stand.
9,1,2,26,09010226," Genji had matured and did indeed quite dazzle the eye, and the prince thought with foreboding that some god might have noticed, and was making plans to spirit the young man away."
9,1,2,27,09010227," His daughter, Princess Asagao, having over the years found Genji a faithful correspondent, knew how remarkably steady his feelings were."
9,1,2,28,09010228, She was aware that attentions moved ladies even when the donor was a most ordinary man;
9,1,2,29,09010229," yet she had no wish for further intimacy. As for her women, their sighs of admiration were almost deafening."
9,1,2,30,09010230,"    No carriages set out from the Sanjo~ mansion on the day of the festival proper.
    Genji presently heard the story of the competing carriages. He was sorry for the Rokujo~ lady and angry at his wife."
9,1,2,31,09010231," It was a sad fact that, so deliberate and fastidious, she lacked ordinary compassion. There was in- deed a tart, forbidding quality about her. She refused to see, though it was probably an unconscious refusal, that ladies who were to each other as she was to the Rokujo~ lady should behave with charity and forbearance. It was under her influence that the men in her service flung themselves so vio- lently about. Genji sometimes felt uncomfortable before the proud dignity of the Rokujo~ lady, and he could imagine her rage and humiliation now."
9,1,2,32,09010232,"    He called upon her. The high priestess, her daughter, was still with her, however, and, making reverence for the sacred _sakaki_ tree* her excuse, she declined to receive him.
    She was right, of course. Yet he muttered to himself: ""Why must it be so? Why cannot the two of them be a little less prickly?"""
9,1,3,1,09010301,"    It was from his Nijo~ mansion, away from all this trouble, that he set forth to view the festival proper. Going over to Murasaki's rooms in the west wing, he gave Koremitsu instructions for the carriages."
9,1,3,2,09010302,"    ""And are all our little ladies going too?"""
9,1,3,3,09010303,"  he asked. He smiled with pleasure at Murasaki, lovely in her festive dress."
9,1,3,4,09010304," ""We will watch it together."""
9,1,3,5,09010305,"  He stroked her hair, which seemed more lustrous than ever."
9,1,3,6,09010306," ""It hasn't been trimmed in a very long time. I wonder if today would be a good day for it."""
9,1,3,7,09010307,"  He summoned a soothsayer and while the man was investigating told the ""little ladies""  to go on ahead."
9,1,3,8,09010308,
9,1,3,9,09010309," They too were a delight, bright and fresh, their hair all sprucely trimmed and flowing over embroidered trousers."
9,1,3,10,09010310,"    He would trim Murasaki's hair himself, he said. ""But see how thick it is. The scissors get all tangled up in it. Think how it will be when you grow up. Even ladies with very long hair usually cut it here at the forehead, and you've not a single lock of short hair. A person might even call it untidy."""
9,1,3,11,09010311,
9,1,3,12,09010312,"    The joy was more than a body deserved, said Sho~nagon, her nurse."
9,1,3,13,09010313,"    ""May it grow to a thousand fathoms,""  said Genji."
9,1,3,14,09010314,"      th ""Mine it shall be, rich as the grasses beneath<br>        The fathomless sea, the thousand-fathomed sea."""
9,1,3,15,09010315,    Murasaki took out brush and paper and set down her answer:
9,1,3,16,09010316,"        ""It may indeed be a thousand fathoms deep.<br>        How can I know, when it restlessly comes and goes?"""
9,1,3,17,09010317,"    She wrote well, but a pleasant girlishness remained."
9,1,3,18,09010318,"    Again the streets were lined in solid ranks. Genji's party pulled up near the cavalry grounds, unable to find a place."
9,1,3,19,09010319,"    ""Very difficult,""  said Genji. ""Too many of the great ones hereabouts."""
9,1,3,20,09010320,    A fan was thrust from beneath the blinds of an elegant ladies' carriage that was filled to overflowing.
9,1,3,21,09010321,"    ""Suppose you pull in here,""  said a lady. ""I would be happy to relin- quish my place."""
9,1,3,22,09010322,    What sort of adventuress might she be? The place was indeed a good one. He had his carriage pulled in.
9,1,3,23,09010323,"    ""How did you find it? I am consumed with envy."""
9,1,3,24,09010324,    She wrote her reply on a rib of a tastefully decorated fan:
9,1,3,25,09010325,"        ""Ah, the fickleness! It summoned me<br>        To a meeting, the heartvine now worn by another.*"
9,1,3,26,09010326,"    ""The gods themselves seemed to summon me, though of course I am not admitted to the sacred precincts."""
9,1,3,27,09010327,"    He recognized the hand: that of old Naishi,+ still youthfully resisting the years.
    Frowning, he sent back:"
9,1,3,28,09010328,"        ""Yes, fickleness, this vine of the day of meeting,<br>          Available to all the eighty clans."""
9,1,3,29,09010329,"    It was her turn to reply, this time in much chagrin:"
9,1,3,30,09010330,"            ""Vine of meeting indeed! A useless weed,<br>          A mouthing, its name, of empty promises."""
9,1,3,31,09010331,"    Many ladies along the way bemoaned the fact that, apparently in feminine company, he did not even raise the blinds of his carriage."
9,1,3,32,09010332," Such a stately figure on the day of the lustration--today it should have been his duty to show himself at his ease. The lady with him must surely be a beauty.
    A tasteless exchange, thought Genji. A more proper lady would have kept the strictest silence, out of deference to the lady with him."
9,2,1,1,09020101,"    For the Rokujo~ lady the pain was unrelieved. She knew that she could expect no lessening of his coldness, and yet to steel herself and go off to Ise with her daughter--she would be lonely, she knew, and people would laugh at her. They would laugh just as heartily if she stayed in the city. Her thoughts were as the fisherman's bob at 1se.* Her very soul seemed to jump wildly about, and at last she fell physically ill."
9,2,1,2,09020102,    Genji discounted the possibility of her going to Ise.
9,2,1,3,09020103," ""It is natural that you should have little use for a reprobate like myself and think of discard- ing me. But to stay with me would be to show admirable depths of feeling."""
9,2,1,4,09020104,"    These remarks did not seem very helpful. Her anger and sorrow in- creased. A hope of relief from this agony of indecision had sent her to the river of lustration, and there she had been subjected to violence."
9,2,1,5,09020105,"    At Sanjo~, Genji's wife seemed to be in the grip of a malign spirit. It was no time for nocturnal wanderings. Genji paid only an occasional visit to his own Nijo~ mansion. His marriage had not been happy, but his wife was important to him and now she was carrying his child. He had prayers read in his Sanjo~ rooms."
9,2,1,6,09020106," Several malign spirits were transferred to the medium and identified themselves, but there was one which quite refused to move. Though it did not cause great pain, it refused to leave her for so much as an instant. There was something very sinister about a spirit that eluded the powers of the most skilled exorcists."
9,2,1,7,09020107, The Sanjo~ people went over the list of Genji's ladies one by one.
9,2,1,8,09020108," Among them all, it came to be whispered, only the Rokujo~ lady and the lady at Nijo~ seemed to have been singled out for special attentions, and no doubt they were jealous."
9,2,1,9,09020109," The exorcists were asked about the possibility, but they gave no very informa- tive answers. Of the spirits that did announce themselves, none seemed to feel any deep enmity toward the lady. Their behavior seemed random and purposeless. There was the spirit of her dead nurse, for instance, and there were spirits that had been with the family for generations and had taken advantage of her weakness.
    The confusion and worry continued. The lady would sometimes weep in loud wailing sobs, and sometimes be tormented by nausea and shortness of breath."
9,2,1,10,09020110,    The old emperor sent repeated inquiries and ordered religious services. That the lady should be worthy of these august attentions made the possibility of her death seem even more lamentable.
9,2,1,11,09020111," Reports that they quite monopolized the attention of court reached the Rokujo~ mansion, to further embitter its lady. No one can have guessed that the trivial incident of the carriages had so angered a lady whose sense of rivalry had not until then been strong."
9,2,2,1,09020201,"    Not at all herself, she left her house to her daughter and moved to one where Buddhist rites would not be out of place.* Sorry to hear of the move, Genji bestirred himself to call on her."
9,2,2,2,09020202," The neighborhood was a strange one and he was in careful disguise. He explained his negligence in terms likely to make it seem involuntary and to bring her forgiveness, and he told her of Aoi's+ illness and the worry it was causing him."
9,2,2,3,09020203,"    ""I have not been so very worried myself, but her parents are beside themselves. It has seemed best to stay with her. It would relieve me enormously if I thought you might take a generous view of it all."""
9,2,2,4,09020204,"  He knew why she was unwell, and pitied her."
9,2,2,5,09020205,    They passed a tense night. As she saw him off in the dawn she found that her plans for quitting the city were not as firm as on the day before.
9,2,2,6,09020206," Her rival was of the highest rank and there was this important new consideration; no doubt his affections would finally settle on her. She herself would be left in solitude, wondering when he might call."
9,2,2,7,09020207," The visit had only made her unhappier. In upon her gloom, in the evening, came a letter."
9,2,2,8,09020208,"    ""Though she had seemed to be improving, she has taken a sudden and drastic turn for the worse. I cannot leave her."""
9,2,2,9,09020209,"    The usual excuses, she thought. Yet she answered:"
9,2,2,10,09020210,"        ""I go down the way of love and dampen my sleeves,<br>        And go yet further, into the muddy fields."
9,2,2,11,09020211," A pity the well is so shallow."" *"
9,2,2,12,09020212,"    The hand was the very best he knew. It was a difficult world, which refused to give satisfaction. Among his ladies there was none who could be dismissed as completely beneath consideration and none to whom he could give his whole love.
    Despite the lateness of the hour, he got off an answer:"
9,2,2,13,09020213," ""You only wet your sleeves--what can this mean? That your feelings are not of the deepest, I should think."
9,2,2,14,09020214,"            "" You only dip into the shallow waters,<br>            And I quite disappear into the slough?"
9,2,2,15,09020215,"    ""Do you think I would answer by letter and not in person if she were merely indisposed?"""
9,2,2,16,09020216,
9,2,3,1,09020301,"    The malign spirit was more insistent, and Aoi was in great distress. Unpleasant rumors reached the Rokujo~ lady, to the effect that it might be her spirit or that of her father, the late minister."
9,2,3,2,09020302," Though she had felt sorry enough for herself, she had not wished ill to anyone; and might it be that the soul of one so lost in sad thoughts went wandering off by itself?"
9,2,3,3,09020303,
9,2,3,4,09020304," She had, over the years, known the full range of sorrows, but never before had she felt so utterly miserable. There had been no release from the anger since the other lady had so insulted her, indeed behaved as if she did not exist. More than once she had the same dream: in the beautifully appointed apartments of a lady who seemed to be a rival she would push and shake the lady, and flail at her blindly and savagely. It was too terrible."
9,2,3,5,09020305, Sometimes in a daze she would ask herself if her soul had indeed gone wandering off. The world was not given to speaking well of people whose transgressions had been far slighter. She would be notorious.
9,2,3,6,09020306," It was common enough for the spirits of the angry dead to linger on in this world. She had thought them hateful, and it was her own lot to set a hateful example while she still lived. She must think no more about the man who had been so cruel to her."
9,2,3,7,09020307," But so to think was, after all, to think.+"
9,2,4,1,09020401,"    The high priestess, her daughter, was to have been presented at court the year before, but complications had required postponement. It was finally decided that in the Ninth Month she would go from court to her temporary shrine. The Rokujo~ house was thus busy preparing for two lustrations, but its lady, lost in thought, seemed strangely indifferent. A most serious state of affairs--the priestess's attendants ordered prayers."
9,2,4,2,09020402," There were no really alarming symptoms. She was vaguely unwell, no more. The days passed. Genji sent repeated inquiries, but there was no relief from his worries about another invalid, a more important one."
9,2,4,3,09020403,"    It was still too early for Aoi to be delivered of her child. Her women were less than fully alert; and then, suddenly, she was seized with labor pains. More priests were put to more strenuous prayers. The malign spirit refused to move. The most eminent of exorcists found this stubbornness extraordinary, and could not think what to do. Then, after renewed efforts at exorcism, more intense than before, it commenced sobbing as if in pain."
9,2,4,4,09020404,"    ""Stop for a moment, please. I want to speak to General Genji."""
9,2,4,5,09020405,    It was as they had thought. The women showed Genji to a place at Aoi's curtains.
9,2,4,6,09020406," Thinking--for she did seem on the point of death--that Aoi had last words for Genji, her parents withdrew. The effect was grandly solemn as priests read from the Lotus Sutra in hushed voices."
9,2,4,7,09020407," Genji drew the curtains back and looked down at his wife. She was heavy with child, and very beautiful. Even a man who was nothing to her would have been saddened to look at her. Long, heavy hair, bound at one side, was set off by white robes, and he thought her lovelier than when she was most carefully dressed and groomed.
    He took her hand."
9,2,4,8,09020408," ""How awful. How awful for you."""
9,2,4,9,09020409,"  He could say no more.
    Usually so haughty and forbidding, she now gazed up at him with languid eyes that were presently filled with tears. How could he fail to be moved?"
9,2,4,10,09020410," This violent weeping, he thought, would be for her parents, soon to be left behind, and perhaps, at this last leave-taking, for him too."
9,2,4,11,09020411,"    ""You mustn't fret so. It can't be as bad as you think. And even if the worst comes, we will meet again. And your good mother and father: the bond between parents and children lasts through many lives. You must tell yourself that you will see them again."""
9,2,4,12,09020412,
9,2,4,13,09020413,"    ""No, no. I was hurting so, I asked them to stop for a while. I had not dreamed that I would come to you like this. It is true: a troubled soul will sometimes go wandering off."""
9,2,4,14,09020414,  The voice was gentle and affectionate.
