Volume,Chapter,Paragraph,Line,LineId,Text
19,1,1,1,19010101, Life was sadder on the banks of the Oi as winter came on.
19,1,1,2,19010102,"    ""This cannot continue,""  said Genji. ""You must move nearer."""
19,1,1,3,19010103,    But the Akashi lady did not want to observe at close hand the coldness of which she had heard from afar. It would be the end of everything.
19,1,1,4,19010104,"    ""I must make arrangements for the child, then. I have plans for her, and they would come to nothing if I were to leave her here. I have discussed the matter with the lady in the west wing at Nijo~, who is most anxious to see her.""  Murasaki might be asked, he said, to arrange unostentatiously for the ritual bestowing of trousers."
19,1,1,5,19010105,"    The Akashi lady had long known that something of the sort was on his mind. This declaration brought matters to a climax, while adding greatly to the uncertainty."
19,1,1,6,19010106," ""I have no doubt that you mean to treat her as if her mother were the noblest of your ladies, but of course people are sure to know who she really is, and behave accordingly."""
19,1,1,7,19010107,
19,1,1,8,19010108,"    ""You need not have the slightest fear that she will be mistreated. It is a matter of very great unhappiness for the lady at Nijo~ that after all these years she has no children of her own. The former high priestess of Ise is already a grown lady, and yet the Nijo~ lady insists on treating her like a child. She is sure to adore your little girl. That is her way."""
19,1,1,9,19010109, He perhaps exaggerated Murasaki's maternal tendencies a little.
19,1,1,10,19010110,"    Rumors of his amorous adventuring had reached Akashi, where there had been speculation upon the sort of grand love affair that might finally bring it to an end. Now it did seem to have vanished without a trace. The bond from an earlier life must be a very strong one, and the lady herself a paragon. She would think it most impertinent of the Akashi lady to come forward. Well, thought the latter, she must drive her own affairs from her mind, and think only of the child, whose future lay before her. In that Murasaki was best qualified to advise. Genji had said that the humane thing would be to take the child away while she was still an infant, and no doubt he was right."
19,1,1,11,19010111," Yet she would worry, she knew, and what would she now have to relieve the tedium of her days? What reason Would Genji have to pay her the briefest and rarest visit? The only thing which seemed certain in this web of uncertainty was that she had been born under unhappy stars."
19,1,2,1,19010201,"    She consulted her mother, a very wise old lady."
19,1,2,2,19010202,"    ""You fret over things that are so simple. It will not be easy to live without her, I know, but it is her interest we must consider, and it is her interest, I have no doubt at all, that His Lordship is most concerned about. You must put your trust in him and let her go. Even when a child has the emperor himself for its father, the mother's station in life makes all the difference. Look at the case of His Lordship. He was the handsomest and the most gifted of them all, and still he was made a commoner. His maternal grandfather was just not important enough, and his mother was one of the lesser ladies at court. And if there are these distinctions among princes, think how much more extreme they are among us commoners."
19,1,2,3,19010203," Even the daughter of a prince or a minister is at a great disadvantage if her mother's family does not have influence. Her father cannot do the things that one might expect from his rank. Your own little girl can look forward to only one thing if a daughter is born to one of the grand ladies: she will be forgotten. The ones with a chance in the world are the ones whose parents give them that chance. I don't care how much we spend on her, no one is going to pay the slightest attention off here in the hills. No, you must turn her over to His Lordship and see what he means to do for her."""
19,1,2,4,19010204,
19,1,2,5,19010205,"    Through well-placed friends she consulted renowned fortunetellers and it was their uniform opinion, to her considerable distress, that the child should be put in Murasaki's charge."
19,1,2,6,19010206," Genji had of course long been of that opinion, but had not wished to seem unreasonable or importunate."
19,1,2,7,19010207,"    What did she propose, asked Genji, in the matter of the bestowing of trousers?"
19,1,2,8,19010208,
19,1,2,9,19010209,"    ""It is of course as you say. It would be quite unfair to leave the child with a useless person like myself. And yet I fear for her. Might they not make fun of her if you were to take her away with you?"""
19,1,2,10,19010210,    He felt very sorry for her indeed.
19,1,2,11,19010211,"    He had a propitious day selected and quietly saw to arrangements for the move. The thought of giving up the child was almost more than the lady could bear, but she held herself under tight control, trying to keep everything from her mind but the future that was spreading before the child."
19,1,2,12,19010212,"    ""And so you must leave?""  she said to the nurse. ""You have been my comfort through the loneliness and boredom. I shall be quite lost without you."""
19,1,2,13,19010213,    The nurse too was in tears.
19,1,2,14,19010214," ""We must reconcile ourselves, my lady, to what must be. I shall not forget your unfailing kindness since we came together so unexpectedly, and I know that we shall continue to think of each other. I refuse to accept it as a final parting. The prospect of going out among strangers is very frightening, and my comfort will be the thought that we will soon be near each other again."""
19,1,2,15,19010215,    The Twelfth Month came.
19,1,3,1,19010301,"    There were snow and sleet to add to the gloom. What sort of legacy was hers from other lives, asked the lady, that she must put up with so much in this one? She spent more time than ever with the little girl, combing her hair, changing her clothes."
19,1,3,2,19010302," On a dark morning of drifting snows she went to the veranda and gazed out at the ice on the river, and thought of what was past and what was to come. It was not like her to expose herself so. She preferred the inner rooms of the house. Warmed by several soft white robes, she sat lost in thought; and the molding of her head and the flow of her hair and robes made her women feel sure that the noblest lady in the land could not be lovelier."
19,1,3,3,19010303,"    She brushed away a tear and said to the nurse: ""This sort of weather will be even more trying now."
19,1,3,4,19010304,"    ""These mountain paths will be closed by snow and clouds.<br>       Do not, I pray you, let your tracks be lost."""
19,1,3,5,19010305,    The nurse replied:
19,1,3,6,19010306,"          ""And were you to move to deepest Yoshino,<br>           I still would find you, through unceasing snow."""
19,1,3,7,19010307,
19,1,4,1,19010401,"    The snow had melted a little when Genji paid his next visit. She would have been delighted except for the fact that she knew its purpose. Well, she had brought it on herself."
19,1,4,2,19010402," The decision had been hers to make. Had she refused he would not have forced her to give up the child. She had made a mistake, but would not risk seeming mercurial and erratic by trying to rectify it at this late date."
19,1,4,3,19010403,"    The child was sitting before her, pretty as a doll."
19,1,4,4,19010404," Yes, she was meant for unusual things, one could not deny it."
19,1,4,5,19010405," Since spring her hair had been allowed to grow, and now, thick and flowing, it had reached the length that would be usual for a nun. I shall say nothing of the bright eyes and the glowing, delicately carved features. Genji could imagine the lady's anguish at sending her child off to a distant foster mother. Over and over again he Sought to persuade her that it was the only thing to do."
19,1,4,6,19010406,"    ""Please, you needn't. I will be happy if you see that she becomes something more than I have been myself."""
19,1,4,7,19010407,  But for all her valiant efforts at composure she was in tears.
19,1,4,8,19010408,"    The little girl jumped innocently into the waiting carriage, the lady having brought her as far as the veranda to which it had been drawn up. She tugged at her mother's sleeves and in charming baby talk urged her to climb in too."
19,1,4,9,19010409,"          ""It is taken away, the seedling pine, so young.<br>          When shall I see it grandly shading the earth?"""
19,1,4,10,19010410,    Her voice broke before she had come to the end.
19,1,4,11,19010411,"    She had every right to weep, thought Genji."
19,1,4,12,19010412,"          ""A seedling, yes, but with the roots to give<br>          The thousand years of the pines of Takekuma.*"
19,1,4,13,19010413,"    ""You must be patient."""
19,1,4,14,19010414,"    He was right, of course. She resumed the struggle, which was not entirely successful, to control herself.
    Only the nurse and a very personable young woman called Sho~sho~ got into the little girl's carriage, taking with them the sword which Genji had sent to Akashi+ and a sacred guardian doll. In a second carriage were several other handsome women and some little page girls. And so the Akashi lady saw them off."
19,1,4,15,19010415,"    Knowing how lonely she would be, Genji asked himself whether he was committing a crime for which he would one day be summoned to do penance."
19,1,5,1,19010501," It was dark when they reached Nijo~. He had feared that the suddenly lavish surroundings would intimidate these provincial women, but Murasaki had gone to a great deal of trouble. The west room of her west wing had been fitted most charmingly to resemble a doll's house. She assigned the nurse a room on the north side of the adjoining gallery."
19,1,5,2,19010502,"    The girl had slept most of the way. She did not weep as she was taken from the carriage. When sweets had been set before her, she looked around and saw that her mother was not with her. The puckered little face was very pretty. Her nurse sought to comfort her."
19,1,5,3,19010503,"    Genji's thoughts were on that mountain dwelling, where the gloom and tedium must be next to unbearable. But he had the child's education to think about."
19,1,5,4,19010504," A little jewel, quite flawless--and why had such a child not been born at Nijo~?"
19,1,5,5,19010505,
19,1,5,6,19010506,"    She wept and hunted for her mother; but she was of a docile, affectionate nature, and soon she had quite taken to Murasaki. For Murasaki it was as if her last wish had been granted. She was always taking the child in her arms, and soon she and the nurse were very close friends. A second nurse, a woman of good family, had by now joined the household."
19,1,5,7,19010507,"    Though no very lavish preparations were made for bestowing the trousers, the ceremony became of its own accord something rather special. The appurtenances and decorations were as if for the finest doll's house in the world. The stream of congratulatory visitors made no distinction between day and night--though one might not have found it remarkably different from the stream that was always pouring in and out of the Nijo~ mansion. The trousers cord,* everyone said, was the most charming little detail of all."
19,1,6,1,19010601,"    The Akashi lady went on thinking that she had brought gratuitous sorrow upon herself. Her mother had been so brave and confident; but old people weep easily, and she was weeping, though pleased at news that the child was the center of such attention. What could they send by way of congratulation? They contented themselves with robes for the nurse and the other women, hoping that the colors gave them a certain distinction."
19,1,6,2,19010602,"    Oi continued to be much on Genji's mind. It was just as she had thought it would be, the lady was no doubt saying to herself; and so he paid a quiet visit late in the year."
19,1,6,3,19010603," Oi was a lonely place at best, and she had lost her dearest treasure. He wrote constantly."
19,1,6,4,19010604," Murasaki's old bitterness had left her. She had the child, and the account was settled."
19,2,1,1,19020101,"    The New Year came. The skies were soft and pleasant and nothing seemed wanting at the Nijo~ mansion, which had been refurbished for the holidays. On the seventh day there was a continious stream of venerable and eminent callers,"
19,2,1,2,19020102," and younger people too, all the picture of prosperity. No doubt there were dissatisfactions beneath the surface, but it was a surface of contentment and pleasure."
19,2,1,3,19020103,"    The lady of the orange blossoms was very happy indeed in the east lodge. Her retinue was efficient and well mannered and the mere fact of being near Genji had changed her life enormously. Sometimes when he had nothing else to do he would look in on her, though never with the intention of staying the night."
19,2,1,4,19020104," She was an undemanding creature, and she asked nothing more. Her life was quiet, remarkably free of unsettling events, and as the seasonal observances came and went she had no reason to think that she was being slighted. In point of smooth and efficient service, indeed, she perhaps had the better of it over Murasaki."
19,2,2,1,19020201,"    He continued to worry about Oi and his inability to visit. Choosing a time when little was happening at court and taking more than usual care with his dress, he set off. His underrobes were beautifully dyed and scented, and over them he had thrown an informal court robe of white lined with red. Looking after him as he came to say goodbye, his radiance competing with the evening sunlight, Murasaki felt vaguely apprehensive."
19,2,2,2,19020202,"    The little girl clung to his trousers and seemed prepared to go with him.
    ""I've a twenty-acre field,""  he sang, looking fondly down at her, ""and I'll be back tomorrow."" *
    Chujo~ was waiting in the gallery with a poem from her mistress:"
19,2,2,3,19020203,"           ""We shall see if you are back tomorrow,<br>          If no one there essays to take your boat."""
19,2,2,4,19020204,"    Chu~jo~,s elocution was beautiful. He smiled appreciatively."
19,2,2,5,19020205,"          ""I go but for a while, and shall return<br>         Though she may wish I had not come at all."""
19,2,2,6,19020206,"    Murasaki no longer really thought a great deal about her rival. The little girl, scampering and tumbling about, quite filled her thoughts."
19,2,2,7,19020207," Yet she did feel for the Akashi lady, knowing how desperate her own loneliness would be in such circumstances."
19,2,2,8,19020208," Taking the little girl in her arms, she playfully offered one of her own small breasts. It was a charming scene. What had gone wrong? asked her women."
19,2,2,9,19020209, Why was Genji's daughter not hers? But such was the way of the world.
19,2,2,10,19020210,
19,2,2,11,19020211,
19,2,3,1,19020301,"    Life at Oi was quiet and dignified. The house was pleasing as country houses can be, and each time he saw the lady Genji thought how little there was to distinguish her from ladies of the highest rank."
19,2,3,2,19020302," Judged by themselves her appearance and manner were beyond reproach. By herself she could compete--such things did happen--with the best of them, even though she had that very odd father.+ He wished he might find time someday for a really satisfying visit."
19,2,3,3,19020303," ""A bridge that floats across dreams?""  # he whispered, reaching for a koto. Always at such times their last night at Akashi came back to him. Diffidently she took up the lute which he pushed towards her, and they played a brief duet. He marveled again that her accomplishments should be so varied. He told her all about the little girl."
19,2,3,4,19020304," Sometimes, though a great deal argued against it, he would take a light supper and stay the night. Katsura and his chapel provided the excuse. His manner toward the lady was not, it is true, his most gallant, but neither was it chilly or uncivil. One might have classed it as rather above the ordinary in warmth and tenderness."
19,2,3,5,19020305," She understood and was content, and was careful to seem neither forward nor obsequiously deferential. She wanted to be what he wanted her to be, and she succeeded."
19,2,3,6,19020306," Rumor had told her that he was stiffer and more formal with most women, and the wiser course seemed to be to keep her distance."
19,2,3,7,19020307," If she were nearer she would be vulnerable, too easy a target for the other ladies. She would count it her good fortune that he troubled himself to visit her occasionally, and ask no more."
19,2,3,8,19020308,
19,2,3,9,19020309,"    Her father had told her that last day that he was no longer a part of her life. Yet he worried, and from time to time he would send off a retainer to make quiet inquiry about Genji's behavior. Some of the reports disturbed him, some pleased him."
19,3,1,1,19030101,"    At about this time Aoi's father died. He had been a loyal and useful public servant, and the emperor was deeply grieved. He had been much missed when he retired from court even briefly, and now he was gone forever. Genji was sadder than anyone. He had had time for himself because he had shared the business of government with his father-in-law. Now it would all be his."
19,3,1,2,19030102,"    The emperor was mature for his age and his judgment was to be trusted. Yet he did need support and advice. To whom was he to look besides Genji? Sadly, Genji concluded that his plans for a life of quiet meditation would have to be deferred."
19,3,1,3,19030103, He was even more attentive than the chancellor's sons to the details of the funeral and memorial services.
19,3,1,4,19030104,"    It was a time of bad omens, erratic movements of the celestial bodies and unsettling cloud formations."
19,3,1,5,19030105,
19,3,1,6,19030106, The geomancers and soothsayers issued portentous announcements. Genji had his own very private reasons for disquiet.
19,3,2,1,19030201,"    Fujitsubo had been ill from early in the year, and from the Third Month her condition was grave. Her son, the emperor, called upon her. He had been very young when his father died and had understood little of what was happening. Now his sorrow made his mother grieve as if it were for someone else."
19,3,2,2,19030202,"    ""I had been sure,""  she said, her voice very weak, ""that this would be a bad year for me.* I did not feel so very ill at first, and did not wish to be one of those for whom the end always seems to be in sight. I asked for no prayers or services besides the usual ones."
19,3,2,3,19030203," I must call on you, I kept telling Myself, and have a good talk about the old days. But it has been so seldom these last weeks that I have really felt myself. And so here we are."""
19,3,2,4,19030204,
19,3,2,5,19030205,"    She seemed much younger than her thirty-seven years. It was even sadder, because she was so youthful, that she might be dying."
19,3,2,6,19030206," As she had said, it was a dangerous year. She had been aware for some weeks of not being well but she had contented herself with the usual penances and retreats."
19,3,2,7,19030207," Apologizing for His negligence, the emperor ordered numerous services.
    Genji was suddenly very worried. She had always been sickly, and he had thought it just another of her indispositions.
    Protocol required that the emperor's visit be a short one. He returned to the palace in great anguish."
19,3,2,8,19030208," His mother had been able to speak to him only with very great difficulty. She had received the highest honors which this world can bestow, and her sorrows and worries too had been greater than most. That the emperor must remain ignorant of them added to the pain. He could not have dreamed of the truth, and so the truth must be the tie with this world which would keep her from repose in the other."
19,3,3,1,19030301,"    Genji shared in the public concern at this succession of misfortunes in high places, and of course his private feelings were deep and complex. He overlooked nothing by way of prayer and petition. He must speak to her once again of what had been given up so long before. Coming near her curtains, he asked how she was feeling. In tears, one of her women gave an account."
19,3,3,2,19030302,"    ""All through her illness she has not for a moment neglected her prayers. They have only seemed to make her worse. She will not touch the tiniest morsel of food, not the tiniest bit of fruit. We are afraid that there is no hope."""
19,3,3,3,19030303,
19,3,3,4,19030304,"    ""I have been very grateful,""  she said to Genji, ""for all the help you have been to the emperor. You have done exactly as your father asked you to do. I have waited for an opportunity to thank you. My gratitude is far beyond the ordinary, and now I fear it is too late."""
19,3,3,5,19030305,"    He could barely catch the words and was too choked with tears to answer. He would have preferred not to exhibit his tears to her women. The loss would have been a grievous one even if she had been, all these years, no more than a friend. But life is beyond our control, and there was nothing he could do to keep her back, and no point in trying to describe his sorrow."
19,3,3,6,19030306,"    ""I have not been a very effective man, I fear, but I have tried, when I have seen a need, to be of use to him. The chancellor's death is a great blow, and now this--it is more than I can bear. I doubt that I shall be in this world much longer myself."""
19,3,3,7,19030307,"    And as he spoke she died, like a dying flame. I shall say no more of his grief."
19,3,4,1,19030401,"    Among persons of the highest birth whose charity and benevolence seem limitless there have been some who, sheltered by power and position, have been unwitting agents of unhappiness. Nothing of the sort was to be detected in the comportment of the dead lady. When someone had been of service to her she went to no end of trouble to avoid the sort of recompense that might indirectly have unfortunate consequences."
19,3,4,2,19030402," Again, there have since the day of the sages been people who have been misled into extravagant and wasteful attentions to the powers above. Here too matters were quite different with the dead lady. Her faith and devotion complete, she offered only what was in her heart to offer, always within her means. The most ignorant and insensitive of mendicant mountain priests regretted her passing."
19,3,4,3,19030403,"    Her funeral became the only business of court, where grief was universal. The colors of late spring gave way to unrelieved gray and black. Gazing out at his Nijo~ garden, Genji thought of the festivities that spring a dozen years before.*"" This year alone, ""+ he whispered. Not wanting to be seen weeping, he withdrew to the chapel, and there spent the day in tears. The trees at the crest of the ridge stood clear in the evening light. Wisps of cloud trailed below, a dull gray. It was a time when the want of striking color had its own beauty."
19,3,4,4,19030404,"         ""A rack of cloud across the light of evening<br>          As if they too, these hills, wore mourning weeds."""
19,3,4,5,19030405,    There was no one to hear.
19,4,1,1,19040101,"    The memorial rites were over, and the emperor still grieved. There was an old bishop who had had the confidence of successive empresses since Fujitsubo's mother. Fujitsubo herself had been very close to him and valued his services highly, and he had been the emperor's intermediary in solemn vows and offerings. A saintly man, he was now seventy. He had been in seclusion, making his own final preparations for the next life, but he had come down from the mountains to be at Fujitsubo's side. The emperor had kept him on at the palace."
19,4,1,2,19040102,    Genji too had pressed him to stay with the emperor through the difficult time and see to his needs as in the old days.
19,4,1,3,19040103," Though he feared, replied the bishop, that he was no longer capable of night attendance, he was most honored by the invitation and most grateful that he had been permitted to serve royal ladies for so long."
19,4,1,4,19040104,"    One night, in the quiet before dawn, between shifts of courtiers on night duty, the bishop, coughing as old people will, was talking with the emperor about matters of no great importance."
19,4,1,5,19040105,"    ""There is one subject which I find it very difficult to broach, Your Majesty. There are times when to speak the truth is a sin, and I have held my tongue. But it is a dilemma, since your august ignorance of a certain matter might lead to unknowing wrong. What good would I do for anyone if I were to die in terror at meeting the eye of heaven? Would it have for me the scorn which it has for the groveling dissembler?"""
19,4,1,6,19040106,
19,4,2,1,19040201,"    What might he be referring to? Some bitterness, some grudge, which he had not been able to throw off? It was unpleasant to think that the most saintly of hearts can be poisoned by envy."
19,4,2,2,19040202,"    ""I have kept nothing from you since I learned to talk,""  said the emperor, ""and I shall not forgive easily if now you are keeping something from me."""
19,4,2,3,19040203,
19,4,2,4,19040204,"    ""It is wrong, I know, Your Majesty. You must forgive me. You have been permitted to see into depths which are guarded by the Blessed One, and why should I presume to keep anything from you?"
