Volume,Chapter,Paragraph,Line,LineId,Text
15,3,3,16,15030316,"    Genji's feet and ankles were soaking. Even in the old days the passage through the south gallery had been more obstacle than passage. Now the gallery had caved in, and Genji's entry was a most ungraceful one. He was glad there were no witnesses."
15,3,4,1,15030401,"    Having waited so long, clinging to the hope that he would come someday, the princess was of course delighted. Yet she regretted that he must see her in these circumstances. The various robes that were gifts from the assistant viceroy's wife had been put aside, for she did not like the giver. The old women had put them in a scented Chinese chest. Now they came out again, pleasantly scented. The princess let herself be dressed and received Genji from behind the yellow curtains of the last interview with her aunt."
15,3,4,2,15030402,
15,3,4,3,15030403,"    ""Although we have seen so little of each other,""  said Genji, ""I have not ceased to think of you all this time. I have waited impatiently for some sign that you too still care. Although I did not detect any welcoming cedars this evening,* I did somehow feel these groves pulling at me. And so you have won the game."""
15,3,4,4,15030404,"    He pushed the curtain slightly aside. She was as shy and withdrawn as ever, he could see, and she was not immediately able to answer. Finally, impressed that he should have made his way through the undergrowth, she gathered courage for a few tentative syllables."
15,3,4,5,15030405,"    ""I can imagine that it has been uncommonly difficult for you these last few years,""  said Genji. ""I myself seem incapable of changing and forgetting, and it would interest me to know how it strikes you that I should have come swimming through these grasses, with no idea at all whether you yourself might have changed. Perhaps I may ask you to forgive the neglect. I have neglected everyone, not only you. I shall consider myself guilty of breach of promise if I ever again do anything to displease you."""
15,3,4,6,15030406,    The warmly affectionate utterances came forth in far larger numbers than he had any real feeling for.
15,3,4,7,15030407," Everything urged against spending the night here. Having made excuses, he was about to leave. The pine tree was not one which he himself had planted, but someone had planted it, many years ago--years that seemed like a dream."
15,3,4,8,15030408,"        ""I obey the waving summons of wisteria<br>        Because it flows, at your gate, from the waiting tree."
15,3,4,9,15030409,"    ""Yes, it has been many years. Things have changed, not always for the better. Someday I must tell you of my struggles with the fisherman's net and the angler's line.* Another thing that seems strange, now that I think of it, is my complete confidence that you would refuse to tell anyone else the story of your unhappy springs and autumns."""
15,3,4,10,15030410,
15,3,4,11,15030411,"        ""I have waited and waited, to no avail, it seems.<br>        Wisteria, not the waiting pine, has brought you."""
15,3,4,12,15030412,"    The faint stirring behind the curtains, the faint perfume that came to him from her sleeves, made him feel that she had perhaps improved a little with age."
15,3,4,13,15030413," The setting moon streamed unobstructed through the open doors, both the gallery and the eaves having collapsed. He could see to the farthest corners of the room. The furnishings which she kept as they had always been made it seem a much finer house than the roof sagging under the weight of ferns would have led him to imagine. She was very unlike --and the contrast was touching--the princess in the old romance who destroyed the tower.+ Her stoicism in the face of poverty gave her a certain dignity. It had made her worth remembering. He hated to think of his own selfishness through the years."
15,3,4,14,15030414,"    Nor could the lady of the orange blossoms have been described as a bright, lively, modern sort. The difference between the two ladies, indeed, as he saw them in quick succession, did not seem very great; and the safflower princess's defects were minimized."
15,4,1,1,15040101,"    Gifts always poured in as the Kamo festival approached. He distributed them among his several ladies as seemed appropriate, taking care this time that Prince Hitachi's mansion was not slighted. He set stewards and artisans who had his confidence to replacing the decayed earthen walls with a sturdy wooden fence. Genji himself stayed away, fearing derisive rumors about his diligence in having searched her out. He sent many an earnest and affectionate note, however. He was remodeling a house very near his own Nijo~ mansion,"
15,4,1,2,15040102," he said, and he thought she might wish to move into it."
15,4,1,3,15040103," Perhaps she could be thinking about presentable maids and footmen and the like. The wormwood patch now seemed to choke with gratitude. Looking off in Genji's direction, the Hitachi household offered thanks."
15,4,1,4,15040104,"    People had always said that Genji chose superior women to spend even a single night with. It was very odd: everything suggested that the Hitachi princess in no respect even rose to mediocrity. What could explain it? A bond tied in a former life, no doubt."
15,4,2,1,15040201,"    Most of the princess's women, whatever their stations in life, had dismissed her as beyond redemption and scrambled over one another in search of better places. Now the direction of the scramble was reversed. The princess, gentle and retiring to a fault, had spoiled them. Life in the service of provincial governors was unpleasantly different from what she had accustomed them to. A certain crassness was apparent in the haste with which they returned.
    Ever more prosperous and powerful, Genji was more thoughtful as well. His instructions had been very detailed, and the princess's mansion came back to life. People were seen at the gates and in the garden, the brook was cleared, the wormwood was cut away so that breezes passed once more. Among Genji's lesser stewards were men who had not yet succeeded in catching his eye. He seemed to care about the Hitachi place. It offered the opportunity they had been looking for."
15,4,3,1,15040301,"    The princess stayed there for two years, after which he moved her to the east lodge at Nijo~. Now he could visit her in the course of ordinary business. It could no longer be said that he treated her badly."
15,4,3,2,15040302,"    Though no one has asked me to do so, I should like to describe the surprise of the assistant viceroy's wife at-this turn of events, and Jiju~'s pleasure and guilt. But it would be a bother and my head is aching; and perhaps--these things do happen, they say--something will someday remind me to continue the story."