Volume,Chapter,Paragraph,Line,LineId,Text
35,3,1,2,35030102,"    Murasaki looked about her and saw how everyone seemed to be moving ahead,"
35,3,1,3,35030103," and asked herself whether she would always have a monopoly on Genji's affections. No, she would grow old and he would weary of her. She wanted to anticipate the inevitable by leaving the world."
35,3,1,4,35030104," She kept these thoughts to herself, not wanting to nag or seem insistent. She did not resent the fact that Genji divided his time evenly between her and the Third Princess. The emperor himself worried about his sister and would have been upset by any suggestion that she was being neglected. Yet Murasaki could not help thinking that her worst fears were coming true."
35,3,1,5,35030105," These thoughts too she kept to herself. She had been given charge of the emperor's daughter, his second child after the crown prince. The little princess was her great comfort on nights when Genji was away, and she was equally fond of the emperor's other children."
35,3,2,1,35030201,"    The lady of the orange blossoms looked on with gentle envy and was given a child of her own, one of Yu~giri's sons, by the daughter of Koremitsu. He was a pretty little boy, advanced for his age and a favorite of Genji's. It had been Genji's chief lament that he had so few children, and now in the third generation his house was growing and spreading. With so many grandchildren to play with he had no excuse to be bored."
35,3,2,2,35030202,"    Genji and Higekuro were better friends now, and Higekuro came calling more frequently. Tamakazura had become a sober matron. No longer suspicious of Genji's intentions, she too came calling from time to time. She and Murasaki were very good friends."
35,3,2,3,35030203,    The Third Princess was the one who refused to grow up. She was still a little child. Genji's own daughter was now with the emperor. He had a new daughter to worry about.
35,3,3,1,35030301,
35,3,3,2,35030302,"     ""I feel that I have very little time left,""  said the Suzaku emperor. ""It is sad to think about dying, of course, but I am determined not to care. My only unsatisfied wish is to see her at least once more. If I do not I shall continue to have regrets. Perhaps I might ask that without making a great show of it she come and see me?"""
35,3,3,3,35030303,    Genji thought the request most reasonable and set about preparations.
35,3,3,4,35030304," ""We really should have sent you without waiting for him to ask. It seems very sad that he should have you so on his mind even now."""
35,3,3,5,35030305,
35,3,3,6,35030306,    But they had to have a good reason--a casual visit would not do. What would it be?
35,3,3,7,35030307,
35,3,3,8,35030308," He remembered that the Suzaku emperor would soon be entering his fiftieth year, and an offering of new herbs seemed appropriate. He gave orders for dark robes and other things a hermit might need and asked the advice of others on how to arrange something worthy of the occasion."
35,3,3,9,35030309," The Suzaku emperor had always been fond of music and so Genji began selecting dancers and musicians. Two of Higekuro's sons and three of Yu~giri's, including one by Koremitsu's daughter, had passed the age of seven and gone to court."
35,3,3,10,35030310," There were young people too in Prince Hotaru's house and other eminent houses, princely and common, and there were young courtiers distinguished for good looks and graceful carriage. Everyone was happy to make an extra effort for so festive an event. All the masters of music and dance were kept busy."
35,3,4,1,35030401,"    The Suzaku emperor had given the Third Princess lessons on the seven-stringed Chinese koto. She was still very young when she left him, however, and he wondered what progress she might have made."
35,3,4,2,35030402,"     ""How good if she could play for me. Perhaps in that regard at least she has grown up a little."""
35,3,4,3,35030403,    He quietly let these thoughts be known and the emperor heard of them.
35,3,4,4,35030404," ""Yes, I should think that with the koto at least she should have made progress. How I wish I might be there."""
35,3,4,5,35030405,    Genji too heard of them.
35,3,4,6,35030406," ""I have done what I can to teach her,""  he said. ""She has improved a great deal, but I wonder whether her playing is really quite good enough yet to delight the royal ear. If she goes unprepared and has to play for him, she might have a very uncomfortable time of it."""
35,3,4,7,35030407,"    Turning his attention now to music lessons,confidence."
35,3,4,8,35030408," he kept back none of his secrets, none of the rare strains, complex medleys, and seasonal variations and tunings. She seemed uncertain at first but presently gathered "
35,3,4,9,35030409,"     ""There are always such crowds of people around in the daytime,""  he said. ""You have your left hand poised over the koto and are wondering what to do with it, and along comes someone with a problem. The evening is the time. I will come in the evening when it is quiet and teach you everything I know."""
35,3,4,10,35030410,
35,3,5,1,35030501,"    He had given neither Murasaki nor the Akashi princess lessons on the seven-stringed koto. They were most anxious to hear what must certainly be unusual playing. The emperor was always reluctant to let the Akashi princess leave court, but he did finally give permission for a visit, which must, he said, be a brief one."
35,3,5,2,35030502," She would soon have another child--she had two sons and was five months pregnant--and the danger of defiling any one of the many Shinto observances was her excuse for leaving. In the Twelfth Month there were repeated messages from the emperor urging her return. The nightly lessons in the Third Princess's rooms fascinated her and aroused a certain envy. Why, she asked Genji, had he not taken similar troubles with her?"
35,3,5,3,35030503,"    Unlike most people, Genji loved the cold moonlit nights of winter. With deep feeling he played several songs that went well with the snowy moonlight. Adepts among his men joined him on lute and koto."
35,3,5,4,35030504, In Murasaki's wing of the house preparations were afoot for the New Year. She made them her own personal concern.
35,3,5,5,35030505,"     ""When it is warmer,""  she said more than once, ""you really must let me hear the princess's koto."""
35,3,5,6,35030506,    The New Year came.
35,3,6,1,35030601,"    The emperor was determined that his father's jubilee year begin with the most solemn and dignified ceremony. A visit from the Third Princess would complicate matters, and so a date towards the middle of the Second Month was chosen. All the musicians and dancers assembled for rehearsals at Rokujo~, which went on and on."
35,3,6,2,35030602,"     ""The lady in the east wing has long been after me to let her hear your koto,""  said Genji to the Third Princess. ""I think a feminine concert on strings is what we want. We have some of the finest players of our day right here in this house. They can hold their own, I am sure of it, with the professionals."
35,3,6,3,35030603," My own formal training was neglected, but when I was a boy I was eager to learn what was to be learned. I had lessons from the famous masters and looked into the secret traditions of all the great houses. I came upon no one who exactly struck me dumb with admiration."
35,3,6,4,35030604," It is even worse today. Young people dabble at music and pick up mannerisms, and what passes for music is very shallow stuff indeed. You are almost alone in your attention to this seven-stringed koto. I doubt that we could find your equal all through the court"""
35,3,6,5,35030605,    She smiled happily at the compliment.
35,3,6,6,35030606," Though she was in her early twenties and very pretty, she was tiny and fragile and still very much a child. He wished that she might at least look a little more grown-up."
35,3,6,7,35030607,"     ""Your royal father has not seen you in years,""  he would say. ""You must show him what a fine young lady you have become."""
35,3,6,8,35030608,
35,3,6,9,35030609,    Her women silently thanked him. That she had grown up at all was because of the trouble he had taken with her.
35,3,6,10,35030610,
35,4,1,1,35040101,"    Late in the First Month the sky was clear and the breeze was warm, and the plums near the veranda were in full bloom. In delicate mists, the other flowering trees were coming into bud."
35,4,1,2,35040102,"     ""From the first of the month we will be caught up in our final rehearsals,""  said Genji, inviting Murasaki to the Third Princess's rooms. ""The confusion will be enormous, and we would not want it to seem that you are getting ready to go with us on the royal visit. Suppose we have our concert now, while it is still fairly quiet."""
35,4,1,3,35040103,
35,4,1,4,35040104,"    All her women wanted to come with her, but she selected only those, including some of rather advanced years, whose aptitude for music had been shaped by serious study."
35,4,1,5,35040105," Four of her prettiest little girls were also with her, all of them in red robes, cloaks of white lined with red, jackets of figured lavender, and damask trousers. Their chemises were also red, fulled to a high sheen. They were as pretty and stylish as little girls can be. The apartments of the Akashi princess were more festive than usual, bright with new spring decorations. Her women quite outdid themselves."
35,4,1,6,35040106," Her little girls too were in uniform dress, green robes, cloaks of pink lined with crimson, trousers of figured Chinese satin, and jackets of a yellow Chinese brocade. The Akashi lady had her little girls dressed in quiet but unexceptionable taste: two wore rose plum* and two were in white robes lined with red, and all four had on celadon-green cloaks and purple jackets and chemises aglow with the marks of the fulling blocks."
35,4,1,7,35040107,"    The Third Princess, upon being informed that she was to be hostess to such a gathering, put her little girls into robes of a rich yellowish green, white cloaks lined with green, and jackets of magenta. Though there was nothing overdone about this finery, the effect was of remarkable richness and elegance."
35,4,2,1,35040201,"    The sliding doors were removed and the several groups separated from one another by curtains. A cushion had been set out for Genji himself at the very center of the assembly. Out near the veranda were two little boys charged with setting the pitch, Tamakazura's elder son on the _sho~_ pipes and Yu~giri's eldest on the flute."
35,4,2,2,35040202," Genji's ladies were behind blinds with their much-prized instruments set out before them in fine indigo covers, a lute for the Akashi lady, a Japanese koto for Murasaki, a thirteenstringed Chinese koto for the Akashi princess. Worried lest the Third Princess seem inadequate, Genji himself tuned her seven-stringed koto for her."
35,4,2,3,35040203,"     ""The thirteen-stringed koto holds its pitch on the whole well enough,""  he said, ""but the bridges have a way of slipping in the middle of a concert. Ladies do not always get the strings as tight as they should. Maybe we should summon Yu~giri. Our pipers are rather young, and they may not be quite firm enough about bringing things to order."""
35,4,2,4,35040204,
35,4,2,5,35040205,
35,4,2,6,35040206,    Yu~giri's arrival put the ladies on their mettle. With the single exception of the Akashi lady they were all Genji's own treasured pupils. He hoped that they would not shame him before his son.
35,4,2,7,35040207," He had no fears about the Akashi princess, whose koto had often enough joined others in His Majesty's own presence. It was the Japanese koto that was most likely to cause trouble. He felt for Murasaki, whose responsibility it would be. Though it is a rather simple instrument, everything about it is fluid and indefinite, and there are no clear guides. All the instruments of spring* were here assembled. It would be a great pity if any of them struck a sour note."
35,4,2,8,35040208,
35,4,3,1,35040301,"    Yu~giri was in dashingly informal court dress, the singlets and most especially the sleeves very nicely perfumed. It was evening when he arrived, looking a little nervous."
35,4,3,2,35040302, The plums were so heavy with blossom in the evening light that one might almost have thought that a winter snow had refused to melt. Their fragrance mixed on the breeze with the wonderfully delicate perfumes inside the house to such enchanting effect that the spring warbler might have been expected to respond immediately.
35,4,3,3,35040303,"     ""I know I should let you catch your breath,""  said Genji, pushing a thirteen-stringed koto towards his son, ""but would you be so kind as to try this out and see that it is in tune? There are no strangers here before whom you need feel shy."""
35,4,3,4,35040304,"    Bowing deeply (his manners were always perfect), Yu~giri tuned the' instrument in the _ichikotsu_* mode and waited politely for further instructions."
35,4,3,5,35040305,"     ""You must get things started for us,""  said Genji. ""No false notes, if you please."""
35,4,3,6,35040306,
35,4,3,7,35040307,"     ""I fear I do not have the qualifications to join you."""
35,4,3,8,35040308,
35,4,3,9,35040309,"     ""I suppose not,""  smiled Genji. ""But would you wish to have it said that a band of ladies drove you away?"""
35,4,3,10,35040310,
35,4,3,11,35040311,"    Yu~giri played just enough to make quite sure the instrument was in tune and pushed it back under the blinds.
    The little boys were very pretty in casual court dress. Their playing was of course immature, but it showed great promise."
35,4,4,1,35040401,"    The stringed instruments were all in tune and the concert began. Each of the ladies did beautifully, but the lute somehow stood out from the other instruments, sedately and venerably quiet and yet with great authority."
35,4,4,2,35040402," Yu~giri was listening especially for the japanese koto. The tone was softly alluring and the plectrum caught at the strings with a vivacity which seemed to him very novel. None of the professed masters could have done better. He would not have thought that the Japanese koto had such life in it. Clearly Murasaki had worked hard, and Genji was pleased and satisfied."
35,4,4,3,35040403,"    The thirteen-stringed Chinese koto, a gentle, feminine sort of instrument, takes its place hesitantly and deferentially among the other instruments."
35,4,4,4,35040404," As for the seven-stringed koto, the Third Princess was not quite a complete master yet, but her playing had an assurance that did justice to her recent labors. Her koto took its place very comfortably among the other instruments. Yes, thought Yu~giri, who beat time and sang the lyrics, she had acquired a most admirable touch. Sometimes Genji too would beat time with his fan and sing a brief passage. His voice had improved with the years, filled out and taken on a dignity it had not had before. Yu~giri's voice was almost as good. I would be very hard put indeed to describe the pleasures of the night, which was somehow quieter as it filled with music."
35,4,5,1,35040501,"    It was the time of the month when the moon rises late. The flares at the eaves were just right, neither too dim nor too strong."
35,4,5,2,35040502," Genji glanced at the Third Princess. She was smaller than the others, so tiny indeed that she seemed to be all clothes. Hers was not a striking sort of beauty, but it was marked by very great refinement and delicacy. One thought of a willow sending forth its first shoots toward the end of the Second Month, so delicate that the breeze from the warbler's wing seems enough to disarrange them."
35,4,5,3,35040503, The hair flowing over a white robe lined with red also suggested the trailing strands of a willow.
35,4,5,4,35040504," One knew that she was the most wellborn of ladies. Beside her the Akashi princess seemed gentle and delicate in a livelier, brighter way, and somehow deeper and subtler too, trained to greater diversity. One might have likened her to a wisteria in early morning, blooming from spring into summer with no other blossoms to rival it."
35,4,5,5,35040505," She was heavy with child and seemed uncomfortable. She pushed her koto away and leaned forward on an armrest which, though the usual size, seemed too large for her. Genji would have liked to send for a smaller one."
35,4,5,6,35040506," Her hair fell thick and full over rose plum. She had a most winning charm in the soft, wavering light from the eaves.
    Over a robe of pink Murasaki wore a robe of a rich, deep hue, a sort of magenta, perhaps. Her hair fell in a wide, graceful cascade. She was of just the right height, so beautiful in every one of her features that they added up to more than perfection. A cherry in full bloom--but not even that seemed an adequate simile."
35,4,5,7,35040507,"    One would have expected the Akashi lady to be quite overwhelmed by such company, but she was not. Careful, conservative taste was evident in her grooming and dress. One sensed quiet depths, and an ineffable elegance which was all her own."
35,4,5,8,35040508," She had on a figured ""willow""  robe, white lined with green, and a cloak of a yellowish green, and as a mark of respect for the other ladies, a train of a most delicate and yielding gossamer. Everything about her emphasized her essential modesty and unassertiveness, but there was much that suggested depth and subtlety as well."
35,4,5,9,35040509," Again as a mark of respect, she knelt turned somewhat away from the others with her lute before her and only her knees on the green Korean brocade with which the matting was fringed. She guided her plectrum with such graceful assurance through a quiet melody that it was almost more of a pleasure to the eye than to the ear. One thought of fruit and flowers on the same orange branch, ""awaiting the Fifth Month."" *"
35,4,6,1,35040601,"    Everything he heard and saw told Yu~giri of a most decorous and Formal assembly. He would have liked to look inside the blinds, most especially at Murasaki, who would doubtless have taken on a calmer and more mature beauty since he had had that one glimpse of her."
35,4,6,2,35040602," As for the Third Princess, only a slight shift of fate and she might have been his rather than his father's. The Suzaku emperor had more than once hinted at something of the sort to Yu~giri himself and mentioned the possibility to others. Yu~giri should have been a little bolder. Yet it was not as if he had lost his senses over the princess. Certain evidences of immaturity had had the effect not exactly of cheapening her in his eyes but certainly of cooling his ardor."
35,4,6,3,35040603," He could have no possible designs on Murasaki. She had through the years been a remote and lofty symbol of all that was admirable. He only wished that he had some way of showing, some disinterested, gentlemanly way, how very high was his regard for her. He was a model of prudence and sobriety and would not have dreamed of doing anything unseemly."
35,5,1,1,35050101,"    It was late and rather chilly when the first rays of ""the moon for which one lies in wait"" + came forth."
35,5,1,2,35050102,"     ""The misty moon of spring is not the best, really,""  said Genji. ""In the autumn the singing of the insects weaves a fabric with the music. The combination is rather wonderful."""
35,5,1,3,35050103,"     ""It is true,""  replied Yu~giri,"
35,5,1,4,35050104," ""that on an autumn night there is sometimes not a trace of a shadow over the moon and the sound of a koto or a flute can seem as high and clear as the night itself. But the sky can have a sort of put-on look about it, like an artificial setting for a concert, and the autumn flowers insist on being gazed at. It is all too pat, too perfect."
35,5,1,5,35050105," But in the spring--the moon comes through a haze and a quiet sound of flute joins it in a way that is not possible in the autumn. No, a flute is not really its purest on an autumn night."
35,5,1,6,35050106," It has long been said that it is the spring night to which the lady is susceptible, and I am inclined to accept the statement. The spring night is the one that brings out the quiet harmonies."""
35,5,1,7,35050107,
35,5,1,8,35050108,"     ""The ancients were unable to resolve the dispute, and I think it would be presumptuous of their inferior descendants to seek to do so. It is a fact that the major modes of spring are commonly given precedence over the minor modes of autumn, and so you may be right."
35,5,1,9,35050109,
35,5,1,10,35050110,"     ""His Majesty from time to time has the famous masters in to play for him, and the conclusion seems to be that the ones who deserve the name are fewer and fewer. Am I wrong in suspecting that a person has less to learn from them? Our ladies here may not be on the established list of masters, but I doubt that they would seem hopelessly out of place."
35,5,1,11,35050111," Of course, it may be that I have been away from things for so long that I no longer have a very good ear. That would be a pity. Yet I do sometimes find myself marveling that a little practice in this house brings out such talents. How does what you have heard tonight compare with what is chosen for His Majesty to hear?"""
35,5,1,12,35050112,
35,5,1,13,35050113,"     ""I am very badly informed,""  said Yu~giri, ""but I do have a thought or two in the matter. It may be a confession of ignorance of the great tradition to say that Kashiwagi on the Japanese koto and Prince Hotaru on the lute are to be ranked among the masters."
35,5,1,14,35050114," I had thought them quite without rivals, but this evening I have been forced to change my mind. I am filled with astonishment at what I have heard. Might it be that I had been prepared for something more casual, more easygoing? You have asked me to be voice and percussion, and I have felt very inadequate indeed."
35,5,1,15,35050115," Lord To~ no Chu~jo~ is said to be the best of them all on the japanese koto, the one who has the widest and subtlest variety of touches to go with the seasons. It is true that one rarely hears anything like his koto, but I confess that tonight I have been treated to skills that seem to me every bit as remarkable."""
35,5,1,16,35050116,
35,5,1,17,35050117,"     ""Oh, surely you exaggerate."""
35,5,1,18,35050118,  Genji was smiling proudly.
35,5,1,19,35050119," ""But I do have a fine set of pupils, do I not? I cannot claim credit for the lute, but even there I think residence in this house has made a difference. I thought it most extraordinary off in the hinterlands and I think it has improved since it came to the city."""
35,5,1,20,35050120,    The women were exchanging amused glances that he should be claiming credit even for the Akashi lady.
35,5,2,1,35050201,"     ""It is very difficult indeed to master any instrument,""  he continued. ""The possibilities seem infinite and nothing seems complete and finished. But there are few these days who even try, and I suppose it should be cause for satisfaction when someone masters any one small aspect. The sevenstringed koto is the unmanageable one."
35,5,2,2,35050202," We are told that in ancient times there were many who mastered the whole tradition of the instrument, and made heaven and earth their own, and softened the hearts of demons and gods. Taking into this one instrument all the tones and overtones of all the others,* they found joy in the depths of sorrow and transformed the base and mean into the fine and proud, and gained wealth and universal fame."
35,5,2,3,35050203," There was a time, before the tradition had been established in japan, when the most enormous trouble was required of anyone who sought to learn the art. He must spend years in strange lands and give up everything, and even then only a few came back with what they had gone out to seek. In the old chronicles there are stories of musicians who moved the moon and the stars and brought unseasonal snows and frosts and conjured up tempests and thunders."
35,5,2,4,35050204," In our day there is scarcely anyone who has even mastered the whole of the written lore, and the full possibilities are enormous. So little these days seems to make even a beginning--because the Good Law is in its decline, I suppose.
     ""It may be that people are intimidated. The seven-stringed koto was the instrument that moved demons and gods, and inadequate mastery had correspondingly unhappy results."
35,5,2,5,35050205," What other instrument is to be at the center of things, setting the tone for all the others? Ours is a day of very sad decline. Only a madman, we say, would be so obsessed with an art as to abandon parents and children and go wandering off over Korea and China."
35,5,2,6,35050206," But we need not make quite such extreme sacrifices. Keeping within reasonable bounds, why should we not try to make the b  inning that seems at least possible? The difficulties in mastering a single mode are indescribable, and there are so many modes and so many complicated melodies. Back in the days when I was a rather enthusiastic student of music, I went through the scores that have been preserved in this country, and presently there was no one to teach me. Yet I know that I am infinitely less competent than the old masters; and it is sad to think that no one is prepared to learn from me even the little that I know, and so the decline must continue."""
35,5,2,7,35050207,"    It was true, thought Yu~giri, feeling very inadequate."
35,5,2,8,35050208,"     ""If one or another of my princely grandchildren should live up to the promise he shows now and I myself still have a few years before me, then perhaps by the time he is grown I can pass on what I know. It is very little, I am afraid. I think that the Second Prince shows very considerable promise."""
