Volume,Chapter,Paragraph,Line,LineId,Text
4,4,2,21,04040221,"    There was a newly confiding response to his offer of his services as guardian in this world and the next. She was a strange little thing. He found it hard to believe that she had had much experience of men. He no longer cared what people might think. He asked Ukon to summon his man, who got the carriage ready. The women of the house, though uneasy, sensed the depth of his feelings and were inclined to put their trust in him."
4,4,2,22,04040222,"    Dawn approached. No cocks were crowing. There was only the voice of an old man making deep obeisance to a Buddha, in preparation, it would seem, for a pilgrimage to Mitake.* He seemed to be prostrating himself repeatedly and with much difficulty. All very sad. In a life itself like the morning dew, what could he desire so earnestly?<br>     ""Praise to the Messiah to come,""  intoned the voice."
4,4,2,23,04040223,"     ""Listen,""  said Genji. ""He is thinking of another world."
4,4,2,24,04040224,"         ""This pious one shall lead us on our way<br>       As we plight our troth for all the lives to come."""
4,4,2,25,04040225,"    The vow exchanged by the Chinese emperor and Yang Kuei-fei seemed to bode ill, and so he preferred to invoke Lord Maitreya, the Buddha of the Future; but such promises are rash."
4,4,2,26,04040226,"        ""So heavy the burden I bring with me from the past,<br>     I doubt that I should make these vows for the future."""
4,4,2,27,04040227,"    It was a reply that suggested doubts about his ""lives to come."""
4,4,3,1,04040301,"    The moon was low over the western hills. She was reluctant to go with him. As he sought to persuade her, the moon suddenly disappeared behind clouds in a lovely dawn sky. Always in a hurry to be off before daylight exposed him, he lifted her easily into his carriage and took her to a nearby villa. Ukon was with them."
4,4,3,2,04040302," Waiting for the caretaker to be summoned, Genji looked up at the rotting gate and the ferns that trailed thickly down over it. The groves beyond were still dark, and the mist and the dews were heavy. Genji's sleeve was soaking, for he had raised the blinds of the carriage."
4,4,3,3,04040303,"     ""This is a novel adventure, and I must say that it seems like a lot of trouble."
4,4,3,4,04040304,"      ""And did it confuse them too, the men of old,<br>      This road through the dawn, for me so new and strange?"
4,4,3,5,04040305,"    ""How does it seem to you?"""
4,4,3,6,04040306,    She turned shyly away.
4,4,3,7,04040307,"       ""And is the moon, unsure of the hills it approaches,<br>          Foredoomed to lose its way in the empty skies?"
4,4,3,8,04040308,"    ""I am afraid."""
4,4,3,9,04040309,"    She did seem frightened, and bewildered. She was so used to all those swarms of people, he thought with a smile."
4,4,3,10,04040310,"    The carriage was brought in and its traces propped against the veranda while a room was made ready in the west wing. Much excited, Ukon was thinking about earlier adventures. The furious energy with which the caretaker saw to preparations made her suspect who Genji was."
4,4,3,11,04040311," It was almost daylight when they alighted from the carriage. The room was clean and pleasant, for all the haste with which it had been readied."
4,4,3,12,04040312,"    ""There are unfortunately no women here to wait upon His Lordship.""  The man, who addressed him through Ukon, was a lesser steward who had served in the Sanjo~ mansion of Genji's father-in-law. ""Shall I send for someone?"""
4,4,3,13,04040313,"    ""The last thing I want. I came here because I wanted to be in complete solitude, away from all possible visitors. You are not to tell a soul."""
4,4,3,14,04040314,"    The man put together a hurried breakfast, but he was, as he had said, without serving women to help him.<br>    Genji told the girl that he meant to show her a love as dependable as ""the patient river of the loons."" * He could do little else in these strange lodgings."
4,4,3,15,04040315,"    The sun was high when he arose. He opened the shutters. All through the badly neglected grounds not a person was to be seen. The groves were rank and overgrown. The flowers and grasses in the foreground were a drab monotone, an autumn moor. The pond was choked with weeds, and all in all it was a forbidding place. An outbuilding seemed to be fitted with rooms for the caretaker, but it was some distance away."
4,4,3,16,04040316,"    ""It is a forbidding place,"" + said Genji. ""But I am sure that whatever devils emerge will pass me by."""
4,4,3,17,04040317,"    He was still in disguise. She thought it unkind of him to be so secre- tive, and he had to agree that their relationship had gone beyond such furtiveness."
4,4,3,18,04040318,"           ""Because of one chance meeting by the wayside<br>          The flower now opens in the evening dew."
4,4,3,19,04040319,"    ""And how does it look to you?"""
4,4,3,20,04040320,
4,4,3,21,04040321,"    ""The face seemed quite to shine in the evening dew,<br>        But I was dazzled by the evening light."""
4,4,3,22,04040322,"    Her eyes turned away. She spoke in a whisper.<br>    To him it may have seemed an interesting poem.<br>    As a matter of fact, she found him handsomer than her poem sug- gested, indeed frighteningly handsome, given the setting."
4,4,3,23,04040323,"    ""I hid my name from you because I thought it altogether too unkind of you to be keeping your name from me. Do please tell me now. This silence makes me feel that something awful might be coming."""
4,4,3,24,04040324,"    ""Call me the fisherman's daughter."" * Still hiding her name, she was like a little child."
4,4,3,25,04040325,"    ""I see. I brought it all on myself? A case of warekara?"" +<br>    And so, sometimes affectionately, sometimes reproachfully, they talked the hours away."
4,4,3,26,04040326,"    Koremitsu had found them out and brought provisions. Feeling a little guilty about the way he had treated Ukon, he did not come near. He thought it amusing that Genji should thus be wandering the streets, and concluded that the girl must provide sufficient cause. And he could have had her himself, had he not been so generous."
4,4,3,27,04040327,"    Genji and the girl looked out at an evening sky of the utmost calm. Because she found the darkness in the recesses of the house frightening, he raised the blinds at the veranda and they lay side by side. As they gazed at each other in the gathering dusk, it all seemed very strange to her, unbelievably strange. Memories of past wrongs quite left her. She was more at ease with him now, and he thought her charming. Beside him all through the day, starting up in fright at each little noise, she seemed delightfully childlike. He lowered the shutters earl y and had lights brought.<br>    ""You seem comfortable enough with me, and yet you raise difficulties."""
4,4,3,28,04040328,"    At court everyone would be frantic. Where would the search be di- rected? He thought what a strange love it was, and he thought of the turmoil the Rokujo~ lady was certain to be in.# She had every right to be resentful, and yet her jealous ways were not pleasant. It was that sad lady to whom his thoughts first turned. Here was the girl beside him, so simple and undemanding; and the other was so impossibly forceful in her demands. How he wished he might in some measure have his freedom."
4,4,4,1,04040401,    It was past midnight. He had been asleep for a time when an exceed- ingly beautiful woman appeared by his pillow.
4,4,4,2,04040402,"    ""You do not even think of visiting me, when you are so much on my mind. Instead you go running off with someone who has nothing to recom- mend her, and raise a great stir over her. It is cruel, intolerable."""
4,4,4,3,04040403,  She seemed about to shake the girl from her sleep.
4,4,4,4,04040404," He awoke, feeling as if he were in the power of some malign being. The light had gone out. In great alarm, he pulled his sword to his pillow and awakened Ukon. She too seemed frightened."
4,4,4,5,04040405,"    ""Go out to the gallery and wake the guard. Have him bring a light."""
4,4,4,6,04040406,"    ""It's much too dark."""
4,4,4,7,04040407,"    He forced a smile. ""You're behaving like a child.""<br>    He clapped his hands and a hollow echo answered. No one seemed to hear. The girl was trembling violently. She was bathed in sweat and as if in a trance, quite bereft of her senses."
4,4,4,8,04040408,"    ""She is such a timid little thing,""  said Ukon, ""frightened when there is nothing at all to be frightened of. This must be dreadful for her.""<br>    Yes, poor thing, thought Genji. She did seem so fragile, and she had spent the whole day gazing up at the sky."
4,4,4,9,04040409,"    ""I'll go get someone. What a frightful echo. You stay here with her."""
4,4,4,10,04040410,"  He pulled Ukon to the girl's side.<br>    The lights in the west gallery had gone out."
4,4,4,11,04040411," There was a gentle wind. He had few people with him, and they were asleep. They were three in number: a young man who was one of his intimates and who was the son of the steward here, a court page, and the man who had been his intermedi- ary in the matter of the ""evening faces.""  He called out. Someone answered and came up to him."
4,4,4,12,04040412,"    ""Bring a light. Wake the other, and shout and twang your bowstrings. What do you mean, going to sleep in a deserted house? I believe Lord Koremitsu was here."""
4,4,4,13,04040413,"    ""He was. But he said he had no orders and would come again at dawn.""<br>    An elite guardsman, the man was very adept at bow twanging. He went off with a shouting as of a fire watch. At court, thought Genji, the courtiers on night duty would have announced themselves, and the guard would be changing. It was not so very late."
4,4,4,14,04040414,"    He felt his way back inside. The girl was as before, and Ukon lay face down at her side."
4,4,4,15,04040415,"    ""What is this? You're a fool to let yourself be so frightened. Are you worried about the fox spirits that come out and play tricks in deserted houses? But you needn't worry. They won't come near me.""  He pulled her to her knees."
4,4,4,16,04040416,"    ""I'm not feeling at all well. That's why I was lying down. My poor lady must be terrified."""
4,4,4,17,04040417,"    ""She is indeed. And I can't think why.""<br>    He reached for the girl. She was not breathing. He lifted her and she was limp in his arms. There was no sign of life. She had seemed as defense- less as a child, and no doubt some evil power had taken possession of her. He could think of nothing to do."
4,4,4,18,04040418," A man came with a torch. Ukon was not prepared to move, and Genji himself pulled up curtain frames to hide the girl."
4,4,4,19,04040419,"    ""Bring the light closer."""
4,4,4,20,04040420,"    It was most a unusual order. Not ordinarily permitted at Genji's side, the man hesitated to cross the threshold."
4,4,4,21,04040421,"    ""Come, come, bring it here! There is a time and place for ceremony."""
4,4,4,22,04040422,    In the torchlight he had a fleeting glimpse of a figure by the girl's pillow.
4,4,4,23,04040423," It was the woman in his dream. It faded away like an apparition in an old romance. In all the fright and honor, his confused thoughts centered upon the girl. There was no room for thoughts of himself.<br>    He knelt over her and called out to her, but she was cold and had stopped breathing. It was too horrible. He had no confidant to whom he could turn for advice. It was the clergy one thought of first on such occasions. He had been so brave and confident, but he was young, and this was too much for him. He clung to the lifeless body."
4,4,4,24,04040424,"    ""Come back, my dear, my dear. Don't do this awful thing to me."" "
4,4,4,25,04040425, But she was cold and no longer seemed human.
4,4,4,26,04040426,    The first paralyzing terror had left Ukon. Now she was writhing and wailing.
4,4,4,27,04040427, Genji remembered a devil a certain minister had encountered in the Grand Hall.*
4,4,4,28,04040428,"    ""She can't possibly be dead.""  He found the strength to speak sharply. ""All this noise in the middle of the night--you must try to be a little quieter."" "
4,4,4,29,04040429, But it had been too sudden.
4,4,4,30,04040430,    He turned again to the torchbearer.
4,4,4,31,04040431," ""There is someone here who seems to have had a very strange seizure. Tell your friend to find out where Lord Koremitsu is spending the night and have him come immediately. If the holy man is still at his mother's house, give him word, very quietly, that he is to come too. His mother and the people with her are not to hear. She does not approve of this sort of adventure."""
4,4,4,32,04040432,"    He spoke calmly enough, but his mind was in a turmoil. Added to grief at the loss of the girl was horror, quite beyond describing, at this desolate place."
4,4,4,33,04040433," It would be past midnight. The wind was higher and whis- tled more dolefully in the pines. There came a strange, hollow call of a bird. Might it be an owl? All was silence, terrifying solitude. He should not have chosen such a place--but it was too late now."
4,4,4,34,04040434," Trembling violently, Ukon clung to him. He held her in his arms, wondering if she might be about to follow her lady. He was the only rational one present, and he could think of nothing to do."
4,4,4,35,04040435," The flickering light wandered here and there. The upper parts of the screens behind them were in darkness, the lower parts fitfully in the light. There was a persistent creaking, as of someone coming up behind them. If only Koremitsu would come. But Koremitsu was a nocturnal wanderer without a fixed abode, and the man had to search for him in numerous places. The wait for dawn was like the passage of a thousand nights."
4,4,4,36,04040436," Finally he heard a distant crowing. What legacy from a former life could have brought him to this mortal peril? He was being punished for a guilty love, his fault and no one else's, and his story would be remembered in infamy through all the ages to come. There were no secrets, strive though one might to have them. Soon everyone would know, from his royal father down, and the lowest court pages would be talking; and he would gain immortality as the model of the complete fool."
4,4,5,1,04040501,"    Finally Lord Koremitsu came. He was the perfect servant who did not go against his master's wishes in anything at any time; and Genji was angry that on this night of all nights he should have been away, and slow in answering the summons. Calling him inside even so, he could not immedi- ately find the strength to say what must be said. Ukon burst into tears, the full honor of it all coming back to her at the sight of Koremitsu. Genji too lost control of himself. The only sane and rational one present, he had held Ukon in his arms, but now he gave himself up to his grief."
4,4,5,2,04040502,"    ""Something very strange has happened,""  he said after a time. ""Strange --'unbelievable' would not be too strong a word. I wanted a priest--one does when these things happen--and asked your reverend brother to come."""
4,4,5,3,04040503,"    ""He went back up the mountain yesterday. Yes, it is very strange indeed. Had there been anything wrong with her?"""
4,4,5,4,04040504,"    ""Nothing."""
4,4,5,5,04040505,"    He was so handsome in his grief that Koremitsu wanted to weep. An older man who has had everything happen to him and knows what to expect can be depended upon in a crisis; but they were both young, and neither had anything to suggest."
4,4,5,6,04040506,"    Koremitsu finally spoke. ""We must not let the caretaker know. He may be dependable enough himself, but he is sure to have relatives who will talk. We must get away from this place."""
4,4,5,7,04040507,"    ""You aren't suggesting that we could find a place where we would be less likely to be seen?"""
4,4,5,8,04040508,"    ""No, I suppose not. And the women at her house will scream and wail when they hear about it, and they live in a crowded neighborhood, and all the mob around will hear, and that will be that. But mountain temples are used to this sort of thing. There would not be much danger of attracting attention.""  He reflected on the problem for a time."
4,4,5,9,04040509," ""There is a woman I used to know. She has gone into a nunnery up in the eastern hills. She is very old, my father's nurse, as a matter of fact. The district seems to be rather heavily populated, but the nunnery is off by itself."""
4,4,5,10,04040510,    It was not yet full daylight. Koremitsu had the carriage brought up.
4,4,5,11,04040511," Since Genji seemed incapable of the task, he wrapped the body in a covering and lifted it into the carriage. It was very tiny and very pretty, and not at all repellent. The wrapping was loose and the hair streamed forth, as if to darken the world before Genji's eyes.<br>    He wanted to see the last rites through to the end, but Koremitsu would not hear of it."
4,4,5,12,04040512," ""Take my horse and go back to Nijo~, now while the streets are still quiet."""
4,4,5,13,04040513,"    He helped Ukon into the carriage and himself proceeded on foot, the skirts of his robe hitched up. It was a strange, bedraggled sort of funeral procession, he thought, but in the face of such anguish he was prepared to risk his life. Barely conscious, Genji made his way back to Nijo-."
4,4,5,14,04040514,"    ""Where have you been?""  asked the women. ""You are not looking at all well.""<br>    He did not answer. Alone in his room, he pressed a hand to his heart. Why had he not gone with the others? What would she think if she were to come back to life? She would think that he had abandoned her. Self- reproach filled his heart to breaking. He had a headache and feared he had a fever. Might he too be dying?"
4,4,5,15,04040515," The sun was high and still he did not emerge. Thinking it all very strange, the women pressed breakfast upon him. He could not eat. A messenger reported that the emperor had been troubled by his failure to appear the day before.<br>    His brothers-in-law came calling.<br>    ""Come in, please, just for a moment.""  He received only To~ no Chu~jo~ and kept a blind between them."
4,4,5,16,04040516," ""My old nurse fell seriously ill and took her vows in the Fifth Month or so. perhaps because of them, she seemed to recover. But recently she had a relapse. Someone came to ask if I would not call on her at least once more. I thought I really must go and see an old and dear servant who was on her deathbed, and so I went."
4,4,5,17,04040517," One of her servants was ailing, and quite suddenly, before he had time to leave, he died. Out of deference to me they waited until night to take the body away. All this I learned later. It would be very improper of me to go to court with all these festivities coming up,* I thought, and so I stayed away. I have had a headache since early this morning--perhaps I have caught cold. I must apologize."""
4,4,5,18,04040518,
4,4,5,19,04040519,"    ""I see. I shall so inform your father. He sent out a search party during the concert last night, and really seemed very upset.""  To~ no Chu~jo~ turned to go, and abruptly turned back. ""Come now. What sort of brush did you really have? I don't believe a word of it."""
4,4,5,20,04040520,"    Genji was startled, but managed a show of nonchalance."
4,4,5,21,04040521," ""You needn't go into the details. Just say that I suffered an unexpected defilement. Very unexpected, really."""
4,4,5,22,04040522,"    Despite his cool manner, he was not up to facing people. He asked a younger brother-in-law to explain in detail his reasons for not going to court. He got off a note to Sanjo~ with a similar explanation."
4,4,6,1,04040601,"    Koremitsu came in the evening. Having announced that he had suf- fered a defilement, Genji had callers remain outside, and there were few people in the house. He received Koremitsu immediately."
4,4,6,2,04040602,"    ""Are you sure she is dead?""  He pressed a sleeve to his eyes."
4,4,6,3,04040603,    Koremitsu too was in tears. 
4,4,6,4,04040604,"""Yes, I fear she is most certainly dead. I could not stay shut up in a temple indefinitely, and so I have made arrange- ments with a venerable priest whom I happen to know rather well. Tomor- row is a good day for funerals."""
4,4,6,5,04040605,"    ""And the other woman?"""
4,4,6,6,04040606,"    ""She has seemed on the point of death herself. She does not want to be left behind by her lady. I was afraid this morning that she might throw herself over a cliff. She wanted to tell the people at Gojo~, but I persuaded her to let us have a little more time."""
4,4,6,7,04040607,
4,4,6,8,04040608,"    ""I am feeling rather awful myself and almost fear the worst."""
4,4,6,9,04040609,"    ""Come, now. There is nothing to be done and no point in torturing yourself. You must tell yourself that what must be must be. I shall let absolutely no one know, and I am personally taking care of everything."""
4,4,6,10,04040610,"    ""Yes, to be sure. Everything is fated. So I tell myself. But it is terrible to think that I have sent a lady to her death. You are not to tell your sister, and you must be very sure that your mother does not hear. I would not survive the scolding I would get from her."""
4,4,6,11,04040611,"    ""And the priests too: I have told them a plausible story.""  Koremitsu exuded confidence."
4,4,6,12,04040612,
4,4,6,13,04040613,"    The women had caught a hint of what was going on and were more puzzled than ever. He had said that he had suffered a defilement, and he was staying away from court; but why these muffled lamentations?"
4,4,6,14,04040614,"    Genji gave instructions for the funeral. ""You must make sure that nothing goes wrong."""
4,4,6,15,04040615,"    ""Of course. No great ceremony seems called for."""
4,4,6,16,04040616,    Koremitsu turned to leave.
4,4,6,17,04040617,"    ""I know you won't approve,""  said Genji, a fresh wave of grief sweep- ing over him, ""but I will regret it forever if I don't see her again. I'll go on horseback."""
4,4,6,18,04040618,"    ""Very well, if you must.""  In fact Koremitsu thought the proposal very ill advised."
4,4,6,19,04040619," ""Go immediately and be back while it is still early."""
4,4,6,20,04040620,    Genji set out in the travel robes he had kept ready for his recent amorous excursions.
4,4,6,21,04040621," He was in the bleakest despair. He was on a strange mission and the terrors of the night before made him consider turning back. Grief urged him on. If he did not see her once more, when, in another world, might he hope to see her as she had been? He had with him only Koremitsu and the attendant of that first encounter."
4,4,6,22,04040622," The road seemed a long one.<br>    The moon came out, two nights past full. They reached the river. In the dim torchlight, the darkness off towards Mount Toribe was ominous and forbidding; but Genji was too dazed with grief to be frightened. And so they reached the temple."
4,4,6,23,04040623,"    It was a harsh, unfriendly region at best. The board hut and chapel where the nun pursued her austerities were lonely beyond description. The light at the altar came dimly through cracks. Inside the hut a woman was weeping. In the outer chamber two or three priests were conversing and invoking the holy name in low voices. Vespers seemed to have ended in several temples nearby. Everything was quiet. There were lights and there seemed to be clusters of people in the direction of Kiyomizu. The grand tones in which the worthy monk, the son of the nun, was reading a sutra brought on what Genji thought must be the full flood tide of his tears."
4,4,6,24,04040624,"    He went inside. The light was turned away from the corpse. Ukon lay behind a screen. It must be very terrible for her, thought Genji. The girl's face was unchanged and very pretty."
4,4,6,25,04040625,"     ""Won't you let me hear your voice again?""  He took her hand. ""What was it that made me give you all my love, for so short a time, and then made you leave me to this misery?"""
4,4,6,26,04040626,  He was weeping uncontrollably.
4,4,6,27,04040627,"    The priests did not know who he was. They sensed something re- markable, however, and felt their eyes mist over."
4,4,6,28,04040628,"     ""Come with me to Nijo~,""  he said to Ukon."
4,4,6,29,04040629,"     ""We have been together since I was very young. I never left her side, not for a single moment. Where am I to go now? I will have to tell the others what has happened. As if this weren't enough, I will have to put up with their accusations.""  She was sobbing. ""I want to go with her."""
4,4,6,30,04040630,"     ""That is only natural. But it is the way of the world. Parting is always sad. Our lives must end, early or late. Try to put your trust in me.""  He comforted her with the usual homilies, but presently his real feelings came out. ""put your trust in me--when I fear I have not long to live myself."""
4,4,6,31,04040631,  He did not after all seem likely to be much help.
4,4,6,32,04040632,"     ""It will soon be light,""  said Koremitsu. ""We must be on our way."""
4,4,6,33,04040633,"    Looking back and looking back again, his heart near breaking, Genji went out."
4,4,6,34,04040634, The way was heavy with dew and the morning mists were thick. He scarcely knew where he was. The girl was exactly as she had been that night. They had exchanged robes and she had on a red singlet of his. What might it have been in other lives that had brought them together? He managed only with great difficulty to stay in his saddle. Koremitsu was at the reins. As they came to the river Genji fell from his horse and was unable to remount.
4,4,6,35,04040635,"     ""So I am to die by the wayside? I doubt that I can go on."""
