Volume,Chapter,Paragraph,Line,LineId,Text
4,1,1,1,04010101," On his way from court to pay one of his calls at Rokujo~, Genji stopped to inquire after his old nurse, Koremitsu's mother, at her house in Gojo~. Gravely ill, she had become a nun."
4,1,1,2,04010102," The carriage entrance was closed. He sent for Koremitsu and while he was waiting looked up and down the dirty, cluttered street. Beside the nurse's house was a new fence of plaited cypress. The four or five narrow shutters above had been raised, and new blinds, white and clean, hung in the apertures. He caught outlines of pretty foreheads beyond."
4,1,1,3,04010103," He would have judged, as they moved about, that they belonged to rather tall women. What sort of women might they be? His carriage was simple and unadorned and he had no outrunners."
4,1,1,4,04010104," Quite certain that he would not be recognized, he leaned out for a closer look. The hanging gate, of something like trelliswork, was propped on a pole, and he could see that the house was tiny and flimsy. He felt a little sorry for the occupants of such a place--and then asked himself who in this world had more than a temporary shelter.* A hut, a jeweled pavilion, they were the same."
4,1,1,5,04010105," A pleasantly green vine was climbing a board wall. The white flowers, he thought, had a rather self-satisfied look about them."
4,1,1,6,04010106,"    ""'I needs must ask the lady far off yonder,'""+ he said, as if to himself."
4,1,1,7,04010107,"    An attendant came up, bowing deeply."
4,1,1,8,04010108," ""The white flowers far off yonder are known as 'evening faces,'""* he said."" A very human Sort of name--and what a shabby place they have picked to bloom in."""
4,1,1,9,04010109,"    It was as the man said. The neighborhood was a poor one, chiefly of small houses. Some were leaning precariously, and there were ""evening faces""  at the sagging eaves."
4,1,1,10,04010110,"     ""A hapless sort of flower. pick one off for me, would you?"""
4,1,1,11,04010111,    The man went inside the raised gate and broke off a flower.
4,1,1,12,04010112," A pretty little girl in long, unlined yellow trousers of raw silk came out through a sliding door that seemed too good for the surroundings. Beckoning to the man, she handed him a heavily scented white fan."
4,1,1,13,04010113,"     ""put it on this. It isn't much of a fan, but then it isn't much of a flower either."""
4,1,1,14,04010114,"    Koremitsu, coming out of the gate, passed it on to Genji."
4,1,1,15,04010115,"     ""They lost the key, and I have had to keep you waiting. You aren't likely to be recognized in such a neighborhood, but it's not a very nice neighborhood to keep you waiting in."""
4,1,1,16,04010116,"    Genji's carriage was pulled in and he dismounted. Besides Koremitsu, a son and a daughter, the former an eminent cleric, and the daughter's husband, the governor of Mikawa, were in attendance upon the old woman. They thanked him profusely for his visit."
4,1,1,17,04010117,    The old woman got up to receive him.
4,1,1,18,04010118," ""I did not at all mind leaving the world, except for the thought that I would no longer be able to see you as I am seeing you now. My vows seem to have given me a new lease on life, and this visit makes me certain that I shall receive the radiance of Lord Amita~bha with a serene and tranquil heart."""
4,1,1,19,04010119,  And she collapsed in tears.
4,1,1,20,04010120,"    Genji was near tears himself. ""It has worried me enormously that you should be taking so long to recover, and I was very sad to learn that you have withdrawn from the world. You must live a long life and see the career I make for myself. I am sure that if you do you will be reborn upon the highest summits of the Pure Land. I am told that it is important to rid oneself of the smallest regret for this world."""
4,1,1,21,04010121,"    Fond of the child she has reared, a nurse tends to look upon him as a paragon even if he is a half-wit. How much prouder was the old woman, who somehow gained stature, who thought of herself as eminent in her own right for having been permitted to serve him. The tears flowed on."
4,1,1,22,04010122,    Her children were ashamed for her. They exchanged glances. It would not do to have these contortions taken as signs of a lingering affection for the world.
4,1,1,23,04010123,    Genji was deeply touched.
4,1,1,24,04010124," ""The people who were fond of me left me when I was very young. Others have come along, it is true, to take care of me, but you are the only one I am really attached to. In recent years there have been restrictions upon my movements, and I have not been able to look in upon you morning and evening as I would have wished, or indeed to have a good visit with you. Yet I become very depressed when the days go by and I do not see you.'Would that there were on this earth no final partings.'""*"
4,1,1,25,04010125," He spoke with great solemnity, and the scent of his sleeve, as he brushed away a tear, quite flooded the room.<br>    Yes, thought the children, who had been silently reproaching their mother for her want of control, the fates had been kind to her. They too were now in tears."
4,1,1,26,04010126,"    Genji left orders that prayers and services be resumed. As he went out he asked for a torch, and in its light examined the fan on which the ""evening face""  had rested. It was permeated with a lady's perfume, elegant and alluring. On it was a poem in a disguised cursive hand that suggested breeding and taste. He was interested."
4,1,1,27,04010127,"          ""I think I need not ask whose face it is,<br>       So bright, this evening face, in the shining dew."""
4,1,1,28,04010128,
4,1,1,29,04010129,"     ""Who is living in the house to the west?""  he asked Koremitsu. ""Have you perhaps had occasion to inquire?"""
4,1,1,30,04010130,"    At it again, thought Koremitsu. He spoke somewhat tartly."
4,1,1,31,04010131," ""I must confess that these last few days I have been too busy with my mother to think about her neighbors."""
4,1,1,32,04010132,
4,1,1,33,04010133,"     ""You are annoyed with me. But this fan has the appearance of something it might be interesting to look into. Make inquiries, if you will, please, of someone who knows the neighborhood."""
4,1,1,34,04010134,"    Koremitsu went in to ask his mother's steward,"
4,1,1,35,04010135," and emerged with the information that the house belonged to a certain honorary vice- governor.* ""The husband is away in the country, and the wife seems to be a young woman of taste. Her sisters are out in service here and there. They often come visiting. I suspect the fellow is too poorly placed to know the details."""
4,1,1,36,04010136,"    His poetess would be one of the sisters, thought Genji. A rather practiced and forward young person, and, were he to meet her, perhaps vulgar as well--but the easy familiarity of the poem had not been at all unpleasant, not something to be pushed away in disdain. His amative propensities, it will be seen, were having their way once more.<br>    Carefully disguising his hand, he jotted down a reply on a piece of notepaper and sent it in by the attendant who had earlier been of service."
4,1,1,37,04010137,"         ""Come a bit nearer, please. Then might you know<br>       Whose was the evening face so dim in the twilight."""
4,1,1,38,04010138,
4,1,1,39,04010139,"    Thinking it a familiar profile, the lady had not lost the opportunity to surprise him with a letter, and when time passed and there was no answer she was left feeling somewhat embarrassed and disconsolate. Now came a poem by special messenger. Her women became quite giddy as they turned their minds to the problem of replying. Rather bored with it all, the messenger returned empty-handed."
4,1,1,40,04010140," Genji made a quiet departure, lighted by very few torches. The shutters next door had been lowered. There was something sad about the light, dimmer than fireflies, that came through the cracks."
4,1,1,41,04010141,"    At the Rokujo~ house, the trees and the plantings had a quiet dignity. The lady herself was strangely cold and withdrawn. Thoughts of the ""evening faces""  quite left him."
4,1,1,42,04010142," He overslept, and the sun was rising when he took his leave. He presented such a fine figure in the morning light that the women of the place understood well enough why he should be so universally admired. "
4,1,1,43,04010143,"On his way he again passed those shutters, as he had no doubt done many times before. Because of that small incident he now looked at the house carefully, wondering who might be within."
4,1,2,1,04010201,
4,1,2,2,04010202,"     ""My mother is not doing at all well, and I have been with her,"" "
4,1,2,3,04010203," said Koremitsu some days later. And, coming nearer: "
4,1,2,4,04010204,"""Because you seemed so interested, I called someone who knows about the house next door and had him questioned. His story was not completely clear. He said that in the Fifth Month or so someone came very quietly to live in the house, but that not even the domestics had been told who she might be."
4,1,2,5,04010205, I have looked through the fence from time to time myself and had glimpses through blinds of several young women. Something about their dress suggests that they are in the service of someone of higher rank.*
4,1,2,6,04010206," Yesterday, when the evening light was coming directly through, I saw the lady herself writing a letter. She is very beautiful. She seemed lost in thought, and the women around her were weeping."""
4,1,2,7,04010207,    Genji had suspected something of the sort. He must find out more.
4,1,2,8,04010208,"    Koremitsu's view was that while Genji was undeniably someone the whole world took seriously, his youth and the fact that women found him attractive meant that to refrain from these little affairs would be less than human. It was not realistic to hold that certain people were beyond temptation."
4,1,2,9,04010209,"     ""Looking for a chance to do a bit of exploring, I found a small pretext for writing to her. She answered immediately, in a good, practiced hand. Some of her women do not seem at all beneath contempt."""
4,1,2,10,04010210,
4,1,2,11,04010211,"     ""Explore very thoroughly, if you will. I will not be satisfied until you do."""
4,1,2,12,04010212,"    The house was what the guardsman would have described as the lowest of the low, but Genji was interested. What hidden charms might he not come upon!"
4,2,1,1,04020101,"    He had thought the coldness of the governor's wife, the lady of ""the locust shell,""  quite unique. Yet if she had proved amenable to his persua- sions the affair would no doubt have been dropped as a sad mistake after that one encounter. As matters were, the resentment and the distinct possibility of final defeat never left his mind. The discussion that rainy night would seem to have made him curious about the several ranks."
4,2,1,2,04020102," There had been a time when such a lady would not have been worth his notice. Yes, it had been broadening, that discussion! He had not found the willing and available one, the governor of Iyo's daughter, entirely uninteresting, but the thought that the stepmother must have been listening coolly to the interview was excruciating. He must await some sign of her real intentions.<br>    The governor of iyo returned to the city."
4,2,1,3,04020103," He came immediately to Genji's mansion. Somewhat sunburned, his travel robes rumpled from the sea voyage, he was a rather heavy and displeasing sort of person. He was of good lineage, however, and, though aging, he still had good manners."
4,2,1,4,04020104," As they spoke of his province, Genji wanted to ask the full count of those hot springs,* but he was somewhat confused to find memories chasing one another through his head."
4,2,1,5,04020105," How foolish that he should be so uncomfortable before the honest old man! He remembered the guardsman's warning that such affairs are unwise,+ and he felt sorry for the governor. Though he resented the wife's coldness, he could see that from the husband's point of view it was admirable."
4,2,1,6,04020106," He was upset to learn that the governor meant to find a suitable husband for his daughter and take his wife to the prov- inces. He consulted the lady's young brother upon the possibility of another meeting. It would have been difficult even with the lady's cooperation, however, and she was of the view that to receive a gentleman so far above her would be extremely unwise."
4,2,1,7,04020107,"    Yet she did not want him to forget her entirely. Her answers to his notes on this and that occasion were pleasant enough, and contained casual little touches that made him pause in admiration. He resented her chilliness, but she interested him."
4,2,1,8,04020108," As for the stepdaughter, he was certain that she would receive him hospitably enough however formidable a husband she might acquire. Reports upon her arrangements disturbed him not at all."
4,3,1,1,04030101,"    Autumn came. He was kept busy and unhappy by affairs of his own making, and he visited Sanjo~ infrequently. There was resentment."
4,3,1,2,04030102,"    As for the affair at Rokujo~, he had overcome the lady's resistance and had his way, and, alas, he had cooled toward her. People thought it worthy of comment that his passions should seem so much more governable than before he had made her his."
4,3,1,3,04030103," She was subject to fits of despondency, more intense on sleepless nights when she awaited him in vain. She feared that if rumors were to spread the gossips would make much of the difference in their ages."
4,3,1,4,04030104,"    On a morning of heavy mists, insistently roused by the lady, who was determined that he be on his way, Genji emerged yawning and sighing and looking very sleepy. Chu~jo~, one of her women, raised a shutter and pulled a curtain aside as if urging her lady to come forward and see him off. The lady lifted her head from her pillow."
4,3,1,5,04030105," He was an incomparably handsome figure as he paused to admire the profusion of flowers below the veranda. Chu~jo~ followed him down a gallery. In an aster robe that matched the season pleasantly and a gossamer train worn with clean elegance, she was a pretty, graceful woman."
4,3,1,6,04030106," Glancing back, he asked her to sit with him for a time at the corner railing. The ceremonious precision of the seated figure and the hair flowing over her robes were very fine."
4,3,1,7,04030107,"    He took her hand.<br>      ""Though loath to be taxed with seeking fresher blooms,<br>        I feel impelled to pluck this morning glory."
4,3,1,8,04030108,"     ""Why should it be?"""
4,3,1,9,04030109,"    She answered with practiced alacrity, making it seem that she was speaking not for herself but for her lady:"
4,3,1,10,04030110,"         'In haste to plunge into the morning mists,<br>                 to have no heart for the blossoms here."""
4,3,1,11,04030111,
4,3,1,12,04030112,"    A pretty little page boy, especially decked out for the occasion, it would seem, walked out among the flowers. His trousers wet with dew, he broke off a morning glory for Genji. He made a picture that called out to be painted."
4,3,1,13,04030113,"    Even persons to whom Genji was nothing were drawn to him. No doubt even rough mountain men wanted to pause for a time in the shade of the flowering tree,* and those who had basked even briefly in his radiance had thoughts, each in accordance with his rank, of a daughter who might be taken into his service, a not ill-formed sister who might perform some humble service for him."
4,3,1,14,04030114," One need not be surprised, then, that people with a measure of sensibility among those who had on some occasion received a little poem from him or been treated to some little kindness found him much on their minds. No doubt it distressed them not to be always with him."
4,4,1,1,04040101,    I had forgotten: Koremitsu gave a good account of the fence peeping to which he had been assigned.
4,4,1,2,04040102,"  ""I am unable to identify her. She seems determined to hide herself from the world. In their boredom her women and girls go out to the long gallery at the street, the one with the shutters, and watch for carriages. Sometimes the lady who seems to be their mistress comes quietly out to join them. I've not had a good loo  at her, but she seems very pretty indeed."
4,4,1,3,04040103," One day a carriage with outrunners went by. The little girls shouted to a person named Ukon that she must come in a hurry. The captain* was going by, they said. An older woman came out and motioned to them to be quiet. How did they know? she asked, coming out toward the gallery."
4,4,1,4,04040104," The passage from the main house is by a sort of makeshift bridge. She was hurrying and her skirt caught on something, and she stumbled and almost fell off.'The sort of thing the god of Katsuragi might do,'+ she said, and seems to have lost interest in sightseeing."
4,4,1,5,04040105," They told her that the man in the carriage was wearing casual court dress and that he had a retinue. They mentioned several names, and all of them were undeniably Lord To~ no Chu~jo~'s guards and pages."""
4,4,1,6,04040106,"     ""I wish you had made positive identification."""
4,4,1,7,04040107,  Might she be the lady of whom To~ no Chu~jo~ had spoken so regretfully that rainy night?
4,4,1,8,04040108,"    Koremitsu went on, smiling at this open curiosity. ""I have as a matter of fact made the proper overtures and learned all about the place. I come and go as if I did not know that they are not all equals. They think they are hiding the truth and try to insist that there is no one there but them- selves when one of the little girls makes a slip."""
4,4,1,9,04040109,"     ""Let me have a peep for myself when I call on your mother."""
4,4,1,10,04040110,"    Even if she was only in temporary lodgings, the woman would seem to be of the lower class for which his friend had indicated such contempt that rainy evening. Yet something might come of it all."
4,4,1,11,04040111," Determined not to go against his master's wishes in the smallest detail and himself driven by very considerable excitement, Koremitsu searched diligently for a chance to let Genji into the house. But the details are tiresome, and I shall not go into them."
4,4,1,12,04040112,"    Genji did not know who the lady was and he did not want her to know who he was. In very shabby disguise, he set out to visit her on foot. He must be taking her very seriously, thought Koremitsu, who offered his horse and himself went on foot."
4,4,1,13,04040113,"     ""Though I do not think that our gentleman will look very good with tramps for servants.""<br>    To make quite certain that the expedition remained secret, Genji took with him only the man who had been his intermediary in the matter of the ""evening faces""  and a page whom no one was likely to recognize. Lest he be found out even so, he did not stop to see his nurse."
4,4,1,14,04040114,"    The lady had his messengers followed to see how he made his way home and tried by every means to learn where he lived; but her efforts came to nothing. For all his secretiveness, Genji had grown fond of her and felt that he must go on seeing her. They were of such different ranks, he tried to tell himself, and it was altogether too frivolous. Yet his visits were frequent."
4,4,1,15,04040115," In affairs of this sort, which can muddle the senses of the most serious and honest of men, he had always kept himself under tight control and avoided any occasion for censure. Now, to a most astonishing degree, he would be asking himself as he returned in the morning from a visit how he could wait through the day for the next. And then he would rebuke himself. It was madness, it was not an affair he should let disturb him. She was of an extraordinarily gentle and quiet nature. Though there was a certain vagueness about her, and indeed an almost childlike quality, it was clear that she knew something about men. She did not appear to be of very good family. What was there about her, he asked himself over and over again, that so drew him to her?"
4,4,1,16,04040116,"    He took great pains to hide his rank and always wore travel dress, and he did not allow her to see his face. He came late at night when everyone was asleep. She was frightened, as if he were an apparition from an old story. She did not need to see his face to know that he was a fine gentleman. But who might he be? Her suspicions turned to Koremitsu. It was that young gallant, surely, who had brought the strange visitor. But Koremitsu pursued his own little affairs unremittingly, careful to feign indifference to and ignorance of this other affair. What could it all mean? The lady was lost in unfamiliar speculations."
4,4,2,1,04040201,"    Genji had his own worries. If, having lowered his guard with an appearance of complete unreserve, she were to slip away and hide, where would he seek her? This seemed to be but a temporary residence, and he could not be sure when she would choose to change it, and for what other. He hoped that he might reconcile himself to what must be and forget the affair as just another dalliance; but he was not confident."
4,4,2,2,04040202,"    On days when, to avoid attracting notice, he refrained from visiting her, his fretfulness came near anguish. Suppose he were to move her in secret to Nijo~. If troublesome rumors were to arise, well, he could say that they had been fated from the start. He wondered what bond in a former life might have produced an infatuation such as he had not known before."
4,4,2,3,04040203,"     ""Let's have a good talk,""  he said to her, ""where we can be quite at our ease."
4,4,2,4,04040204,
4,4,2,5,04040205,"     ""It's all so strange. What you say is reasonable enough, but what you do is so strange. And rather frightening."""
4,4,2,6,04040206,"    Yes, she might well be frightened. Something childlike in her fright brought a smile to his lips."
4,4,2,7,04040207," ""Which of us is the mischievous fox spirit? I wonder. Just be quiet and give yourself up to its persuasions."""
4,4,2,8,04040208,"    Won over by his gentle warmth, she was indeed inclined to let him have his way. She seemed such a pliant little creature, likely to submit absolutely to the most outrageous demands. He thought again of To~ no Chu~jo~'s ""wild carnation,""  of the equable nature his friend had described that rainy night. Fearing that it would be useless, he did not try very hard to question her."
4,4,2,9,04040209," She did not seem likely to indulge in dramatics and suddenly run off and hide herself, and so the fault must have been To~ no Chu~jo~'s. Genji himself would not be guilty of such negligence--though it did occur to him that a bit of infidelity* might make her more interesting."
4,4,2,10,04040210,"    The bright full moon of the Eighth Month came flooding in through chinks in the roof. It was not the sort of dwelling he was used to, and he was fascinated. Toward dawn he was awakened by plebeian voices in the shabby houses down the street."
4,4,2,11,04040211,"     ""Freezing, that's what it is, freezing. There's not much business this year, and when you can't get out into the country you feel like giving up. Do you hear me, neighbor?"""
4,4,2,12,04040212,
4,4,2,13,04040213,    He could make out every word.
4,4,2,14,04040214," It embarrassed the woman that, so near at hand, there should be this clamor of preparation as people set forth on their sad little enterprises."
4,4,2,15,04040215," Had she been one of the stylish ladies of the world, she would have wanted to shrivel up and disappear. She was a placid sort, however, and she seemed to take nothing, painful or embar- rassing or unpleasant, too seriously. Her manner elegant and yet girlish, she did not seem to know what the rather awful clamor up and down the street might mean. He much preferred this easygoing bewilderment to a show of consternation, a face scarlet with embarrassment."
4,4,2,16,04040216," As if at his very pillow, there came the booming of a foot pestle,+ more fearsome than the stamping of the thunder god, genuinely earsplitting. He did not know what device the sound came from, but he did know that it was enough to awaken the dead."
4,4,2,17,04040217," From this direction and that there came the faint thump of fulling hammers against coarse cloth; and mingled with it--these were sounds to call forth the deepest emotions--were the calls of geese flying overhead. He slid a door open and they looked out. They had been lying near the veranda. There were tasteful clumps of black bamboo just outside and the dew shone as in more familiar places. Autumn insects sang busily, as if only inches from an ear used to wall crickets at considerable distances. It was all very clamorous, and also rather wonderful."
4,4,2,18,04040218," Countless details could be overlooked in the singleness of his affection for the girl. She was pretty and fragile in a soft, modest cloak of lavender and a lined white robe. She had no single feature that struck him as especially beautiful, and yet, slender and fragile, she seemed so delicately beautiful that he was almost afraid to hear her voice. He might have wished her to be a little more assertive, but he wanted only to be near her, and yet nearer."
4,4,2,19,04040219,"     ""Let's go off somewhere and enjoy the rest of the night. This is too much."""
4,4,2,20,04040220,"     ""But how is that possible?""  She spoke very quietly. ""You keep taking me by surprise."""
